title,authors,average_rating,rating,date_of_publication,descriptions,total_pages,no_of_books_by_author,author_followers,genres,no_of_reviews,five_star_ratings,four_star_ratings,three_star_ratings,two_star_ratings,one_star_ratings
Quest for Lost Heroes,David Gemmell,4.12,"9,899 rating","January 1, 1990","The Drenai stronghold had fallen. Now blood-hungry Nadir hordes spread desolation and despair across all the lands......even tiny Gothir, where slavers seized a young girl while the villagers looked the other way--all but the peasant boy Kiall. His unlikely rescue attempt would lead across the savage steppes and on through the Halls of Hell. The youth would face ferocious beasts, deadly warriors, and demons of the dark; he would emerge a man--or not emerge at all.But Kiall would not face these dangers alone. Heroes out of legend joined his Chareos the Blademaster, Beltzer the Axeman, and the bowmen Finn and Maggrig. And one among their company hid a secret that could free the world of Nadir domination. That one was the Nadir Bane, the hope of the Drenai. That one was the Earl of Bronze.Thus did a search for a stolen slave girl become a quest that would shake the very world.",291,156,"3,233 follower","['Fantasy', 'Fiction', 'Epic Fantasy', 'Heroic Fantasy', 'High Fantasy', 'Adventure', 'Science Fiction Fantasy']",215 review,"3,698 (37%)","3,986 (40%)","1,968 (19%)",212 (2%),35 (<1%)
Leaves of Hypnos,René Char,4.21,326 rating,"January 1, 1946","A war had begun which, though most of his country was soon occupied, occupied Rene Char still more. He was about 36 then. And the poetic journal he kept of and at that time comes to us under the auspices of his Resistance code-name, Hypnos, the Greek divinity of Sleep. As for the present work, the ""leaves"" remind the translator of Rimbaud's from a Season in Hell, but this is no longer a private hell expatiated into a vision of the human condition, but a public hell drawn from, exceeded by, a sense of responsibility.",237,181,114 follower,"['Poetry', 'France', 'French Literature', 'Fiction', 'War', 'Philosophy', 'Poetry', 'France', 'French Literature', 'Fiction', 'War', 'Philosophy', 'Poetry', 'France', 'French Literature', 'Fiction', 'War', 'Philosophy']",37 review,156 (47%),105 (32%),49 (15%),10 (3%),6 (1%)
Defy Not the Heart,Johanna Lindsey,4.07,"8,851 rating","January 1, 1989","Reina seethes with rage over her fate: taken captive by the knight Ranulf — a golden giant of a man — who has pledged to deliver her to the nuptial bed of the despised Lord Rothwell. She will never accept such bondage — and Reina offers herself to her kidnapped instead, offering to make Ranulf a great lord...if he agrees to wed her.But the brave knight desires much more than a marriage of convenience from this proud, headstrong lady who treats him with scorn yet makes his blood run hotter than liquid fire. She must come to him of her own free will — or Ranulf will take her. For the passion that consumes them both cannot long be denied — even though gravest peril surely awaits them on the heart's trail to a destines and turbulent love.",432,157,"6,878 follower","['Historical Romance', 'Romance', 'Historical', 'Medieval', 'Medieval Romance', 'Historical Fiction', 'Fiction']",289 review,"3,566 (40%)","2,885 (32%)","1,916 (21%)",383 (4%),101 (1%)
The Groovy Greeks,Terry Deary,4.07,"3,802 rating","January 1, 1996","""The Groovy Greeks"" is full of fab facts about the hip and happening Greeks - who hung out all over 2000 years ago. This book tells you who had the world's first flushing toilet and why dedicated doctors tasted their patients' ear wax.",128,539,723 follower,"['History', 'Nonfiction', 'Childrens', 'Historical', 'Humor', 'Middle Grade', 'Comedy']",203 review,"1,396 (36%)","1,468 (38%)",776 (20%),133 (3%),29 (<1%)
Teoria socialismului și a capitalismului,Hans-Hermann Hoppe,4.30,475 rating,"December 1, 1988","cu două capitole suplimentare:
* Activitatea bancară, statele naţiune și politica internaţională* Constituția și strategia libertății
„Alături de Manifestul liberal al lui Murray Rothbard, această carte încapsulează ce ar trebui să ştie orice bacalaureat despre teoria comparată a sistemelor politico-economice moderne. Printre ştiintele omului căzut din har, economia şi etica proprietăţii private tot mai contrafactuale şi ale agresiunii instituţionalizate tot mai actuale îşi dovedesc la superlativ aptitudinea de a explica dinamica devolutivă a competiţiei pentru materie şi putere. Sesizând ordinea proprietăţii private exclusiv în ipostaza ei progresiv capitalistă, profesorul Hoppe demonstrează fără dificultate superioritatea economică şi etică relativă a acestui tip ideal, faţă de sistemele alternative, ideale sau existente, compatibile cu orientarea programatic pământească şi (deci) consumeristă a omului recent. Paradoxul creşterii sufocante a statului, în ciuda iraţionalităţii sale sociale, ţine însă de o cvasi-implacabilă logică a stimulentelor şi efectelor socio-psihologice perverse asociate dinamicii sale interne, care probabil nu pot fi depăşite de sugestii strategice care nu «sparg» şi cutia presupoziţiilor teo-antropologice scolastico-nihiliste ale autorului.“Dan Cristian Comănescu",317,98,483 follower,"['Economics', 'Politics', 'Philosophy', 'Nonfiction', 'History', 'Political Science', 'Business', 'Economics', 'Politics', 'Philosophy', 'Nonfiction', 'History', 'Political Science', 'Business', 'Economics', 'Politics', 'Philosophy', 'Nonfiction', 'History', 'Political Science', 'Business', 'Economics', 'Politics', 'Philosophy', 'Nonfiction', 'History', 'Political Science', 'Business', 'Economics', 'Politics', 'Philosophy', 'Nonfiction', 'History', 'Political Science', 'Business']",31 review,253 (53%),150 (31%),46 (9%),13 (2%),13 (2%)
"All This, and Heaven Too",Rachel Field,4.11,458 rating,"January 1, 1929","This number-one bestselling novel is based on the true story of one of the most notorious murder cases in French history. The heroine, Henriette Deluzy-Desportes, governess to the children of the Duc de Praslin, found herself strangely drawn to her employer; when the Duc murdered his wife in the most savage fashion, she had to plead her own case before the Chancellor of France in a sensational murder trial that helped bring down the French king. After winning her freedom, Henriette took refuge in America, where she hosted a salon visited by all the socialites of New York and New England. This thrilling historical romance, full of passion, mystery, and intrigue, has laid claim to the hearts and minds of readers for generations.",596,129,40 follower,"['Historical Fiction', 'Fiction', 'Classics', 'Romance', 'France', 'Mystery', 'Crime']",69 review,187 (40%),164 (35%),86 (18%),13 (2%),8 (1%)
The.PowerBook,Jeanette Winterson,3.67,"4,803 rating","January 1, 2001",The.PowerBook The Powerbook,244,112,"6,769 follower","['Fiction', 'Queer', 'LGBT', 'Novels', 'Contemporary', 'Literary Fiction', 'Fantasy']",338 review,"1,214 (25%)","1,581 (32%)","1,387 (28%)",475 (9%),146 (3%)
There Are Alligators in Our Sewers and Other American Credos,Paul Dickson,2.83,12 rating,"February 1, 1983","An up-to-date collection of popular beliefs current in today's America reveals--and provides backgrounds for--what Americans believe about themselves, each other, their country, and the world","HardcoverFirst published February 1, 1983",129,37 follower,"['Nonfiction', 'Nonfiction', 'Nonfiction']",3 review,1 (8%),1 (8%),6 (50%),3 (25%),1 (8%)
Another Chance to Dream,Lynn Kurland,4.09,"2,812 rating","December 1, 1998","From Lynn Kurland, the New York Times bestselling author of the Nine Kingdom series.  With neither title nor land, Rhys could not win the hand of Gwennelyn of Segrave. But he would always have her heart. The two are kindred souls...Rhys, a knight with far too many notions of chivalry for his own good. And Gwen, a lover of minstral tales, waiting to be swept away. But Gwen is betrothed to another man, and Rhys fears he will lose her forever. Until a suprise offer comes his way—bringing Rhys and Gwen a second chance at love...",416,55,"1,514 follower","['Romance', 'Historical Romance', 'Historical', 'Time Travel', 'Medieval', 'Historical Fiction', 'Fiction']",149 review,"1,182 (42%)",940 (33%),502 (17%),132 (4%),56 (1%)
Elmer and the Dragon,Ruth Stiles Gannett,4.08,"5,500 rating","October 28, 1950",In this sequel to My Father's Dragon . Elmer and Boris's island hopping adventures continue.,96,57,89 follower,"['Fantasy', 'Childrens', 'Fiction', 'Dragons', 'Chapter Books', 'Adventure', 'Middle Grade']",389 review,"2,086 (37%)","2,024 (36%)","1,167 (21%)",181 (3%),42 (<1%)
Something Upstairs,Avi,3.83,"2,821 rating","September 1, 1988","The mystery deepens The room was shabby and dirty, heavy with heat. None of the things which Kenny called his own remained. Even the painted walls and skylight were gone. Baffled, he wondered if other things  even outside  had changed. Kenny went to one of the windows and looked down. On a stoop across the dark street a man was standing, gazing straight at Kenny's window. He was wearing what appeared to be a long black cape which reached his knees, and a hat, triangular in shape. Its brim obscured his face. As if suddenly realizing he was being observed, the man moved quickly into the shadows. Keeping his face averted, he fled up the street.",128,312,"1,609 follower","['Historical Fiction', 'Mystery', 'Fiction', 'Fantasy', 'Young Adult', 'Middle Grade', 'Childrens']",295 review,852 (30%),963 (34%),747 (26%),193 (6%),66 (2%)
The Short Reign of Pippin IV,John Steinbeck,3.57,"3,092 rating","April 15, 1957","Steinbeck's only work of political satire turns the French Revolution on its head, as amateur astronomer Pippin Heristal is drafted in to rule the unruly French. Enchanting comedy ensues as Steinbeck creates the most hilarious royal court ever around the brief, bold reign of the corduroy-clad Pippin, his social-climbing wife Maria, his star-struck daughter Clotilde and her Californian beau, Todd.",192,784,22.5k follower,"['Fiction', 'Classics', 'Humor', 'Historical Fiction', 'Nobel Prize', 'Literature', 'American']",306 review,517 (16%),"1,113 (35%)","1,119 (36%)",291 (9%),52 (1%)
The Smoke Ring,Larry Niven,3.78,"3,639 rating","April 1, 1987","In the free-fall environment of the Smoke Ring, the descendants of the crew of the Discipline no longer remembered their Earth roots -- or the existence of Sharls Davis Kendy, the computer-program despot of the ship. Until Kendy initiated contact once more.Fourteen years later, only Jeffer, the Citizens Tree Scientist, knew that Kendy was still watching -- and waiting. Then the Citizens Tree people rescued a family of loggers and learned for the first time of the Admiralty, a large society living in free fall amid the floating debris called the Clump. And it was likely that the Admiralty had maintained, intact, Discipline's original computer library.Exploration was a temptation neither Jeffer nor Kendy could resist, and neither Citizens Tree nor Sharls Davis Kendy would ever be the same again...",323,309,"3,090 follower","['Science Fiction', 'Fiction', 'Science Fiction Fantasy', 'Hard Science Fiction', 'Audiobook', 'Fantasy', 'Space']",99 review,908 (24%),"1,337 (36%)","1,121 (30%)",231 (6%),42 (1%)
The Legend of Deathwalker,David Gemmell,4.34,"8,925 rating","January 1, 1996","Enter a powerful realm of legend, dark sorcery, and conquest, where the mighty Drenai warrior Druss faces his most deadly opponent . . .Druss the Legend, the dark axman known as the Deathwalker, must join the warrior Talisman on a mission of blood and glory. Only the stolen Eyes of Alchazzar--mystic jewels of power--will save Druss's dying friend, then unite the Nadir tribes against the evil of the Gothir. Druss agrees to help look for the twin gems--hidden for centuries in the shrine of Oshikai, the Demon-bane, the Nadir's greatest hero.It has been prophesied that with the recovery of the stones, there will come the Uniter, a magnificent fighter who will free the Nadir from brutal oppression. But Garen-Tsen, the sadistic power behind the Gothir throne, also seeks the gems. To control them, he will send five thousand men against a handful of savages, Talisman, and the one Drenai warrior.",376,156,"3,233 follower","['Fantasy', 'Fiction', 'Heroic Fantasy', 'Epic Fantasy', 'High Fantasy', 'Sword and Sorcery', 'Adventure']",164 review,"4,408 (49%)","3,259 (36%)","1,123 (12%)",116 (1%),19 (<1%)
The Case-Book of Sherlock Holmes,Arthur Conan Doyle,4.14,"27,386 rating","June 16, 1927","'When you have eliminated all which is impossible, then whatever remains, however improbable, must be the truth.'In this, the final collection of Sherlock Holmes adventures, the intrepid detective and his faithful companion Dr Watson examine and solve twelve cases that puzzle clients, baffle the police and provide readers with the thrill of the chase.These mysteries - involving an illustrious client and a Sussex vampire; the problems of Thor Bridge and of the Lions Mane; a creeping man and the three-gabled house - all test the bravery of Dr Watson and the brilliant mind of Mr Sherlock Homes, the greatest detective we have ever known.Contains 12 stories published 1921–1927.* ""The Adventure of the Mazarin Stone"" (1921)* ""The Problem of Thor Bridge"" (1922)* ""The Adventure of the Creeping Man"" (1923)* ""The Adventure of the Sussex Vampire"" (1924)* ""The Adventure of the Three Garridebs"" (1924)* ""The Adventure of the Illustrious Client"" (1924)* ""The Adventure of the Three Gables"" (1926)* ""The Adventure of the Blanched Soldier"" (1926)* ""The Adventure of the Lion's Mane"" (1926)* ""The Adventure of the Retired Colourman"" (1926)* ""The Adventure of the Veiled Lodger"" (1927)* ""The Adventure of Shoscombe Old Place"" (1927)",303,13.6k,22.4k follower,"['Classics', 'Mystery', 'Fiction', 'Short Stories', 'Crime', 'Detective', 'Audiobook']","1,396 review","10,835 (39%)","10,482 (38%)","5,170 (18%)",732 (2%),167 (<1%)
Two Little Savages,Ernest Thompson Seton,4.37,483 rating,"January 1, 1903"," This work has been selected by scholars as being culturally important, and is part of the knowledge base of civilization as we know it. This work was reproduced from the original artifact, and remains as true to the original work as possible. Therefore, you will see the original copyright references, library stamps (as most of these works have been housed in our most important libraries around the world), and other notations in the work. This work is in the public domain in the United States of America, and possibly other nations. Within the United States, you may freely copy and distribute this work, as no entity (individual or corporate) has a copyright on the body of the work.As a reproduction of a historical artifact, this work may contain missing or blurred pages, poor pictures, errant marks, etc. Scholars believe, and we concur, that this work is important enough to be preserved, reproduced, and made generally available to the public. We appreciate your support of the preservation process, and thank you for being an important part of keeping this knowledge alive and relevant.",320,712,97 follower,"['Fiction', 'Childrens', 'Adventure', 'Classics', 'Nature', 'Young Adult', 'Historical']",44 review,275 (56%),134 (27%),58 (12%),10 (2%),6 (1%)
Écrits,Jacques Lacan,4.03,"3,245 rating","January 1, 1966","“Fink’s precise new translation makes this pivotal period in Lacan’s thought more accessible to English speakers.”—Publishers Weekly, starred review Brilliant and innovative, Jacques Lacan's work lies at the epicenter of modern thought about otherness, subjectivity, sexual difference, the drives, the law, and enjoyment. This new translation of his complete works offers welcome, readable access to Lacan's seminal thinking on diverse subjects touched upon over the course of his inimitable intellectual career. .",896,255,990 follower,"['Philosophy', 'Psychology', 'Psychoanalysis', 'Theory', 'Nonfiction', 'France', 'Classics', 'Philosophy', 'Psychology', 'Psychoanalysis', 'Theory', 'Nonfiction', 'France', 'Classics', 'Philosophy', 'Psychology', 'Psychoanalysis', 'Theory', 'Nonfiction', 'France', 'Classics']",109 review,"1,378 (42%)",978 (30%),597 (18%),179 (5%),113 (3%)
Capitalismul și istoricii,Friedrich A. Hayek,3.95,189 rating,"January 1, 1954","Texte de T. S. Ashton, L. M. Hacker, W. T. Hutt, B. de JouvenelIntreoducere F. A. HayekVolumul coordonat de F. A. Hayek a avut, deopotriva la aparitie (in 1954) si la fiecare reeditare sau traducere, soarta marilor carti: a fost aparat si atacat cu egala pasiune, dar nu a lasat pe nimeni indiferent. Motivul e simplu. Capitalismul si istoricii demonteaza cu argumente clare si viguroase o conceptie adanc inradacinata in opinia comuna – o „axioma istorica“ pe care generatii intregi si-au insusit-o din manuale, impreuna cu Marx, cu fabianistii, cu grosul intelectualitatii (de stanga, centru si dreapta), cu ecologistii, cu avocatii contemporani ai societatii civile, ba chiar si cu majoritatea liberalilor – toti impartasim viziunea dickensiana potrivit careia in Anglia „capitalismului primitiv“ era o vale a plangerii, plina de fabrici mohorate in care erau exploatati la sange muncitori (inclusiv copii!), alungati de industrializare din raiul societatii agrare traditionale si aruncati in mahalalele marilor orase... Autorii volumului propun o imagine complet noua: Revolutia industriala a initiat „cercul virtuos“ al cresterii economice bazate pe consumul de masa, principalii sai beneficiari fiind, pentru prima oara in istorie, oamenii de rand. Iar greseala initiala de perceptie a intelectualilor independenti, perpetuata pana in zilele noastre, e explicabila prin valul romantic care a inundat cultura Europei, gasind ecou in insusi miezul democratiei americane.",184,235,"1,464 follower","['Economics', 'History', 'Politics', 'Nonfiction', 'Philosophy', 'Government', 'Economics', 'History', 'Politics', 'Nonfiction', 'Philosophy', 'Government', 'Economics', 'History', 'Politics', 'Nonfiction', 'Philosophy', 'Government', 'Economics', 'History', 'Politics', 'Nonfiction', 'Philosophy', 'Government', 'Economics', 'History', 'Politics', 'Nonfiction', 'Philosophy', 'Government']",5 review,60 (31%),80 (42%),34 (17%),9 (4%),6 (3%)
Φυσάει στα σταυροδρόμια του κόσμου,Tasos Leivaditis,4.33,138 rating,"January 1, 1953",Ποιητική συλλογή,27,42,69 follower,"['Poetry', 'Greece', 'Poetry', 'Greece', 'Poetry', 'Greece']",9 review,75 (54%),42 (30%),14 (10%),5 (3%),2 (1%)
Gentleman's Agreement,Laura Z. Hobson,3.94,916 rating,"January 1, 1946","A landmark novel that ranked #1 on the New York Times bestseller list for five months straight, Gentleman’s Agreement speaks to the pervasive nature of prejudice after World War II—an issue just as relevant today as when the book was first published Journalist Philip Green has just moved to New York City from California when the Third Reich falls. To mark this moment in history, his editor at Smith’s Weekly Magazine assigns Phil a series of articles on anti-Semitism in America. In order to experience anti-Semitism firsthand, Phil, a Christian, decides to pose as a Jew. What he discovers about the rampant bigotry in America will change him forever.",278,17,21 follower,"['Fiction', 'Classics', 'Historical Fiction', 'Jewish', 'Novels', 'Literature', 'Race']",127 review,288 (31%),370 (40%),190 (20%),50 (5%),18 (1%)
Basic Black With Pearls,Helen Weinzweig,3.52,670 rating,"January 1, 1980","A brilliant, lost feminist classic that is equal parts domestic drama and international intrigue.Shirley and Coenraad’s affair has been going on for decades, but her longing for him is as desperate as ever. She is a Toronto housewife; he works for an international organization known only as the Agency. Their rendezvous take place in Tangier, in Hong Kong, in Rome and are arranged by an intricate code based on notes slipped into issues of National Geographic. He recognizes her by her costume: a respectable black dress and string of pearls; his appearance, however, is changeable. But something has happened, the code has been discovered, and Coenraad sends Shirley (who prefers to be known as “Lola Montez”) to Toronto, the last place she wants to go. There the trail leads her through the sites of her impoverished immigrant childhood and sends her, finally, to her own house, where she discards her pearls and trades in her basic black for a dress of vibrant multicolored silk.Helen Weinzweig published her first novel when she was fifty-eight. Basic Black with Pearls, her second, won the Toronto Book Award and has since come to be recognized as a feminist landmark. Here Weinzweig imbues the formal inventiveness of the nouveau roman with psychological poignancy and surprising humor to tell a story of simultaneous dissolution and discovery.",161,4,12 follower,"['Fiction', 'Canada', 'Classics', 'Feminism', 'Literature', '20th Century', 'Novels', 'Fiction', 'Canada', 'Classics', 'Feminism', 'Literature', '20th Century', 'Novels', 'Fiction', 'Canada', 'Classics', 'Feminism', 'Literature', '20th Century', 'Novels']",112 review,110 (16%),247 (36%),221 (32%),65 (9%),27 (4%)
Walkabout,James Vance Marshall,3.48,"2,548 rating","January 1, 1959","Mary and her young brother Peter are the only survivors of an aircrash in the middle of the Australian desert. Facing death from exhaustion and starvation, they meet an aboriginal boy who helps them to survive, and guides them along their long journey. But a terrible misunderstanding results in a tragedy that neither Mary nor Peter will ever forget...",128,32,9 follower,"['Fiction', 'Australia', 'Young Adult', 'Classics', 'Adventure', 'Survival', 'School']",271 review,469 (18%),775 (30%),891 (34%),325 (12%),88 (3%)
Harvesting the Heart,Jodi Picoult,3.64,"55,605 rating","January 1, 1993","From the #1 New York Times Bestselling author of Leaving Time Paige has only a few vivid memories of her mother, who abandoned her at five years old. Now, having left her father behind in Chicago for dreams of art school and marriage to an ambitious young doctor, she finds herself with a child of her own. But her mother's absence and shameful memories of her past force her to doubt whether she could ever be capable of bringing joy and meaning into the life of her child, gifts her own mother never gave.Harvesting the Heart is written with astonishing clarity and evocative detail, convincing in its depiction of emotional pain, love, and vulnerability, and recalls the writing of Alice Hoffman and Kristin Hannah. Out of Paige's struggle to find wholeness, Jodi Picoult crafts an absorbing novel peopled by richly drawn characters, and explores motherhood with a power and depth only she is capable of.“A brilliant, moving examination of motherhood, brimming with detail and emotion.” —Richmond Times-Dispatch“Jodi Picoult explores the fragile ground of ambivalent motherhood in her lush second novel. This story belongs to… the lucky reader.” —The New York Times Book Review",453,107,80.1k follower,"['Fiction', 'Contemporary', 'Chick Lit', 'Romance', 'Drama', 'Audiobook', 'Adult']","3,404 review","12,195 (21%)","19,153 (34%)","17,618 (31%)","5,236 (9%)","1,403 (2%)"
Up in the Old Hotel,Joseph Mitchell,4.32,"4,040 rating","January 1, 1992","Saloon-keepers and street preachers, gypsies and steel-walking Mohawks, a bearded lady and a 93-year-old “seafoodetarian” who believes his specialized diet will keep him alive for another two decades. These are among the people that Joseph Mitchell immortalized in his reportage for The New Yorker and in four books—McSorley's Wonderful Saloon, Old Mr. Flood, The Bottom of the Harbor, and Joe Gould's Secret—that are still renowned for their precise, respectful observation, their graveyard humor, and their offhand perfection of style.These masterpieces (along with several previously uncollected stories) are available in one volume, which presents an indelible collective portrait of an unsuspected New York and its odder citizens—as depicted by one of the great writers of this or any other time.",716,120,171 follower,"['Nonfiction', 'Essays', 'Short Stories', 'New York', 'History', 'Journalism', 'Literature']",387 review,"2,163 (53%)","1,233 (30%)",475 (11%),125 (3%),44 (1%)
