title,authors,average_rating,rating,date_of_publication,descriptions,total_pages,genres,author_followers,no_of_reviews,no_of_books_by_author,one_star_ratings,two_star_ratings,three_star_ratings,four_star_ratings,five_star_ratings
Children of the Night,Dan Simmons,3.72,"8,116 rating","January 1, 1992","An evil legacy comes to life in this classic and ultimately human novel about believable vampires, featuring a brand-new introduction by Dan Simmons. Children of the Night will take you to a place that no one knows—yet all of us fear.In a desolate orphanage in post-Communist Romania, a desperately ill infant is given the wrong blood transfusion—and flourishes rather than dies. For immunologist Kate Neuman, the infant’s immune system may hold the key to cure cancer and AIDS. Kate adopts the baby and takes him home to the States. But baby Joshua holds a link to an ancient clan and their legendary leader—Vlad Tşepeş, the original Dracula – whose agents kidnap the child. Against impossible odds and vicious enemies– both human and vampire – Kate and her ally, Father Mike O’Rourke, steal into Romania to get her baby back.",453,"['Horror', 'Vampires', 'Fiction', 'Fantasy', 'Thriller', 'Science Fiction', 'Mystery']",11.9k follower,519 review,314,156 (1%),629 (7%),"2,530 (31%)","2,849 (35%)","1,952 (24%)"
Postcards from No Man's Land,Aidan Chambers,3.67,"2,631 rating","January 1, 1999",This compelling Printz Award winner alternates between the story of 17-year-old Jacob's visit to modern-day Amsterdam and that of 19-year-old Geetrui during Holland's Nazi occupation.,320,"['Young Adult', 'Historical Fiction', 'Fiction', 'Historical', 'LGBT', 'War', 'Teen']",293 follower,287 review,98,96 (3%),271 (10%),711 (27%),884 (33%),669 (25%)
"Bastards & Boneheads: Canada’s Glorious Leaders, Past and Present",Will Ferguson,4.10,287 rating,"October 1, 1999","This is it! After years of research, often late into the night, best-selling author Will Ferguson has come up with the most sophisticated system ever devised for evaluating Canadian leadership. It’s called BASTARDS AND BONEHEADS.Bastards succeed. Whether their goals are noble or immoral, Bastards are ruthless. Active. They cause events to unfold by an act of focussed will. Boneheads fail, usually by stumbling over their own two feet. Boneheads are reactive. Inept. They cause events to unfold mainly by accident. Bastards screw Canada. Boneheads just screw up.BASTARDS AND BONEHEADS makes an excellent parlour game. Pierre Trudeau was a Bastard. Joe Clark was not. Brian Mulroney managed to be both. Your turn: Jean Chrétien—Bastard or Bonehead?But Ferguson doesn’t limit himself to the prime ministers. No, sir. He takes on the full sweep of Canadian history, examining and evaluating the key personalities behind our most momentous events. When the English captured Quebec in 1759, was it a “Battle of Boneheads” or a “Contest of Bastards”? Was the War of 1812 won by Bastards? Or lost by Boneheads? From the internment of Japanese Canadians during the Second World War to Canada’s contribution to the Holocaust, from the battle for women’s rights to the rise of the separatist movement, Will Ferguson looks at our past head-on, wars and all. This is history on the edge: opinionated, hard-hitting, outrageous and always thought-provoking. Watch out, Canada. Will Ferguson is headed our way.",326,"['History', 'Nonfiction', 'Canada', 'Humor', 'Politics']",514 follower,36 review,45,2 (<1%),8 (2%),51 (17%),123 (42%),103 (35%)
My Other Life,Paul Theroux,3.83,"1,047 rating","September 1, 1996","In the Washington Post Book World, Sven Birkerts called this exuberant novel ""a complex and gripping work of invention and confession . . . I understood again how the prose of a true writer can bring us to a world beyond."" The book spans almost thirty years in the life of a fictional ""Paul Theroux,"" who moves through young bachelorhood in Africa, in and out of marriage, affairs, and employment, and between continents. It's a wry, worldly, erotic, and deeply moving account of one man's first half century - ""among the strongest things Theroux has ever written"" (New York Times Book Review).",464,"['Fiction', 'Travel', 'Africa', 'Contemporary', 'American', 'Literary Fiction', 'Novels']","2,335 follower",70 review,225,11 (1%),56 (5%),293 (27%),424 (40%),263 (25%)
Mandala,Jose Arguelles,4.29,65 rating,"January 1, 1974","This lavishly illustrated classic, selling over 70,000 copies in English and translated into four European languages, is the first to deal comprehensively with the mandala, the principle of the center, as a universal image, a vision, a way of growth, a ritual technique, and an essential life process. 92 illustrations, 11 in color.",140,"['Art', 'Spirituality', 'Religion', 'Philosophy']",37 book,8 review,37,2 (3%),2 (3%),4 (6%),24 (36%),33 (50%)
Whatever Happened to the Human Race?,Francis A. Schaeffer,4.15,275 rating,"January 1, 1979","""If a mother can kill her own children, then what can be next?"" Mother Teresa once asked. What indeed? Once the value of human life has been depreciated, as in Roe v. Wade and the Baby Doe Case, no one is safe. Once ""quality of life"" is substituted for the absolute value of human life itself, we all are endangered. Already respected scientists are calling for a time period following birth (a week or so) to decide if newborns have ""sufficient quality of life"" to be allowed to live. Already committees of ""medical professionals"" would like to decide whether the ""quality of life"" of the elderly or anyone seriously ill is high enough to allow them to go on living. In this moving book, the renowned pediatric surgeon and Surgeon General of the United States, C. Everett Koop, M.D., joins with one of the leading Christian thinkers of our day, Francis A. Schaeffer, to analyze the widespread implications and frightening loss of human rights brought on by today's practices of abortion, infanticide, and euthanasia. They see the present as a crucial turning point. Choices are being made that undermine human rights at their most basic level. Practices once labeled ""unthinkable"" are now considered acceptable. The destruction of human life, young and old, is being sanctioned on an ever-increasing scale by the medical profession, by the courts, by parents, and by silent citizens. ""But what can I do?"" you ask. ""I'm just one person."" You can start by reading this book. Yes, it will shock you. And it will make you weep. But it will also help you see how you can actually make a difference.",256,"['Christian', 'Theology', 'Philosophy', 'Nonfiction', 'Politics', 'Christianity', 'Cultural', 'Christian', 'Theology', 'Philosophy', 'Nonfiction', 'Politics', 'Christianity', 'Cultural', 'Christian', 'Theology', 'Philosophy', 'Nonfiction', 'Politics', 'Christianity', 'Cultural']",712 follower,32 review,75,7 (2%),8 (2%),43 (15%),97 (35%),120 (43%)
Love Takes Wing,Janette Oke,4.18,"9,084 rating","January 1, 1988","Book 7 of the bestselling Love Comes Softly series. Belinda Davis had trained as a nurse to assist her older brother, Doctor Luke. But as time goes by and she sees those she's grown up with getting married and settling into their own lives, Belinda becomes restless. What had seemed exciting and fresh becomes dull and routine. When she meets an elderly woman who needs nursing care, Belinda jumps at the invitation to go to Boston--a large, ""civilized"" city with cultural opportunities she's never even dreamed of in her little prairie town. But in spite of financial security and countless new experiences, Belinda finds herself restless, lonely, and empty inside.","PaperbackFirst published January 1, 1988","['Christian Fiction', 'Historical Fiction', 'Christian', 'Fiction', 'Romance', 'Historical', 'Christian Romance']","3,023 follower",155 review,296,114 (1%),333 (3%),"1,597 (17%)","2,769 (30%)","4,271 (47%)"
Who Moved the Stone?,Frank Morison,3.96,842 rating,"January 1, 1930","""I owe Morison a great debt of gratitude. Who Moved the Stone? was an important early link in a long chain of evidence that God used to bring me into his kingdom. Morison’s stirring intellectual exploration of the historical record proved to be an excellent starting point for my spiritual investigation."" --From the foreword by Lee Strobel English journalist Frank Morison had a tremendous drive to learn of Christ. The strangeness of the Resurrection story had captured his attention, and, influenced by skeptic thinkers at the turn of the century, he set out to prove that the story of Christ’s Resurrection was only a myth. His probings, however, led him to discover the validity of the biblical record in a moving, personal way. Who Moved the Stone? is considered by many to be a classic apologetic on the subject of the Resurrection. Morison includes a vivid and poignant account of Christ’s betrayal, trial, and death as a backdrop to his retelling of the climactic Resurrection itself. Among the chapter titles are: * The Book That Refused to Be Written * The Real Case Against the Prisoner * What Happened Before Midnight on Thursday * Between Sunset and Dawn * The Witness of the Great Stone * Some Realities of That Far-off Morning Who Moved the Stone? is a well-researched book that is as fascinating in its appeal to reason as it is accurate to the truthfulness of the Resurrection.",192,"['Christian', 'Christianity', 'Religion', 'Theology', 'Nonfiction', 'Faith', 'History']",8 follower,104 review,4,15 (1%),61 (7%),179 (21%),274 (32%),313 (37%)
Letting Go,Philip Roth,3.73,"1,805 rating","January 1, 1961","Leting Go is Philip Roth's masterly novel about the social and ethical constraints of the fifties. ""A rich book, full of incident, wry and sad and even in its most desolating scenes somehow amusing"".--Elizabeth Hardwick, Harper's.",630,"['Fiction', 'Literary Fiction', 'American', 'Americana', 'Literature', 'Novels', 'Classics']","6,690 follower",199 review,260,31 (1%),128 (7%),541 (29%),700 (38%),405 (22%)
The Capture,K.A. Applegate,3.97,"7,462 rating","February 1, 1997","It was really bad when Jake found out his older brother was one of them. It was even worse when Tobias stayed in his morph too long. But nothing compares to the horror the Animorphs are about to face. Nothing.Jake, Rachel, Tobias, Cassie and Marco have a feeling they know where the Yeerks' new base is located. And they've even figured out how to get in—how many people notice a few flies on the wall? But they never figured they might get caught. Or that Jake could fall into the Yeerk pool. That Jake could become a human controller.A Yeerk.The enemy.",154,"['Science Fiction', 'Young Adult', 'Fiction', 'Fantasy', 'Childrens', 'Middle Grade', 'Aliens', 'Science Fiction', 'Young Adult', 'Fiction', 'Fantasy', 'Childrens', 'Middle Grade', 'Aliens', 'Science Fiction', 'Young Adult', 'Fiction', 'Fantasy', 'Childrens', 'Middle Grade', 'Aliens']",361 follower,369 review,254,83 (1%),374 (5%),"1,880 (25%)","2,459 (32%)","2,666 (35%)"
Glory Road,Robert A. Heinlein,3.79,"13,799 rating","September 1, 1963","E. C. ""Scar"" Gordon was on the French Riviera recovering from a tour of combat in Southeast Asia , but he hadn't given up his habit of scanning the Personals in the newspaper. One ad in particular leapt out at him:""ARE YOU A COWARD? This is not for you. We badly need a brave man. He must be 23 to 25 years old, in perfect health, at least six feet tall, weigh about 190 pounds, fluent English, with some French, proficient in all weapons, some knowledge of engineering and mathematics essential, willing to travel, no family or emotional ties, indomitably courageous and handsome of face and figure. Permanent employment, very high pay, glorious adventure, great danger. You must apply in person, rue Dante, Nice, 2me étage, apt. D.""How could you not answer an ad like that, especially when it seemed to describe you perfectly? Well, except maybe for the ""handsome"" part, but that was in the eye of the beholder anyway. So he went to that apartment and was greeted by the most beautiful woman he'd ever met. She seemed to have many names, but agreed he could call her ""Star."" A pretty appropriate name, as it turned out, for the empress of twenty universes.Robert A. Heinlein's one true fantasy novel, Glory Road is as much fun today as when he wrote it after Stranger in a Strange Land. Heinlein proves himself as adept with sword and sorcery as with rockets and slide rules and the result is exciting, satirical, fast-paced, funny and tremendously readable -- a favorite of all who have read it. Glory Road is a masterpiece of escapist entertainment with a typically Heinleinian sting in its tail. ",320,"['Science Fiction', 'Fantasy', 'Fiction', 'Science Fiction Fantasy', 'Adventure', 'Speculative Fiction', 'Classics']","9,547 follower",706 review,819,293 (2%),"1,124 (8%)","3,824 (27%)","4,553 (32%)","4,005 (29%)"
Advanced Control Theory,A. Nagoor Kani,3.92,193 rating,"July 1, 1999",,550,[],72 follower,7 review,12,18 (9%),13 (6%),23 (11%),52 (26%),87 (45%)
Swamp Foetus,Poppy Z. Brite,3.92,"5,763 rating","December 1, 1993","In the brightly decadent nightscape of New Orleans, strange figures stalk the fringes of existence, demanding sacrifice and blood. In backwoods Georgia, flesh stirs among the unknown graveyards. And in the human swamp of Calcutta, the souls of the dead walk among the living... Poppy Z. Brite is back to haunt us with twelve new tales of bizarre and seductive terror.From America's fastest rising horror star—author of Drawing Blood and Lost Souls—Swamp Foetus is a trip to the black heart of longing... to the darkest regions of desire...",190,"['Horror', 'Short Stories', 'Fiction', 'Fantasy', 'Gothic', 'Anthologies', 'Vampires']","3,108 follower",203 review,156,86 (1%),307 (5%),"1,466 (25%)","2,007 (34%)","1,897 (32%)"
When Hitler Stole Pink Rabbit,Judith Kerr,3.99,"21,228 rating","January 1, 1971","Partly autobiographical, this is first of the internationally acclaimed trilogy by Judith Kerr telling the unforgettable story of a Jewish family fleeing from Germany at the start of the Second World WarSuppose your country began to change. Suppose that without your noticing, it became dangerous for some people to live in Germany any longer. Suppose you found, to your complete surprise, that your own father was one of those people.That is what happened to Anna in 1933. She was nine years old when it began, too busy with her schoolwork and toboganning to take much notice of political posters, but out of them glared the face of Adolf Hitler, the man who would soon change the whole of Europe – starting with her own small life.Anna suddenly found things moving too fast for her to understand. One day, her father was unaccountably missing. Then she herself and her brother Max were being rushed by their mother, in alarming secrecy, away from everything they knew – home and schoolmates and well-loved toys – right out of Germany…",191,"['Historical Fiction', 'Fiction', 'Historical', 'Childrens', 'Holocaust', 'War', 'Young Adult']",338 follower,"1,632 review",128,304 (1%),943 (4%),"4,428 (20%)","8,476 (39%)","7,077 (33%)"
Pacific Vortex!,Clive Cussler,3.80,"23,407 rating","January 1, 1983",Vintage paperback,270,"['Adventure', 'Fiction', 'Thriller', 'Action', 'Mystery', 'Suspense', 'Mystery Thriller']","7,903 follower",902 review,492,338 (1%),"1,379 (5%)","6,984 (29%)","8,596 (36%)","6,110 (26%)"
The Failure of the New Economics,Henry Hazlitt,4.16,410 rating,"January 1, 1959","Henry Hazlitt did the seemingly impossible, something that was and is a magnificent service to all people everywhere. He wrote a line-by-line commentary and refutation of one of the most destructive, fallacious, and convoluted books of the century. The target here is John Maynard Keynes's General Theory, the book that appeared in 1936 and swept all before it. In economic science, Keynes changed everything. He supposedly demonstrated that prices don't work, that private investment is unstable, that sound money is intolerable, and that government was needed to shore up the system and save it. It was simply astonishing how economists the world over put up with this, but it happened. He converted a whole generation in the late period of the Great Depression. By the 1950s, almost everyone was Keynesian. But Hazlitt, the nation's economics teacher, would have none of it. And he did the hard work of actually going through the book to evaluate its logic according to Austrian-",451,"['Economics', 'Nonfiction', 'Politics', 'History', 'Philosophy']",374 follower,25 review,100,11 (2%),15 (3%),57 (13%),141 (34%),186 (45%)
A Diplomat in Japan: The Inner History of the Critical Years in the Evolution of Japan When the Ports Were Opened and the Monarchy Restored,Ernest Mason Satow,3.95,59 rating,"January 1, 1821","Based on the author’s detailed diary, personal encounters, and keen memory, this book is a record of the inner history of the critical years of social and political upheaval that accompanied Japan’s first encounters with the West around the time of the Meiji Restoration.Sir Ernest Mason Satow (1843–1929) was a member of the British legation in Tokyo for twenty-one years.",472,"['Japan', 'History', 'Nonfiction', 'Japanese Literature', 'Asia', 'World History', 'Travel']",6 follower,7 review,82,0 (0%),4 (6%),11 (18%),28 (47%),16 (27%)
Dziewczyna w złotych majtkach,Juan Marsé,3.26,535 rating,"January 1, 1978","Luys Forest - wdowiec i emerytowany falangista - postanawia spędzić resztę życia w zaciszu nadmorskiej posiadłości w Calafell i tam poświęcić się spisywaniu wspomnień. Nieoczekiwanie błogą samotność przerywa przybycie siostrzenicy Mariany. Wyzwolona i spontaniczna dziewczyna deklaruje chęć pomocy w przepisywaniu powstającej książki.Między Luysem a jego siostrzenicą rodzi się zażyłość, dzięki której na jaw wychodzą skrywane dotąd tajemnice dotyczące życia politycznego i prywatnego. Mariana bezceremonialnie dopytuje o wszystko, odkrywając kłamstwa, które służą Luysowi do stworzenia monumentalnego wizerunku bohaterskiej przeszłości.Wisząca nad wujem i jego siostrzenicą erotyczna atmosfera, sprowokowana rozwiązłością Mariany i wyobraźnią Luysa, doprowadzi do finału, w którym wyjaśni się, kim naprawdę był Luys, a kim złota dziewczyna.Dziewczyna w złotych majtkach zarówno tytułem, jak i poruszeniem kwestii swobody seksualnej, nawiązuje do balzakowskiej Dziewczyny o złotych oczach",208,"['Spain', 'Spanish Literature', 'Fiction', 'Spain', 'Spanish Literature', 'Fiction', 'Spain', 'Spanish Literature', 'Fiction']",164 follower,50 review,51,27 (5%),83 (15%),196 (36%),180 (33%),49 (9%)
The Integral Trees,Larry Niven,3.76,"9,146 rating","January 1, 1983","When leaving Earth, the crew of the spaceship Discipline was prepared for a routine assignment. Dispatched by the all-powerful State on a mission of interstellar exploration and colonization, Discipline was aided (and secretly spied upon) by Sharls Davis Kendy, an emotionless computer intelligence programmed to monitor the loyalty and obedience of the crew. But what they weren’t prepared for was the smoke ring–an immense gaseous envelope that had formed around a neutron star directly in their path. The Smoke Ring was home to a variety of plant and animal life-forms evolved to thrive in conditions of continual free-fall. When Discipline encountered it, something went wrong. The crew abandoned ship and fled to the unlikely space oasis.Five hundred years later, the descendants of the Discipline crew living on the Smoke Ring no longer remember their origins. Earth is more myth than memory, and no recollection of the State remains. But Kendy remembers. And just outside the Smoke Ring, Discipline waits patiently to make contact with its wayward children.",272,"['Science Fiction', 'Fiction', 'Science Fiction Fantasy', 'Fantasy', 'Hard Science Fiction', 'Audiobook', 'Adventure']","3,090 follower",256 review,309,137 (1%),653 (7%),"2,727 (29%)","3,384 (36%)","2,245 (24%)"
Deception,Philip Roth,3.35,"2,912 rating","January 1, 1993","""With the lover everyday life recedes,"" Roth writes - and exhibiting all his skill as a brilliant observer of human passion, he presents in Deception the tightly enclosed world of adulterous intimacy with a directness that has no equal in American fiction.At the center of Deception are two adulterers in their hiding place. He is a middle-aged American writer named Philip, living in London, and she is an articulate, intelligent, well-educated Englishwoman compromised by a humiliating marriage to which, in her 30s, she is already nervously half-resigned.The book's action consists of conversation - mainly the lovers talking to each other before and after making love. That dialogue - sharp, rich, playful, inquiring, ""moving"", as Hermione Lee writes, ""on a scale of pain from furious bafflement to stoic gaiety"" - is nearly all there is to this audiobook, and all there needs to be.",208,"['Fiction', 'American', 'Literature', 'Literary Fiction', 'Novels', 'The United States Of America', '20th Century']","6,690 follower",296 review,260,130 (4%),408 (14%),"1,067 (36%)",934 (32%),373 (12%)
"My Traitor's Heart: A South African Exile Returns to Face His Country, His Tribe, and His Conscience",Rian Malan,4.25,"3,778 rating","January 1, 1990","A classic of literary nonfiction, My Traitor's Heart has been acclaimed as a masterpiece by readers around the world. Rian Malan is an Afrikaner, scion of a centuries-old clan and relative of the architect of apartheid, who fled South Africa after coming face-to-face with the atrocities and terrors of an undeclared civil war between the races. This book is the searing account of his return after eight years of uneasy exile. Armed with new insight and clarity, Malan explores apartheid's legacy of hatred and suffering, bearing witness to the extensive physical and emotional damage it has caused to generations of South Africans on both sides of the color line. Plumbing the darkest recesses of the white and black South African psyches, Malan ultimately finds his way toward the light of redemption and healing. My Traitor's Heart is an astonishing book -- beautiful, horrifying, profound, and impossible to put down.",349,"['Africa', 'Nonfiction', 'South Africa', 'History', 'Memoir', 'Biography', 'Politics']",61 follower,242 review,23,63 (1%),123 (3%),483 (12%),"1,247 (33%)","1,862 (49%)"
Rama II,Arthur C. Clarke,3.70,"26,847 rating","November 1, 1989","Rama est revenu ! Rama, ou plutôt son double, son clone, son jumeau : Rama II. Soixante-dix ans plus tôt, un mystérieux engin extraterrestre traversait brièvement le système solaire, donnant corps à cette fabuleuse révélation : l'homme n'était pas seul dans l'Univers. Et voilà qu'en cette année 2196, le scénario se répète ! Un deuxième vaisseau interstellaire, exactement semblable au précédent, se matérialise dans l'espace... L'humanité, pour la seconde fois de son histoire, envoie une équipe de savants à la rencontre du visiteur. Mission exaltante, bien sûr, mais les intentions des uns et des autres sont-elles aussi nobles qu'elles le paraissent ? Sans oublier celles de l'étranger : pourquoi la nef infléchit-elle brusquement sa course vers la Terre ? Que dissimulent les flancs de Rama II ? Des merveilles... ou un danger mortel ?",512,"['Science Fiction', 'Fiction', 'Science Fiction Fantasy', 'Space', 'Aliens', 'Novels', 'Fantasy', 'Science Fiction', 'Fiction', 'Science Fiction Fantasy', 'Space', 'Aliens', 'Novels', 'Fantasy', 'Science Fiction', 'Fiction', 'Science Fiction Fantasy', 'Space', 'Aliens', 'Novels', 'Fantasy']",10.4k follower,900 review,"1,419",875 (3%),"2,350 (8%)","7,490 (27%)","9,384 (34%)","6,748 (25%)"
The Violet Fairy Book,Andrew Lang,4.12,"1,491 rating","January 1, 1901","Roumania, Japan, Serbia, Lithuania, Africa, Portugal, and Russia are among the sources of these 35 stories that tell of a haunted forest, chests of gold coins, a magical dog, and a man who outwits a dragon. Perhaps the best English versions available of these classic stories. 74 illustrations.",388,"['Fantasy', 'Fairy Tales', 'Classics', 'Fiction', 'Childrens', 'Short Stories', 'Folklore']",493 follower,55 review,"2,772",24 (1%),45 (3%),311 (20%),461 (30%),650 (43%)
