title,authors,average_rating,rating,date_of_publication,descriptions,total_pages,genres,author_followers,no_of_reviews,no_of_books_by_author,one_star_ratings,two_star_ratings,three_star_ratings,four_star_ratings,five_star_ratings
Notes of a Pug-Nosed Mephistopheles,Volodymyr Vynnychenko,4.39,950 rating,"January 1, 1917","Роман В. Винниченка (1880—1951) “Записки Кирпатого Мефістофеля” — своєрідний підсумок творчих пошуків письменника. На сторінках роману перед нами постає успішний адвокат, інтелектуал, діяльна людина (в минулому — революціонер), беззастережний і цинічний гравець життям. Але драматичність наслідків власних вчинків змушує його під­нятися над своїм егоїзмом, беззахисність маленької дитини пробуджує батьківські почуття, потребу піклуватися про неї. Інтригуючі сюжетні лінії, глибокий психологізм, іронічність оповіді, точне і колоритне слово — все це робить твір живим та цікавим і сьогодні. Роман читається з великим інтересом і спонукає читача замислитися над питанням, як повинна жити людина, у чому її справжнє щастя?",184,"['Ukrainian Literature', 'Classics', 'Fiction', 'Ukraine', 'Audiobook', 'Ukrainian Literature', 'Classics', 'Fiction', 'Ukraine', 'Audiobook', 'Ukrainian Literature', 'Classics', 'Fiction', 'Ukraine', 'Audiobook']",25 follower,119 review,82,0 (0%),16 (1%),80 (8%),367 (38%),487 (51%)
Torch Song Trilogy,Harvey Fierstein,4.25,"2,384 rating","June 1, 1978","Drama, American Literature, Gay and Lesbian Studies, PlaysTorch Song Trilogy is a collection of three plays by Harvey Fierstein rendered in three acts: International Stud, Fugue in a Nursery, and Widows and Children First! The story centers on Arnold Beckoff, a torch song singing Jewish drag queen living in New York City in the late 1970 and 1980s. The four hour-plus play begins with a soliloquy in which he explains his cynical disillusionment with love.Each act focuses on a different phase in Arnold's life. In the first, Arnold meets Ed, who is uncomfortable with his bisexuality. In the second, one year later, Arnold meets Alan, and the two settle down into a blissful existence that includes plans to adopt a child, until tragedy strikes. In the third, several years later, Arnold is a single father raising gay teenager David. Arnold is forced to deal with his mother's intolerance and disrespect when she visits from Florida.",173,"['Plays', 'LGBT', 'Drama', 'Theatre', 'Queer', 'Fiction', 'Gay']",142 follower,69 review,23,26 (1%),66 (2%),356 (14%),776 (32%),"1,160 (48%)"
The Hobbit & The Lord of the Rings,J.R.R. Tolkien,4.61,"132,912 rating","January 1, 1954","Delve into Tolkien’s Middle-earth with this special collector’s hardback boxed set. Presented in sumptuous new cover designs discover the complete story of Bilbo Baggins and the Hobbits’ epic encounters with Gandalf, Gollum, dragons and monsters, in the quest to destroy the One Ring.When they were first published, The Hobbit and The Lord of the Rings became instant classics. Treasured by readers young and old, these works of sweeping fantasy, steeped in unrivalled magic and otherworldliness have sold more than 150 million copies around the world.This new boxed set contains both titles and features brand new cover designs. It offers readers a new opportunity to discover Tolkien’s remarkable world of Middle-earth and to follow the complete story of Bilbo Baggins and the Hobbits’ part in the epic quest for the Ring – beginning with Bilbo’s fateful visit from Gandalf and culminating in the dramatic climax between Frodo and Gollum atop Mount Doom.",1792,"['Fantasy', 'Fiction', 'Classics', 'Adventure', 'Science Fiction Fantasy', 'Epic Fantasy', 'High Fantasy']",70.5k follower,"2,250 review",585,"1,154 (<1%)","1,747 (1%)","7,632 (5%)","26,866 (20%)","95,513 (71%)"
The Invention of Solitude,Paul Auster,3.76,"14,746 rating","January 1, 1982","In this debut work by New York Times-bestselling author Paul Auster (The New York Trilogy), The Invention of Solitude, a memoir, established Auster’s reputation as a major new voice in American writing. His moving and personal meditation on fatherhood is split into two stylistically separate sections. In the first, Auster reflects on the memories of his father who was a distant, undemonstrative, and cold man who died an untimely death. As he sifts through his Father’s things, Auster uncovers a sixty-year-old murder mystery that sheds light on his father’s elusive character. In the second section, the perspective shifts and Auster begins to reflect on his own identity as a father by adopting the voice of a narrator, “A.” Through a mosaic of images, coincidences, and associations “A,” contemplates his separation from his son, his dying grandfather, turning the story into a self-conscious reflection on the process of writing.",192,"['Nonfiction', 'Memoir', 'Biography', 'Literature', 'American', 'Autobiography', 'The United States Of America']",10.9k follower,"1,736 review",249,220 (1%),"1,001 (6%)","4,331 (29%)","5,693 (38%)","3,501 (23%)"
"Women Writing in India: 600 B.C. to the Present, V: 600 B.C. to the Early Twentieth Century",Susie J. Tharu,4.36,50 rating,"February 1, 1991","These ground-breaking collections offer 200 texts from 11 languages, never before available in English or as a collection, along with a new reading of cultural history that draws on contemporary scholarship on women and on India. This extraordinary body of literature and important documentary resource illuminates the lives of Indian women through 2,600 years of change and extends the historical understanding of literature, feminism, and the making of modern India. The biographical, critical, and bibliographical headnotes in both volumes, supported by an introduction which Anita Desai describes as “intellectually rigorous, challenging, and analytical,” place the writers and their selections within the context of Indian culture and history.Volume I: 600 B.C. to the Early Twentieth Century includes songs by Buddhist nuns, testimonies of medieval rebel poets and court historians, and the voices of more than 60 other writers of the 18th and 19th centuries. Among the diverse selections are a rare early essay by an untouchable woman; an account by the first feminist historian; and a selection from the first novel written in English by an Indian woman. ",576,"['India', 'History', 'Feminism', 'Nonfiction', 'Womens', 'Anthologies', 'Indian Literature', 'India', 'History', 'Feminism', 'Nonfiction', 'Womens', 'Anthologies', 'Indian Literature', 'India', 'History', 'Feminism', 'Nonfiction', 'Womens', 'Anthologies', 'Indian Literature']",2 follower,8 review,9,0 (0%),0 (0%),6 (12%),20 (40%),24 (48%)
The Stranger Beside Me: Ted Bundy: The Shocking Inside Story,Ann Rule,4.14,"99,489 rating","August 1, 1980","Utterly unique in its astonishing intimacy, as jarringly frightening as when it first appeared, Ann Rule's The Stranger Beside Me defies our expectation that we would surely know if a monster lived among us, worked alongside of us, appeared as one of us. With a slow chill that intensifies with each heart-pounding page, Rule describes her dawning awareness that Ted Bundy, her sensitive coworker on a crisis hotline, was one of the most prolific serial killers in America. He would confess to killing at least thirty-six young women from coast to coast, and was eventually executed for three of those cases. Drawing from their correspondence that endured until shortly before Bundy's death, and striking a seamless balance between her deeply personal perspective and her role as a crime reporter on the hunt for a savage serial killer -- the brilliant and charismatic Bundy, the man she thought she knew -- Rule changed the course of true-crime literature with this unforgettable chronicle.",548,"['True Crime', 'Nonfiction', 'Crime', 'Audiobook', 'Biography', 'Memoir', 'Mystery']","3,935 follower","5,909 review",142,"1,087 (1%)","3,232 (3%)","16,933 (17%)","38,104 (38%)","40,133 (40%)"
Killer Clown: The John Wayne Gacy Murders,Terry Sullivan,3.95,"6,336 rating","April 19, 1983",The state prosecutor at the Gacy trial recounts the police investigation that led to Gacy's arrest and details the course of Gacy's trial for the murder of 33 young men and boys. Reissue.,400,"['True Crime', 'Nonfiction', 'Crime', 'Biography', 'Audiobook', 'Horror', 'History', 'True Crime', 'Nonfiction', 'Crime', 'Biography', 'Audiobook', 'Horror', 'History', 'True Crime', 'Nonfiction', 'Crime', 'Biography', 'Audiobook', 'Horror', 'History']",31 follower,341 review,11,82 (1%),282 (4%),"1,597 (25%)","2,313 (36%)","2,062 (32%)"
The Star of Kazan,Eva Ibbotson,4.03,"8,607 rating","December 31, 1999","La naissance d'Annika est un mystère. Abandonnée dans une église en pleine montagne, elle a été élevée par une famille excentrique de Vienne. Sa vie bascule lorsque sa vraie mère réapparaît et l'emmène vivre en Allemagne, dans son château morne et glacé. Heureusement, Annika trouve l'amitié auprès du jeune palefrenier, Zed, un gitan passionné par les chevaux et qui rêve de rentrer à la prestigieuse école d'équitation de Vienne.",405,"['Historical Fiction', 'Fiction', 'Young Adult', 'Fantasy', 'Childrens', 'Historical', 'Middle Grade']","2,261 follower",721 review,58,69 (<1%),346 (4%),"1,864 (21%)","3,290 (38%)","3,038 (35%)"
The Valkyries,Paulo Coelho,3.32,"26,554 rating","January 1, 1988","A Magical Tale About Forgiving Our Past and Believing in Our FutureThe enchanting, true story of The Valkyries begins in Rio de Janeiro when author Paulo Coelho gives his mysterious master J., the only manuscript for his book The Alchemist. Haunted by a devastating curse, Coelho confesses to J., ""I′ve seen my dreams fall apart just when I seemed about to achieve them."" In response, J. gives Coelho a daunting task: He must find and speak with his guardian angel. ""The curse can be broken,"" he replies, ""if you complete the task.""Rising to the challenge, Paulo and his wife, Cristina, drop everything, pack their bags, and take off on a forty day adventure into the starkly beautiful and sometimes dangerous Mojave Desert where they encounter more than they bargained for. A masterful blend of the exotic locales, dramatic adventure, and magical storytelling, for which Coelho′s fictional works are renowned, this true-life account is at once a modern-day adventure and a metaphysical odyssey.",243,"['Fiction', 'Spirituality', 'Philosophy', 'Novels', 'Fantasy', 'Contemporary', 'Inspirational']",133k follower,"1,285 review",303,"1,731 (6%)","4,325 (16%)","8,916 (33%)","6,976 (26%)","4,606 (17%)"
The Price of Glory: Verdun 1916,Alistair Horne,4.29,"2,842 rating","January 1, 1962","
The Price of Glory: Verdun 1916 
is the second book of Alistair Horne's trilogy, which includes The Fall of Paris and To Lose a Battle and tells the story of the great crises of the rivalry between France and Germany.The battle of Verdun lasted ten months. It was a battle in which at least 700,000 men fell, along a front of fifteen miles. Its aim was less to defeat the enemy than bleed him to death and a battleground whose once fertile terrain is even now a haunted wilderness.Alistair Horne's classic work, continuously in print for over fifty years, is a profoundly moving, sympathetic study of the battle and the men who fought there. It shows that Verdun is a key to understanding the First World War to the minds of those who waged it, the traditions that bound them and the world that gave them the opportunity.'Verdun was the bloodiest battle in history ... The Price of Glory is the essential book on the subject'  Sunday Times'It has almost every merit ... Horne sorts out complicating issues with the greatest clarity. He has a splendid gift for depicting individuals'  A.J.P. Taylor, Observer'A masterpiece'  The New York Times'Compellingly told ... Alastair Horne uses contemporary accounts from both sides to build up a picture of heroism, mistakes, even farce'  Sunday Telegraph'Brilliantly written ... very readable; almost like a historical novel - except that it is true'  Field Marshal Viscount MontgomeryOne of Britain's greatest historians, Sir Alistair Horne, CBE, is the author of a trilogy on the rivalry between France and Germany, The Price of Glory, The Fall of Paris and To Lose a Battle, as well as a two-volume life of Harold Macmillan.",388,"['History', 'Nonfiction', 'World War I', 'Military History', 'War', 'France', 'Military Fiction']",178 follower,186 review,68,27 (<1%),68 (2%),343 (12%),"1,011 (35%)","1,393 (49%)"
Τα ποιήματα 1941-1956,Μανόλης Αναγνωστάκης,4.49,35 rating,"January 1, 1956",,"First published January 1, 1956","['Poetry', 'Poetry', 'Poetry']",27 follower,2 review,21,0 (0%),2 (5%),2 (5%),8 (22%),23 (65%)
El Eternauta,Héctor Germán Oesterheld,4.33,"5,482 rating","September 4, 1957","El Eternauta: La historieta original. Edición especial: literatura complementaria.Ni de paz ni de amor. La noche que abre El Eternauta es de angustia y desolación. La nevada que cae sobre Buenos Aires es sólo el primer tramo de una invasión alienígena que desgranará sobre reconocibles escenarios urbanos su violenta espiral de poesía y aniquilamiento. ¿Cómo se combate esta estratégica avanzada militar que ahoga las esperanzas de supervivencia humana? ¿Dónde se esconde el verdadero enemigo? ¿Quién será capaz de enfrentar un destino peor que la muerte? ¿Qué hacer cuando es imposible avanzar e inviable retroceder? Resistir. Contra el invasor. O contra el ejercicio abusivo del poder, que viene a ser lo mismo.La mayor aventura de ciencia-ficción escrita en el sur del mundo apareció serializada como un largo folletín en la revista Hora Cero Semanal entre 1957 y 1959. Obra de Héctor Germán Oesterheld y Francisco Solano López, la epopeya de El Eternauta es una minuciosa radiografía de la historia argentina de los últimos cincuenta años. Metáfora alucinante del país arrasado, entregado a los intereses externos y dominado por el invasor. Una historia actual que continúa gritando su mensaje a los cuatro vientos: Cuando ya no importa si se gana o se pierde, lo único que prevalece es la dignidad con la cual se presente batalla.",368,"['Comics', 'Graphic Novels', 'Science Fiction', 'Fiction', 'Graphic Novels Comics', 'Comic Book', 'Spanish Literature', 'Comics', 'Graphic Novels', 'Science Fiction', 'Fiction', 'Graphic Novels Comics', 'Comic Book', 'Spanish Literature', 'Comics', 'Graphic Novels', 'Science Fiction', 'Fiction', 'Graphic Novels Comics', 'Comic Book', 'Spanish Literature', 'Comics', 'Graphic Novels', 'Science Fiction', 'Fiction', 'Graphic Novels Comics', 'Comic Book', 'Spanish Literature', 'Comics', 'Graphic Novels', 'Science Fiction', 'Fiction', 'Graphic Novels Comics', 'Comic Book', 'Spanish Literature']",159 follower,474 review,116,44 (<1%),143 (2%),656 (11%),"1,744 (31%)","2,895 (52%)"
Permanent Revolution & Results and Prospects,Leon Trotsky,3.86,668 rating,"January 1, 1930","Trotsky's theory of permanent revolution, based on his view of the strategy and class alliances needed to overthrow tsarism in Russia, as first elaborated in 1906 and later generalized in 1929 to struggles throughout the colonial and semicolonial world.",281,"['Politics', 'Nonfiction', 'History', 'Philosophy', 'Theory', 'Russian Revolution', 'Russia', 'Politics', 'Nonfiction', 'History', 'Philosophy', 'Theory', 'Russian Revolution', 'Russia', 'Politics', 'Nonfiction', 'History', 'Philosophy', 'Theory', 'Russian Revolution', 'Russia']",651 follower,48 review,964,25 (3%),62 (9%),143 (21%),189 (28%),249 (37%)
Tree Book : Learning to Recognize Trees of British Columbia,Roberta Parish,4.15,13 rating,"January 1, 1994",,183,"['Science', 'Plants', 'Nonfiction']",2 book,2 review,2,0 (0%),1 (7%),3 (23%),2 (15%),7 (53%)
Return to My Native Land,Aimé Césaire,4.09,"2,879 rating","January 1, 1939","A work of immense cultural significance and beauty, this long poem became an anthem for the African diaspora and the birth of the Negritude movement. With unusual juxtapositions of object and metaphor, a bouquet of language-play, and deeply resonant rhythms, Césaire considered this work a ""break into the forbidden,"" at once a cry of rebellion and a celebration of black identity.More praise:""The greatest living poet in the French language.""--American Book Review""Martinique poet Aime Cesaire is one of the few pure surrealists alive today. By this I mean that his work has never compromised its wild universe of double meanings, stretched syntax, and unexpected imagery. This long poem was written at the end of World War II and became an anthem for many blacks around the world. Eshleman and Smith have revised their original 1983 translations and given it additional power by presenting Cesaire's unique voice as testament to a world reduced in size by catastrophic events."" --Bloomsbury Review ""Through his universal call for the respect of human dignity, consciousness and responsibility, he will remain a symbol of hope for all oppressed peoples."" --Nicolas Sarkozy""Evocative and thoughtful, touching on human aspiration far beyond the scale of its specific concerns with Cesaire's native land - Martinique."" --The Times",88,"['Poetry', 'France', 'Classics', 'Nonfiction', 'Race', 'School', 'French Literature', 'Poetry', 'France', 'Classics', 'Nonfiction', 'Race', 'School', 'French Literature', 'Poetry', 'France', 'Classics', 'Nonfiction', 'Race', 'School', 'French Literature', 'Poetry', 'France', 'Classics', 'Nonfiction', 'Race', 'School', 'French Literature', 'Poetry', 'France', 'Classics', 'Nonfiction', 'Race', 'School', 'French Literature']",451 follower,218 review,101,54 (1%),164 (5%),458 (15%),992 (34%),"1,211 (42%)"
The Devil in Massachusetts: A Modern Enquiry Into the Salem Witch Trials,Marion L. Starkey,3.59,896 rating,"January 1, 1949",This historical narrative of the Salem witch trials takes its dialogue from actual trial records but applies modern psychiatric knowledge to the witchcraft hysteria. Starkey's sense of drama also vividly recreates the atmosphere of pity and terror that fostered the evil and suffering of this human tragedy.,310,"['History', 'Nonfiction', 'Witches', 'American History', 'Religion', 'Historical', 'Witchcraft']",5 follower,99 review,25,29 (3%),86 (9%),290 (32%),313 (34%),178 (19%)
Platero y yo,Juan Ramón Jiménez,3.82,"9,288 rating","January 1, 1914","""Platero y yo"" es el mejor conjunto de poemas en prosa de la literatura española. Lectura de niños y adultos en todos los países de habla hispana. Traducido a las más importantes lenguas de cultura. Libro que es, entre otras cosas, elegía andaluza, autobiografía lírica, inmortalización del pueblo natal del autor y creación de un mito imperecedero: el burrillo de Moguer. Michael P. Predmore, especialista en la obra de Juan Ramón, ofrece en este volumen el texto cuidado de la edición alargada (1917), cuatro apéndices y un estudio de esta obra clave de la literatura contemporánea.",192,"['Poetry', 'Classics', 'Fiction', 'Spanish Literature', 'Spain', 'Nobel Prize', 'Literature', 'Poetry', 'Classics', 'Fiction', 'Spanish Literature', 'Spain', 'Nobel Prize', 'Literature', 'Poetry', 'Classics', 'Fiction', 'Spanish Literature', 'Spain', 'Nobel Prize', 'Literature', 'Poetry', 'Classics', 'Fiction', 'Spanish Literature', 'Spain', 'Nobel Prize', 'Literature', 'Poetry', 'Classics', 'Fiction', 'Spanish Literature', 'Spain', 'Nobel Prize', 'Literature']",211 follower,671 review,401,302 (3%),790 (8%),"2,255 (24%)","2,843 (30%)","3,098 (33%)"
The Animals of Farthing Wood,Colin Dann,4.06,"5,757 rating","January 1, 1979","‘We must all find a new home. Now – before it’s too late!’ Farthing Wood is being bulldozed, and there’s a drought. Fox, Badger, Toad, Tawny Owl, Mole and the other animals must band together and set off to a far-away nature reserve. Their journey is full of adventure and fraught with disasters, and the animals must work together to survive. The Animals of Farthing Wood is one of the most popular animal stories in children’s literature and is still in print nearly 40 years after first publication. ‘The Animals of Farthing Wood always made me very happy’ – Alison Flood, Guardian This edition features a brand-new cover by award-winning illustrator, Sam Usher.",400,"['Childrens', 'Animals', 'Fiction', 'Fantasy', 'Classics', 'Adventure', 'Middle Grade']",79 follower,229 review,97,84 (1%),256 (4%),"1,186 (20%)","1,921 (33%)","2,310 (40%)"
The Seven Silly Eaters,Mary Ann Hoberman,4.44,"3,901 rating","February 1, 1997","Peter wants only milk, Lucy won’t settle for anything but homemade lemonade, and Jack is stuck on applesauce. Each new addition to the household brings a new demand for a special meal. What’s a mother to do? “[A] highly comic rhyming romp that surprisingly (and nicely) twists into a birthday story.” —School Library Journal",38,"['Picture Books', 'Childrens', 'Fiction', 'Family', 'Food', 'Humor', 'Poetry', 'Picture Books', 'Childrens', 'Fiction', 'Family', 'Food', 'Humor', 'Poetry', 'Picture Books', 'Childrens', 'Fiction', 'Family', 'Food', 'Humor', 'Poetry']",66 follower,492 review,62,42 (1%),103 (2%),391 (10%),934 (23%),"2,431 (62%)"
Pobby and Dingan,Ben Rice,3.86,"1,996 rating","January 1, 2000","Pobby and Dingan live in Lightning Ridge, New South Wales, the opal capital of Australia. They are friends with Kellyanne Williamson, the daughter of an opal miner, but only Kellyanne can see them. Pobby and Dingan are imaginary.Ashmol Williamson, Kellyanne's brother, thinks his sister should grow up and stop being such a fruit loop. Until the day, that is, when Pobby and Dingan disappear--the same day that Ashmol and Kellyanne's father is accused of ""ratting"" (poaching on someone else's land), the worst sin an opal miner can commit.As Kellyanne--grief-stricken and suddenly, mysteriously, ill--begins to fade away, Ashmol recruits the whole town in a search for Pobby and Dingan. In the end, however, he discovers that only he can find them, and that he can only find them if he too believes they are real.Funny, deeply moving and told without a wasted word, Pobby and Dingan--the debut of a prodigiously gifted new writer--is an enchanting story.",112,"['Fiction', 'Australia', 'Magical Realism', 'Young Adult', 'Novella', 'Contemporary', 'Childrens']",19 follower,256 review,8,33 (1%),136 (6%),502 (25%),722 (36%),603 (30%)
Grapefruit: A Book of Instructions and Drawings,Yoko Ono,4.21,"2,524 rating","January 1, 1970","Back in print for the first time in nearly thirty years, here is Yoko Ono's whimsical, delightful, subversive, startling book of instructions for art and for life.""A dream you dream alone may be a dream, but a dream two people dream together is a reality.""""Burn this book after you've read it.""  -- Yoko Ono""This is the greatest book I've ever burned.""  -- John Lennon",320,"['Art', 'Poetry', 'Nonfiction', 'Music', 'Philosophy', 'Womens', 'Japan', 'Art', 'Poetry', 'Nonfiction', 'Music', 'Philosophy', 'Womens', 'Japan', 'Art', 'Poetry', 'Nonfiction', 'Music', 'Philosophy', 'Womens', 'Japan']",205 follower,237 review,156,46 (1%),106 (4%),390 (15%),710 (28%),"1,272 (50%)"
Damia,Anne McCaffrey,4.03,"13,018 rating","January 1, 1991","Of all the Rowan's children, Damia was the most brilliant and the one who inherited the Talent. It was obvious that she would be a Prime. As Damia grew up, her Talent became almost too strong to control, and the only solution was to send her to the planet of Deneb, to her strange grandmother.",380,"['Science Fiction', 'Fantasy', 'Fiction', 'Science Fiction Fantasy', 'Romance', 'Paranormal', 'Space Opera']","7,225 follower",251 review,568,114 (<1%),625 (4%),"2,925 (22%)","4,417 (33%)","4,937 (37%)"
Little House in Brookfield,Maria D. Wilkes,3.92,"8,247 rating","May 1, 1996","Spirit of the Western Frontier: Meet Caroline Quiner, the little girl who would grow up to be Laura Ingalls Wilder's mother.Little House in Brookfield marks the launch of an on-going series about the adventures of Caroline Quiner, who would grow up to be Ma Ingalls in the Little House books. Written in the classic tradition of the Little House and the Rocky Ridge books, and based on diaries, letters, and other historical papers, these books offer a glimpse into America's adventurous past, as seen through the eyes of another girl from America's beloved frontier family.",298,"['Historical Fiction', 'Childrens', 'Fiction', 'Historical', 'Classics', 'Middle Grade', 'Young Adult', 'Historical Fiction', 'Childrens', 'Fiction', 'Historical', 'Classics', 'Middle Grade', 'Young Adult', 'Historical Fiction', 'Childrens', 'Fiction', 'Historical', 'Classics', 'Middle Grade', 'Young Adult']",59 follower,115 review,15,179 (2%),509 (6%),"2,155 (26%)","2,363 (28%)","3,041 (36%)"
