title,authors,average_rating,rating,date_of_publication,descriptions,total_pages,no_of_books_by_author,author_followers,genres,no_of_reviews,five_star_ratings,four_star_ratings,three_star_ratings,two_star_ratings,one_star_ratings
Nine Coaches Waiting,Mary  Stewart,4.05,"15,869 rating","January 1, 1958","A governess in a French chateau encounters an apparent plot against her young charge's life in this unforgettably haunting and beautifully written suspense novel. When lovely Linda Martin first arrives at Château Valmy as an English governess to the nine-year-old Count Philippe de Valmy, the opulence and history surrounding her seems like a wondrous, ecstatic dream. But a palpable terror is crouching in the shadows. Philippe's uncle, Léon de Valmy, is the epitome of charm, yet dynamic and arrogant, his paralysis little hindrance as he moves noiselessly in his wheelchair from room to room. Only his son Raoul, a handsome, sardonic man who drives himself and his car with equally reckless abandon, seems able to stand up to him. To Linda, Raoul is an enigma, though irresistibly attracted to him, she senses some dark twist in his nature. When an accident deep in the woods nearly kills Linda's innocent charge, she begins to wonder if someone has deadly plans for the young count.",342,71,"2,405 follower","['Mystery', 'Romance', 'Gothic', 'Fiction', 'Historical Fiction', 'Suspense', 'Romantic Suspense', 'Mystery', 'Romance', 'Gothic', 'Fiction', 'Historical Fiction', 'Suspense', 'Romantic Suspense', 'Mystery', 'Romance', 'Gothic', 'Fiction', 'Historical Fiction', 'Suspense', 'Romantic Suspense', 'Mystery', 'Romance', 'Gothic', 'Fiction', 'Historical Fiction', 'Suspense', 'Romantic Suspense', 'Mystery', 'Romance', 'Gothic', 'Fiction', 'Historical Fiction', 'Suspense', 'Romantic Suspense']","1,540 review","5,679 (35%)","6,190 (39%)","3,328 (20%)",536 (3%),136 (<1%)
A Place of Execution,Val McDermid,4.13,"17,005 rating","June 7, 1999","Winter 1963: two children have disappeared in Manchester; the murderous careers of Myra Hindley and Ian Brady have begun. On a freezing day in December, another child goes missing: 13-year-old Alison Carter vanishes from the isolated Derbyshire hamlet of Scardale. For the young George Bennett it is the beginning of his most difficult and harrowing case: a murder with no body, an investigation with more dead ends and closed faces than he'd have found in the inner city; an outcome that reverberates down the years.Decades later he tells his story to journalist Catherine Heathcote, but just when her book is poised for publication, Bennett tries to pull the plug. He has new information that he will not divulge, and that threatens the very foundation of his existence. Catherine is forced to reinvestigate the past, with results that turn the world upside down.A taut psychological thriller that explores, exposes and explodes the border between reality and illusion in a multilayered narrative that turns expectations on their head and reminds us that what we know is what we do not know...",480,271,"4,656 follower","['Mystery', 'Crime', 'Fiction', 'Thriller', 'Mystery Thriller', 'Suspense', 'British Literature']","1,163 review","7,013 (41%)","6,452 (37%)","2,633 (15%)",604 (3%),303 (1%)
Killing Hope: U.S. Military and C.I.A. Interventions Since World War II,William Blum,4.23,"1,832 rating","March 1, 1995","Is the United States a force for democracy? In this classic and unique volume that answers this question, William Blum serves up a forensic overview of U.S. foreign policy spanning sixty years. For those who want the details on our most famous actions (Chile, Cuba, Vietnam, to name a few), and for those who want to learn about our lesser-known efforts (France, China, Bolivia, Brazil, for example), this book provides a window on what our foreign policy goals really are. This edition is updated through 2003.",500,35,186 follower,"['History', 'Politics', 'Nonfiction', 'War', 'American History', 'The United States Of America', 'American']",115 review,918 (50%),550 (30%),266 (14%),68 (3%),30 (1%)
The Educated Imagination,Northrop Frye,4.13,"1,599 rating","January 1, 1963","Addressed to educators as well as the general reader, this important yet lively and readable book explores the value and uses of literature and its study in our scientific age, and offers a broad program for the teaching of literature in elementary and secondary schools.",159,180,265 follower,"['Nonfiction', 'Education', 'Literary Criticism', 'Philosophy', 'Essays', 'Literature', 'Criticism']",186 review,692 (43%),551 (34%),249 (15%),83 (5%),24 (1%)
Dark Angel,Sally Beauman,4.03,952 rating,"July 1, 1990","Halley's Comet night at Winterscombe in 1910 ends with a violent death which throws a giant shadow over three generations of the Cavendish dynasty. At the centre of events is the beautiful and dangerous Constance, who casts a spell - which may be a curse - on all the sons of the family. Following the destruction of two World Wars - and the passions, deceits and hatreds of the intervening peace - it is the coruscating power of Constance's personality, and the sinister secret at the heart of her life, which will determine if Victoria, last of the Cavendishes, is to inherit happiness or misery.",791,32,154 follower,"['Historical Fiction', 'Fiction', 'Mystery', 'Gothic', 'Historical', 'Literature', 'Suspense']",106 review,373 (39%),313 (32%),204 (21%),41 (4%),21 (2%)
Silencing the Past: Power and the Production of History,Michel-Rolph Trouillot,4.36,"2,694 rating","November 1, 1995","Placing the West's failure to acknowledge the most successful slave revolt in history alongside denials of the Holocaust and the debate over the Alamo, Michel-Rolph Trouillot offers a stunning meditation on how power operates in the making and recording of history.",216,14,84 follower,"['History', 'Nonfiction', 'Philosophy', 'Theory', 'Politics', 'Anthropology', 'Academic']",267 review,"1,447 (53%)",853 (31%),309 (11%),76 (2%),9 (<1%)
Magic by the Lake,Edward Eager,4.08,"5,347 rating","January 1, 1957","If Jane and Mark and Katharine and Martha had stopped to think, they might have ordered magic by the pound, or by the day, but a lakeful of magic causes extraordinary and unexpected events. By the end of vacation, with an unwilling sly old turtle, and Ali Baba's forty thieves, they help stepfather Mr. Smith save his failing bookstore in a most surprising way.",208,20,305 follower,"['Fantasy', 'Childrens', 'Fiction', 'Middle Grade', 'Magic', 'Young Adult', 'Classics', 'Fantasy', 'Childrens', 'Fiction', 'Middle Grade', 'Magic', 'Young Adult', 'Classics', 'Fantasy', 'Childrens', 'Fiction', 'Middle Grade', 'Magic', 'Young Adult', 'Classics']",215 review,"2,061 (38%)","1,921 (35%)","1,144 (21%)",174 (3%),47 (<1%)
Romance,Joseph Conrad,3.45,100 rating,"January 1, 1903","Joseph Conrad, born Jozef Teodor Konrad Korzeniowski, (1857-1924) was a Polish-born novelist who spent most of his adult life in Britain. He is regarded as one of the greatest English novelists, which is even more notable because he did not learn to speak English well until he was in his 20s. He is recognized as a master prose stylist. Some of his works have a strain of romanticism, but more importantly he is recognized as an important forerunner of modernist literature. His narrative style and anti-heroic characters have influenced many writers, including Ernest Hemingway, D.H. Lawrence and Graham Greene. Writing during the apogee of the British Empire, Conrad drew upon his experiences in the British Merchant Navy to create novels and short stories that reflected aspects of a world-wide empire while also plumbing the depths of the human soul. Amongst his best known works are Heart of Darkness (1899), Lord Jim (1900), Under Western Eyes (1911), Victory (1915) and The Rescue (1920).",426,"3,101","4,179 follower","['Novels', 'Classics', 'British Literature', 'Adventure', 'Fiction', 'Novels', 'Classics', 'British Literature', 'Adventure', 'Fiction', 'Novels', 'Classics', 'British Literature', 'Adventure', 'Fiction']",6 review,24 (24%),20 (20%),36 (36%),17 (17%),3 (3%)
Biedermann und die Brandstifter,Max Frisch,3.65,"5,881 rating","January 1, 1958","Das Stück ist die Geschichte des Bürgers Gottlieb Biedermann, der die Brandstifter in sein Haus einlädt, um von ihnen verschont zu werden. Es entlarvt präzise eines Geisteshaltung, die der Technik des Totalitären zum Erfolg verhilft. Bidermann und die Brandstifter - eine politische Parabel, die ihre kritische Kraft nicht aus der Entlarvung der Lüge bezieht, sondern aus der Inszenierung der biedermännischen Wehrlosigkeit gegenüber Verbrechern, die von Anfang an sagen, was sie wirklich wollen.Das »Lehrstück ohne Lehre« wurde am 29. März 1958 am Schauspielhaus Zürich uraufgeführt. Die deutsche Erstaufführung mit der Uraufführung des Nachspiels war am 28. September 1958 an den Städtischen Bühnen Frankfurt am Main. Biedermann und die Brandstifter gehört seit Jahren nicht nur zum Theaterrepertoire, sondern auch zum Lekturekanon im Deutschunterricht.",94,238,707 follower,"['Classics', 'Plays', 'German Literature', 'Fiction', 'Drama', 'School', 'Theatre']",175 review,"1,382 (23%)","2,106 (35%)","1,598 (27%)",561 (9%),234 (3%)
"Bearing the Cross: Martin Luther King, Jr., and the Southern Christian Leadership Conference",David J. Garrow,4.34,"2,182 rating","December 1, 1986","Winner of the Pulitzer Prize: The definitive biography of Martin Luther King Jr.  In this monumental account of the life of Martin Luther King Jr., professor and historian David Garrow traces King’s evolution from young pastor who spearheaded the 1955–56 bus boycott of Montgomery, Alabama, to inspirational leader of America’s civil rights movement. Based on extensive research and more than seven hundred interviews, with subjects including Andrew Young, Jesse Jackson, and Coretta Scott King, Garrow paints a multidimensional portrait of a charismatic figure driven by his strong moral obligation to lead—and of the toll this calling took on his life. Bearing the Cross provides a penetrating account of King’s spiritual development and his crucial role at the Southern Christian Leadership Conference, whose protest campaigns in Birmingham and Selma, Alabama, led to enactment of the landmark Civil Rights Act of 1964 and Voting Rights Act of 1965.   This comprehensive yet intimate study reveals the deep sense of mission King felt to serve as an unrelenting crusader against prejudice, inequality, and violence, and his willingness to sacrifice his own life on behalf of his beliefs. Written more than twenty-five years ago, Bearing the Cross remains an unparalleled examination of the life of Martin Luther King Jr. and the legacy of the civil rights movement.",794,35,61 follower,"['History', 'Biography', 'Nonfiction', 'Race', 'American History', 'African American', 'Politics']",135 review,"1,164 (53%)",681 (31%),269 (12%),46 (2%),22 (1%)
Reflections from the North Country,Sigurd F. Olson,4.24,454 rating,"September 12, 1976","Written in the last years of his life, Reflections from the North Country is often considered Sigurd Olson's most intellectually significant work. In an account alive with anecdote and insight, Olson outlines the wilderness philosophy he developed while working as an outspoken advocate for the conservation of America's natural heritage.Based on speeches delivered at town meetings and government hearings, this book joins The Singing Wilderness and Listening Point as the core of Olson's work. Upon its initial publication in 1976, Reflections from the North Country, with Olson's unique combination of lyrical nature writing and activism, became an inspiration to the burgeoning environmental movement, selling over 46,000 copies in hardcover.In this wide-ranging work, Olson evokes the soaring grace of raven, osprey, and eagle, the call of the loon, and the song of the hermit thrush. He challenges the reader to loosen the grasp of technology and the rush of contemporary life and make room for a sense of wonder heightened by being in nature. From evolution to the meaning and power of solitude, Olson meditates on the human condition, offering eloquent testimony to the joys and truths he discovered in his beloved north-country wilderness.",192,36,64 follower,"['Nature', 'Nonfiction', 'Philosophy', 'Outdoors', 'Memoir', 'Environment', 'Conservation']",44 review,204 (44%),174 (38%),61 (13%),11 (2%),4 (<1%)
A Book of Common Prayer,Joan Didion,3.81,"5,270 rating","January 1, 1977","Writing with the telegraphic swiftness and microscopic sensitivity that have made her one of our most distinguished journalists, Joan Didion creates a shimmering novel of innocence and evil.A Book of Common Prayer is the story of two American women in the derelict Central American nation of Boca Grande. Grace Strasser-Mendana controls much of the country's wealth and knows virtually all of its secrets; Charlotte Douglas knows far too little. ""Immaculate of history, innocent of politics,"" she has come to Boca Grande vaguely and vainly hoping to be reunited with her fugitive daughter. As imagined by Didion, her fate is at once utterly particular and fearfully emblematic of an age of conscienceless authority and unfathomable violence.",272,92,13.3k follower,"['Fiction', 'Literary Fiction', 'Novels', 'Contemporary', 'Politics', 'Literature', 'American']",542 review,"1,379 (26%)","2,049 (38%)","1,370 (25%)",382 (7%),90 (1%)
Trainspotting: A Screenplay,John Hodge,4.38,"5,563 rating","January 1, 1996","Set in the underbelly of Edinburgh, Trainspotting is a story inhabited by a galaxy of immensely colorful characters -- liars, thieves, junkies -- people whose habits, emotions, and stories will leave an indelible imprint on the reader's mind.",123,63,11 follower,"['Fiction', 'Film', 'Plays', 'Media Tie In', 'Contemporary', 'Crime', 'Adult Fiction', 'Fiction', 'Film', 'Plays', 'Media Tie In', 'Contemporary', 'Crime', 'Adult Fiction', 'Fiction', 'Film', 'Plays', 'Media Tie In', 'Contemporary', 'Crime', 'Adult Fiction']",37 review,"2,992 (53%)","1,871 (33%)",571 (10%),87 (1%),42 (<1%)
The Greater Trumps,Charles  Williams,3.84,727 rating,"January 1, 1932","The Greater Trumps are the most important cards in the Tarot pack. In this story they are the symbol of the dance of life itself. A set of golden images reflects this dance, but they have been separated from the original pack of cards for centuries. When they are brought together again, good and evil contend for them.",230,111,333 follower,"['Fantasy', 'Fiction', 'Tarot', 'Classics', 'Literature', 'Novels', 'Christian']",104 review,223 (30%),251 (34%),183 (25%),55 (7%),15 (2%)
"Hamlet: Screenplay, Introduction And Film Diary",Kenneth Branagh,4.14,"182,735 rating","November 17, 1996","Often credited with creating a popular movie audience for Shakespeare, Kenneth Branagh has wanted for many years to bring to the screen the complete, full-length version of Hamlet, Shakespeare's greatest play.""The film, like the play, will have something for everyone,"" he says. ""Its a ghost story, a thriller, an action-packed murder mystery, and a great tragedy that is profoundly moving."" With an outstanding cast of international actors--including Derek Jacobi as Claudius, Julie Christie as Gertrude, Kate Winslet as Ophelia, Charlton Heston as the Player King, Robin Williams as Osric, and Gerard Depardieu as Reynaldo--Branagh's version, in which he will play the title role as well as direct, is sure to go down in film history.This beautiful volume includes Branagh's introduction and screenplay adaptation of Shakespeare's text, color and black-and-white stills, and a production diary that takes us behind the scenes for a day-to-day look at the shooting of his film.",208,61,85 follower,"['Classics', 'Plays', 'Fiction', 'Drama', 'Literature', 'School', 'Theatre', 'Classics', 'Plays', 'Fiction', 'Drama', 'Literature', 'School', 'Theatre', 'Classics', 'Plays', 'Fiction', 'Drama', 'Literature', 'School', 'Theatre']",249 review,"80,668 (44%)","58,498 (32%)","34,350 (18%)","7,143 (3%)","2,076 (1%)"
Music at Night and Other Essays,Aldous Huxley,3.95,244 rating,"January 1, 1931","As T. S. Eliot said, Huxley's place in English literature is unique and is undoubtedly assured. In these essays, with his usual freedom and joy, Huxley deals with a variety of topics ranging from art, literature, music, science, philosophy, religion and history. A book of indisputable amenity and lucidity.",174,958,12.1k follower,"['Essays', 'Nonfiction', 'Music', 'Art', 'British Literature', 'Criticism']",17 review,75 (30%),98 (40%),56 (22%),13 (5%),2 (<1%)
Magnificent Obsession,Lloyd C. Douglas,3.86,"2,041 rating","January 1, 1929","One of the best-loved novels of all time, Magnificent Obsession tells of a young playboy's determination to follow in the steps of the brilliant surgeon whose life has been sacrificed for his own ... of how he discovers the inspiring secret behind the dead man's achievements and applies it to his own life ... how he earns the respect of all around him - and yet almost loses the woman he loves.Twice filmed and a world best-seller, this is an unforgettable story, spilling over with compassion, humour and an uncanny insight into human weakness and strength.",252,174,441 follower,"['Fiction', 'Classics', 'Romance', 'Novels', 'Christian Fiction', 'Religion', 'Inspirational']",350 review,615 (30%),748 (36%),487 (23%),152 (7%),39 (1%)
Crisótemis,Yannis Ritsos,4.54,26 rating,"January 1, 1972","Ritsos, una de las mejores voces de la lírica europea, creó una serie de monólogos de excepcional sutileza, con los que consigue trasladar a nuestros días el pathos de la tragedia griega. Con Crisótemis continuamos la publicación de estos soliloquios dramáticos en versión de Selma Ancira.",112,83,3 follower,"['Poetry', 'Poetry', 'Poetry']",4 review,18 (69%),6 (23%),0 (0%),2 (7%),0 (0%)
Anna Édes,Dezső Kosztolányi,3.87,"3,102 rating","January 1, 1926","This ​long out-of-print novel by Hungarian writer Kosztolanyi (1885-1936) takes place in Budapest just after the end of WW I. The city is occupied by Romanian troops after having undergone two brief social revolutions. The novel focuses on the plight of a young peasant woman who comes to work as a maid for the Vizys, a pathologically self-absorbed middle-class couple who are struggling to maintain their social standing amidst the ever-changing political climate. Pleased with Anna's almost robotic work ethic, Mrs. Vizy becomes obsessed with maintaining her servant's loyalty through psychological manipulation. A metaphor for the inhumanity of Hungary's precarious bourgeoisie, the novel follows Anna's victimization by her employers, her fellow servants and the Vizys' dissolute nephew as she struggles to achieve even the slightest emotional connection. Kosztolanyi's characters are ironic to the point of caricature, except Anna, whose inexplicable simple-mindedness limits the reader's sympathy for her. The novel nevetheless provides fascinating insight into a volatile period in Europe's history, laying bare the barbarism and hypocrisy inherent in all strata of society.",220,155,173 follower,"['Hungarian Literature', 'Classics', 'Fiction', 'Hungary', 'Historical Fiction', 'Literature', 'School', 'Hungarian Literature', 'Classics', 'Fiction', 'Hungary', 'Historical Fiction', 'Literature', 'School', 'Hungarian Literature', 'Classics', 'Fiction', 'Hungary', 'Historical Fiction', 'Literature', 'School']",150 review,897 (28%),"1,212 (39%)",739 (23%),198 (6%),56 (1%)
The Black Heralds (Lannan Literary Selections),César Vallejo,4.20,"1,076 rating","August 31, 1918","Throughout his life, César Vallejo (1892–1938) focused on human suffering and the isolation of people victimized by inexplicable forces. One of the great Spanish language poets, he merged radical politics and language consciousness, resulting in the first examples of a truly new world poetry.The Black Heralds is Vallejo’s first book and contains a wide range of poems, from love sonnets in which he struggles to free his erotic life from the bounds of Spanish Catholicism to the linguistically inventive sequence, ""Imperial Nostalgias,"" where he parodies with considerable savagery the pastoral romanticism of Indian and rural life.In this bilingual volume, translator Rebecca Seiferle attempts to undo the ""colonization"" of Vallejo in other translations. As Seiferle writes in her introduction: ""Reading and translating Vallejo has been a long process of trying to meet him on his own terms, to discover what those terms were within the contexts of his particular time and, finally, taking his word for it.""from ""Our Bread""And in this frigid hour, when the earthsmells of human dust and is so sad,I want to knock on every doorand beg forgiveness of I don’t know whom,and bake bits of fresh bread for him,here, in the oven of my heart...!César Vallejo (1892–1938) was born in Peru to a family of mixed Spanish and native descent. He wrote two books of poetry, the second of which was partly composed during a short prison term. Disappointed by the reception of his poetry in his own country, Vallejo moved to Paris, where he became active in Marxist politics and the antifascist campaign in Spain, while publishing essays, political articles, a play, and short stories.Vallejo died in Paris, in utter poverty, on the day Franco’s armies entered Madrid.",250,283,339 follower,"['Poetry', 'Spanish Literature', 'Classics', 'Latin American Literature', 'Fiction', 'Latin American', 'Literature', 'Poetry', 'Spanish Literature', 'Classics', 'Latin American Literature', 'Fiction', 'Latin American', 'Literature', 'Poetry', 'Spanish Literature', 'Classics', 'Latin American Literature', 'Fiction', 'Latin American', 'Literature']",75 review,507 (47%),341 (31%),178 (16%),39 (3%),11 (1%)
Toddler-Hunting & Other Stories,Taeko Kōno,3.85,"1,087 rating","January 1, 1996","""A sense of unease permeates this disturbing and exceptional collection of stories centered on unhappy women in postwar Japan...,"" wrote Publishers Weekly. World Literature Today proclaimed: ""Reminiscent of Flannery O’Connor’s works, Kono’s stories explore the dark, terrifying side of human nature that manifests itself in antisocial behavior."" Toddler-Hunting & Other Stories introduces to American readers a startlingly original voice. Winner of most of Japan’s top literary prizes for fiction, Kono Taeko writes with a disquieting and strange beauty, always foregrounding what Choice called ""the great power of serious, indeed shocking events."" In the title story, the protagonist loathes young girls, but she compulsively buys expensive clothes for little boys so that she can watch them dress and undress. The impersonal gaze Kono Taeko turns on this behavior transfixes the reader with a fatal question: What are we hunting for? And why? Now available in paperback for the first time, Toddler-Hunting Other Stories should fascinate any reader interested in Japanese literature––or in the growing world of transgressive fiction.",272,38,45 follower,"['Short Stories', 'Japan', 'Fiction', 'Japanese Literature', 'Horror', 'Asia', 'Asian Literature', 'Short Stories', 'Japan', 'Fiction', 'Japanese Literature', 'Horror', 'Asia', 'Asian Literature', 'Short Stories', 'Japan', 'Fiction', 'Japanese Literature', 'Horror', 'Asia', 'Asian Literature']",179 review,294 (27%),443 (40%),259 (23%),74 (6%),17 (1%)
Kerosene,Chris Wooding,3.58,468 rating,"January 1, 1999","A novel of rage, confusion, and release from an extraordinary young authorIn order to cope with his feelings of pain and confusion, sixteen-year-old Cal burns things, but the situation gets out of control after he meets Abby, a girl whose games will push him to the edge.",208,76,"2,071 follower","['Young Adult', 'Fiction', 'Mental Health', 'Realistic Fiction', 'Mental Illness', 'Novels', 'Contemporary']",37 review,108 (23%),136 (29%),156 (33%),57 (12%),11 (2%)
Insurgent Mexico,John   Reed,3.97,699 rating,"January 1, 1914","American journalist John 'Jack' Reed writes, on the scene, describing the Mexican Revolution of 1914. He gives an excellent realistic account of the Mexican Indians & peons that have suffered under a brutal dictatorship. He writes about the time he spent in Northern Mexico with Pancho Villa & the war in the desert. It was hard for him as a Gringo as most Americans had only gone to Mexico to plunder the environment. Read ""The White Rose' by Bruno Traven & his other 'jungle' series books about the exploitation of Indian Mexican's. Many would say that Jack Reed took over from Jack London in his war reporting, since Jack had just died in 1914. Jack Reed's other famous book ""Ten Days That Shook The World"" is about the Red October (Boleshvik) Russian Revolution--the movie ""Reds"" by Warren Beaty is Jack Reed's story.","AudiobookFirst published January 1, 1914",54,122 follower,"['History', 'Nonfiction', 'Politics', 'Journalism', 'War', 'Latin American History', '20th Century']",65 review,225 (32%),274 (39%),165 (23%),26 (3%),9 (1%)
