title,authors,average_rating,rating,date_of_publication,descriptions,total_pages,genres,author_followers,no_of_reviews,no_of_books_by_author,one_star_ratings,two_star_ratings,three_star_ratings,four_star_ratings,five_star_ratings
Queens' Play,Dorothy Dunnett,4.45,"4,588 rating","January 1, 1964","This second book in the legendary  Lymond Chronicles  follows Francis Crawford of Lymond who has been abruptly called into the service of Mary Queen of Scots.Though she is only a little girl, the Queen is already the object of malicious intrigues that extend from her native country to the court of France. It is to France that Lymond must travel, exercising his sword hand and his agile wit while also undertaking the most unlikely of masquerades, all to make sure that his charge's royal person stays intact.",432,"['Historical Fiction', 'Historical', 'Fiction', 'Scotland', 'France', 'Adventure', '16th Century']",788 follower,344 review,48,36 (<1%),82 (1%),402 (8%),"1,314 (28%)","2,754 (60%)"
Making History,Stephen Fry,3.93,"11,279 rating","October 22, 1996","In Making History, Stephen Fry has bitten off a rather meaty chunk by tackling an at first deceptively simple premise: What if Hitler had never been born? An unquestionable improvement, one would reason--and so an earnest history grad student and an aging German physicist idealistically undertake to bring this about by preventing Adolf's conception. And with their success is launched a brave new world that is in some ways better than ours--but in most ways even worse. Fry's experiment in history makes for his most ambitious novel yet, and his most affecting. His first book to be set mostly in America, it is a thriller with a funny streak, a futuristic fantasy based on one of mankind's darkest realities. It is, in every sense, a story of our times",575,"['Fiction', 'Science Fiction', 'Alternate History', 'Historical Fiction', 'Time Travel', 'Humor', 'Fantasy']",10.4k follower,761 review,235,138 (1%),538 (4%),"2,601 (23%)","4,702 (41%)","3,300 (29%)"
Insciallah,Oriana Fallaci,4.02,"1,394 rating","January 1, 1990","Insciallah (invocazione araba che significa ""sia fatta la volotà di Dio"") è ambientato ai tempi della guerra civile in Libano negli anni ottanta, durante l'intervento delle forze internazionali, alle quali partecipò anche l'Italia. Oriana Fallaci descrive un complesso retroscena, proprio attraverso le vicende dei componenti il contingente italiano nei tre mesi che intercorsero tra gli attentati di Beirut e il ritorno in patria della forza italiana.",795,"['Fiction', 'Roman', 'Italian Literature', 'Historical Fiction', 'Italy', 'War', 'Journalism']","1,350 follower",88 review,56,34 (2%),78 (5%),251 (18%),494 (35%),537 (38%)
The Brethren,John Grisham,3.76,"95,295 rating","February 1, 2000","They call themselves the Brethren: three disgraced former judges doing time in a Florida federal prison. One was sent up for tax evasion. Another, for skimming bingo profits. The third for a career-ending drunken joyride.Meeting daily in the prison law library, taking exercise walks in their boxer shorts, these judges-turned-felons can reminisce about old court cases, dispense a little jailhouse justice, and contemplate where their lives went wrong. Or they can use their time in prison to get very rich—very fast. ...",440,"['Fiction', 'Thriller', 'Mystery', 'Legal Thriller', 'Crime', 'Suspense', 'Mystery Thriller']",80.4k follower,"2,365 review",712,"1,532 (1%)","6,302 (6%)","29,079 (30%)","34,794 (36%)","23,588 (24%)"
There is a River: The Story of Edgar Cayce,Thomas Joseph Sugrue,4.25,"2,072 rating","PaperbackPublished May 1, 2003","This is the complete, original biography of the best-documented psychic in America. It tells the story of how Edgar Cayce discovered his astounding psychic gifts and what led him to a life dedicated to helping others. Cayce’s ""readings,"" given in a trancelike state, ranged from phenomenal medical cures to advice on spiritual growth, psychology, and the prophesy of world events. A philosophy section outlines Cayce’s revelations about our origin, purpose, and destinies on the earth, making this book a valuable resource. This book contains many photos of Edgar Cayce, his family, and close friends. This special edition features Auras, the only book written by Edgar Cayce himself.","PaperbackPublished May 1, 2003","['Biography', 'Spirituality', 'Nonfiction', 'Metaphysics', 'Religion', 'Philosophy', 'Paranormal', 'Biography', 'Spirituality', 'Nonfiction', 'Metaphysics', 'Religion', 'Philosophy', 'Paranormal', 'Biography', 'Spirituality', 'Nonfiction', 'Metaphysics', 'Religion', 'Philosophy', 'Paranormal']",12 follower,122 review,15,20 (<1%),67 (3%),310 (14%),658 (31%),"1,017 (49%)"
In-House Weddings,Bohumil Hrabal,4.16,371 rating,"January 1, 1987","Inspired by “Mrs. Tolstoy and Mrs. Dostoevsky, whose biographies about their husbands have now been published in Prague,” Bohumil Hrabal decided to produce his own autobiographical work, ostensibly fiction, from his wife’s point of view. He would write, he said, “not a putdown about myself, but a little bit of how it all was, that marriage of ours, with myself as a jewel and adornment of our life together.”The task, taken up by such a rogue comic talent, could be nothing other than strangely delightful; and in In-House Weddings , the first of the trilogy that Hrabal produced, we meet the author through the eyes of his wife Eliska. She narrates his life from his upbringing in Nymburk through his work as a dispatcher in a train station and then in a scrap paper plant, his first publication, his trouble with the authorities, and his association with notable artists and authors such as Jiri Kolar, Vladimir Boudnik, and Arnost Lustig. Hrabal’s bohemian life was itself a source of great interest to the Czech public; transmuted here, it is even more compelling, a wry portrait of artistic life in postwar Eastern Europe and a telling reflection on how such a life might be recast in the light of literary brilliance.",171,"['Czech Literature', 'Fiction', 'Literature', 'Classics', 'Novels', 'Czech Literature', 'Fiction', 'Literature', 'Classics', 'Novels', 'Czech Literature', 'Fiction', 'Literature', 'Classics', 'Novels']","1,170 follower",36 review,181,4 (1%),11 (2%),59 (15%),146 (39%),151 (40%)
جدد حياتك,محمد الغزالي,4.21,"11,438 rating","January 1, 1987",«فى هذا الكتاب مقارنة بين تعاليم الإسلام كما وصلت إلينا، وبين أصدق ما وصلت إليه حضارة الغرب فى أدب النفس والسلوك فى محاولة للكشف عن روعة التقارب وصدق التطابق» .. هذه بعض كلمات المؤلف التى عبر بها عن سبب كتابته لهذا العمل الفريد، خاصة بعد قراءته لكتاب «دع القلق وابدأ الحياة» لديل كارنيجى وقد اعتمد فى هذا العمل على جانبين رئيسين: فهو يعرض نصوص وأحكام الإسلام ويقابل بها كتابات وتجارب وشواهد كارنيجى .. تأكيدًا لقيمة الإسلام ومنهجه فى التعامل مع النفس البشرية فمن القلق إلى الثبات إلى العمل إلى مشكلات الفراغ إلى محاسبة النفس وغيرها حيث تتنوع موضوعات هذا الكتاب تنوعًا ممتعًا.,236,"['Religion', 'Islam', 'Self Help', 'Nonfiction', 'Psychology', 'Philosophy', 'Personal Development']","6,692 follower","1,254 review",139,224 (1%),427 (3%),"1,609 (14%)","3,601 (31%)","5,577 (48%)"
A Game Of Hide And Seek,Elizabeth Taylor,3.79,"1,185 rating","January 1, 1951","During summer games of hide-and-seek Harriet falls in love with Vesey and his elusive, teasing ways. When he goes to Oxford she cherishes his photograph and waits for the letter that never comes. Then Charles enters her life, and Harriet stifles her imaginings. With a husband and daughter, she excels at respectability: ornaments on the mantlepiece, remembered birthdays and jars of lilac. But when Vesey reappears, her marriage seems to melt away. Harriet is older, it is much too late, but she is still in love with him.",320,"['Fiction', 'Classics', 'British Literature', 'Literary Fiction', '20th Century', 'Novels', 'Literature']",431 follower,185 review,113,23 (1%),73 (6%),317 (26%),486 (41%),286 (24%)
The Puritans,Jack  Cavanaugh,4.15,823 rating,"January 1, 1994","Young Drew Morgan has an enviable position. Handpicked by Bishop Laud, next to the king the most powerful man in England, it is his assignment to infiltrate Puritan villages, turn over ""traitors"" to the church and crown, and discover the secret identity of the notorious pamphleteer Justin.But when Drew falls in love with a Puritan curate's daughter, his personal fortunes begin to falter as his spiritual yearnings take root. After unwittingly betraying what he knows to be right, the stage is set for his conversion.At last Drew sails to the New World colony of Massachusetts and sets out to win the forgiveness of those whom he has wronged--especially the woman he loves. Only as Bishop Laud reaches his long arm across the ocean in one final threat can Drew prove his true mettle and affections.Trace this unforgettable adventure of one of America's first families of faith, the beginnings of a vibrant spiritual heritage that will span generations.",510,"['Historical Fiction', 'Christian Fiction', 'Christian', 'Fiction', 'Historical', 'Romance', 'British Literature']",136 follower,69 review,37,15 (1%),27 (3%),134 (16%),294 (35%),353 (42%)
The Smile at the Foot of the Ladder,Henry Miller,3.61,"1,946 rating","January 1, 1948","First published in 1959, this touching fable tells of Auguste, a famous clown who could make people laugh but who sought to impart to his audiences a lasting joy. Originally inspired by a series of circus and clown drawings by the cubist painter Femand L�ger, Miller eventually used his own decorations to accompany the text in their stead. ""Undoubtedly, he says in his explanatory epilogue, �'it is the strangest story I have yet written. . . . No, more even than all the stories which I based on fact and experience is this one the truth. My whole aim in writing has been to tell the truth, as I know it. Heretofore all my characters have been real, taken from life, my own life. Auguste is unique in that he came from the blue. But what is this blue which surrounds and envelopes us if not reality itself? . . . We have only to open our eyes and hearts, to become one with that which is.",56,"['Fiction', 'Short Stories', 'Classics', 'American', 'Novels', 'Philosophy', 'Literature']","4,725 follower",228 review,780,56 (2%),182 (9%),660 (33%),616 (31%),432 (22%)
Don Camillo della Bassa: Gente così - Lo spumarino pallido,Giovannino Guareschi,4.30,80 rating,"January 1, 1999","La Bassa: così è chiamata la terra emiliana in riva al Po. In questa pianura, che brucia di sole in estate e sprofonda nella nebbia d'inverno, la passione politica, come dice Guareschi, arriva spesso ad una intensità preoccupante.Qui nascono le storie di Don Camillo della Bassa (il libro che raccoglie i racconti già pubblicati con i titoli Gente così e Lo Spumarino pallido): sono storie vere di gente vera, gente che ""è simpatica e ospitale e generosa e ha uno spiccato senso dell'umorismo"". Gente che per glorificare Dio o il Partito farebbe qualunque cosa, salvo una: dimenticare l'amicizia. Un'amicizia che lega da sempre don Camillo e Peppone, che mantiene il calore dell'affetto, della complicità e del cameratismo al di là delle divergenze politiche.",493,[],205 follower,4 review,192,0 (0%),1 (1%),11 (13%),31 (38%),37 (46%)
If Tomorrow Comes,Sidney Sheldon,4.07,"67,364 rating","January 1, 1985","This is a story of intrigue and revenge. Tracy Whitney is young, beautiful and intelligent - and about to marry into wealth and glamour. Until, suddenly, she is betrayed, framed by a ruthless Mafia gang, abandoned by the man she loves. Only her ingenuity saves her and helps her fight back.",501,"['Fiction', 'Thriller', 'Mystery', 'Romance', 'Suspense', 'Crime', 'Mystery Thriller']","8,009 follower","2,681 review",277,744 (1%),"2,673 (3%)","13,522 (20%)","24,815 (36%)","25,610 (38%)"
The Town and the City,Jack Kerouac,3.91,"3,682 rating","January 1, 1950","'It is the sum of myself, as far as the written word can go' - Kerouac on ""The Town and the City"". Kerouac's debut novel is a great coming of age story which can be read as the essential prelude to his later classics. Inspired by grief over his father's death and gripped by determination to write the Great American Novel, he draws largely on his own New England childhood.",512,"['Fiction', 'Classics', 'Novels', 'American', 'Literature', '20th Century', 'Literary Fiction']",10.4k follower,234 review,357,52 (1%),234 (6%),895 (24%),"1,317 (35%)","1,184 (32%)"
Bridge of Birds,Barry Hughart,4.27,"10,362 rating","April 1, 1984","When the children of his village were struck with a mysterious illness, Number Ten Ox sought a wiseman to save them. He found master Li Kao, a scholar with a slight flaw in his character. Together, they set out to find the Great Root of Power, the only possible cure.The quest led them to a host of truly memorable characters, multiple wonders, incredible adventures—and strange coincidences, which were really not coincidences at all. And it involved them in an ancient crime that still perturbed the serenity of Heaven. Simply and charmingly told, this is a wry tale, a sly tale, and a story of wisdom delightfully askew. Once read, its marvels and beauty will not easily fade from the mind.The author claims that this is a novel of an ancient China that never was. But, oh…it should have been!",278,"['Fantasy', 'Fiction', 'Historical Fiction', 'China', 'Humor', 'Historical', 'Mystery']",259 follower,"1,181 review",10,156 (1%),345 (3%),"1,345 (12%)","3,168 (30%)","5,348 (51%)"
The Willows,Algernon Blackwood,4.07,"13,011 rating","January 1, 1907","Two friends are midway on a canoe trip down the Danube River. Throughout the story Blackwood personifies the surrounding environment—river, sun, wind—and imbues them with a powerful and ultimately threatening character. Most ominous are the masses of dense, desultory, menacing willows, which ""moved of their own will as though alive, and they touched, by some incalculable method, my own keen sense of the horrible.""""The Willows"" is one of Algernon Blackwood's best known short stories. American horror author H.P. Lovecraft considered it to be the finest supernatural tale in English literature. ""The Willows"" is an example of early modern horror and is connected within the literary tradition of weird fiction.",105,"['Horror', 'Fiction', 'Short Stories', 'Fantasy', 'Gothic', 'Weird Fiction', 'Classics']","1,019 follower","1,467 review","1,150",125 (<1%),531 (4%),"2,454 (18%)","5,058 (38%)","4,843 (37%)"
Louis de Bernières Box Set of 3 books: The War of Don Emmanuel's Nether Parts / Señor Vivo and the Coca Lord / The Troublesome Offspring of Cardinal Guzmán,Louis de Bernières,4.48,662 rating,"January 1, 1994","This rambunctious first novel by the author of the bestselling Corelli's Mandolin is set in an impoverished, violent, yet ravishingly beautiful country somewhere in South America. When the haughty Dona Constanza decides to divert a river to fill her swimming pool, the consequences are at once tragic, heroic, and outrageously funny. ""Walks a precarious edge between slapstick and pathos, never once losing its balance.""Washington Post Book World.","PaperbackFirst published January 1, 1994","['Fiction', 'Magical Realism', 'English Literature', 'Contemporary', 'British Literature']","1,825 follower",53 review,60,5 (<1%),7 (1%),54 (8%),194 (29%),402 (60%)
Op-Center,Jeff Rovin,3.65,"14,297 rating","February 28, 1995","Tom Clancy's Op-Center is the beating heart of America's defense, intelligence and crisis management technology. It is run by a crack team of operatives both within its own walls and out in the field. When a job is too dirty--or too dangerous--it's the only place our government can turn.But nothing can prepare Director Paul Hood and his Op-Center crisis management team for what they're about to uncover--a very real, very frightening power play that could unleash new players in a new world order...",387,"['Fiction', 'Thriller', 'Adventure', 'Espionage', 'Action', 'Military Fiction', 'Mystery', 'Fiction', 'Thriller', 'Adventure', 'Espionage', 'Action', 'Military Fiction', 'Mystery', 'Fiction', 'Thriller', 'Adventure', 'Espionage', 'Action', 'Military Fiction', 'Mystery', 'Fiction', 'Thriller', 'Adventure', 'Espionage', 'Action', 'Military Fiction', 'Mystery', 'Fiction', 'Thriller', 'Adventure', 'Espionage', 'Action', 'Military Fiction', 'Mystery']",206 follower,243 review,232,528 (3%),"1,323 (9%)","4,386 (30%)","4,505 (31%)","3,555 (24%)"
Forty Fathom Bank,Les Galloway,3.90,41 rating,"December 31, 1984","Book by Galloway, Les",108,[],11 book,6 review,11,0 (0%),2 (4%),12 (29%),15 (36%),12 (29%)
I giganti della montagna,Luigi Pirandello,3.82,164 rating,"95 pages, PaperbackPublished March 26, 1994","Uma companhia teatral decadente chega a uma vila mágica povoada por fantasmas e governada pelo Mago Cotrone. Sua história convida os leitores para uma reflexão fundamental: qual o lugar da arte num mundo cada vez mais pragmático e dominado por “gigantes” insensíveis à poesia e ao poder da imaginação?Com idealização e roteirização de Inês Peixoto para o universo das HQs, criado a partir da montagem do Grupo Galpão (dirigida por Gabriel Villela), Os gigantes da montanha ganha vida pelo olhar encantado dos artistas Carlos Avelino e Bruno Costa, trazendo para a linguagem dos quadrinhos a magia dessa obra inacabada do dramaturgo italiano Luigi Pirandello.",95,"['Italian Literature', 'Fiction', 'Plays', 'Drama']","1,256 follower",7 review,"1,229",3 (1%),10 (6%),44 (26%),64 (39%),43 (26%)
A Student of Weather,Elizabeth Hay,3.70,"2,467 rating","January 1, 2000","From some accidents of love and weather we never quite recover. At the worst of the Prairie dust bowl of the 1930s, a young man appears out of a blizzard and forever alters the lives of two sisters. There is the beautiful, fastidious Lucinda, and the tricky and tenacious Norma Joyce, at first a strange, self-possessed child, later a woman who learns something of self-forgiveness and of the redemptive nature of art. Their rivalry sets the stage for all that follows in a narrative spanning over thirty years, beginning in Saskatchewan and moving, in the decades following the war, to Ottawa and New York City. Disarming, vividly told, unforgettable, this is a story about the mistakes we make that never go away, about how the things we want to keep vanish and the things we want to lose return to haunt us.",376,"['Fiction', 'Canada', 'Historical Fiction', 'Canadian Literature', 'Literary Fiction', 'Contemporary', 'Coming Of Age']",279 follower,188 review,26,52 (2%),181 (7%),706 (28%),"1,033 (41%)",495 (20%)
Batman: Year One,Frank Miller,4.24,"249,469 rating","January 1, 1988","A new edition of one of the most important and critically acclaimed Batman adventures ever, written by Frank Miller, author of The Dark Knight Returns!In 1986, Frank Miller and David Mazzucchelli produced this groundbreaking reinterpretation of the origin of Batman—who he is and how he came to be.Written shortly after The Dark Knight Returns, Miller's dystopian fable of Batman's final days, Year One set the stage for a new vision of a legendary character.This edition includes the complete graphic novel, a new introduction by writer Frank Miller and a new illustrated afterword by artist David Mazzucchelli. Completing this collection are over 40 pages of never-before-seen developmental material such as character and layout sketches, sample script pages, sketches and more that provide a glimpse into the making of this contemporary classic.This volume collects Batman #404–407.",144,"['Comics', 'Graphic Novels', 'Batman', 'Fiction', 'Dc Comics', 'Graphic Novels Comics', 'Comic Book', 'Comics', 'Graphic Novels', 'Batman', 'Fiction', 'Dc Comics', 'Graphic Novels Comics', 'Comic Book', 'Comics', 'Graphic Novels', 'Batman', 'Fiction', 'Dc Comics', 'Graphic Novels Comics', 'Comic Book', 'Comics', 'Graphic Novels', 'Batman', 'Fiction', 'Dc Comics', 'Graphic Novels Comics', 'Comic Book', 'Comics', 'Graphic Novels', 'Batman', 'Fiction', 'Dc Comics', 'Graphic Novels Comics', 'Comic Book']","4,745 follower","4,207 review","1,394","6,729 (2%)","7,659 (3%)","31,414 (12%)","77,584 (31%)","126,083 (50%)"
The Old Man and Mr. Smith: A Fable,Peter Ustinov,3.94,807 rating,"January 1, 1990","An increasingly decrepit God and a merely ill-tempered Satan are reconciled and attempt a mission to Earth, where their misadventures point up the comedy and tragedy of modern life",368,"['Fiction', 'Humor', 'Fantasy', 'Roman', 'German Literature', 'British Literature', 'Novels']",47 follower,65 review,125,15 (1%),48 (5%),190 (23%),272 (33%),282 (34%)
Ka: Stories of the Mind and Gods of India,Roberto Calasso,4.14,948 rating,"September 1, 1996","With the same narrative fecundity and imaginative sympathy he brought to his acclaimed retelling of the Greek myths, Roberto Calasso plunges Western readers into the mind of ancient India. He begins with a mystery: Why is the most important god in the Rg Veda, the oldest of India's sacred texts, known by a secret name--""Ka,"" or Who?What ensues is not an explanation, but an unveiling. Here are the stories of the creation of mind and matter; of the origin of Death, of the first sexual union and the first parricide. We learn why Siva must carry his father's skull, why snakes have forked tongues, and why, as part of a certain sacrifice, the king's wife must copulate with a dead horse. A tour de force of scholarship and seduction, Ka is irresistible.",464,"['Mythology', 'India', 'Religion', 'Philosophy', 'Fiction', 'Spirituality', 'Hinduism']",435 follower,94 review,59,26 (2%),41 (4%),142 (14%),309 (32%),430 (45%)
The Cream of the Jest,James Branch Cabell,3.93,164 rating,"October 1, 1917","This work has been selected by scholars as being culturally important, and is part of the knowledge base of civilization as we know it. This work is in the ""public domain in the United States of America, and possibly other nations. Within the United States, you may freely copy and distribute this work, as no entity (individual or corporate) has a copyright on the body of the work. Scholars believe, and we concur, that this work is important enough to be preserved, reproduced, and made generally available to the public. We appreciate your support of the preservation process, and thank you for being an important part of keeping this knowledge alive and relevant.","PaperbackFirst published October 1, 1917","['Fantasy', 'Fiction', 'Speculative Fiction', 'Novels', 'Science Fiction Fantasy']",116 follower,14 review,278,5 (3%),8 (4%),31 (18%),69 (42%),51 (31%)
"The Struggle for Mastery in Europe, 1848-1918",A.J.P. Taylor,4.07,349 rating,"December 4, 1954","The fall of Metternich in the revolutions which swept Europe in 1848 heralded an era of unprecedented nationalism, which culminated in the collapse of the Habsburg, Romanov, and Hohenzollern dynasties at the of the First World War. In the intervening seventy years which are the subject of this book, the boundaries of Europe changed dramatically from those established at Vienna in 1815: Cavour championed the cause of Risorgimento in Italy; Bismarck brought about the unification of Germany; while the Great Powers scrambled for a place in the sun in Africa.In this, one of his most enduring works, A.J.P. Taylor shows how the changing balance of power determined the course of European history, during this, the last age when Europe was the centre of world history. Throughout, Taylor's narrative is so vivid that the book is as much a work of literature as a contribution to historical scholarship.",674,"['History', 'European History', 'Nonfiction', 'Politics', 'International Relations', 'World War I', '19th Century']",147 follower,30 review,109,2 (<1%),18 (5%),65 (18%),131 (37%),133 (38%)
When Memory Dies,Ambalavaner Sivanandan,4.24,221 rating,"696 pages, PaperbackPublished January 1, 1997",A powerful three-generational saga of a Sri Lankan family's search for coherence and continuity in a country broken by colonial occupation and riven by ethnic wars. Winner of the Sagittarius Prize. Shortlisted for the Commonwealth Writers' Prize,696,"['Fiction', 'Historical Fiction', 'India', 'Literature']",28 follower,32 review,17,2 (<1%),10 (4%),31 (14%),67 (30%),111 (50%)
The Monk Who Sold His Ferrari,Robin S. Sharma,3.89,"158,580 rating","January 1, 1996","WISDOM TO CREATE A LIFE OF PASSION, PURPOSE, AND PEACE. This inspiring tale provides a step-by-step approach to living with greater courage, balance, abundance, and joy. A wonderfully crafted fable, The Monk Who Sold His Ferrari tells the extraordinary story of Julian Mantle, a lawyer forced to confront the spiritual crisis of his out-of-balance life. On a life-changing odyssey to an ancient culture, he discovers powerful, wise, and practical lessons that teach us to:— Develop joyful thoughts— Follow our life's mission and calling— Cultivate self-discipline and act courageously— Value time as our most important commodity— Nourish our relationships, and— live fully, one day at a time",198,"['Self Help', 'Nonfiction', 'Philosophy', 'Spirituality', 'Personal Development', 'Psychology', 'Inspirational']","6,100 follower","9,936 review",278,"5,933 (3%)","11,686 (7%)","32,590 (20%)","52,042 (32%)","56,329 (35%)"
