title,authors,average_rating,rating,date_of_publication,descriptions,total_pages,genres,author_followers,no_of_reviews,no_of_books_by_author,one_star_ratings,two_star_ratings,three_star_ratings,four_star_ratings,five_star_ratings
Dina's Book,Herbjørg Wassmo,4.07,"4,102 rating","January 1, 1989","On the scale of Gone with the Wind and War and Peace, this grand, sweeping epic will enthrall readers just as Dina bewitches everyone she meets. Set in Norway in the mid-nineteenth century, Dina's Book presents an extraordinary heroine. Beautiful, eccentric, and tempestuous, Dina carries a terrible at the age of five she accidentally causes her mother's death. Blamed by her father and banished to a farm, she grows up untamed and untaught. Nobody leads the child through her grief, and the accident remains a gruesome riddle of death. Her guilt becomes her her unforgiving mother haunts her every day. After several years of exile, and at the insistence of the local pastor, her father takes Dina back. By now she has become like a wolf cub. Her father has remarried, to a younger woman whom she detests, and a strict discipline begins. A tutor is brought in; coarse language is replaced by polite conversation, climbing to the top of the trees by music. But the efforts have little effect. Private and closely guarded, Dina nonetheless is able to manipulate those around her, while her unconventional behavior and erotic power both enchant and ensnare. At sixteen Dina is married off to wealthy fifty-year-old landowner Jacob, a friend of her father who has fallen completely under her spell. Jacob dies under mysterious circumstances, and Dina becomes mute. When finally she emerges from her trauma, she runs Jacob's estate with an iron hand. But still Dina wrestles with her two unappeased Jacob and her mother. Until one day a mysterious stranger, the Russian wanderer Leo, enters her life and changes it forever.",527,"['Fiction', 'Historical Fiction', 'Historical', 'Romance', 'Scandinavian Literature', 'Classics', 'Roman']",271 follower,201 review,37,69 (1%),197 (4%),727 (17%),"1,503 (36%)","1,606 (39%)"
Tales of the Klondyke,Jack London,3.61,241 rating,"January 1, 1901","Contents:- The God of His Fathers- The Great Interrogation Which Make Men Remember- Siwash- The Man with the Gash- Jan, the Unrepentant- Grit of Women- Where the Trail Forks- A Daughter of the Aurora- At the Rainbow's End- The Scorn of Women",132,"['Short Stories', 'Fiction', 'Adventure', 'Classics', 'American', 'Canada', 'Westerns']","6,795 follower",15 review,"6,588",7 (2%),29 (12%),71 (29%),79 (32%),55 (22%)
Shiloh,Shelby Foote,4.11,"5,306 rating","January 1, 1952","In the novel Shiloh, historian and Civil War expert Shelby Foote delivers a spare, unflinching account of the battle of Shiloh, which was fought over the course of two days in April 1862. By mirroring the troops' movements through the woods of Tennessee with the activity of each soldier's mind, Foote offers the reader a broad perspective of the battle and a detailed view of the issues behind it. The battle becomes tangible as Foote interweaves the observations of Union and Confederate officers, simple foot soldiers, brave men, and cowards and describes the roar of the muskets and the haze of the gun smoke. The author's vivid storytelling creates a rich chronicle of a pivotal battle in American history.",226,"['Historical Fiction', 'Civil War', 'Fiction', 'American Civil War', 'War', 'American History', 'Military Fiction']",602 follower,298 review,129,46 (<1%),154 (2%),985 (18%),"2,121 (39%)","2,000 (37%)"
Theophilus North,Thornton Wilder,4.03,"1,100 rating","January 1, 1973","Marking the thirtieth anniversary of Theophilus North, this beautiful new edition features Wilder's unpublished notes for the novel and other illuminating documentary material, all of which is included in a new Afterword by Tappan Wilder. The last of Wilder's works published during his lifetime, this novel is part autobiographical and part the imagined adventure of his twin brother who died at birth. Setting out to see the world in the summer of 1926, Theophilus North gets as far as Newport, Rhode Island, before his car breaks down. To support himself, Theophilus takes jobs in the elegant mansions along Ocean Drive, just as Wilder himself did in the same decade. Soon the young man finds himself playing the roles of tutor, spy, confidant, lover, friend, and enemy as he becomes entangled in the intrigues of both upstairs and downstairs in a glittering society dominated by leisure. Narrated by the elderly North from a distance of fifty years, Theophilus North is a fascinating commentary on youth and education from the vantage point of age, and deftly displays Wilder's trademark wit juxtaposed with his lively and timeless ruminations on what really matters about life, love, and work at the end of the day -- even after a visit to Newport.",351,"['Fiction', 'Historical Fiction', 'Classics', 'American', '20th Century', 'Novels', 'Literature']",435 follower,127 review,213,16 (1%),52 (4%),214 (19%),414 (37%),404 (36%)
A Book Dragon,Donn Kushner,4.05,286 rating,"January 1, 1987","Nonesuch, the last in a line of dragons, uses his unique ability to change in size to survive for six centuries, during which time he observes such different humans as a medieval monk, an eighteenth-century London chemist, and a modern American bookseller.Nonesuch, the last of a family of dragons, survives six centuries, including visits to plague-stricken London and a modern bookstore, without being discovered",198,"['Fantasy', 'Dragons', 'Fiction', 'Young Adult', 'Middle Grade', 'Historical Fiction', 'Childrens']",2 follower,50 review,10,8 (2%),17 (5%),49 (17%),90 (31%),122 (42%)
Silent Night,R.L. Stine,3.69,"4,522 rating","November 1, 1991","Welcome to Fear Street.Don’t listen to the stories they tell you about Fear Street. Wouldn’t you rather explore it yourself…and see if its dark terrors and unexplained mysteries are true? You’re not afraid, are you?Don’t open that present!If only Reva Dalby had listened to that warning.But beautiful, cold Reva won’t listen to anyone. Reva thinks she can have whatever—and whoever—she wants. After all, her daddy owns Dalby Department Stores.Now, someone has some surprises instore for her. Robbery? Terror? Even murder? Someone wants to treat Reva to a holiday she’ll never forget.Holiday cheer quickly turns to holiday chills for Reva. Someone is stalking her, someone is trying to get to her.Her money can’t help her. No one can.After all, who can you turn to when murder comes gift-wrapped?",216,"['Horror', 'Young Adult', 'Christmas', 'Fiction', 'Childrens', 'Thriller', 'Mystery']",16.7k follower,268 review,"1,674",81 (1%),369 (8%),"1,592 (35%)","1,301 (28%)","1,179 (26%)"
Grand Canyon: A Trail Through Time,Linda Vieira,3.85,27 rating,"November 1, 1997","Visited by millions of people every year, the Grand Canyon is one of the Seven Natural Wonders of the World. It is also a multi-story home to all kinds of animals and plants. The award-winning team of The Ever-Living Tree brings to life the awesome story of one of our country's greatest national treasures, with breathtaking illustrations and illuminating prose.",32,"['Geography', 'Picture Books', 'Geography', 'Picture Books', 'Geography', 'Picture Books']",5 book,5 review,5,0 (0%),2 (7%),8 (29%),9 (33%),8 (29%)
Patience dans l'azur,Hubert Reeves,4.31,348 rating,"January 1, 1981","Paul Valéry, étendu sur le sable chaud d’une lagune, regarde le ciel. Dans son champ de vision, des palmiers se balancent mollement, mûrissant leurs fruits. Il est à l’écoute du temps qui sourdement fait son œuvre. Cette écoute, on peut l’appliquer à l’univers. Au fil du temps se déroule la gestation cosmique. À chaque seconde, l’univers prépare quelque chose. Il monte lentement les marches de la complexité. » H.R.Quand Hubert Reeves rencontre Paul Valéry, et l’astrophysique la poésie, la vulgarisation des sciences s’enrichit d’un grand classique qui, en un quart de siècle, n’a pas pris une ride.",324,"['Science', 'Nonfiction', 'Astronomy', 'Physics', 'Popular Science', 'Contemporary', 'Space']",142 follower,23 review,136,2 (<1%),4 (1%),47 (13%),126 (36%),169 (48%)
The Cardinal of the Kremlin,Tom Clancy,4.09,"56,184 rating","July 28, 1988","In a rolling sea off the coast of South America, a target disappears in a puff of green light. In the Soviet hills of Dushanbe near the Afghanistan border, an otherworldly array of pillars and domes rises into the night. To the two greatest nations on earth, no contest is more urgent than the race to build the first Star Wars missile defense system, and no one knows that more than the two men charged with assessing the Soviets' capabilities: Colonel Mikhail Filitov of the Soviet Union, an old-line warrior distrusted by the army's new inner circle of technocrats, and CIA analyst Jack Ryan, hero of the Red October affair.Each must use all his craft to arrive at the truth, but Filitov gets there first -- and that's when all hell breaks loose. Because Filitov, code-named Cardinal, is America's highest agent in the Kremlin, and he is about to be betrayed to the KGB. His rescue could spell the difference between peace and war, and it is up to Jack Ryan to accomplish it -- if he can -- as, in a breathtaking sequence of hunter and hunted, Filitov's life, and Ryan's and that of the world itself literally hang in the balance.",547,"['Fiction', 'Thriller', 'Espionage', 'Military Fiction', 'Action', 'Suspense', 'Adventure']","8,014 follower",951 review,808,275 (<1%),"1,663 (2%)","11,597 (20%)","22,075 (39%)","20,574 (36%)"
হাজার চুরাশির মা,Mahasweta Devi,4.23,"1,648 rating","August 1, 1974","'হাজার চুরাশির মা' উপন্যাসটি একটি লাশের গল্পকে কেন্দ্র করে। নির্মিত। একজন সৎ, বিবেকবান বিপ্লবী সন্তানের মৃতদেহের। পরিচয় দিতে অবশেষে কেউ আর রইল না। পরিবারে অন্যান্য। সদস্য থেকে এমন কী কোনও আতীয়স্বজনও নয় । তিনি মা। তিনিই হাজার চুরাশি নম্বর লাশটির মা হয়েই মর্গের দরজায়। অপেক্ষা। উপন্যাসটির শরীরের এক প্রান্তের সংলাপ এমনই। মি. কাপাডিয়া নিখুঁত বাংলায় বলতে লাগলেন, দেশের সমস্যা। কি বলুন? ইনট্রিগ্রেশন হচ্ছে না। বহু ধর্ম, জাতি, ভাষা হবার দরুণ। দেশটা ভেঙে যাচ্ছে। ফুড কোনও সমস্যাই নয়। ফুডরয়েটে হচ্ছে। কি? চাষীরা অত্যন্ত ওয়েল অফ। সবাই রেডিও কিনছে...",120,"['Fiction', 'India', 'Classics', 'Historical Fiction', 'Indian Literature', 'Literature', 'Politics']",280 follower,232 review,184,25 (1%),35 (2%),211 (12%),650 (39%),727 (44%)
Advice to a Young Wife from An Old Mistress,Michael Drury,3.97,184 rating,"January 1, 1968","A compendium of wisdom and insight on love and romance offers commentary on such topics as the value of exclusivity, the impact of money as power over sex, and the relationship between emotion and reason",110,"['Nonfiction', 'Romance', 'Self Help', 'Relationships']",41 book,28 review,41,5 (2%),15 (8%),33 (17%),58 (31%),73 (39%)
Coin Locker Babies,Ryū Murakami,3.79,"8,393 rating","October 28, 1980","A surreal coming-of-age tale that establishes Ryu Murakami as one of the most inventive young writers in the world today. Abandoned at birth in adjacent train station lockers, two troubled boys spend their youth in an orphanage and with foster parents on a semi-deserted island before finally setting off for the city to find and destroy the women who first rejected them. Both are drawn to an area of freaks and hustlers called Toxitown. One becomes a bisexual rock singer, star of this exotic demimonde, while the other, a pole vaulter, seeks his revenge in the company of his girlfriend, Anemone, a model who has converted her condominium into a tropical swamp for her pet crocodile.Together and apart, their journey from a hot metal box to a stunning, savage climax is a brutal funhouse ride through the eerie landscape of late-twentieth-century Japan.",393,"['Fiction', 'Japan', 'Japanese Literature', 'Horror', 'Contemporary', 'Novels', 'Asian Literature', 'Fiction', 'Japan', 'Japanese Literature', 'Horror', 'Contemporary', 'Novels', 'Asian Literature', 'Fiction', 'Japan', 'Japanese Literature', 'Horror', 'Contemporary', 'Novels', 'Asian Literature']","3,033 follower",616 review,254,267 (3%),665 (7%),"2,062 (24%)","2,966 (35%)","2,433 (28%)"
The Box Man,Kōbō Abe,3.61,"6,359 rating","January 1, 1973","Kobo Abe, the internationally acclaimed author of Woman in the Dunes, combines wildly imaginative fantasies and naturalistic prose to create narratives reminiscent of the work of Kafka and Beckett.In this eerie and evocative masterpiece, the nameless protagonist gives up his identity and the trappings of a normal life to live in a large cardboard box he wears over his head. Wandering the streets of Tokyo and scribbling madly on the interior walls of his box, he describes the world outside as he sees or perhaps imagines it, a tenuous reality that seems to include a mysterious rifleman determined to shoot him, a seductive young nurse, and a doctor who wants to become a box man himself. The Box Man is a marvel of sheer originality and a bizarrely fascinating fable about the very nature of identity.Translated from the Japanese by E. Dale Saunders.",178,"['Fiction', 'Japanese Literature', 'Japan', 'Literature', 'Novels', 'Classics', 'Asia']","1,776 follower",627 review,200,206 (3%),682 (10%),"1,891 (29%)","2,196 (34%)","1,384 (21%)"
Last of the Breed,Louis L'Amour,4.27,"13,442 rating","June 1, 1986","Here is the kind of authentically detailed epic novel that has become Louis L’Amour’s hallmark. It is the compelling story of U.S. Air Force Major Joe Mack, a man born out of time. When his experimental aircraft is forced down in Russia and he escapes a Soviet prison camp, he must call upon the ancient skills of his Indian forebears to survive the vast Siberian wilderness. Only one route lies open to Mack: the path of his ancestors, overland to the Bering Strait and across the sea to America. But in pursuit is a legendary tracker, the Yakut native Alekhin, who knows every square foot of the icy frontier—and who knows that to trap his quarry he must think like a Sioux.",371,"['Fiction', 'Westerns', 'Adventure', 'Historical Fiction', 'Thriller', 'Survival', 'Action']","2,914 follower","1,179 review",946,115 (<1%),364 (2%),"1,999 (14%)","4,289 (31%)","6,675 (49%)"
The Broken Sword,Poul Anderson,3.86,"6,838 rating","November 5, 1954","Thor broke the sword Tyrfing to save the roots of Yggdrasil, the tree that binds earth, heaven and hell. Now the elves need the weapon for their war against the trolls. Only Scafloc, a human kidnapped and raised by elves, can hope to persuade Bolverk the ice-giant to make Tyrfing whole again. But Scafloc must also confront his shadow self, Valgard, the changeling in his place among men.",231,"['Fantasy', 'Fiction', 'Mythology', 'Classics', 'Epic Fantasy', 'High Fantasy', 'Sword and Sorcery']",999 follower,740 review,"1,457",142 (2%),455 (6%),"1,677 (24%)","2,519 (36%)","2,045 (29%)"
Titus Alone,Mervyn Peake,3.45,"5,505 rating","January 1, 1959","Titus, almost 20, flees oppressive Castle Rituals. Lost in a sandstorm, helped by Muzzlehatch owner of traveling zoo and his ex-lover Juno, stranded in big city, arrested for vagrancy, he longs for home. Nobody has heard of Gormenghast, few believe. Titus wants to prove it is real.",284,"['Fantasy', 'Fiction', 'Classics', 'Gothic', 'Science Fiction', 'Novels', 'Science Fiction Fantasy']","1,013 follower",425 review,101,215 (3%),803 (14%),"1,880 (34%)","1,497 (27%)","1,110 (20%)"
Alligator Pie,Dennis Lee,4.10,"1,454 rating","September 1, 1974","""Alligator Pie, alligator pie,If I don't get some I think I'm gonna die.Give away the green grass, give away the sky,But don't give away my alligator pie!"" You savored it as a child. You served it every night to your children. Now it's back-the tasty, delicious nonsense of Alligator Pie, in a collector's edition complete with the original artwork from the classic 1974 edition. Dennis Lee's wonderfully playful rhymes, along with Frank Newfield's memorable illustrations, have enchanted two generations of young readers. What better way could there be to discover the magic of books?",64,"['Poetry', 'Picture Books', 'Canada', 'Childrens', 'Fiction', 'Classics', 'Humor', 'Poetry', 'Picture Books', 'Canada', 'Childrens', 'Fiction', 'Classics', 'Humor', 'Poetry', 'Picture Books', 'Canada', 'Childrens', 'Fiction', 'Classics', 'Humor']",47 follower,82 review,121,27 (1%),78 (5%),267 (18%),433 (29%),649 (44%)
Botchan,Natsume Sōseki,3.64,"13,016 rating","January 1, 1906","Like The Catcher in the Rye or The Adventures of Huckleberry Finn, Botchan, a hilarious tale about a young man's rebellion against ""the system"" in a country school, is a classic of its kind. Among Japanese readers both young and old it has enjoyed a timeless popularity, making it, according to Donald Keene, ""probably the most widely read novel in modern Japan.""The setting is Japan's deep south, where the author himself spent some time teaching English in a boys' school. Into this conservative world, with its social proprieties and established pecking order, breezes Botchan, down from the big city, with scant respect for either his elders or his noisy young charges; and the result is a chain of collisions large and small.Much of the story seems to occur in summer, against the drone of cicadas, and in many ways this is a summer book light, funny, never slow-moving. Here, in a lively new translation much better suited to Western tastes than any of its forebears, Botchan's homespun appeal is all the more apparent, and even those who have never been near the sunlit island on which these calamitous episodes take place should find in it uninterrupted entertainment.",171,"['Japan', 'Fiction', 'Japanese Literature', 'Classics', 'Novels', 'Literature', 'Asian Literature', 'Japan', 'Fiction', 'Japanese Literature', 'Classics', 'Novels', 'Literature', 'Asian Literature', 'Japan', 'Fiction', 'Japanese Literature', 'Classics', 'Novels', 'Literature', 'Asian Literature']","2,706 follower","1,654 review",672,211 (1%),"1,011 (7%)","4,461 (34%)","4,918 (37%)","2,415 (18%)"
Padre Pio's Words of Hope,Eileen Dunn Bertanzetti,4.51,67 rating,"January 1, 1999","If you've ever wished you could sit down and ask Saint Padre Pio, the famous stigmatist of the 20th century, some of the deepest questions of the human heart, now you can. With beautiful illustrations and topics ranging from simple queries about the role of angels to the cry of a soul seeking to understand the meaning of suffering, these meditations use the actual words of this sainted priest to answer your most intimate questions and reveal God's own messages of encouragement, exhortation, inspiration, and blessing. Padre Pio (1887-1968) was an internationally beloved Franciscan priest. From his home in Italy, he drew thousands of pilgrims who wished to obtain a blessing, experience healing, go to Confession, or be present at Mass celebrated by the sainted friar. He was canonized a saint on June 16, 2002.",192,['Catholic'],4 follower,4 review,15,2 (2%),0 (0%),6 (8%),13 (19%),46 (68%)
"Grand Expectations: The United States, 1945-1974",James T. Patterson,4.10,"1,180 rating","April 18, 1996","Beginning in 1945, America rocketed through a quarter-century of extraordinary economic growth, experiencing an amazing boom that soared to unimaginable heights in the 1960s. At one point, in the late 1940s, American workers produced 57 percent of the planet's steel, 62 percent of the oil, 80 percent of the automobiles. The U.S. then had three-fourths of the world's gold supplies. English Prime Minister Edward Heath later said that the United States in the post-War era enjoyed ""the greatest prosperity the world has ever known."" It was a boom that produced a national euphoria, a buoyant time of grand expectations and an unprecedented faith in our government, in our leaders, and in the American dream--an optimistic spirit which would be shaken by events in the '60s and '70s, and particularly by the Vietnam War.Now, in Grand Expectations, James T. Patterson has written a highly readable and balanced work that weaves the major political, cultural, and economic events of the period into a superb portrait of America from 1945 through Watergate. Here is an era teeming with memorable events--from the bloody campaigns in Korea and the bitterness surrounding McCarthyism to the assassinations of the Kennedys and Martin Luther King, to the Vietnam War, Watergate, and Nixon's resignation. Patterson excels at portraying the amazing growth after World War II--the great building boom epitomized by Levittown (the largest such development in history) and the baby boom (which exploded literally nine months after V-J Day)--as well as the resultant buoyancy of spirit reflected in everything from streamlined toasters, to big, flashy cars, to the soaring, butterfly roof of TWA's airline terminal in New York. And he shows how this upbeat, can-do mood spurred grander and grander expectations as the era progressed.Of course, not all Americans shared in this economic growth, and an important thread running through the book is an informed and gripping depiction of the civil rights movement--from the electrifying Brown v. Board of Education decision, to the violent confrontations in Little Rock, Birmingham, and Selma, to the landmark civil rights acts of 1964 and 1965. Patterson also shows how the Vietnam War--which provoked LBJ's growing credibility gap, vast defense spending that dangerously unsettled the economy, and increasingly angry protests--and a growing rights revolution (including demands by women, Hispanics, the poor, Native Americans, and gays) triggered a backlash that widened hidden rifts in our society, rifts that divided along racial, class, and generational lines. And by Nixon's resignation, we find a national mood in stark contrast to the grand expectations of ten years earlier, one in which faith in our leaders and in the attainability of the American dream was greatly shaken.The Oxford History of the United StatesThe Oxford History of the United States is the most respected multi-volume history of our nation. The series includes three Pulitzer Prize winners, a New York Times bestseller, and winners of the Bancroft and Parkman Prizes. The Atlantic Monthly has praised it as ""the most distinguished series in American historical scholarship,"" a series that ""synthesizes a generation's worth of historical inquiry and knowledge into one literally state-of-the-art book."" Conceived under the general editorship of C. Vann Woodward and Richard Hofstadter, and now under the editorship of David M. Kennedy, this renowned series blends social, political, economic, cultural, diplomatic, and military history into coherent and vividly written narrative.",880,"['History', 'American History', 'Nonfiction', 'Politics', 'American', 'United States', 'The United States Of America']",36 follower,86 review,24,17 (1%),36 (3%),206 (17%),477 (40%),444 (37%)
Collected Poems: 1945-1990 R.S.Thomas: Collected Poems : R S Thomas,R.S. Thomas,4.39,305 rating,"January 1, 1993","In language of great strength, simplicity, and beauty, poet R. S. Thomas explores his often-prophetic themes: technology and our use of it to destroy nature and rural life; the search for self and for meaning; and the quest for and dialogue with God. Originally published to mark the author's 80th birthday, it confirms him as a pre-eminent poet. ""Read these poems.""--Stephen Spender. ""This is a book I've been waiting for.""--Ted Hughes.",560,"['Poetry', 'Anthologies', 'Literature']",47 follower,30 review,89,3 (<1%),6 (1%),35 (11%),85 (27%),176 (57%)
Niklay Teri Talash Main / نکلے تیری تلاش میں,Mustansar Hussain Tarar,4.26,346 rating,"January 1, 1971",Niklay Teri Talash Main by Mustansar Hussain Tarar,368,"['Nonfiction', 'Travelogue', 'Travel']",426 follower,26 review,156,9 (2%),8 (2%),42 (12%),111 (32%),176 (50%)
Tandia,Bryce Courtenay,4.09,"11,360 rating","January 1, 1992","Tandia sat waiting anxiously for the fight to begin between the man she loved the most in the world and the man she hated the most in the world.Tandia is a child of Africa: half Indian, half African, beautiful and intelligent, she is only sixteen when she is first brutalised by the police. Her fear of the white man leads her to join the black resistance movement, where she trains as a terrorist.With her in the fight for justice is the one white man Tandia can trust, the welterweight champion of the world, Peekay. Now he must fight their common enemy in order to save both their lives.",905,"['Fiction', 'Historical Fiction', 'Africa', 'South Africa', 'Drama', 'Audiobook', 'Novels']","1,984 follower",530 review,72,116 (1%),413 (3%),"2,121 (18%)","4,423 (38%)","4,287 (37%)"
