title,authors,average_rating,rating,date_of_publication,descriptions,total_pages,genres,author_followers,no_of_reviews,no_of_books_by_author,one_star_ratings,two_star_ratings,three_star_ratings,four_star_ratings,five_star_ratings
The Acts of King Arthur and His Noble Knights,John Steinbeck,3.83,"6,370 rating","December 31, 1976","Steinbeck's first posthumously published work, The Acts of King Arthur and His Noble Knights is a reinterpretation of tales from Malory's Morte d'Arthur. In this highly successful attempt to render Malory into Modern English, Steinbeck recreated the rhythm and tone of the original Middle English.",384,"['Fiction', 'Fantasy', 'Classics', 'Arthurian', 'Historical Fiction', 'Mythology', 'Literature', 'Fiction', 'Fantasy', 'Classics', 'Arthurian', 'Historical Fiction', 'Mythology', 'Literature', 'Fiction', 'Fantasy', 'Classics', 'Arthurian', 'Historical Fiction', 'Mythology', 'Literature']",22.5k follower,488 review,784,108 (1%),389 (6%),"1,764 (27%)","2,348 (36%)","1,761 (27%)"
The Calvin and Hobbes Tenth Anniversary Book,Bill Watterson,4.62,"51,554 rating","September 1, 1995","Many moons ago, the magic of Calvin and Hobbes first appeared on the funny pages and the world was introduced to a wondrous pair of friends -- a boy and his tiger, who brought new life to the comics page. To celebrate the tenth anniversary of this distinguished partnership, Bill Watterson prepared this special book, sharing his thoughts on cartooning and creating Calvin and Hobbes, illustrated throughout with favorite black-and-white and color cartoons.",208,"['Comics', 'Humor', 'Graphic Novels', 'Fiction', 'Graphic Novels Comics', 'Comic Strips', 'Comic Book']","4,474 follower",485 review,384,444 (<1%),693 (1%),"3,187 (6%)","9,150 (17%)","38,080 (73%)"
Worstward Ho,Samuel Beckett,3.73,719 rating,"January 1, 1983","Beckett's second last prose text, Worstward Ho, is a novella written in 1983, shortly after the largely autobiographical Company and  an ironic theological speculation, both previously published as the first two parts of a late trilogy of short novels. The concentration of language and precision of description in the current work is revolutionary, even for Beckett, the great reshaper of literary expression, and its theme is the creation of life, as if by a malignant God or Demiurge. Life, against all possibility, finally exists, and man becomes a painful presence. It is one of the supreme poetic texts of the 20th century.",47,"['Fiction', 'Short Stories', 'Poetry', 'Literature', 'Classics', 'Irish Literature', 'Ireland']","5,808 follower",90 review,705,46 (6%),67 (9%),149 (20%),231 (32%),226 (31%)
Michael Crichton's Jurassic World: Jurassic Park / The Lost World,Michael Crichton,4.24,"10,710 rating","September 30, 1997","Now at last in one volume, Michael Crichton's Jurassic Park and The Lost World--the two incomparably suspenseful, supremely scary, utterly unputdownable, worldwide best-selling return-of-the-dinosaurs novels, which together constitute Jurassic World.--front flap",801,"['Science Fiction', 'Fiction', 'Thriller', 'Classics', 'Adventure', 'Horror', 'Fantasy']",17.3k follower,267 review,205,102 (<1%),295 (2%),"1,623 (15%)","3,587 (33%)","5,103 (47%)"
The Mandarins,Simone de Beauvoir,4.18,"5,684 rating","October 21, 1954","In her most famous novel, Simone de Beauvoir does not flinch in her look at Parisian intellectual society at the end of the Second World War. Drawing on those who surrounded her—Jean-Paul Sartre, Albert Camus, Arthur Koestler—and her passionate love affair with Nelson Algren, Beauvoir dissects the emotional and philosophical currents of her time. At once an engrossing drama and an intriguing political tale, The Mandarins is the emotional odyssey of a woman torn between her inner desire and her public life. The Mandarins won France's highest literary prize, the Prix Goncourt.",752,"['Fiction', 'Classics', 'Philosophy', 'France', 'Feminism', 'French Literature', 'Novels', 'Fiction', 'Classics', 'Philosophy', 'France', 'Feminism', 'French Literature', 'Novels', 'Fiction', 'Classics', 'Philosophy', 'France', 'Feminism', 'French Literature', 'Novels']","9,113 follower",463 review,307,77 (1%),203 (3%),871 (15%),"1,994 (35%)","2,539 (44%)"
Selected Poems,Galway Kinnell,4.21,435 rating,"January 1, 1980",Winner of the Pulitzer Prize and the National Book Award,148,"['Poetry', 'Classics', 'The United States Of America', 'Literary Fiction']",179 follower,26 review,120,2 (<1%),13 (2%),68 (15%),160 (36%),192 (44%)
On the Edge of Reason,Miroslav Krleža,4.26,"1,477 rating","January 1, 1938","During his long and distinguished career, the Croatian writer Miroslav Krleza (1893-1981) battled against many forms of tyranny. In On the Edge of Reason, his protagonist is a middle-aged lawyer whose life and career have been eminently respectable and respected. One evening, at a party attended by the local elite, he inadvertently blurts out an honest thought. From this moment, all hell breaks loose.... On the Edge of Reason reveals the fundamental chasm between conformity and individuality. As folly piles on folly, hypocrisy on hypocrisy, reason itself begins to give way, and the edge between reality and unreality disappears.--back cover",192,"['Fiction', 'Classics', 'Literature', '20th Century', 'Philosophy', 'Literary Fiction', 'Politics', 'Fiction', 'Classics', 'Literature', '20th Century', 'Philosophy', 'Literary Fiction', 'Politics', 'Fiction', 'Classics', 'Literature', '20th Century', 'Philosophy', 'Literary Fiction', 'Politics', 'Fiction', 'Classics', 'Literature', '20th Century', 'Philosophy', 'Literary Fiction', 'Politics', 'Fiction', 'Classics', 'Literature', '20th Century', 'Philosophy', 'Literary Fiction', 'Politics']",195 follower,112 review,220,8 (<1%),49 (3%),211 (14%),494 (33%),715 (48%)
Knights of Dark Renown,David Gemmell,4.10,"4,888 rating","January 1, 1989","Once the legendary knights of the Gabala defended the nine duchies. Their hearts were beautiful; their armor was beyond compare. They were greater than princes, more than men.But they were gone, disappeared through a demon-haunted gateway between worlds. Only one held back -- Manannan, whose every instinct told him to stay. Now he was the coward knight, and in torment.Murder and black magic beset the land. Rumors circulated that the king was enchanted, changed, that his soul was dead . . . and that a reign of terror was about to begin.Now Manannan realized he would have to face his darkest he had no choice but to ride through that dreaded gate and seek out his vanished companions.And the secret he would learn there would tear his soul apart . . . .""A sharp, distinctive medieval fantasy. Dramatic, colorful, taut."" -- Locus",311,"['Fantasy', 'Fiction', 'Epic Fantasy', 'Heroic Fantasy', 'High Fantasy', 'Adventure', 'Vampires']","3,233 follower",202 review,156,29 (<1%),155 (3%),973 (19%),"1,881 (38%)","1,850 (37%)"
The Moons of Jupiter,Alice Munro,3.90,"4,697 rating","January 1, 1983","THE WINNER OF THE NOBEL PRIZE IN LITERATUREThe characters who populate an Alice Munro story live and breathe. Passions hopelessly conceived, affections betrayed, marriages made and broken: the joys, fears, loves and awakenings of women echo throughout these twelve unforgettable stories, laying bare the unexceptional and yet inescapable pain of human contact.",233,"['Short Stories', 'Fiction', 'Canada', 'Contemporary', 'Nobel Prize', 'Literary Fiction', 'Canadian Literature']","5,921 follower",451 review,209,78 (1%),300 (6%),"1,019 (21%)","1,908 (40%)","1,392 (29%)"
"Akira, Vol. 3",Katsuhiro Otomo,4.44,"12,767 rating","January 1, 1984","In the 21st century, the glittering Neo-Tokyo has risen from the rubble of a Tokyo destroyed by an apocalyptic telekinetic blast from a young boy called Akira -- the subject of a covert government experiment gone wrong now imprisoned in frozen stasis. But Tetsuo, an angry young man with immense and rapidly growing psychic abilities, has done the unthinkable: he has released Akira and set into motion a chain of events that could once destroy the city and drag the world to the brink of Armageddon. Resistance agents and an armada of government forces race against the clock to find the child with godlike powers before his unthinkable destructive abilities are unleashed!",284,"['Manga', 'Comics', 'Graphic Novels', 'Science Fiction', 'Fiction', 'Cyberpunk', 'Japan']",778 follower,487 review,402,20 (<1%),128 (1%),"1,267 (9%)","4,105 (32%)","7,247 (56%)"
The Dark Portal,Robin Jarvis,3.82,"2,508 rating","January 1, 1989","In the British tradition of Redwall comes this first novel of a trilogy that is sure to capture fans both young and old. In the sewers of Deptford, there lurks a dark presence that fills the tunnels with fear. The rats worship it in the blackness and name it ""Jupiter, Lord of All."" Into this twilight realm wanders a small and frightened mouse-the unwitting trigger of a chain of events that hurtles the Deptford mice into a world of heroic adventure and terror.",243,"['Fantasy', 'Young Adult', 'Fiction', 'Animals', 'Childrens', 'Horror', 'Middle Grade', 'Fantasy', 'Young Adult', 'Fiction', 'Animals', 'Childrens', 'Horror', 'Middle Grade', 'Fantasy', 'Young Adult', 'Fiction', 'Animals', 'Childrens', 'Horror', 'Middle Grade']",230 follower,138 review,57,77 (3%),173 (6%),616 (24%),906 (36%),736 (29%)
Shadow & Claw,Gene Wolfe,4.03,"19,782 rating","October 15, 1994","The Shadow of the Torturer is the tale of young Severian, an apprentice in the Guild of Torturers on the world called Urth, exiled for committing the ultimate sin of his profession -- showing mercy toward his victim.The Claw of the Conciliator continues the saga of Severian, banished from his home, as he undertakes a mythic quest to discover the awesome power of an ancient relic, and learn the truth about his hidden destiny.The Book of the New Sun is unanimously acclaimed as Gene Wolfe's most remarkable work, hailed as ""a masterpiece of science fantasy comparable in importance to the major works of Tolkien and Lewis"" by Publishers Weekly, and ""one of the most ambitious works of speculative fiction in the twentieth century"" by The Magazine of Fantasy and Science Fiction. Shadow & Claw brings together the first two books of the tetralogy in one volume.",413,"['Fantasy', 'Science Fiction', 'Fiction', 'Science Fiction Fantasy', 'Speculative Fiction', 'Classics', 'Novels']","3,095 follower","1,453 review",496,578 (2%),"1,417 (7%)","3,319 (16%)","5,933 (29%)","8,535 (43%)"
الرواية المستحيلة - فسيفساء دمشقية,غادة السمان,4.02,786 rating,"March 1, 1997","نبذة موقع النيل والفرات عن الرواية:من ذاكرة الأيام تنسج غادة السمان روايتها الآتية من بيوتات الشام. ممزوجة بعبقها الياسميني، بأحداثها أحياناً، وبعراقتها وحضارتها الراسخة عبر الزمان، أحياناً أخرى. تحكي قصة صبية… تتابع مراحل حياتها… تعيشها معها في ذكرياتها الوهمية الأولى إلى حين سجلت في دفترها السري أسرار مراهقة تصنع نفسها وعندما أضحت منفية إلى الوطن ورفيق مشوارها البومة الحكيمة التي ما انفكت تغذي خيالها وفكرها لتحلق في النهاية بين البومة والنسر… تنساب الأحداث وفي ثناياها تتغلغل أنفاس دمشقية تعكس من خلالها غادة السمان المجريات التاريخية والاجتماعية لتتوضح في إطار الذات الشامية بكل أبعادها ومعتقداتها وعاداتها الراسخة في ذلك الزمان.It’s in Arabic, lovely details and descriptions, she is good at it.I felt as if I was walking with him in the streets of old Damascus.",502,"['Novels', 'Fiction', 'Novels', 'Fiction', 'Novels', 'Fiction']","7,823 follower",151 review,78,27 (3%),43 (5%),135 (17%),261 (33%),320 (40%)
Beyaz Zambaklar Ülkesinde,Grigory Petrov,4.20,"10,964 rating","May 1, 1923","Rus asıllı bir yazarın, Rusların Fin halkına yaptıkları baskı politikasını yazması, kitabın en orijinal tarafı olsa gerektir. Dünya bir asırdır bu kitabı okuyor... Beyaz Zambaklar Ülkesinde; hem Finlerin, hem Bulgarların, hem de Türk milletinin ulusal bilinç elde etmesinde rol oynar. Bulgar yazar G. Baltaciev; Beyaz Zambaklar Ülkesinde hakkında, Naradna Tzelina dergisinde şunları yazmıştı İnanıyorum ki, biz Bulgarlar bir ulus olarak topyekun olduysak, bunu Grigory Petrov’un kütüphanelerimizdeki eserlerine borçlu olduğumuzu iftiharla söyleyebiliriz. İnanıyorum ki, çok yakında Beyaz Zambaklar Ülkesinde adlı kitabın, herhangi bir okul veya millet kütüphanesinde bulunmayışını suç olarak kabul edeceğiz. Millet adına yazılmış böyle bir kitap, enderdir. Bu kitap, herkes için değerli ve yararlıdır. Kitabı okuduğunuzda yazarın sizi nasıl sürüklediğini, kanatlandırdığını hissedeceksiniz. (...) Beyaz Zambaklar Ülkesinde, Türkçeye çevrildiğinde Türk basını tarafından ilgiyle karşılanır ve kitaptan övgüyle bahseder. Milli Talim ve Terbiye Kurulu Başkanı Mehmet Emin Bey’in Hayat mecmuasının 74. sayısında kitaptan övgüyle bahsettiği yazısı şö Elimde olsa; HaydarpaşaAnkara arasında seyahat eden her bir yolcunun eline bu kitabı tutuşturur, kitabı okuturken bir yandan da çevrede bulunan toprak yığını köylere baktırırdım. Öğretmen olsaydım; çocuklara bulunduğum şehrin kenar semtlerini gezdirirken, evlerde konuşulanları tekrarlatırken, (yemeiçme, giyimkuşam) tarzlarını gösterirken, Grigory Petrov’un kitabından sayfalar okurdum. Komutan olsaydım; askerlerimin toplandıkları koğuşlara bu kitabın bazı sayfalarını kopya eder ve asardım. (...) Kitap, Müdafaai Milliye Vekâleti (Milli Savunma Bakanlığı) tarafından askerlere tavsiye edilir. Yine Maarif Vekâleti (Milli Eğitim Bakanlığı) tarafından da öğretmen okullarının son dönem mezunlarına birer adet hediye edilir. Kitap, Bulgarcadan Türkçeye 1928’de çevrildi. M. Kemal’in bu kitapla n",175,"['History', 'Classics', 'Nonfiction', 'Roman', 'Politics', 'Russian Literature', 'Literature']",51 follower,689 review,7,112 (1%),405 (3%),"1,703 (15%)","3,663 (33%)","5,081 (46%)"
Omon Ra,Victor Pelevin,3.90,"8,704 rating","January 1, 1992","Victor Pelevin's novel Omon Ra has been widely praised for its poetry and its wickedness, a novel in line with the great works of Gogol and Bulgakov. Omon is chosen to be trained in the Soviet space program the fulfillment of his lifelong dream. However, he enrolls only to encounter the terrifying absurdity of Soviet protocol and its backward technology: a bicycle-powered moonwalker; the outrageous Colonel Urgachin; and a one-way assignment to the moon.",154,"['Fiction', 'Russia', 'Science Fiction', 'Russian Literature', 'Novels', 'Literature', 'Contemporary', 'Fiction', 'Russia', 'Science Fiction', 'Russian Literature', 'Novels', 'Literature', 'Contemporary', 'Fiction', 'Russia', 'Science Fiction', 'Russian Literature', 'Novels', 'Literature', 'Contemporary']","1,823 follower",499 review,198,146 (1%),514 (5%),"2,080 (23%)","3,275 (37%)","2,689 (30%)"
The Great Chain of Being: A Study of the History of an Idea,Arthur O. Lovejoy,4.07,466 rating,"January 1, 1936","From later antiquity down to the close of the eighteenth century, most philosophers and men of science and, indeed, most educated men, accepted without question a traditional view of the plan and structure of the world.In this volume, which embodies the William James lectures for 1933, Arthur O. Lovejoy points out the three principles - plenitude, continuity, and graduation - which were combined in this conception; analyzes their origins in the philosophies of Plato, Aristotle, and the Neoplatonists; traces the most important of their diverse ramifications in subsequent religious thought, in metaphysics, in ethics and aesthetics, and in astronomical and biological theories; and copiously illustrates the influence of the conception as a whole, and of the ideas out of which it was compounded, upon the imagination and feelings as expressed in literature.",382,"['Philosophy', 'History', 'Nonfiction', 'Religion', 'Science', 'History Of Science', 'Politics']",27 follower,31 review,36,13 (2%),15 (3%),89 (19%),160 (34%),189 (40%)
Wise Child,Monica Furlong,4.20,"9,383 rating","June 25, 1987","In a remote Scottish village, nine-year-old Wise Child is taken in by Juniper, a healer and sorceress. Then Wise Child's mother, Maeve, a black witch, reappears. In choosing between Maeve and Juniper, Wise Child discovers the extent of her supernatural powers--and her true loyalties.",240,"['Fantasy', 'Young Adult', 'Fiction', 'Historical Fiction', 'Childrens', 'Middle Grade', 'Historical']",209 follower,464 review,69,128 (1%),258 (2%),"1,520 (16%)","3,177 (33%)","4,300 (45%)"
How to Become King,Jan Terlouw,4.13,"9,315 rating","January 1, 1971","Seventeen years after the king of Katoren dies, a boy aspires to win the crown and is tested with seven impossible tasks by six Ministers.",128,"['Fantasy', 'Childrens', 'Fiction', 'Young Adult', 'Adventure', 'Classics', 'Dutch Literature']",158 follower,452 review,57,102 (1%),222 (2%),"1,602 (17%)","3,865 (41%)","3,524 (37%)"
Mockingbird Wish Me Luck,Charles Bukowski,4.11,"2,218 rating","January 1, 1972","Mockingbird Wish Me Luck captures glimpses of Charles Bukowski's view on life through his poignant poetry: the pain, the hate, the love, and the beauty. He writes of lechery and pain while finding still being able to find its beauty.",160,"['Poetry', 'Fiction', 'American', 'Classics', '20th Century', 'The United States Of America', 'Literature']",27.7k follower,129 review,855,21 (<1%),64 (2%),408 (18%),885 (39%),840 (37%)
School for Love,Olivia Manning,3.86,604 rating,"January 1, 1951","Jerusalem in 1945 is a city in flux: refugees from the war in Europe fill its streets and cafés, the British colonial mandate is coming to an end, and tensions are rising between the Arab and Jewish populations. Felix Latimer, a recently orphaned teenager, arrives in Jerusalem from Baghdad, biding time until he can secure passage to England. Adrift and deeply lonely, Felix has no choice but to room in a boardinghouse run by Miss Bohun, a relative he has never met. Miss Bohun is a holy terror, a cheerless miser who proclaims the ideals of a fundamentalist group known as the Ever-Readies—joy, charity, and love—even as she makes life a misery for her boarders. Then Mrs. Ellis, a fascinating young widow, moves into the house and disrupts its dreary routine for good.Olivia Manning’s great subject is the lives of ordinary people caught up in history. Here, as in her panoramic depiction of World War II, The Balkan Trilogy, she offers a rich and psychologically nuanced story of life on the precipice, and she tells it with equal parts compassion, skepticism, and humor.",192,"['Fiction', 'Historical Fiction', 'British Literature', '20th Century', 'Literary Fiction', 'Israel', 'Classics', 'Fiction', 'Historical Fiction', 'British Literature', '20th Century', 'Literary Fiction', 'Israel', 'Classics', 'Fiction', 'Historical Fiction', 'British Literature', '20th Century', 'Literary Fiction', 'Israel', 'Classics']",138 follower,100 review,61,8 (1%),17 (2%),170 (28%),266 (44%),143 (23%)
King Arthur and His Knights of the Round Table,Roger Lancelyn Green,3.90,"6,159 rating","January 1, 1953","Retells the stories of Sir Gawain and the Green Knight, the quest for the Holy Grail, and Morgana le Fay",330,"['Classics', 'Fantasy', 'Fiction', 'Arthurian', 'Mythology', 'Historical Fiction', 'Adventure', 'Classics', 'Fantasy', 'Fiction', 'Arthurian', 'Mythology', 'Historical Fiction', 'Adventure', 'Classics', 'Fantasy', 'Fiction', 'Arthurian', 'Mythology', 'Historical Fiction', 'Adventure']",209 follower,477 review,138,96 (1%),351 (5%),"1,566 (25%)","2,194 (35%)","1,952 (31%)"
Stones Under the Scythe,Ольга Мак,4.64,22 rating,"January 1, 1973","Olha Mak, author of several novels for adolescents and young adults, wrote ""Stones Under the Scythe"" to help shatter a conspiracy of silence and deliberate denial about one of the most terrible tragedies to befall any nation, a catastrophe caused by the workings of a group of fanatical ""creators of a new breed of men."" The characters in the novel are composites of individuals and the narrative is based on real events the author witnessed as a university student. The story of 15 yearold Andriy recreates the fate of millions of Ukrainian children who either perished or barely escaped death in the years of a man-made famine, the ""Holodomor,"" that took the life of every fourth Ukrainian. However, Olha Mak's novel is not a somber story of horrible events. Her characters bear witness to the truth that the human spirit cannot be fully subdued. But this is a truth that needs frequent reminders, for everyone at some point comes to feel vanquished by the brutality that confronts them.",184,"['Fiction', 'Fiction', 'Fiction']",5 follower,7 review,16,0 (0%),0 (0%),1 (4%),6 (27%),15 (68%)
Zdarzenia na brygu Banbury,Witold Gombrowicz,3.66,38 rating,"January 1, 1982","Opowiadanie Zdarzenia na brygu Banbury zostało napisane w 1932 r. a opublikowane po raz pierwszy w 1933 r., w zbiorze Pamiętnik z okresu dojrzewania w wydawnictwie Rój w Warszawie. Podobnie jak inne utwory z tego zbioru, opowiadanie to zostało włączone do rozszerzonego tomu opowiadań Bakakaj, który został opublikowany w 1957 roku przez krakowskie Wydawnictwo Literackie. Przygotowując nową wersję zbioru opowiadań, Gombrowicz usunął podtytuł tego opowiadania: „Czyli aura umysłu F. Zantmana”.",113,[],916 follower,3 review,113,0 (0%),2 (5%),18 (47%),9 (23%),9 (23%)
I'll Bring You Buttercups,Elizabeth Elgin,4.24,215 rating,"July 1, 1993","A stunningly repackaged edition of this unforgettably stirring wartime tale of passion, heartbreak and tragedy from the bestselling author of A Scent of Lavender and The Willow Pool. From love springs tragedy, from tragedy comes hope! It is 1931 and Rowangarth, Yorkshire is a rural arcadia for sewing-maid Alice Hawthorn and young gamekeeper Tom Dwerryhouse. For Julia Sutton, daughter of Alice's employer, it is also a time of unfolding love for the handsome doctor, Andrew MacMalcolm. But with the outbreak of war their lives will be changed for ever! As Tom and Andrew volunteer to fight for King and Empire so too do Alice and Julia as VAD nurses on the Western Front. All find trials that will test them -- and their love -- to the limit as passion and hope are tempered by heartbreak and sorrow.","PaperbackFirst published July 1, 1993","['Historical Fiction', 'Fiction', 'Romance']",27 follower,15 review,29,2 (<1%),11 (5%),34 (15%),55 (25%),113 (52%)
Fear and Misery in the Third Reich,Bertolt Brecht,4.06,"1,244 rating","January 1, 1938","Twenty-four interconnected playlets describe events which took place in ordinary German households in the 1930s. They dramatize with clinical precision the suspicion and anxiety experienced by ordinary people, particularly Jewish citizens, as Hitler's powers grew.Written in exile in Denmark and first staged in 1938 it was inspired in part by his recent trip to Moscow where he had been researching tasks for the anti-Nazi effort.This Student Edition features an extensive introduction and commentary and includes: a chronology of the Brecht's life and work; a synopsis of each playlet; an introduction to the context of the play; commentary on themes, characters, style and language; a review of the play in performance; notes on individual words and phrases in the text, and questions for further study.",216,"['Plays', 'Drama', 'Fiction', 'German Literature', 'Classics', 'Theatre', 'Germany', 'Plays', 'Drama', 'Fiction', 'German Literature', 'Classics', 'Theatre', 'Germany', 'Plays', 'Drama', 'Fiction', 'German Literature', 'Classics', 'Theatre', 'Germany', 'Plays', 'Drama', 'Fiction', 'German Literature', 'Classics', 'Theatre', 'Germany', 'Plays', 'Drama', 'Fiction', 'German Literature', 'Classics', 'Theatre', 'Germany']","1,722 follower",92 review,"1,410",12 (<1%),57 (4%),235 (18%),478 (38%),462 (37%)
The Witch in the Cherry Tree,Margaret Mahy,4.25,133 rating,"January 1, 1974","The lovely smell of baking cakes being made by David and his mother, lures a witch to their garden. David takes pity on her and gives her his cakes which are exactly the way she likes them - burnt! And there is a recipe on the last page too.",32,"['Picture Books', 'Childrens', 'Witches', 'Fiction', 'Halloween', 'Picture Books', 'Childrens', 'Witches', 'Fiction', 'Halloween', 'Picture Books', 'Childrens', 'Witches', 'Fiction', 'Halloween']",266 follower,19 review,392,0 (0%),4 (3%),19 (14%),50 (37%),60 (45%)
Whirlwind,James Clavell,3.86,"7,754 rating","January 1, 1986","Presents the story of three weeks in Tehran in February 1979: three weeks of fanaticism, passion, self-sacrifice and heartbreak. Caught between the revolutionaries and the forces of international intrigue is a team of professional pilots. They are ordered to flee to safety with their helicopters.",1252,"['Historical Fiction', 'Fiction', 'Historical', 'Adventure', 'Thriller', 'Asia', 'Novels']","2,853 follower",287 review,173,161 (2%),534 (6%),"1,965 (25%)","2,701 (34%)","2,393 (30%)"
