title,authors,average_rating,rating,date_of_publication,descriptions,total_pages,genres,author_followers,no_of_reviews,no_of_books_by_author,one_star_ratings,two_star_ratings,three_star_ratings,four_star_ratings,five_star_ratings
The Winter Beach,Kate Wilhelm,4.05,21 rating,"January 1, 1981","Kate Wilhelm explores concepts ranging from truth to immortality in this novella. A young woman is duped into quitting her university teaching position, and finds that she is entwined in a cloak-and-daggar investigation with implications she can hardly fathom. Action packed science fiction from master story teller Kate Wilhelm.",82,[],418 follower,4 review,253,1 (4%),1 (4%),4 (19%),5 (23%),10 (47%)
The Pirate Prince,Gaelen Foley,3.83,"2,837 rating","July 29, 1998","When Allegra Monteverdi, the daughter of Lazar's sworn enemy, throws herself on his mercy, the pirate prince Lazar di Fiori agrees to spare the lives of her family but only if she sails away with him. Alone at sea with this dark, intriguing man, moving between seduction and fear, Allegra realizes it will take more than her growing love for this pirate prince to bring peace to her beloved home. For Lazar must face the demons of his shattered past - if he is to forge the destiny that is theirs to claim...",407,"['Historical Romance', 'Romance', 'Historical', 'Pirates', 'Historical Fiction', 'Regency', 'Adult']","1,837 follower",206 review,55,87 (3%),214 (7%),698 (24%),923 (32%),915 (32%)
The Golden Barbarian,Iris Johansen,3.93,"1,995 rating","January 1, 1991","From the halls of a palatial prison to the hot sands of an endless desert...Here is a timeless story of love and adventure set among hills of gold, warring tribes, and fabled kingdoms—the story of a fearless princess and a barbarian sheikh....She was a ravishing pawn in a game of politics and passion...Flaunting the oppressive destiny decreed for her by the kingdom of Tamrovia, Princess Theresa Christina Rubinoff struck a sensual bargain with a handsome barbarian chieftain. She vowed to play his seductive game, surrendering herself to his will, all the while determined to fight for her independence in a land that considered women only as playthings.Mysterious as the desert night, rich as Midas, Galen ben Rashid swept Tess away to his palace in exotic Sedikhan, offering her freedom in exchange for the marriage that would join their kingdoms. A man surrounded by enemies, he would make her a slave to his passion in order to bind her to his side, little knowing that when he took the captivating princess as his bride, he would lose his heart.",352,"['Romance', 'Historical Romance', 'Historical', 'Historical Fiction', 'Medieval', 'Fiction', 'Mystery Thriller']","6,876 follower",75 review,294,25 (1%),108 (5%),508 (25%),703 (35%),651 (32%)
Butterfly,V.C. Andrews,3.71,"5,868 rating","January 1, 1998","All she wanted was to be someone's little girl... Fate made her a lonely orphan, yearning for the embrace of a real family and a loving home. But a golden chance at a new life may not be enough to escape the dark secrets of her past...",170,"['Fiction', 'Young Adult', 'Horror', 'Romance', 'Thriller', 'Gothic', 'Adult Fiction']","8,072 follower",140 review,325,150 (2%),631 (10%),"1,739 (29%)","1,571 (26%)","1,777 (30%)"
When Genius Failed: The Rise and Fall of Long-Term Capital Management,Roger Lowenstein,4.20,"28,892 rating","January 1, 2000","“A riveting account that reaches beyond the market landscape to say something universal about risk and triumph, about hubris and failure.”— The New York TimesNAMED ONE OF THE BEST BOOKS OF THE YEAR BY BUSINESSWEEKIn this business classic—now with a new Afterword in which the author draws parallels to the recent financial crisis—Roger Lowenstein captures the gripping roller-coaster ride of Long-Term Capital Management. Drawing on confidential internal memos and interviews with dozens of key players, Lowenstein explains not just how the fund made and lost its money but also how the personalities of Long-Term’s partners, the arrogance of their mathematical certainties, and the culture of Wall Street itself contributed to both their rise and their fall.When it was founded in 1993, Long-Term was hailed as the most impressive hedge fund in history. But after four years in which the firm dazzled Wall Street as a $100 billion moneymaking juggernaut, it suddenly suffered catastrophic losses that jeopardized not only the biggest banks on Wall Street but the stability of the financial system itself. The dramatic story of Long-Term’s fall is now a chilling harbinger of the crisis that would strike all of Wall Street, from Lehman Brothers to AIG, a decade later. In his new Afterword, Lowenstein shows that LTCM’s implosion should be seen not as a one-off drama but as a template for market meltdowns in an age of instability—and as a wake-up call that Wall Street and government alike tragically ignored.Praise for When Genius Failed“[Roger] Lowenstein has written a squalid and fascinating tale of world-class greed and, above all, hubris.” —BusinessWeek“Compelling . . . The fund was long cloaked in secrecy, making the story of its rise . . . and its ultimate destruction that much more fascinating.” — The Washington Post“Story-telling journalism at its best.” — The Economist",264,"['Finance', 'Business', 'Nonfiction', 'Economics', 'History', 'Money', 'Biography']",436 follower,921 review,23,336 (1%),707 (2%),"4,149 (14%)","11,382 (39%)","12,318 (42%)"
A Hora dos Ruminantes,José J. Veiga,4.05,346 rating,"January 1, 1966","Manirema bij het vallen van de avond – voorboden, voortekens, geluiden. Aangedragen door de wind, die rond de straathoeken speelt, het onvermijdelijke hondengeblaf en gehuil van baby’s met oorpijn of angst voor het donker. Druk confererende kikkers, ijzer slijpende krekels, vleermuizen die met grote steken zwarte lappen naaien en die over het kerkplein uitstrekken voor een somber feest. Manirema wacht de nacht.Vreemde mannen slaan een kamp op bij het gezapige stadje in het Braziliaanse binnenland. Wie zijn ze en wat komen ze doen? Waarom sturen ze een meute honden op het stadje af? En waar komen de ossen vandaan die als een Bijbelse plaag Manirema bezetten?In 1964 pleegt het Braziliaanse leger een staatsgreep en vestigt een nationalistische dictatuur. Er daalt een duistere nacht van vrijheidsberoving, censuur en geweld neer over het land die twintig jaar zal aanhouden. De drie plagen van Manirema is in 1966 het allegorische antwoord van José J. Veiga op die nacht. Het boek heeft de huiveringwekkende kracht van het werk van Franz Kafka en José Saramago.",106,"['Fiction', 'Literature', 'Brazil', '20th Century']",26 follower,43 review,34,2 (<1%),13 (3%),62 (17%),156 (45%),113 (32%)
Politically Correct Death: Answering the Arguments for Abortion Rights,Francis J. Beckwith,4.39,31 rating,"April 1, 1993",Thorough explanation of sixty-nine ethical and philosophical arguments sometimes given to defend a proDchoice position and persuasive proDlife responses to each.,256,"['Philosophy', 'Christian']",27 follower,6 review,39,1 (3%),0 (0%),2 (6%),11 (35%),17 (54%)
"Buddhism Plain and Simple: The Practice of Being Aware, Right Now, Every Day",Steve Hagen,4.04,"9,323 rating","October 1, 1997","“This is the clearest and most precise exposition of Buddhism I have ever read. If you’re looking for enlightenment rather than just scholarly knowledge, you’d better read this.”—Robert M. Pirsig, author of  Zen and the Art of Motorcycle MaintenanceThis is a book about awareness. It’s about being “awake” and in touch with what is going on here and now. Practical and down-to-earth, it deals exclusively with the present, not with speculation, theory, or belief in some far off time and place. The teachings of the Buddha are plain and straightforward, and because they remain focused on the moment, they are just as relevant now as they have ever been. Buddhism Plain and  The Practice of Being Aware, Right Now, Every Day is the book for anyone wanting to discover, or rediscover, the essence of Buddhism.",165,"['Buddhism', 'Nonfiction', 'Philosophy', 'Religion', 'Spirituality', 'Self Help', 'Zen']",94 follower,602 review,17,165 (1%),448 (4%),"1,800 (19%)","3,374 (36%)","3,536 (37%)"
Love Finds A Home,Janette Oke,4.23,"9,138 rating","January 1, 1989","Leaving her little prairie town, Belinda Davis never dreamed that the excitement of living in Boston would leave her restless and empty inside. Wealth, literature, travel, and romance touched her life with choices and decisions that brought dissatisfaction rather than joy. She discovered that only when God had first place in her life was her peace restored. Belinda once again faces decisions about her life that are no less difficult than before. A very unexpected responsibility makes the choice even harder.",219,"['Christian Fiction', 'Historical Fiction', 'Christian', 'Fiction', 'Romance', 'Historical', 'Christian Romance']","3,023 follower",197 review,296,112 (1%),303 (3%),"1,465 (16%)","2,709 (29%)","4,549 (49%)"
"Exclusion and Embrace: A Theological Exploration of Identity, Otherness, and Reconciliation",Miroslav Volf,4.30,"2,403 rating","January 1, 1996","Life at the end of the twentieth century presents us with a disturbing reality. Otherness, the simple fact of being different in some way, has come to be defined as in and of itself evil. Miroslav Volf contends that if the healing word of the gospel is to be heard today, Christian theology must find ways of speaking that address the hatred of the other. Reaching back to the New Testament metaphor of salvation as reconciliation, Volf proposes the idea of embrace as a theological response to the problem of exclusion.Increasingly we see that exclusion has become the primary sin, skewing our perceptions of reality and causing us to react out of fear and anger to all those who are not within our (ever-narrowing) circle. In light of this, Christians must learn that salvation comes, not only as we are reconciled to God, and not only as we ""learn to live with one another,"" but as we take the dangerous and costly step of opening ourselves to the other, of enfolding him or her in the same embrace with which we have been enfolded by God.Is there any hope of embracing our enemies? Of opening the door to reconciliation? Miroslav Volf, a Yale University theologian, has won the 2002 Louisville Grawemeyer Award in Religion for his book, Exclusion & Embrace: A Theological Exploration of Identity, Otherness, and Reconciliation (Abingdon, 1996). Volf argues that exclusion of people who are alien or different is among the most intractable problems in the world today. He writes, It may not be too much to claim that the future of our world will depend on how we deal with identity and difference. The issue is urgent. The ghettos and battlefields throughout the world in the living rooms, in inner cities, or on the mountain ranges testify indisputably to its importance. A Croatian by birth, Volf takes as a starting point for his analysis the recent civil war and ethnic cleansing in the former Yugoslavia, but he readily finds other examples of cultural, ethnic, and racial conflict to illustrate his points. And, since September 11, one can scarcely help but plug the new world players into his incisive descriptions of the dynamics of interethnic and international strife.Exclusion happens, Volf argues, wherever impenetrable barriers are set up that prevent a creative encounter with the other. It is easy to assume that exclusion is the problem or practice of barbarians who live over there, but Volf persuades us that exclusion is all too often our practice here as well. Modern western societies, including American society, typically recite their histories as narratives of inclusion, and Volf celebrates the truth in these narratives. But he points out that these narratives conveniently omit certain groups who disturb the integrity of their happy ending plots. Therefore such narratives of inclusion invite long and gruesome counter-narratives of exclusion the brutal histories of slavery and of the decimation of Native American populations come readily to mind, but more current examples could also be found.Most proposed solutions to the problem of exclusion have focused on social arrangements what kind of society ought we to create in order to accommodate individual or communal difference? Volf focuses, rather, on what kind of selves we need to be in order to live in harmony with others. In addressing the topic, Volf stresses the social implications of divine self-giving. The Christian scriptures attest that God does not abandon the godless to their evil, but gives of Godself to bring them into communion. We are called to do likewise whoever our enemies and whoever we may be. The divine mandate to embrace as God has embraced is summarized in Paul’s injunction to the Romans: Welcome one another, therefore, just as Christ has welcomed you (Romans 15:7).Susan R. Garrett, Coordinator of the Religion Award, said that the Grawemeyer selection committee praised Volf s book on many counts. These included its profound interpretation of certain pivotal passages of Scripture and its brilliant engagement with contemporary theology, philosophy, critical theory, and feminist theory. Volf s focus is not on social strategies or programs but, rather, on showing us new ways to understand ourselves and our relation to our enemies. He helps us to imagine new possibilities for living against violence, injustice, and deception. Garrett added that, although addressed primarily to Christians, Volf's theological statement opens itself to religious pluralism by upholding the importance of different religious and cultural traditions for the formation of personal and group identity. The call to embrace the other is never a call to remake the other into one s own image. Volf who had just delivered a lecture on the topic of Exclusion and Embrace at a prayer breakfast for the United Nations when the first hijacked plane hit the World Trade Center will present a lecture and receive his award in Louisville during the first week of April, 2002.The annual Religion Award, which includes a cash prize of $200,000, is given jointly by Louisville Presbyterian Theological Seminary and the University of Louisville to the authors or originators of creative works that contribute significantly to an understanding of the relationship between human beings and the divine, and ways in which this relationship may inspire or empower human beings to attain wholeness, integrity, or meaning, either individually or in community. The Grawemeyer awards given also by the University of Louisville in the fields of musical composition, education, psychology, and world order honor the virtue of accessibility: works chosen for the awards must be comprehensible to thinking persons who are not specialists in the various fields.""",306,"['Theology', 'Religion', 'Nonfiction', 'Christianity', 'Christian', 'Faith', 'Philosophy']",293 follower,190 review,63,36 (1%),73 (3%),281 (11%),755 (31%),"1,258 (52%)"
الحمامة,Patrick Süskind,3.71,"19,039 rating","January 1, 1987","عبر صفحات هذة ""الرواية -الحكاية"" يلج بنا زوكسيند صاحب رواية ""العطر"" الشهيرة في العوالم النفسية المتناقضة لإحدى أشهر شخصياته، وبأكثر تفاصيلها دقة، جواثان نويل. وللوهلة الأولى قد يعتقد القارئ أن هذه الشخصية متفردة وغير موجودة إلا عبر صفحات الورق. لن ما أن يتأمل واحدنا قليلاً وينقب في أعماقه حتى يجد أن ""جوناثان نويل"" موجود في دواخلنا المقموعة بشكل ما، والحمامة ليست إلا تجل من تجليات القمع والاضطهاد اليومي الذي نتعرض له من الرتابة التي تفرضها حيانا المعاصرة وتناقضاتها المرعبة.",80,"['Fiction', 'Classics', 'German Literature', 'Novels', 'Short Stories', 'Literature', 'Germany', 'Fiction', 'Classics', 'German Literature', 'Novels', 'Short Stories', 'Literature', 'Germany', 'Fiction', 'Classics', 'German Literature', 'Novels', 'Short Stories', 'Literature', 'Germany', 'Fiction', 'Classics', 'German Literature', 'Novels', 'Short Stories', 'Literature', 'Germany', 'Fiction', 'Classics', 'German Literature', 'Novels', 'Short Stories', 'Literature', 'Germany']","3,578 follower","2,168 review",39,423 (2%),"1,497 (7%)","5,584 (29%)","7,211 (37%)","4,324 (22%)"
Kurt Cobain,Christopher Sandford,3.51,"1,315 rating","January 1, 1995","Here is the first biography to explore, with shocking detail, the drama that formed this troubled, tragic rock star. Neither an apology nor a condemnation, Kurt Cobain presents a vivid insider's view of the life and death of a man who galvanized a generation and gave birth to the ""grunge"" revolution with his band Nirvana. Sandford portrays the provocative, small-town rebel with the talent of John Lennon, and then shows him at work on concert stages in Seattle, New York, and London. Readers follow the struggles of Cobain's emotional life—his tumultuous relationships with family and his fellow band members, his drug addiction and sexual appetite, his stormy marriage to Courtney Love, and the birth of his daughter, who, as Cobain wrote in his suicide note, ""reminds me too much of who I used to be."" During his research, Sandford has had access to Cobain's family, his colleagues, his former friends and lovers, and even author William S. Burroughs, whom Cobain considered to be his ""greatest influence."" The result is a graphic account of the life that led to the day in April 1994 when Cobain turned a shotgun on himself and became a martyr to disaffected youth around the world.",408,"['Music', 'Nonfiction', 'Biography', 'Biography Memoir', 'Mental Illness', 'Rock N Roll', 'Autobiography']",27 follower,67 review,69,76 (5%),160 (12%),412 (31%),355 (26%),312 (23%)
Norwood,Charles Portis,3.86,"3,914 rating","January 1, 1966","Ex-Marine Norwood Pratt of Ralph, Texas, accepts an offer to deliver a car to New York and takes the Trailways bus back to Texas. The story is told in the language of the rural South, in conversation that sounds like Country Western music.",190,"['Fiction', 'Humor', 'Literature', 'Novels', 'Southern', 'Classics', 'American']",651 follower,554 review,14,34 (<1%),212 (5%),"1,032 (26%)","1,636 (41%)","1,000 (25%)"
Ghost World,Daniel Clowes,3.82,"75,530 rating","March 1, 1998","Ghost World is the story of Enid and Rebecca, teenage friends facing the unwelcome prospect of adulthood, and the uncertain future of their complicated relationship. Clowes conjures a balanced semblance, both tender and objective, of their fragile existence, capturing the mundane thrills and hourly tragedies of a waning adolescence, as he follows a tenuous narrative thread through the fragmented lives of these two fully realized young women.Originally serialized in the pages of the seminal comic book Eightball throughout the mid-1990s, this is a quasi-autobiographical story (the name of one of the protagonists is famously an anagram of the author's name) about two best friends facing the prospect of growing up, and more importantly, apart.",80,"['Graphic Novels', 'Comics', 'Fiction', 'Graphic Novels Comics', 'Young Adult', 'Coming Of Age', 'Comic Book']","1,769 follower","3,028 review",104,"3,168 (4%)","5,913 (7%)","16,750 (22%)","24,987 (33%)","24,712 (32%)"
"Prisoner's Dilemma: John von Neumann, Game Theory, and the Puzzle of the Bomb",William Poundstone,3.92,"1,932 rating","January 1, 1992","A masterful work of science writing that’s ""both a fascinating biography of von Neumann, the Hungarian exile whose mathematical theories were building blocks for the A-bomb and the digital computer, and a brilliant social history of game theory and its role in the Cold War and nuclear arms race"" ( San Francisco Chronicle ). Should you watch public television without pledging?...Exceed the posted speed limit?...Hop a subway turnstile without paying? These questions illustrate the so-called ""prisoner's dilemma"", a social puzzle that we all face every day. Though the answers may seem simple, their profound implications make the prisoner's dilemma one of the great unifying concepts of science. Watching players bluff in a poker game inspired John von Neumann—father of the modern computer and one of the sharpest minds of the century—to construct game theory, a mathematical study of conflict and deception. Game theory was readily embraced at the RAND Corporation, the archetypical think tank charged with formulating military strategy for the atomic age, and in 1950 two RAND scientists made a momentous discovery.Called the ""prisoner's dilemma,"" it is a disturbing and mind-bending game where two or more people may betray the common good for individual gain. Introduced shortly after the Soviet Union acquired the atomic bomb, the prisoner's dilemma quickly became a popular allegory of the nuclear arms race. Intellectuals such as von Neumann and Bertrand Russell joined military and political leaders in rallying to the ""preventive war"" movement, which advocated a nuclear first strike against the Soviet Union. Though the Truman administration rejected preventive war the United States entered into an arms race with the Soviets and game theory developed into a controversial tool of public policy—alternately accused of justifying arms races and touted as the only hope of preventing them.Prisoner's Dilemma is the incisive story of a revolutionary idea that has been hailed as a landmark of twentieth-century thought.",294,"['Nonfiction', 'Science', 'History', 'Economics', 'Mathematics', 'Biography', 'Psychology']",330 follower,150 review,50,14 (<1%),92 (4%),453 (23%),851 (44%),522 (27%)
Double Lives: Spies and Writers in the Secret Soviet War of Ideas Against the West,Stephen Koch,4.27,56 rating,"December 27, 1993",Chronicles the secret propaganda campaign of the former Soviet Union to globalize communism and describes how a German communist successfully recruited notable writers and artists to participate in this propaganda network.,419,"['History', 'Russia', 'Espionage']",77 follower,6 review,33,0 (0%),1 (1%),9 (16%),20 (35%),26 (46%)
Control Systems,A. Nagoor Kani,3.85,608 rating,"January 1, 1998",ASIN assigned: B0018NKLGQOCLC Number:	174944394,606,"['Engineering', 'Education']",72 follower,46 review,12,53 (8%),48 (7%),83 (13%),176 (28%),248 (40%)
A Feather on the Breath of God,Sigrid Nunez,3.98,"1,575 rating","January 1, 1995","From Sigrid Nunez, the National Book Award-winning author of The Friend, comes A Feather on the Breath of God : a mesmerizing story about the tangled nature of relationships between parents and children, between language and loveA young woman looks back to the world of her immigrant a Chinese-Panamanian father and a German mother. Growing up in a housing project in the 1950s and 1960s, she escapes into dreams inspired both by her parents' stories and by her own reading and, for a time, into the otherworldly life of ballet. A yearning, homesick mother, a silent and withdrawn father, the ballet--these are the elements that shape the young woman's imagination and her sexuality.",192,"['Fiction', 'Historical Fiction', 'Novels', 'Literary Fiction', 'Contemporary', 'Race', '20th Century']","1,290 follower",224 review,24,12 (<1%),66 (4%),348 (22%),662 (42%),487 (30%)
Penguin Lost,Andrey Kurkov,3.83,"2,202 rating","January 1, 1996","Viktor – last seen in Death and the Penguin fleeing Mafia vengeance on an Antarctica-bound flight booked for Penguin Misha – seizes a heaven-sent opportunity to return to Kiev with a new identity. Clear now as to the enormity of abandoning Misha, then convalescent from a heart-transplant, Viktor determines to make amends. Viktor falls in with a Mafia boss who engages him to help in his election campaign, then introduces him to men who might further his search for Misha, said to be in a private zoo in Chechnya.What ensues is for Viktor both a quest and an odyssey of atonement, and, for the reader, an experience as rich, topical and illuminating as Death and the Penguin.",256,"['Fiction', 'Ukraine', 'Russia', 'Mystery', 'Literature', 'Humor', 'Novels']",655 follower,202 review,55,20 (<1%),109 (4%),620 (28%),936 (42%),517 (23%)
