title,authors,average_rating,rating,date_of_publication,descriptions,total_pages,no_of_books_by_author,author_followers,genres,no_of_reviews,five_star_ratings,four_star_ratings,three_star_ratings,two_star_ratings,one_star_ratings
The Invention of Curried Sausage,Uwe Timm,3.47,"3,401 rating","January 1, 1993","The Invention of Curried Sausage is an ingenious, revealing, and delightful novel about the invention of a popular German sidewalk food. Uwe Timm has heard claims that currywurst first appeared in Berlin in the 1950s, but he seems to recall having eaten it much earlier, as a boy in his native Hamburg, at a stand owned and operated by Lena Brücker. He decides to check it out. Although the discovery of curried sausage is eventually explained, it is its prehistory - about how Lena Brücker met, seduced and held captive a German deserter in Hamburg, in April, 1945, just before the war's end - that is the tastiest part. Timm draws gorgeous details from Lena's fine-grained recollections, and the pleasure these provide her and the reader supply the tale's real charm.",218,76,102 follower,"['Fiction', 'German Literature', 'Germany', 'Historical Fiction', 'School', 'Contemporary', 'Classics', 'Fiction', 'German Literature', 'Germany', 'Historical Fiction', 'School', 'Contemporary', 'Classics', 'Fiction', 'German Literature', 'Germany', 'Historical Fiction', 'School', 'Contemporary', 'Classics']",307 review,556 (16%),"1,225 (36%)","1,040 (30%)",413 (12%),167 (4%)
The Fat Man in History,Peter Carey,3.86,"1,078 rating","January 1, 1974","If, in some post-Marxist utopia, obesity were declared counterrevolutionary, how would a houseful of fat men strike back?  If it were possible to win a new body by lottery, what kind of people would choose ugliness? If two gun-toting thugs decided to take over a business—and run it through sheer terror—how far would their methods take them? These are the questions that Peter Carey, author of The Tax Inspector and Oscar and Lucinda, brilliantly explores in this collection of stories. Exquisitely written and thoroughly envisioned, the tales in The Fat Man in History reach beyond their arresting premises to utter deep and often frightening truths about our brightest and darkest selves.",192,97,989 follower,"['Short Stories', 'Fiction', 'Australia', 'Fantasy', 'Novels', 'Anthologies', 'Science Fiction']",84 review,316 (29%),408 (37%),270 (25%),59 (5%),25 (2%)
El cuaderno gris: Un dietario,Josep Pla,4.19,634 rating,"January 1, 1965","Al abrir «El cuaderno gris»> es mucho lo que puede asombrar al lector: una conversación cazada al vuelo en un café; una sentencia (casi un aforismo) oída o pronunciada como por casualidad, capaz de condensar el sentimiento de toda una época; la sucinta y emotiva descripción de un paisaje; descarnados apuntes de crítica literaria; un afilado juicio político, hilvanado en medio de consideraciones sobre el tiempo, la higiene, la salud, las mujeres o la gastronomía. Todo esto y mucho más contiene el dietario que Josep Pla (nace en Palafrugell, 1897, muere en Llofriu, 1981) escribió entre marzo de 1918 y noviembre de 1919, siendo un joven estudiante de Derecho al que el cierre de la universidad, a causa de la Gran Guerra, obliga a interrumpir sus estudios en Barcelona y regresar a su pueblo natal, donde se entretiene, con constancia de grafómano, en escribir sus impresiones sobre el día a día en un cuaderno gris. Observador minucioso, Pla proyectará a posteriori sobre sus apuntes de juventud, laboriosamente reelaborados, toda una vida de corresponsal El cuaderno gris acaba justo antes de que el joven Pla parta hacia París, el primero de sus destinos en el extranjero, ya sea en Francia tras el fin de la guerra, en Roma durante el despunte del fascismo o en el Madrid de la Segunda República. Tras un período retirado de la vida pública, en los años cincuenta retoma los viajes por el mundo a instancias de Josep Vergés, histórico editor de Pla en Destino, quien también le convencerá para editar su obra completa, 46 volúmenes que se abrirán en 1966 precisamente con este libro. Traducido años después al castellano por Dionisio Ridruejo y su mujer, Gloria de Ros, «El cuaderno gris» llega hoy hasta nosotros revisado por Narcís Garolera, catedrático de Filología Catalana de la Universitat Pompeu Fabra, y vuelve, así, a lucir como lo concibió Pla: un libro de vida que es también valioso testimonio de una época y el mejor exponente de la obra de uno de los más grandes de la literatura catalana.",848,209,91 follower,"['Nonfiction', 'Spain', 'Memoir', 'History', 'Biography', 'Spanish Literature', 'Literature']",67 review,285 (44%),221 (34%),100 (15%),19 (2%),9 (1%)
Mistress,Amanda Quick,3.96,"9,392 rating","June 1, 1994","After a year of grand adventures touring the classical ruins of Italy and Greece, Iphiginia Bright returned to England to discover that the real excitement was at home. It seems that her Aunt Zoe has fallen victim to a sinister blackmailer and only Iphiginia can hope to stop the culprit before he can do more harm. Her plan is Imitating history's most legendary beauties--Cleopatra, Helen of Troy, Aphrodite--the former schoolmistress will remake herself, and descend upon London Society as the dazzling mistress of Marcus Valerius Cloud, the infamous Earl of Masters. Rumors hint that the Earl has disappeared at the blackmailer's hands, and by posing as his unknown mistress, Iphiginia is convinced she can ferret out the villain. Overnight, Iphiginia is transformed into a vision with a host of eager admirers, including one she does not expect -- the Earl of Masters himself, who strides into a shimmering ballroom one evening to cooly reclaim his ""mistress"". He is everything they say he is... arrogant, attractive, devastatingly seductive, and Iphiginia can't help but be enthralled. But when Marcus agrees to play along with her charade, she doesn't know that the determined earl has plans of his to tease and tempt her, until the beautiful deceiver becomes more than his mistress in name only.",384,117,"5,205 follower","['Romance', 'Historical Romance', 'Historical', 'Regency', 'Historical Fiction', 'Mystery', 'Fiction', 'Romance', 'Historical Romance', 'Historical', 'Regency', 'Historical Fiction', 'Mystery', 'Fiction', 'Romance', 'Historical Romance', 'Historical', 'Regency', 'Historical Fiction', 'Mystery', 'Fiction']",441 review,"3,062 (32%)","3,555 (37%)","2,247 (23%)",434 (4%),94 (1%)
O Menino Maluquinho,Ziraldo,4.25,"2,426 rating","January 1, 1980","Na grande obra infantil de Ziraldo, verso e desenho contam a história de um menino traquinas que aprontava muita confusão. Alegria da casa, liderava a garotada, era sabido e um amigão. Fazia versinhos, canções, inventava brincadeiras. Tirava dez em todas as matérias, mas era zero em comportamento. Menino maluquinho, diziam. Mas na verdade ele era um menino feliz.",107,268,70 follower,"['Childrens', 'Fiction', 'Brazil', 'Portuguese Literature', 'Comics', 'Classics', 'Literature']",56 review,"1,201 (49%)",735 (30%),397 (16%),76 (3%),17 (<1%)
The Rape of Europa: The Fate of Europe's Treasures in the Third Reich and the Second World War,Lynn H. Nicholas,3.92,"7,505 rating","April 12, 1994","The story told in this superbly researched and suspenseful book is that of the Third Reich's war on European culture and the Allies' desperate effort to preserve it. From the Nazi purges of 'degenerate art' and Goering's shopping sprees in occupied Paris to the perilous journey of the 'Mona Lisa' from Paris and the painstaking reclamation of the priceless treasures of liberated Italy, The Rape of Europa is a sweeping narrative of greed, philistinism, and heroism that combines superlative scholarship with a compelling drama.The cast of characters includes Hitler and Goering, Gertrude Stein and Marc Chagall--not to mention works by artists from Leonardo da Vinci to Pablo Picasso.",498,6,14 follower,"['History', 'Nonfiction', 'Art', 'World War II', 'Art History', 'War', 'Germany']",238 review,"2,878 (38%)","2,303 (30%)","1,484 (19%)",531 (7%),309 (4%)
The Three Legions,Gregory Solon,4.00,14 rating,"January 1, 1956","The Tribune Claudius Cinna had won glory and the title of ""the one savage who pleased Rome,"" yet he found his triumphant life empty. Arminius, Prince of the German tribe, the Cherusci, ""looked more Roman than German,"" yet he hated Rome and longed to free his people. The girl, Thessia, did not fear the Roman enemy. ""Let them come soon,"" she said, hating only the filth and cold and barrenness of her people's life. The youth, the fisher from Marsilia, knew nothing of war or love except his dreams. The governing passions of these four strangely assorted people - their passions for love, for freedom, for comfort and for fulfillment - played dominant and conflicting parts in the events that led to one of the decisive battles of history. This novel of the time of Augustus Caesar combines a stirringly dramatic story with mature and subtle characterization.",304,2,2 follower,"['Historical Fiction', 'Fiction', 'Roman']",6 review,5 (35%),5 (35%),3 (21%),1 (7%),0 (0%)
"Я, бабушка, Илико и Илларион",Nodar Dumbadze,4.54,"1,692 rating","January 1, 1960","Романы выдающегося грузинского писателя Нодара Думбадзе ""Я, бабушка, Илико и Илларион"" (1960), ""Белые флаги"" (1972), ""Закон вечности"" (1978) повествуют о людях простых и глубоких, наивных и мудрых, глубоко страдающих и безгранично любящих жизнь.",544,46,237 follower,"['Georgian', 'Fiction', 'Childrens', 'Humor', 'Classics', 'Russia', 'Literature']",87 review,"1,152 (68%)",350 (20%),150 (8%),34 (2%),6 (<1%)
No Great Mischief,Alistair MacLeod,4.02,"11,616 rating","September 30, 1999","Alistair MacLeod musters all of the skill and grace that have won him an international following to give us No Great Mischief , the story of a fiercely loyal family and the tradition that drives it.Generations after their forebears went into exile, the MacDonalds still face seemingly unmitigated hardships and cruelties of life. Alexander, orphaned as a child by a horrific tragedy, has nevertheless gained some success in the world. Even his older brother, Calum, a nearly destitute alcoholic living on Toronto's skid row, has been scarred by another tragedy. But, like all his clansman, Alexander is sustained by a family history that seems to run through his veins. And through these lovingly recounted stories-wildly comic or heartbreakingly tragic-we discover the hope against hope upon which every family must sometimes rely.",304,37,215 follower,"['Fiction', 'Canada', 'Historical Fiction', 'Canadian Literature', 'Contemporary', 'Literary Fiction', 'Literature']",877 review,"4,266 (36%)","4,300 (37%)","2,242 (19%)",615 (5%),193 (1%)
River of Time: A Memoir of Vietnam and Cambodia,Jon Swain,4.15,"1,004 rating","January 1, 1995","""A splendid memoir...a tale, at once tragic and beautiful, of love and loss, of coming of age and of witnessing the end of Indochina as the West had known it for more than a century.""—Los Angleles Times Book Review. From the writer immortalized in the Academy Award-winning film The Killing Fields.",304,6,8 follower,"['Nonfiction', 'Travel', 'History', 'Asia', 'War', 'Memoir', 'Biography']",100 review,428 (42%),368 (36%),152 (15%),40 (3%),16 (1%)
Afternoon on the Amazon,Mary Pope Osborne,3.96,"17,124 rating","August 29, 1995","The #1 bestselling chapter book series of all time celebrates 25 years with new covers and a new, easy-to-use numbering system!Vampire bats and killer ants? That's what Jack and Annie are about to run into when the Magic Tree House whisks them away to the Amazon River. It's not long before they get hopelessly lost. Will they be able to find their way back to the tree house? Or are Jack and Annie stuck forever in the rain forest?Did you know that there’s a Magic Tree House book for every kid?Merlin Missions: More challenging adventures for the experienced readerSuper Edition: A longer and more dangerous adventureFact Trackers: Nonfiction companions to your favorite Magic Tree House adventures",67,895,"2,273 follower","['Childrens', 'Fantasy', 'Fiction', 'Chapter Books', 'Adventure', 'Historical Fiction', 'Middle Grade', 'Childrens', 'Fantasy', 'Fiction', 'Chapter Books', 'Adventure', 'Historical Fiction', 'Middle Grade', 'Childrens', 'Fantasy', 'Fiction', 'Chapter Books', 'Adventure', 'Historical Fiction', 'Middle Grade']",578 review,"6,662 (38%)","4,770 (27%)","4,418 (25%)",939 (5%),335 (1%)
"A Study of History, Abridgement of Vols 1-6",Arnold Joseph Toynbee,4.09,510 rating,"January 1, 1947","Arnold Toynbee's A Study of History has been acknowledged as one of the greatest achievements of modern scholarship. A ten-volume analysis of the rise and fall of human civilizations, it is a work of breath-taking breadth and vision. D.C. Somervell's abridgement, in two volumes, of this magnificent enterprise, preserves the method, atmosphere, texture, and, in many instances, the very words of the original. Originally published in 1947 and 1957, these two volumes are themselves a great historical achievement.Volume 1, which abridges the first six volumes of Toynbee's study, includes the Introduction, The Geneses of Civilizations, and The Disintegrations of Civilizations. Volume 2, an abridgement of Volumes VII-X, includes sections on Universal States, Universal churches, Heroic Ages, Contacts Between Civilizations in Space, Contacts Between Civilizations in Time, Law and Freedom in History, The Prospects of the Western Civilization, and the Conclusion.Of Somervell's work, Toynbee wrote, ""The reader now has at his command a uniform abridgement of the whole book, made by a clear mind that has not only mastered the contents but has entered into the writer's outlook and purpose.""",640,554,456 follower,"['History', 'Nonfiction', 'Philosophy', 'World History', 'Classics', 'Sociology', 'Historical', 'History', 'Nonfiction', 'Philosophy', 'World History', 'Classics', 'Sociology', 'Historical', 'History', 'Nonfiction', 'Philosophy', 'World History', 'Classics', 'Sociology', 'Historical']",44 review,209 (40%),176 (34%),96 (18%),21 (4%),8 (1%)
The Way Things Work,David Macaulay,4.36,"2,693 rating","January 1, 1988","Get to grips with how things work inside hundreds of machines with this extraordinary book for kids that explains the science behind technologies and inventions.In this extensive encyclopedia packed full of simple science for kids aged 9+, David Macaulay's beautiful illustrations show the inner workings of each machine, from clocks and watches to jet engines and the Internet.The Way Things Work explains every machine you've ever wanted to understand, as well as some you've probably never thought about before. From the basic lever to the modern microprocessor, this bestseller has now been completely updated with the latest technologies - find out how a touchscreen works, look inside an optical mouse, and see the inner workings of a smartphone. This fascinating machines book for children - The inner workings of each machine, showing the technology in detail but making it accessible through Macaulay's uniquely playful illustrations.- The use of machines in everyday objects explainde, such as clocks, bikes, and watches, as well as the technology behind complicated machines such as space rockets and nuclear reactors.- Key scientific principles illustrated with Macaulay's brand of dry humour, using lighthearted stories involving mammoths.- An updated edition with machines and technologies that have become commonplace since the book's last major revision in 2016.In The Way Things Work Now, David Macaulay explains machines in a way no other illustrator can. Macaulay's inspired illustrations and humorous approach make even the most complex technology fun, fascinating, and accessible for children of all ages.",384,96,341 follower,"['Science', 'Nonfiction', 'Reference', 'Childrens', 'Picture Books', 'Technology', 'Engineering']",125 review,"1,411 (52%)",894 (33%),334 (12%),44 (1%),10 (<1%)
Domu: A Child's Dream,Katsuhiro Otomo,4.09,"2,196 rating","January 1, 1982","Old Cho, a disturbed old man with psychic powers, takes control of an apartment complex and causes the tenants to kill themselves or others, but is finally challenged by Etsuko, a young girl with her own psychic talents.",240,402,778 follower,"['Manga', 'Comics', 'Graphic Novels', 'Horror', 'Science Fiction', 'Fiction', 'Japan', 'Manga', 'Comics', 'Graphic Novels', 'Horror', 'Science Fiction', 'Fiction', 'Japan', 'Manga', 'Comics', 'Graphic Novels', 'Horror', 'Science Fiction', 'Fiction', 'Japan', 'Manga', 'Comics', 'Graphic Novels', 'Horror', 'Science Fiction', 'Fiction', 'Japan', 'Manga', 'Comics', 'Graphic Novels', 'Horror', 'Science Fiction', 'Fiction', 'Japan']",179 review,835 (38%),837 (38%),420 (19%),88 (4%),16 (<1%)
"The Last Lion: Winston Spencer Churchill: Alone, 1932-40",William Manchester,4.38,"11,455 rating","October 28, 1988","In this powerful biography, the middle volume of William Manchester’s critically acclaimed trilogy, Winston Churchill wages his defining campaign: not against Hitler’s war machine but against his own reluctant countrymen. Manchester contends that even more than his leadership in combat, Churchill’s finest hour was the uphill battle against appeasement. As Parliament received with jeers and scorn his warnings against the growing Nazi threat, Churchill stood alone—only to be vindicated by history as a beacon of hope amid the gathering storm. Praise for The Last Lion: Alone   “Manchester has such control over a huge and moving narrative, such illumination of character . . . that he can claim the considerable achievement of having assembled enough powerful evidence to support Isaiah Berlin’s judgment of Churchill as ‘the largest human being of our time.’”—The New Yorker
 
 “Memorable.”—San Francisco Chronicle    “Stirring . . . As Manchester points out several times, it’s as if the age, having produced a Hitler, then summoned Churchill as the only figure equal to the task of vanquishing him. The years Alone are the pivotal years of Churchill’s career.”—The Boston Sunday Globe  “The best Churchill biography [for] this generation . . . Even readers who know the basic story will find much that is new.”—Newsweek   “A triumph . . . equal in stature to the first volume of the series.”—Newsday  “Vivid . . . history in the grand manner.”
—The Washington Post
   “Compelling reading.”—The Times (London)",800,131,488 follower,"['Biography', 'History', 'Nonfiction', 'Politics', 'World War II', 'Biography Memoir', 'War']",462 review,"6,899 (60%)","2,911 (25%)",990 (8%),370 (3%),285 (2%)
The Legacy of Gird Omnibus: Surrender None/Liar's Oath,Elizabeth Moon,3.89,"1,118 rating","September 1, 1996","Moon's The Deed of Paksennarion has been a blockbuster success in Baen's one-volume trade paper edition--and now the trilogy has a companion. The Legacy of Gird tells of Gird, the liberator, who teaches his people that they can fight--and win--against their Mage-born rulers, and Luap, Gird's sworn follower, who dares not lie and cannot tell the truth--nor face the future.",864,152,"2,467 follower","['Fantasy', 'Science Fiction Fantasy', 'Fiction', 'Epic Fantasy', 'Novels', 'Adventure', 'Epic']",45 review,365 (32%),375 (33%),283 (25%),82 (7%),13 (1%)
Pincher Martin,William Golding,3.56,"2,349 rating","January 1, 1956","Drowning in the freezing North Atlantic, Christopher Hadley Martin, temporary lieutenant, happens upon a grotesque rock, an island that appears only on weather charts. To drink there is a pool of rain water; to eat there are weeds and sea anemones. Through the long hours with only himself to talk to, Martin must try to assemble the truth of his fate, piece by terrible piece.From the author of Lord of the Flies, Pincher Martin is a terrifying and unforgettable journey into one man's mind.",208,141,"3,887 follower","['Fiction', 'Classics', 'Literature', 'Novels', 'Fantasy', 'British Literature', 'Literary Fiction']",222 review,526 (22%),752 (32%),688 (29%),272 (11%),111 (4%)
The English Teacher,R.K. Narayan,3.81,"4,354 rating","October 1, 1945","This novel completes the informal trilogy which began with ""Swami and Friends"" and ""The Bachelor of Arts,"" The protagonist, Krishna, is an English teacher at the same college he had attended as a student. Although Krishna has recently married, his wife Susila and their daughter live with his parents-in-law some miles away. The story opens with his immediate family deciding to join him in Malgudi. Krishna is initially frightened by his new state of affairs, but he soon finds that his love for both his wife and child grows deeper than he could have imagined.""Mr. Narayan has repeatedly been compared with Chekhov. Ordinarily such comparisons are gratuitous and strained, but in this case there are such clear and insistent echoes that any careful reader will be aware of them. There is that sense of rightness which transcends mere structure. There is the inexplicable blending of tragedy and humor. Most of all, there is a brooding awareness of fate which makes the story seem not authored, but merely translated.""--J.F. Muehl, ""Saturday Review""""[Narayan] does not deal in exemplary fates, and the Western novel's machinery of retribution is far too grandiose for him. . . . In Narayan's world, scores are not settled but dissolved, recycled, restated. 'Both of us will shed our forms soon and perhaps we could meet again, who knows? So goodbye for the present.' These are the concluding words for the novel ""A Tiger for Malgudi,"" but they constitute a universal epilogue one could append to most of Narayan's fiction.""--Russell Davies, ""Times Literary Supplement""",180,151,"1,808 follower","['Fiction', 'India', 'Indian Literature', 'Classics', 'Literature', 'Novels', 'Asia']",314 review,"1,171 (26%)","1,632 (37%)","1,207 (27%)",250 (5%),94 (2%)
The Emigrants,W.G. Sebald,4.16,"10,002 rating","January 1, 1992","At first The Emigrants appears simply to document the lives of four Jewish émigrés in the twentieth century. But gradually, as Sebald's precise, almost dreamlike prose begins to draw their stories, the four narrations merge into one overwhelming evocation of exile and loss.Written with a bone-dry sense of humour and a fascination with the oddness of existence The Emigrants is highly original in its heady mix of fact, memory and fiction and photographs.",237,52,"1,535 follower","['Fiction', 'German Literature', 'Historical Fiction', 'Germany', 'Novels', 'Literature', '20th Century', 'Fiction', 'German Literature', 'Historical Fiction', 'Germany', 'Novels', 'Literature', '20th Century', 'Fiction', 'German Literature', 'Historical Fiction', 'Germany', 'Novels', 'Literature', '20th Century']",993 review,"4,389 (43%)","3,562 (35%)","1,496 (14%)",422 (4%),133 (1%)
Mysticism and Logic and Other Essays,Bertrand Russell,3.80,881 rating,"October 1, 1910","The classic by Bertrand Russell, in Kindle format.",123,"1,418","6,688 follower","['Philosophy', 'Nonfiction', 'Essays', 'Logic', 'Religion', 'Classics', 'Mysticism']",76 review,200 (22%),373 (42%),248 (28%),48 (5%),12 (1%)
Felicidade Clandestina,Clarice Lispector,4.23,"2,858 rating","January 1, 1971","An alternative cover edition for this ISBN can be found here.Publicado pela primeira vez em 1971, Felicidade clandestina reúne 25 contos que falam de infância, adolescência e família, mas relatam, acima de tudo, as angústias da alma.",160,220,"4,841 follower","['Short Stories', 'Fiction', 'Brazil', 'Classics', 'Female Authors', 'Womens', 'Portuguese Literature']",201 review,"1,335 (46%)",986 (34%),421 (14%),86 (3%),30 (1%)
Adolf Hitler,John  Toland,4.23,"3,534 rating","January 1, 1976","Pulitzer Prize-winning historian John Toland’s classic, definitive biography of Adolf Hitler remains the most thorough, readable, accessible, and, as much as possible, objective account of the life of a man whose evil effect on the world in the twentieth century will always be felt.Toland’s research provided one of the final opportunities for a historian to conduct personal interviews with over two hundred individuals intimately associated with Hitler. At a certain distance yet still with access to many of the people who enabled and who opposed the führer and his Third Reich, Toland strove to treat this life as if Hitler lived and died a hundred years before instead of within his own memory. From childhood and obscurity to his desperate end, Adolf Hitler emerges as, in Toland’s words, “far more complex and contradictory . . . obsessed by his dream of cleansing Europe Jews . . . a hybrid of Prometheus and Lucifer.”",1120,72,162 follower,"['History', 'Biography', 'Nonfiction', 'World War II', 'War', 'Germany', 'Biography Memoir']",226 review,"1,684 (47%)","1,193 (33%)",504 (14%),108 (3%),45 (1%)
