title,authors,average_rating,rating,date_of_publication,descriptions,total_pages,no_of_books_by_author,author_followers,genres,no_of_reviews,five_star_ratings,four_star_ratings,three_star_ratings,two_star_ratings,one_star_ratings
The Bridesmaid,Ruth Rendell,3.63,"2,256 rating","January 1, 1989","When Philip Wardman's feminine ideal, a Greek goddess, appears in the flesh as Senta Pelham, Philip thinks he has found true love. But darker forces are at work, and Senta is led to propose that Philip prove his love by committing murder.",259,454,"1,514 follower","['Mystery', 'Fiction', 'Crime', 'Thriller', 'Suspense', 'Psychological Thriller', 'British Literature']",195 review,494 (21%),807 (35%),666 (29%),214 (9%),75 (3%)
The Casting of Bells,Jaroslav Seifert,3.74,39 rating,"August 1, 1967",This is Seifert's first collection published in English in the U.S.A. (translated from the Czech).,64,126,67 follower,"['Poetry', 'Poetry', 'Poetry', 'Poetry', 'Poetry']",8 review,9 (23%),14 (35%),13 (33%),3 (7%),0 (0%)
Standing for Something: 10 Neglected Virtues That Will Heal Our Hearts and Homes,Gordon B. Hinckley,4.60,"14,421 rating","February 22, 2000","In this national bestseller, the president of The Church of Jesus Christ of Latter-day Saints, Gordon B. Hinckley, has created a classic look at the values that can change our world--and how to stand up for them. Drawing on anecdotes from his much-admired life of faith and service, as well as examples from American culture today, he examines ten virtues that have always illuminated the path to a better world: love, honesty, morality, civility, learning, forgiveness and mercy, thrift and industry, gratitude, optimism, and faith. He then shows how the two guardians of virtue--marriage and the family--can keep us on that path, even in difficult times. Standing for Something is an inspiring blueprint for what we all can do--as individuals, as a nation, and as a world community--to rediscover the values and virtues that have historically made us strong and that will lead us to a brighter future.",256,97,348 follower,"['Religion', 'Nonfiction', 'Lds', 'Church', 'Self Help', 'Inspirational', 'Spirituality']",768 review,"10,401 (72%)","2,810 (19%)",844 (5%),193 (1%),173 (1%)
After the Night,Linda Howard,4.06,"25,687 rating","December 1, 1995","FAITH DEVLIN: A poor, outcast child in Prescott, Louisiana, she'd always adored the town's golden boy from afar. But he called her white trash that sultry Southern night when his rich, respected father disappeared, along with her pretty Mom. Now Faith wanted to hate Gray Rouillard...not to feel a powerful surge of desire. But she couldn't quench her passion, any more than she could hide the truth about the past she had waited so long to unravel. GRAY ROUILLARD: Even when he raised hell, he did it with style. Reckless, charming, and backed by Rouillard money, Gray controlled the town of Prescott -- and Devlin was a name he never wanted to hear again. But when he gazed at Faith Devlin, all he saw was a swirl of tangled sheets and her silken flesh beneath him. To care for her was impossible, unthinkable...because Gray Rouillard planned to use all his power to ruin her.",352,279,"6,852 follower","['Romance', 'Contemporary Romance', 'Romantic Suspense', 'Contemporary', 'Suspense', 'Mystery', 'Adult']","1,569 review","10,308 (40%)","8,969 (34%)","4,644 (18%)","1,232 (4%)",534 (2%)
The Bum's Rush,G.M. Ford,3.98,"1,341 rating","May 1, 1997","Packed with all the outrageous shenanigans that quickly marked Who in Hell is Wanda Fuca? and Cast in Stone as two of the most original mysteries in years, G.M. Ford crafts a devilishly funny and bat-out-of-hell paced novel featuring his smart-aleck yet irrepressible Seattle-based p.i., Leo Waterman. Nobody loves you when you're down and out--except maybe Leo Waterman. As a man who has transformed a gaggle of residentially challenged devotees of cheap alcohol into a crack surveillance team, Leo has a soft spot for society's downtrodden. When a homeless woman says she's the mother of a deceased rock idol, Leo takes it upon himself to investigate the lady's claim, thereby embroiling the Boys, his dissolute deputies, and his own already bruised body in a high speed, life-threatening pursuit of the truth.",320,28,222 follower,"['Mystery', 'Fiction', 'Thriller', 'Crime', 'Detective', 'Humor']",62 review,418 (31%),549 (40%),316 (23%),48 (3%),10 (<1%)
Felicity: An American Girl,Valerie Tripp,4.04,"7,328 rating","January 1, 1992","Felicity Merriman is a spunky, spritely girl growing up in Virginia in 1774, just before the Revolutionary War. Felicity's stories tell of the adventures of this spirited girl, who grows impatient doing the ""sitting down kinds of things"" that colonial girls are expected to do. Felicity much prefers to be outdoors, especially riding horses In her stories, Felicity learns about responsibility and loyalty -- to her family, her friends, and her new country -- and what it means to be truly free.The perfect way to learn about Felicity is with a complete set of her six books in an attractive slipcase.",412,254,370 follower,"['Historical Fiction', 'Childrens', 'Fiction', 'Historical', 'Middle Grade', 'Young Adult', 'Juvenile']",216 review,"3,009 (41%)","2,181 (29%)","1,676 (22%)",320 (4%),142 (1%)
Open Boat,Stephen Crane,3.65,"4,453 rating","January 1, 1897",Four men struggle for survival after escaping from a sinking ship and into a small open boat,64,"1,781",746 follower,"['Short Stories', 'Classics', 'Fiction', 'American', 'School', 'Literature', 'Read For School']",330 review,"1,028 (23%)","1,506 (33%)","1,357 (30%)",439 (9%),123 (2%)
The Silver Branch,Rosemary Sutcliff,3.94,"2,729 rating","January 1, 1957","Intrigue, plotting, and battles in the second of Rosemary Sutcliff's best-selling trilogy which began with The Eagle of the NinthViolence and unrest are sweeping through Roman Britain. Justin and Flavius find themselves caught up in the middle of it all when they discover a plot to overthrow the Emperor.In fear for their lives they gather together a tattered band of men and lead them into the thick of battle, to defend the honour of Rome. But will they be in time to save the Emperor?Rosemary Sutcliff's books about Roman Britain have won much acclaim and the first in the trilogy, The Eagle of the Ninth, has now sold over a million copies worldwide. The author writes with such passion and with such attention to detail that the Roman age is instantly brought to life and stays with the reader long after the last page has been turned.Features Rosemary Sutcliff is the acknowledged master of children's historical storytelling Award-winning author has won Carnegie Medal and has also been awarded the OBE and the CBE Historical fiction is currently enjoying a huge amount of popularity Great book for boys and girls alike Beautiful package with original black and white artwork throughout by Charles Keeping together with new cover look to tie in with other books in the sequence, The Eagle of the Ninth and The Lantern Bearers",272,121,620 follower,"['Historical Fiction', 'Fiction', 'Young Adult', 'Historical', 'Classics', 'Adventure', 'Childrens', 'Historical Fiction', 'Fiction', 'Young Adult', 'Historical', 'Classics', 'Adventure', 'Childrens', 'Historical Fiction', 'Fiction', 'Young Adult', 'Historical', 'Classics', 'Adventure', 'Childrens']",239 review,782 (28%),"1,159 (42%)",647 (23%),111 (4%),30 (1%)
The Case of the Borrowed Brunette,Erle Stanley Gardner,3.86,849 rating,"January 1, 1946",A strange newspaper ad for a brunette with specific measurements gets Eve Martell in trouble and provides Perry Mason with a baffling murder to solve.,201,"1,110",729 follower,"['Mystery', 'Fiction', 'Crime', 'Detective', 'Classics', 'Mystery Thriller', 'Thriller']",75 review,224 (26%),338 (39%),240 (28%),38 (4%),9 (1%)
"Very Good, Jeeves",P.G. Wodehouse,4.30,"12,550 rating","January 1, 1930","A Jeeves and Wooster collectionAn outstanding collection of Jeeves stories, every one a winner, in which Jeeves endeavours to give satisfaction: By saving a grumpy cabinet minister from being marooned and attacked by a swan - in the process saving Bertie Wooster from his impending doom...By rescuing Bingo Little and Tuppy Glossop from the soup (twice each)...By arranging rather too many performances of the song 'Sonny Boy' to a not very appreciative audience...And by a variety of other sparkling stratagems that should reduce you to helpless laughter. This early collection shows P.G.Wodehouse at the top of his game, writing with sublime wit and delicacy of plotting.‘Ever since I picked up my dad’s copy of Very Good, Jeeves aged 11 I’ve adored PG Wodehouse.’ Anna Carey’s favourite funny book for Irish TimesJeeves and the impending doom --The inferiority complex of old Sippy --Jeeves and the Yule-tide spirit --Jeeves and the song of songs --Episode of the dog Macintosh --The spot of art --Jeeves and the kid Clementina --The love that purifies --Jeeves and the old school chum --Indian summer of an uncle --The ordeal of young Tuppy",297,"1,129","6,441 follower","['Fiction', 'Humor', 'Classics', 'Short Stories', 'Comedy', 'British Literature', 'Audiobook']",794 review,"5,881 (46%)","4,988 (39%)","1,375 (10%)",189 (1%),117 (<1%)
The Fall of Hyperion,Dan Simmons,4.23,"125,014 rating","March 1, 1990","In the stunning continuation of the epic adventure begun in Hyperion, Simmons returns us to a far future resplendent with drama and invention. On the world of Hyperion, the mysterious Time Tombs are opening. And the secrets they contain mean that nothing--nothing anywhere in the universe--will ever be the same.",517,314,11.9k follower,"['Science Fiction', 'Fiction', 'Fantasy', 'Space Opera', 'Science Fiction Fantasy', 'Audiobook', 'Time Travel']","4,954 review","57,552 (46%)","44,700 (35%)","17,734 (14%)","3,914 (3%)","1,114 (<1%)"
Rolling Stone Encyclopedia of Rock & Roll,Rolling Stone Magazine,4.09,587 rating,"January 1, 1983","Completely updated with new entries and extensive revisions of the previous 1,800, The Rolling Stone Encyclopedia Of Rock & Roll is the authoritative volume on the world's music makers—from the one-hit wonders to the megastars.In 1983, Rolling Stone Press introduced its first Rock & Roll Encyclopedia. Almost two decades later, it has become the premier guide to the history of rock & roll, and has been selected by the Rock and Roll Hall of Fame & Museum as its official source of information. Giving full coverage to all aspects of the rock scene, it tells the story of rock & roll in a clear and easy reference format, including complete discographies, personnel changes for every band, and backstage information like date and place of birth, from Elvis Presley to Eminem.Since the last edition, the music scene has exploded in every area, from boy-bands to hip-hop, electronica to indie rock. Here, the Encyclopedia explores them all—'NSync, Notorious B.I.G., Ricky Martin, Radiohead, Britney Spears, Blink-182, Sean “Puffy” Combs, Portishead, Fatboy Slim, Fiona Apple, Lil' Kim, Limp Bizkit, Oasis, Outkast, Yo La Tengo, TLC, and many, many more. The Rolling Stone Encyclopedia of Rock & Roll, Third Edition includes all the facts, phenomena, and flukes that make up the history of rock. Accompanying the biographical and discographical information on the nearly 2,000 artists included in this edition are incisive essays that reveal the performers' musical influences, first breaks, and critical and commercial hits and misses, as well as evaluations of their place in rock history. Filled with hundreds of historical photos, The Rolling Stone Encyclopedia is more than just a reference book, it is the bible of rock & roll.",1136,222,34 follower,"['Music', 'Nonfiction', 'Reference', 'History', 'Childrens', 'Rock N Roll', 'Cultural', 'Music', 'Nonfiction', 'Reference', 'History', 'Childrens', 'Rock N Roll', 'Cultural', 'Music', 'Nonfiction', 'Reference', 'History', 'Childrens', 'Rock N Roll', 'Cultural', 'Music', 'Nonfiction', 'Reference', 'History', 'Childrens', 'Rock N Roll', 'Cultural', 'Music', 'Nonfiction', 'Reference', 'History', 'Childrens', 'Rock N Roll', 'Cultural']",30 review,236 (40%),198 (33%),124 (21%),25 (4%),4 (<1%)
Infatuarea fatală: erorile socialismului,Friedrich A. Hayek,4.23,"2,272 rating","January 1, 1988","În Infatuarea fatală, Friedrich August von Hayek se concentrează asupra a două tipuri de ordine, cea creată prin dispunerea deliberată a elementelor componente și cea spontană, formată prin ajustarea liberă a membrilor. Dezvoltând din perspectivă filosofică una din ideile formulate de Mises în cartea Socialism: An Economic and Sociological Analysis (1922), autorul demontează himera scientistă a societății organizate rațional, o himeră ce invadase lumea academică la finalul primei jumătăți a secolului trecut. Din cuprins: Între instinct și rațiune; Originile libertății, ale proprietății și ale justiției; Evoluția pieței: comerț și civilizație; Revolta instinctului și a rațiunii; Infatuarea fatală; Misterioasa lume a comerțului și a banilor; Limbajul nostru otrăvit; Ordinea extinsă și creșterea demografică; Religia și apărătorii tradiției",188,235,"1,464 follower","['Economics', 'Politics', 'Philosophy', 'Nonfiction', 'History', 'Political Science', 'Sociology', 'Economics', 'Politics', 'Philosophy', 'Nonfiction', 'History', 'Political Science', 'Sociology', 'Economics', 'Politics', 'Philosophy', 'Nonfiction', 'History', 'Political Science', 'Sociology']",158 review,"1,124 (49%)",717 (31%),299 (13%),89 (3%),43 (1%)
Owls in the Family,Farley Mowat,4.10,"5,428 rating","January 1, 1961","Farley Mowat's funniest book tells the adventures of Wol and Weeps, two owls from Saskatchewan who shape up a whole neighbourhood, turn a house topsy-turvy, and outsmart Mutt, the dog hero of The Dog Who Wouldn't Be. Wol brings dead skunks to the family dinner table and terrorizes the minister, the postman, and the French teacher. Weeps is a comical bird, afraid of everything except Mutt, and he never does learn how to fly. Here is the heartwarming story of how a boy named Billy finds Wol and Weeps and unwittingly adds two new members to the family.",91,136,599 follower,"['Fiction', 'Childrens', 'Animals', 'Canada', 'Classics', 'Middle Grade', 'Nature', 'Fiction', 'Childrens', 'Animals', 'Canada', 'Classics', 'Middle Grade', 'Nature', 'Fiction', 'Childrens', 'Animals', 'Canada', 'Classics', 'Middle Grade', 'Nature']",509 review,"2,117 (39%)","2,043 (37%)","1,024 (18%)",176 (3%),68 (1%)
Sonnets to Orpheus,Rainer Maria Rilke,4.25,"3,623 rating","January 1, 1923","One of the literary masterpieces of the century, this translation is now presented with facing-page German. To Rilke himself the Sonnets to Orpheus were ""perhaps the most mysterious in the way they came up and entrusted themselves to me, the most enigmatic dictation I have ever held through and achieved; the whole first part was written down in a single breathless act of obedience, between the 2nd and 5th of February, without one word being doubtful or having to be changed."" With facing-page German.",162,"1,443","5,861 follower","['Poetry', 'Classics', 'German Literature', '20th Century', 'Fiction', 'Literature', 'Germany', 'Poetry', 'Classics', 'German Literature', '20th Century', 'Fiction', 'Literature', 'Germany', 'Poetry', 'Classics', 'German Literature', '20th Century', 'Fiction', 'Literature', 'Germany']",285 review,"1,724 (47%)","1,226 (33%)",549 (15%),104 (2%),20 (<1%)
Winter Words: Poetry and Personal Writings of Thomas Hardy,Thomas Hardy,3.85,40 rating,"January 1, 1928","Although he is best known for his great novels, author Thomas Hardy wrote poetry throughout his life, and letters too, reflecting aspects of his personality that are not so readily seen in his fiction, illustrated in the recording of this special compilation.","AudiobookFirst published January 1, 1928","1,743","5,987 follower","['Poetry', 'Classics', 'Poetry', 'Classics', 'Poetry', 'Classics', 'Poetry', 'Classics', 'Poetry', 'Classics']",11 review,13 (32%),10 (25%),15 (37%),2 (5%),0 (0%)
On the Trail of the Assassins: One Man's Quest to Solve the Murder of President Kennedy,Jim Garrison,4.06,"1,987 rating","January 1, 1988","Jim Garrison’s classic account of his investigation and prosecution of the murder of JFK.Almost fifty years after the assassination of President John F. Kennedy, his murder continues to haunt the American psyche and stands as a turning point in our nation’s history. The Warren Commission rushed out its report in 1964, but questions continue to linger: Was there a conspiracy? Was there a coup at the highest levels of government?On March 1, 1967, New Orleans district attorney Jim Garrison shocked the world by arresting local businessman Clay Shaw for conspiracy to murder the president. His alleged co-conspirator, David Ferrie, had been found dead a few days before. Garrison charged that elements of the United States government, in particular the CIA, were behind the crime. From the beginning, his probe was virulently attacked in the media and violently denounced from Washington. His office was infiltrated and sabotaged, and witnesses disappeared and died strangely. Eventually, Shaw was acquitted after the briefest of jury deliberation and the only prosecution ever brought for the murder of President Kennedy was over.Returning to print for the first time in years, On the Trail of the Assassins—the primary source material for Oliver Stone’s hit film JFK—is Garrison’s own account of his investigations into the background of Lee Harvey Oswald and the assassination of President Kennedy, and his prosecution of Clay Shaw in the trial that followed.",342,36,33 follower,"['History', 'Nonfiction', 'True Crime', 'Politics', 'Crime', 'Historical', 'Conspiracy Theories']",141 review,785 (39%),721 (36%),349 (17%),82 (4%),50 (2%)
The Far Side Gallery 3,Gary Larson,4.43,"26,067 rating","January 1, 1984","The third Far Side treasury.Copyright © 1988 FarWorks, Inc. All rights reserved.The Far Side ®, FarWorks, Inc. ®, and the Larson ® signature are registered trademarks of FarWorks, Inc. in certain countries.",192,124,676 follower,"['Comics', 'Humor', 'Graphic Novels', 'Comedy', 'Fiction', 'Comic Strips', 'Cartoon']",157 review,"15,313 (58%)","7,410 (28%)","2,751 (10%)",405 (1%),188 (<1%)
Colas Breugnon,Romain Rolland,3.79,590 rating,"January 1, 1919","""Colas Breugnon"" is a charming romance of life in Burgundy three hundred years ago. It is an ""autobiographical"" novel, the story being told in the first person by Colas, who reviews his fifty years of life, and describes all its joys and sorrows. The story is gay and humorous, and full of wise observations about life. --- ""Colas Breugnon is the jovial Burgundian, the lusty wood-carver, the practical joker always fond of his glass, the droll fellow. Before everything, Colas Breugnon is a free man. He loves his king, but only so long as the king leaves him his liberty; he loves his wife, but follows his own bent; he is on excellent terms with the priest of a neighboring parish, but never goes to church; he idolizes his children, but his vigorous individuality makes him unwilling to live with them. He is friendly with all, but subject to none; he is freer than the king; he has that sense of humor characteristic of the free spirit to whom the whole world belongs.",242,"1,149",424 follower,"['Fiction', 'Classics', 'France', 'Nobel Prize', 'French Literature', 'Literature', '20th Century']",49 review,194 (32%),184 (31%),131 (22%),56 (9%),25 (4%)
Find a Victim,Ross Macdonald,3.94,"1,480 rating","January 1, 1954","Las Cruces wasn’t a place most travelers would think to stop. But after Lew Archer plays the good samaritan and picks up a bloodied hitchhiker, he finds himself in town for a few days awaiting a murder inquest. A hijacked truck full of liquor and an evidence box full of marijuana, $20,000 from a big time bank heist by a small time crook, corruption, adultery, incest, prodigal daughters and abused wives all make the little town seem a lot more interesting than any guide book ever could. And as the murder rate rises, Archer finds himself caught up in mystery where everyone is a suspect and everyone’s a victim.",224,184,733 follower,"['Mystery', 'Fiction', 'Crime', 'Noir', 'Detective', 'Thriller', 'Hard Boiled']",159 review,384 (25%),684 (46%),359 (24%),45 (3%),8 (<1%)
"Don Quixote, U.S.A.",Richard  Powell,4.28,253 rating,"January 1, 1966","Arthur Peabody Goodpasture is the descendant of an old and respected Boston family. He has, however, been a disappointment to his family in several In appearance he is insignificant looking both in face and figure; he went to the University of Florida instead of Harvard where his forbears had been mainstays of the varsity crew for generations, and he studied agriculture instead of pointing himself toward a career in banking, bonds, or law. To say the least he is not apparently the stuff from which heroes are fashioned.As an agricultural expert specializing in fruit farming, Arthur becomes a Peace Corps volunteer and is assigned to the Republic of San Marco in the Caribbean. This weak-chinned Don Quixote soon acquires his Sancho Panza in the person of a rascally eleven-year-old boy, Pepe, who makes a bargain to be paid 400 pesos each time he saves Arthur's life. (The payments mount alarmingly!)The island's dictator thinks he can use Arthur to obtain military supplies with which to wipe out the band of guerillas in the hills who oppose his corrupt dictatorship. Failing in this the dictator decides to murder Goodpasture and cause an international incident by blaming it on the guerillas. This, he reasons, will bring the U.S. in to help stamp out the rebels.This plan also backfires (with Pepe's help, of course) and Goodpasture is taken prisoner and when they see he is a harmless eccentric he is appointed chief cook for the guerillas. From then on Arthur's life becomes a series of misadventures through which he moves serenely and from which he generally emerges unscathed (again with Pepe's assistance) until he surprisingly finds himself the guerillas' leader.Following one of the funniest bloodless revolutions imaginable Arthur Peabody Goodpasture ends up as Arthur el Gavilan, the new dictator of San Marco. ""His strength was as the strength of ten because his heart was pure.""",192,36,16 follower,"['Fiction', 'Humor']",36 review,131 (51%),76 (30%),33 (13%),12 (4%),1 (<1%)
Among the Shadows: Tales from the Darker Side,L.M. Montgomery,3.86,"1,903 rating","April 1, 1990","These nineteen fascinating stories are unlike any others L.M. Montgomery ever wrote.  Filled with strange and supernatural occurrences, they are peopled with drunkards, embezzlers, and A woman confesses to murder after she has passed away. . . . A righteous deacon gets a taste of his own bitter medicine. . . . An amateur photographer records a dark deed. . . . The ghost of a woman's sweetheart comes to bid her good-bye. . . . Somber, dark, and brooding, these intriguing stories suggest that love really can last beyond death and that poetic justice does exist.  Each of these wonderful tales is full of the strength of Montgomery's own inner resources.",284,"2,107",11.5k follower,"['Short Stories', 'Classics', 'Fiction', 'Young Adult', 'Historical Fiction', 'Mystery', 'Romance']",132 review,545 (28%),695 (36%),532 (27%),113 (5%),18 (<1%)
The Woman's Comfort Book,Jennifer Louden,3.97,"1,228 rating","March 27, 1992","With over 200 prescriptions for giving yourself a break, this book helps the reader to sort out guilty feelings about self–nurture and to define her comfort/self–nurture needs.In this book the author delivers a host of creative and comforting programmes like the self–care schedule, creative selfishness, creating a comfort network, body delights, a personal sanctuary, the comfort journal, bathing pleasures and comfort rituals. Organised by topic and cross–referenced throughout, this guidebook is designed to appeal to women of all ages. The new edition has been revised and updated for modern women.",209,29,237 follower,"['Self Help', 'Nonfiction', 'Womens', 'Psychology', 'Health', 'Personal Development', 'Reference']",56 review,463 (37%),390 (31%),275 (22%),80 (6%),20 (1%)
