title,authors,average_rating,rating,date_of_publication,descriptions,total_pages,no_of_books_by_author,author_followers,genres,no_of_reviews,five_star_ratings,four_star_ratings,three_star_ratings,two_star_ratings,one_star_ratings
Hitchcock/Truffaut,François Truffaut,4.48,"8,262 rating","January 1, 1966","Any book-length interview with Alfred Hitchcock is valuable, but considering that this volume's interlocutor is François Truffaut, the conversation is remarkable indeed. Here is a rare opportunity to eavesdrop on two cinematic masters from very different backgrounds as they cover each of Hitch's films in succession. Though this book was initially published in 1967 when Hitchcock was still active, Truffaut later prepared a revised edition that covered the final stages of his career. It's difficult to think of a more informative or entertaining introduction to Hitchcock's art, interests, and peculiar sense of humor. The book is a storehouse of insight and witticism, including the master's impressions of a classic like Rear Window (""I was feeling very creative at the time, the batteries were well charged""), his technical insight into Psycho's shower scene (""the knife never touched the body; it was all done in the [editing]""), and his ruminations on flops such as Under Capricorn (""If I were to make another picture in Australia today, I'd have a policeman hop into the pocket of a kangaroo and yell 'Follow that car!'""). This is one of the most delightful film books in print. --Raphael Shargel",368,133,207 follower,"['Film', 'Nonfiction', 'Biography', 'Media Tie In', 'Art', 'History', 'Writing', 'Film', 'Nonfiction', 'Biography', 'Media Tie In', 'Art', 'History', 'Writing', 'Film', 'Nonfiction', 'Biography', 'Media Tie In', 'Art', 'History', 'Writing']",527 review,"4,926 (59%)","2,555 (30%)",659 (7%),91 (1%),31 (<1%)
"The Arctic Grail: The Quest for the Northwest Passage and the North Pole, 1818-1909",Pierre Berton,4.36,713 rating,"November 1, 1988","Covering the entire period of exploration from the expedition of William Edward Perry in 1818 to that of Robert Peary in a single volume, Pierre Berton has written a revisionist history of the search for the Northwest passage and the North Pole. 26 illustrations.",672,150,180 follower,"['History', 'Nonfiction', 'Canada', 'Travel', 'Adventure', 'World History', 'Historical']",71 review,368 (51%),257 (36%),74 (10%),6 (<1%),8 (1%)
Charming the Prince,Teresa Medeiros,3.91,"6,356 rating","April 6, 1999","He never lost a battle until he met the one woman who might succeed in...Charming the Prince.Dear Reader,My enemies know me as Lord Bannor the Bold, Pride of the English and Terror of the French. Never in my life have I backed down from any challenge or betrayed so much as a hint of fear—until the war ended and I found myself a reluctant papa to a dozen unruly children.Realizing that I couldn't lop their little heads off or throw them in the dungeon, I sent my steward out to find them a mother and me a bride—an attractive, meek, maternal creature too plain to tempt me to get her with child. You can imagine my horror when he returned with Lady Willow of Bedlington, a spirited beauty who made me think of nothing else!With her cloud of dark curls and the sparkle of passion in her eyes, Willow was everything I'd sworn to resist. I never dreamed she would join forces with those mischievous imps of mine to teach this cynical warrior just how sweet surrender can be.Bannor the Bold,Lord of Elsinore",342,49,"2,521 follower","['Historical Romance', 'Romance', 'Historical', 'Medieval', 'Historical Fiction', 'Medieval Romance', 'Fairy Tales']",434 review,"2,024 (31%)","2,272 (35%)","1,597 (25%)",363 (5%),100 (1%)
Final Flight,Stephen Coonts,4.07,"6,272 rating","August 1, 1988","The most daring -- and deadly -- terrorist plot of all time is about to unfold aboard the supercarrier USS United States. If it succeeds, the balance of nuclear power will tilt in favor of a remorseless Arab leader. And it looks as if no one can stop it - except navy ""jet jock"" Jake Grafton. ""Cag "" Grafton is one helluva pilot. His F-14 Tomcat is one helluva plane. But some of Jake's crewmates have already vanished. A woman reporter who boarded the ship in Tangiers may not be who she claims to be. And Jake may have to disobey a direct order from the President himself for one spine-tingling, hair-raising Final FlightFrom the Paperback edition.",387,157,712 follower,"['Fiction', 'Thriller', 'Military Fiction', 'Aviation', 'Action', 'Adventure', 'Espionage']",94 review,"2,284 (36%)","2,409 (38%)","1,332 (21%)",204 (3%),43 (<1%)
Meet Addy,Connie Rose Porter,4.11,"9,999 rating","September 1, 1993","In 1864, after her father and brother are sold to another owner, nine-year-old Addy Walker and her mother escape from their cruel life as slaves in North Carolina to freedom in Philadelphia.",69,32,92 follower,"['Historical Fiction', 'Childrens', 'Fiction', 'Historical', 'Middle Grade', 'Civil War', 'Young Adult']",361 review,"4,406 (44%)","2,931 (29%)","2,161 (21%)",388 (3%),113 (1%)
Bear Island,Alistair MacLean,3.60,"3,747 rating","January 1, 1971","Reissue of the classic tale of adventure and death on a mysterious Arctic island, from the acclaimed master of action and suspense. A converted fishing trawler, Morning Rose carries a movie-making crew across the Barents Sea to isolated Bear Island, well above the Arctic Circle, for some on-location filming, but the script is a secret known only to the producer and screenwriter. En route, members of the movie crew and ship's company begin to die under mysterious circumstances. The crew's doctor, Marlowe, finds himself enmeshed in a violent, multi-layered plot in which very few of the persons aboard are whom they claim to be. Marlowe's efforts to unravel the plot become even more complicated once the movie crew is deposited ashore on Bear Island, beyond the reach of the law or outside help. The murders continue ashore, and Marlowe, who is not what he seems to be either, discovers they may be related to some forgotten events of the Second World War.",464,334,"1,089 follower","['Thriller', 'Fiction', 'Adventure', 'Mystery', 'Suspense', 'Action', 'Crime']",137 review,676 (18%),"1,344 (35%)","1,345 (35%)",323 (8%),59 (1%)
There Was an Old Lady Who Swallowed a Fly,Simms Taback,4.23,"61,218 rating","January 1, 1997","
An old favorite as you've never seen it before!
Everyone knows the song about the old lady who swallowed a fly, a spider, a bird, and even worse, but who's ever seen what's going on inside the old lady's stomach?With this inventive die-cut artwork, 
Simms Tabak
 gives us a rollicking, eye-popping version of the well-loved poem.",36,80,60 follower,"['Picture Books', 'Childrens', 'Poetry', 'Fiction', 'Animals', 'Humor', 'Fantasy']","1,177 review","33,277 (54%)","14,108 (23%)","9,855 (16%)","2,769 (4%)","1,209 (1%)"
Wicked Loving Lies,Rosemary Rogers,3.91,"2,113 rating","January 1, 1976","In the sweeping tradition of Sweet Savage Love, New York Times bestselling author Rosemary Rogers takes readers on an epic journey that spans continents and explores the depths of human passions. Born of scandal and denied his birthright, Dominic Challenger took to the sea, charting his own future. A true rogue, Dominic answers to no one, trusting only himself. Until Marisa. Born of wealth and privilege, Marisa is a prisoner to her father's expectations. When the sanctuary she has found behind the walls of a convent is threatened by the news that her father has arranged for her to marry, Marisa flees...right into the arms of a pirate. From the safety of a sheltered convent to a sultan's harem, from the opulence of Napoleon's court to the wilds of the new frontier, Marisa and Dominic brave all that they encounter in this thrilling age: intrigue, captivity and danger. And above all, an enduring passion that ignites into an infinite love.",768,89,387 follower,"['Historical Romance', 'Romance', 'Historical', 'Historical Fiction', 'Harem', 'Pirates', 'Fiction']",110 review,825 (39%),623 (29%),416 (19%),140 (6%),109 (5%)
Exercises in Style,Raymond Queneau,4.06,"11,429 rating","April 28, 1947","The plot of Exercises in Style is quite simple: a man gets into an argument with another passenger on a bus. However, this anecdote is told ninety-nine more times, each in a radically different style, as a sonnet, an opera, in slang, and with many more permutations. This virtuoso set of variations is a linguistic rust-remover, and a guide to literary forms.",204,192,517 follower,"['Fiction', 'France', 'Short Stories', 'Writing', 'Classics', 'French Literature', 'Literature', 'Fiction', 'France', 'Short Stories', 'Writing', 'Classics', 'French Literature', 'Literature', 'Fiction', 'France', 'Short Stories', 'Writing', 'Classics', 'French Literature', 'Literature']",989 review,"4,315 (37%)","4,213 (36%)","2,258 (19%)",506 (4%),137 (1%)
Αριάγνη,Στρατής Τσίρκας,4.32,558 rating,"January 1, 1962","Οι ""Ακυβέρνητες Πολιτείες"" απαρτίζονται από τρεις τόμους: ""Η λέσχη"" (1961), ""Αριάγνη"" (1962), ""Η νυχτερίδα"" (1965). Η δράση τοποθετείται αντίστοιχα στην Ιερουσαλήμ, στο Κάιρο, στην Αλεξάνδρεια. Ένα μυθιστόρημα που τιθασεύει αριστοτεχνικά μια χειμαρρώδη ιστορική ύλη, δίνοντας ανθρώπινη φωνή στο έπος και στο δράμα του Β΄ Παγκοσμίου Πολέμου, την ώρα που κρινόταν το μέλλον των λαών και παίχτηκε στα ζάρια η τύχη της Ελλάδας. Χάρη σε ποικίλες αναδρομές, η τριλογία ζωντανεύει και προγενέστερες περιόδους, από τον Μεσοπόλεμο, τον χλωρό παράδεισο της εφηβείας με τα πρώτα ερωτικά σκιρτήματα κάποιων ηρώων, ως την παλιά Αίγυπτο, ανακαλώντας μνήμες προγόνων. Το έργο κορυφώνεται με την εξέγερση του Στρατού και του Στόλου, το κίνημα του Απρίλη 1944 και τη δραματική καταστολή του, ενώ, με τον επίλογο του γ΄ τόμου, μεταφερόμαστε στη Θεσσαλονίκη μετά τον Εμφύλιο, το 1954, όπου ακούγεται ένα συγκλονιστικό ρέκβιεμ για τους χαμένους αγωνιστές.Ωστόσο, ο Τσίρκας δεν έγραψε χρονικό, αλλά έργο τέχνης. Ιστορική ακρίβεια και φαντασία σπάνια δένονται σ' ένα τόσο αρμονικό σύνολο. Κινώντας στιβαρά μεγάλους όγκους, καταγράφει ευαίσθητα τις απηχήσεις των γεγονότων στη συνείδηση και στις σχέσεις των ανθρώπων, πλάθοντας ολοζώντανες μορφές που θα μείνουν στο πάνθεον των μυθιστορηματικών ηρώων. Πολιτικές μηχανορραφίες, αχαλίνωτες φιλοδοξίες μέσα στη δίνη του πολέμου, αλλά και ωραία όνειρα και περίσσευμα ανθρωπιάς και γενναιότητας δίνουν το στίγμα των ""Ακυβέρνητων Πολιτειών"", όπου ο έρωτας, κυρίαρχος, τυλίγει και ξετυλίγει το νήμα μιας συναρπαστικής πλοκής. Παράλληλα, με την πολυφωνία της αφήγησης και άλλες νεωτερικές τεχνοτροπίες, ο συγγραφέας κατορθώνει να συγχωνεύσει τον μοντερνισμό με την παράδοση. Ένα μεταιχμιακό έργο, που σφράγισε τα ελληνικά γράμματα σ' αυτό τον ""σύντομο 20ό αιώνα"".",405,30,36 follower,"['Fiction', 'Literature', 'Historical Fiction', 'Classics', 'Historical', 'Fiction', 'Literature', 'Historical Fiction', 'Classics', 'Historical', 'Fiction', 'Literature', 'Historical Fiction', 'Classics', 'Historical']",26 review,284 (50%),189 (33%),68 (12%),12 (2%),5 (<1%)
Aurélien,Louis Aragon,4.29,"1,667 rating","January 1, 1944","Dans cette chronique parisienne de l'entre-deux guerres, Aragon décrit la toute nouvelle société surréaliste. Aurélien, jeune homme sensible et oisif, fréquente les salons parisiens d'avant-garde, y côtoie les poètes, les actrices, les peintres qui ne sont autres que Picabia ou Cocteau. Au sein de ce microcosme insouciant et sans entraves, un amour irrésistible mais inavoué naît entre Aurélien et Bérénice, une jeune provinciale venue à Paris pour quelques jours. Malgré la séparation, leur passion ne se démentira pas malgré le temps et la distance qui les auront transformés tous deux. Dans ce roman, c'est Aragon poète que l'on retrouve, ""le fou d'Elsa"" laissant sa plume courir au gré d'un lyrisme profond et sobre inspiré par l'amour (voir Les Yeux d'Elsa). Il a d'ailleurs bien volontiers reconnu la présence d'éléments autobiographiques dans son oeuvre, lui qui pourtant avouait : ""L'art du roman, c'est de savoir mentir."" Quel plus noble et plus délicieux mensonge que ce roman d'amour ? --Lenaïc Gravis et Jocelyn Blériot ",816,264,294 follower,"['France', 'Classics', 'Fiction', 'French Literature', 'Roman', 'Romance', 'Novels']",127 review,870 (52%),507 (30%),215 (12%),61 (3%),14 (<1%)
The Vicious Vikings,Terry Deary,3.98,"2,971 rating","January 1, 1994",A comical review of viking history.,128,539,723 follower,"['History', 'Nonfiction', 'Childrens', 'Humor', 'Historical', 'Comedy', 'Middle Grade', 'History', 'Nonfiction', 'Childrens', 'Humor', 'Historical', 'Comedy', 'Middle Grade', 'History', 'Nonfiction', 'Childrens', 'Humor', 'Historical', 'Comedy', 'Middle Grade']",141 review,998 (33%),"1,076 (36%)",752 (25%),127 (4%),18 (<1%)
Zeul care a dat greş,Richard Crossman,4.01,406 rating,"January 1, 1949","„O carte esenţială pentru înţelegerea fenomenologiei deşteptării din somnul dogmatic, din mirajul utopiei, din vraja religiei politice marxiste. De la Arthur Koestler şi Ignazio Silone la Richard Wright şi André Gide, autorii acestei cărţi decisive îşi privesc necruţător trecutul şi se întreabă: «Cum şi de ce am putut crede?» Dar mai ales este vorba de mecanismele trezirii, de agoniile rupturii cu un cosmos al certitudinilor în favoarea unei lumi a interogaţiilor libere. De fiecare dată cand predau ascensiunea şi căderea comunismului în veacul lagărelor de concentrare şi al ideologiilor pretins redemptive, această carte, o veritabilă gramatică a apostaziei, este bibliografie obligatorie."" (Vladimir TISMĂNEANU)",332,34,7 follower,"['History', 'Politics', 'Nonfiction', 'Philosophy', 'Essays', 'Russia', 'Economics', 'History', 'Politics', 'Nonfiction', 'Philosophy', 'Essays', 'Russia', 'Economics', 'History', 'Politics', 'Nonfiction', 'Philosophy', 'Essays', 'Russia', 'Economics', 'History', 'Politics', 'Nonfiction', 'Philosophy', 'Essays', 'Russia', 'Economics', 'History', 'Politics', 'Nonfiction', 'Philosophy', 'Essays', 'Russia', 'Economics']",61 review,145 (35%),155 (38%),77 (18%),22 (5%),7 (1%)
Mr. Bridge,Evan S. Connell,4.00,"2,512 rating","January 1, 1969","Walter Bridge is an ambitious lawyer who redoubles his efforts and time at the office whenever he senses that his family needs something, even when what they need is more of him and less of his money. Affluence, material assets, and comforts create a cocoon of community respectability that cloaks the void within - not the skeleton in the closet but a black hole swallowing the whole household.",246,55,140 follower,"['Fiction', 'Classics', 'Historical Fiction', 'Novels', 'Literary Fiction', 'American', '20th Century']",315 review,798 (31%),"1,086 (43%)",491 (19%),114 (4%),23 (<1%)
Foxfire: Confessions of a Girl Gang,Joyce Carol Oates,3.78,"7,815 rating","August 1, 1993","New York Times bestselling author Joyce Carol Oates’s strongest and most unsparing novel yet—an always engrossing, often shocking evocation of female rage, gallantry, and grit. The time is the 1950s. The place is a blue-collar town in upstate New York, where five high school girls join a gang dedicated to pride, power, and vengeance on a world that seems made to denigrate and destroy them.Here is the secret history of a sisterhood of blood, a haven from a world of male oppressors, marked by a liberating fury that burns too hot to last. Above all, it is the story of Legs Sadovsky, with her lean, on-the-edge, icy beauty, whose nerve, muscle, hate, and hurt make her the spark of its guiding spirit, its burning core.At once brutal and lyrical, this is a careening joyride of a novel—charged with outlaw energy and lit by intense emotion. Amid scenes of violence and vengeance lies this novel’s greatest the exquisite, astonishing rendering of the bonds that link the Foxfire girls together. Foxfire reaffirms Joyce Carol Oates’s place at the very summit of American writing.",328,837,"8,243 follower","['Fiction', 'Feminism', 'Historical Fiction', 'Young Adult', 'Contemporary', 'Literature', 'Coming Of Age']",526 review,"1,930 (24%)","3,097 (39%)","2,120 (27%)",513 (6%),155 (1%)
The Pinch Runner Memorandum,Ōe Kenzaburō,3.48,103 rating,"January 1, 1976","This novel offers a contemporary and explosive picture of the nuclear family, which pivots on the bizarre odyssey of a Japanese father and son.",270,10,10 book,"['Japanese Literature', 'Japan', 'Fiction', 'Novels', 'Japanese Literature', 'Japan', 'Fiction', 'Novels', 'Japanese Literature', 'Japan', 'Fiction', 'Novels', 'Japanese Literature', 'Japan', 'Fiction', 'Novels', 'Japanese Literature', 'Japan', 'Fiction', 'Novels']",10 review,16 (15%),35 (33%),37 (35%),12 (11%),3 (2%)
Sport,Louise Fitzhugh,3.75,"1,010 rating","March 28, 1980","Eleven-year-old Sport Rocque is living a happy life, keeping his father's absentmindedness under control and managing the family budget. When Kate, Sport's new and nice stepmother, enters the picture, things couldn't be better. Then comes the news: Sport's wealthy grandfather has just died and Sport is a multimillionaire. But millions of dollars equals millions of problems, as Sport soon discovers when his mother returns and kidnaps him to double her share of the inheritance! Life at the Plaza Hotel is no fun when you're a prisoner. Will Sport manage to return his life to normal?From the Hardcover edition",240,16,451 follower,"['Fiction', 'Childrens', 'Middle Grade', 'Mystery', 'Young Adult', 'Classics', 'Realistic Fiction']",78 review,253 (25%),362 (35%),310 (30%),60 (5%),25 (2%)
Low Country,Anne Rivers Siddons,3.98,"18,625 rating","January 1, 1998","Caroline Venable has everything her Southern heritage money, prestige, a powerful husband—and a predictable routine of country-club luncheons, cocktail parties, and dinners hosting her husband's wealthy friends, clients, and associates in his successful land-developing conglomerate.To escape her stifling routine, Caro drinks a little too much. But her true solace is the Lowcountry island her beloved Granddaddy left her—an oasis of breathtaking beauty that is home to a band of wild ponies. When Caro learns that her husband must develop the island or lose the business, she is devastated. The Lowcountry is her heritage—and what will happen to the ponies whose spirit and freedom have captivated her since childhood?Saving the island could cost Caroline more than she ever imagined. To succeed, she must confront the part of herself numbed by alcohol and careful avoidance—and shatter long-held ideals about her role in society, her marriage, and ultimately, herself.",461,50,"1,106 follower","['Fiction', 'Southern', 'Chick Lit', 'Romance', 'Contemporary', 'Womens Fiction', 'Drama']",236 review,"6,036 (32%)","7,258 (38%)","4,487 (24%)",652 (3%),192 (1%)
"The Visual Display of Quantitative Information, 2nd Ed.",Edward R. Tufte,4.39,"8,235 rating","January 1, 1983","The classic book on statistical graphics, charts, tables. Theory and practice in the design of data graphics, 250 illustrations of the best (and a few of the worst) statistical graphics, with detailed analysis of how to display data for precise, effective, quick analysis. Design of the high-resolution displays, small multiples. Editing and improving graphics. The data-ink ratio. Time-series, relational graphics, data maps, multivariate designs. Detection of graphical deception: design variation vs. data variation. Sources of deception. Aesthetics and data graphical displays. This is the second edition of The Visual Display of Quantitative Information. Recently published, this new edition provides excellent color reproductions of the many graphics of William Playfair, adds color to other images, and includes all the changes and corrections accumulated during 17 printings of the first edition.",197,14,658 follower,"['Design', 'Nonfiction', 'Science', 'Business', 'Reference', 'Art', 'Mathematics']",587 review,"4,539 (55%)","2,608 (31%)",890 (10%),158 (1%),40 (<1%)
If I Had You,Lynn Kurland,4.19,"2,429 rating","October 1, 2000","Artane is a majestic keep on the edge of the sea, the foster home of Anne of Fenwyck and the legacy of Robin de Piaget. Warring had kept Robin far from home for so long, Anne had all but given up hope he would ever return. But now Robin has come home – to the enchanting young woman who leaves him breathless with longing … and to a treachery that places them both in terrible danger. Then as the past threatens their future, he realizes that he wants nothing more than to have her – forever…",433,55,"1,514 follower","['Romance', 'Historical Romance', 'Historical', 'Time Travel', 'Medieval', 'Historical Fiction', 'Fantasy']",104 review,"1,065 (43%)",881 (36%),388 (15%),74 (3%),21 (<1%)
Fascism and Big Business,Daniel Guérin,4.19,118 rating,"January 1, 1936",Examines the development of fascism in Germany and Italy and its relationship with the ruling capitalist families there.,318,79,94 follower,"['History', 'Politics', 'Economics', 'Nonfiction', 'Theory', 'Germany', 'Italy']",14 review,53 (44%),44 (37%),14 (11%),5 (4%),2 (1%)
Season of the Machete,James Patterson,3.24,"6,896 rating","October 12, 1977","
From the bestselling, Edgar Award-winning author James Patterson comes a classic thriller.
Cool and glamorous, they could be a successful couple on a holiday. But Damian and Carrie Rose are psychopathic murderers for hire. Their new venue is a picture-perfect vacation island. Their adversary will be Peter Macdonald, the dashing young American who forsakes a life of leisure for a confrontation with cold-blooded terror. And risks everything only to discover that he alone suspects the hideous truth about the...Season of the Machete.",341,"1,591",345k follower,"['Mystery', 'Fiction', 'Thriller', 'Suspense', 'Mystery Thriller', 'Crime', 'Murder Mystery']",321 review,"1,355 (19%)","1,457 (21%)","2,267 (32%)","1,130 (16%)",687 (9%)
Drummer Boy for Montcalm,Wilma Pitchford Hays,3.88,8 rating,"September 28, 1959","The story of Peter who sails to Quebec with the French army in 1759 to try to keep this new country from the English. Peter served diligently and bravely all during the battle on the Plains of Abraham, and survived. But this is not only a story of war; it is much more than that. Here is love of the land itself, beauty of many kinds of friendships, and hope that comes even in defeat at the hands of a merciful conqueror.",191,73,3 follower,[],3 review,2 (25%),4 (50%),1 (12%),1 (12%),0 (0%)
Lock 14,Georges Simenon,3.64,"3,076 rating","March 1, 1931","One rainy night a canal worker stumbles across the strangled body of Mary Lampson in a stable near Lock 14. The dead woman's husband seems unmoved by her death and is curt and unhelpful when Maigret interviews him aboard his yacht. But gradually Maigret is able to piece together their story--a sordid tale of whiskey-fueled orgies and nomadic life on the canals. Can the answer to this crime be found aboard the yacht? Or is the murderer among the bargemen, carters, and lockkeepers who work the canal?",154,"2,368","1,870 follower","['Mystery', 'Fiction', 'Crime', 'France', 'Detective', 'Mystery Thriller', 'Noir', 'Mystery', 'Fiction', 'Crime', 'France', 'Detective', 'Mystery Thriller', 'Noir', 'Mystery', 'Fiction', 'Crime', 'France', 'Detective', 'Mystery Thriller', 'Noir']",367 review,505 (16%),"1,198 (38%)","1,172 (38%)",170 (5%),31 (1%)
