title,authors,average_rating,rating,date_of_publication,descriptions,total_pages,no_of_books_by_author,author_followers,genres,no_of_reviews,five_star_ratings,four_star_ratings,three_star_ratings,two_star_ratings,one_star_ratings
The Lost Honor of Katharina Blum,Heinrich Böll,3.69,"15,651 rating","January 1, 1974","In an era in which journalists will stop at nothing to break a big story, Henrich Böll's The Lost Honor of Katharina Blum has taken on heightened relevance. A young woman's association with a hunted man makes her the target of a journalist determined to grab the headlines by portraying her as an evil woman. As the attacks on her escalate and she becomes the victim of anonymous threats, Katharina sees only one way out of her nightmare.Turning the mystery genre on its head, the novel begins with the confession of a crime, drawing the reader into a web of sensationalism, character assassination, and the unavoidable eruption of violence.",140,540,"1,543 follower","['Fiction', 'German Literature', 'Classics', 'Germany', 'Literature', 'Novels', 'Nobel Prize', 'Fiction', 'German Literature', 'Classics', 'Germany', 'Literature', 'Novels', 'Nobel Prize', 'Fiction', 'German Literature', 'Classics', 'Germany', 'Literature', 'Novels', 'Nobel Prize']","1,031 review","3,213 (20%)","6,222 (39%)","4,642 (29%)","1,246 (7%)",328 (2%)
Walt Disney's Story Land,Frances Saldinger,4.11,243 rating,"January 1, 1962","More than 50 beloved stories, many adapted from classic Walt Disney films, have been brought together in this new and revised 320-page volume, illustrated in color.",319,5,5 book,"['Childrens', 'Fiction', 'Short Stories', 'Picture Books', 'Fantasy', 'Childrens Classics', 'Art']",28 review,97 (39%),93 (38%),39 (16%),10 (4%),4 (1%)
Lost in the Cosmos: The Last Self-Help Book,Walker Percy,4.06,"2,654 rating","January 1, 1983",Walker Percy's mordantly funny and wholly original contribution to the self-help book craze deals with the Western mind's tendency toward heavy abstraction. This favorite of Percy fans continues to charm and beguile readers of all tastes and backgrounds. Lost in the Cosmos invites us to think about how we communicate with our world.,272,68,711 follower,"['Philosophy', 'Nonfiction', 'Psychology', 'Self Help', 'Religion', 'Humor', 'Literature']",288 review,"1,077 (40%)",920 (34%),456 (17%),146 (5%),55 (2%)
The Animal Family,Randall Jarrell,4.19,"1,436 rating","January 1, 1965","This is the story of how, one by one, a man found himself a family. Almost nowhere in fiction is there a stranger, dearer, or funnier family -- and the life that the members of The Animal Family live together, there in the wilderness beside the sea, is as extraordinary and as enchanting as the family itself.",180,105,79 follower,"['Fantasy', 'Fiction', 'Childrens', 'Animals', 'Classics', 'Juvenile', 'Young Adult', 'Fantasy', 'Fiction', 'Childrens', 'Animals', 'Classics', 'Juvenile', 'Young Adult', 'Fantasy', 'Fiction', 'Childrens', 'Animals', 'Classics', 'Juvenile', 'Young Adult']",243 review,701 (48%),413 (28%),239 (16%),61 (4%),22 (1%)
Barren Ground,Ellen Glasgow,3.72,313 rating,"January 1, 1925","Barren Ground is a 1925 novel by Ellen Glasgow giving an account of 30 years in the life of a woman in rural Virginia: Dorinda Oakley is an intelligent, independent and vibrant young lady who is trying find herself and her purpose in life by moving to New York after a love disillusion.Dorinda Oakley, daughter of a land‐poor farmer in Virginia, at 20 goes to work in Nathan Pedlar's store. She falls in love with Jason Greylock, weak‐willed son of the village doctor, and forgets her purpose of helping her father to rebuild the farm, but soon before their planned wedding Jason is forced to marry a former fiancée. Bitterly disillusioned and pregnant, Dorinda seeks work in New York City, where she is injured and miscarries in a street accident. She is attended by Dr. Faraday, who later employs her as a nurse for his children. A young doctor proposes to her, but she refuses him, determined to ""find something else in life.""After her father's death, Dorinda returns to the family farm, which is impoverished and overgrown with broomsedge. Having studied scientific agriculture in New York, she introduces progressive methods, gradually returning the ""barren ground"" to fertility and creating a prosperous dairy farm. Her mother becomes an invalid after her brother Rufus is questioned for murder, and Dorinda only can rely on the aid of a few farm laborers. After her mother's death, she marries Nathan Pedlar to provide a home for his children, and after he dies, she shelters Jason, now penniless and ill from excessive drinking. He soon dies.",540,131,63 follower,"['Fiction', 'Classics', 'Southern', 'Literary Fiction', 'Historical Fiction', '20th Century', 'American']",42 review,67 (21%),136 (43%),71 (22%),33 (10%),6 (1%)
Pilgrim,Timothy Findley,3.80,"3,689 rating","January 1, 1999","Ageless. Sexless. Deathless. Timeless. Pilgrim is a man who cannot die, an astounding character in a novel of the cataclysmic contest between creation and destruction. Pilgrim is Timothy Findley’s latest masterwork, a finalist for the Giller Prize, and a national bestseller that has smashed the author’s own impressive sales records. Recently published in the US, Pilgrim is gathering rave reviews, and will be released in the UK this spring.It is 1912 and Pilgrim has been admitted to the Burghölzli Psychiatric Clinic in Zürich, Switzerland, having failed—once again—to commit suicide. Over the next two years, it is up to Carl Jung, self-professed mystical scientist of the mind, to help Pilgrim unlock his unconsciousness, etched as it is with myriad sufferings and hopes of history. Is Pilgrim mad, or is he condemned to live forever, witness to the terrible tragedy and beauty of the human condition? Both intimate and expansive in its scope, with an absorbing parade of characters—mythic, fictional and historical—Pilgrim is a fiercely original and powerful story from one of our most distinguished artists.",538,52,328 follower,"['Fiction', 'Canada', 'Historical Fiction', 'Fantasy', 'Historical', 'Canadian Literature', 'Psychology']",279 review,"1,048 (28%)","1,365 (37%)",892 (24%),275 (7%),109 (2%)
Tenderness,Robert Cormier,3.69,"2,937 rating","January 1, 1997","Eighteen-year-old Eric has just been released from juvenile detention for murdering his parents. Now he's looking for tenderness--tenderness he finds in killing girls. Fifteen-year-old Lori has run away from home again. Emotionally naive and sexually precocious, she is also looking for tenderness--tenderness that she finds in Eric. Will Lori and Eric be each other's salvation or destruction? An ALA Best Book for Young Adults.",242,74,598 follower,"['Young Adult', 'Fiction', 'Horror', 'Crime', 'Thriller', 'Realistic Fiction', 'Teen']",366 review,791 (26%),947 (32%),798 (27%),294 (10%),107 (3%)
Híbýli vindanna,Böðvar Guðmundsson,4.19,248 rating,"January 1, 1995","Written as a letter from a father to a daughter, Where the Winds Dwell is compassionate and real. Guðmundsson brings together past and present in this tragic story of the historic journey to Nýja Ísland, the world's largest Icelandic community outside of Iceland.",339,34,9 follower,"['Fiction', 'Historical', 'Historical Fiction', 'Scandinavian Literature']",11 review,95 (38%),117 (47%),26 (10%),7 (2%),3 (1%)
Una storia semplice,Leonardo Sciascia,3.82,"6,226 rating","November 20, 1989","Una storia semplice è una storia complicatissima, un giallo siciliano, con sfondo di mafia e droga. Eppure mai – ed è un vero tour de force – l'autore si trova costretto a nominare sia l'una sia l'altra parola. Tutto comincia con una telefonata alla polizia, con un messaggio troncato, con un apparente suicidio. E subito, come se assistessimo alla crescita accelerata di un fiore, la storia si espande, si dilata, si aggroviglia, senza lasciarci neppure l'opportunità di riflettere. Davanti alla proliferazione dei fatti, non solo noi lettori ma anche l’unico personaggio che nel romanzo ricerca la verità, un brigadiere, siamo chiamati a far agire nel tempo minimo i nostri riflessi – un tempo che può ridursi, come in una memorabile scena del romanzo, a una frazione di secondo. È forse questo l'estremo azzardo concesso a chi vuole «ancora una volta scandagliare scrupolosamente le possibilità che forse ancora restano alla giustizia».",66,214,410 follower,"['Italian Literature', 'Fiction', 'Crime', 'Italy', 'Classics', 'School', 'Mystery']",390 review,"1,526 (24%)","2,585 (41%)","1,683 (27%)",357 (5%),75 (1%)
Bully,Jan Needle,3.47,57 rating,"February 23, 1995","'Unbidden, Simon saw a face before his eyes, a girl's face with blonde hair. Unbidden, his teeth clamped shut, ground against each other. She was the target.' Simple, lumpy Simon Mason. Of course he's a bully and a liar, even his mother thinks so. And he's picking on that nice Anna Royle, her brother and Rebekka. Or is he? Has Simon been found guilty, sentenced and condemned without a proper hearing? Simon's teacher is determined to find out just who's bullying who. Hostilities reach a head when bully and victim meet for a final confrontation. Will the truth come out in time? Or have too many lies been told?",144,73,28 follower,[],3 review,14 (24%),14 (24%),18 (31%),7 (12%),4 (7%)
Silences,Tillie Olsen,4.21,564 rating,"January 1, 1978","First published in 1978, Silences single-handedly revolutionized the literary canon. In this classic work, now back in print, Olsen broke open the study of literature and discovered a lost continent-the writing of women and working-class people. From the excavated testimony of authors' letters and diaries we learn the many ways the creative spirit, especially in those disadvantaged by gender, class and race, can be silenced. Olsen recounts the torments of Melville, the crushing weight of criticism on Thomas Hardy, the shame that brought Willa Cather to a dead halt, and struggles of Virginia Woolf, Olsen's heroine and greatest exemplar of a writer who confronted the forces that would silence her. This 25th-anniversary edition includes Olsen's now infamous reading lists of forgotten authors and a new introduction and author preface.",316,42,116 follower,"['Feminism', 'Nonfiction', 'Writing', 'Essays', 'Literature', 'Literary Criticism', 'Womens']",88 review,247 (43%),207 (36%),92 (16%),16 (2%),2 (<1%)
Ronggeng Dukuh Paruk,Ahmad Tohari,4.23,"6,418 rating","January 1, 1982","Gabungan 3 buku seri Dukuh Paruk: Ronggeng Dukuh Paruk, Lintang Kemukus Dini Hari & Jantera Bianglala.Semangat Dukuh Paruk kembali menggeliat sejak Srintil dinobatkan menjadi ronggeng baru, menggantikan ronggeng terakhir yang mati dua belas tahun yang lalu. Bagi pedukuhan yang kecil, miskin, terpencil dan bersahaja itu, ronggeng adalah perlambang. Tanpanya dukuh itu merasakah kehilangan jati diri.Dengan segera Srintil menjadi tokoh yang amat terkenal dan digandrungi. Cantik dan menggoda. Semua ingin pernah bersama ronggeng itu. Dari kaula biasa hingga pekabat-pejabat desa maupun kabupaten. Namun malapetaka politik tahun 1965 membuat dukuh tersebut hancur, baik secara fisik maupun mental. Karena kebodohannya, mereka terbawa arus dan divonis sebagai manusia-manusia yang telah mengguncangkan negara ini. Pedukuhan itu dibakar. Ronggeng berserta para penabuh calung ditahan.Hanya karena kecantikannya Srintil tidak diperlakukan semena-mena oleh para penguasa penjara itu. Namun pengalaman pahit sebagai tahanan politikmembuat Srintil sadar akan harkatnya sebagai manusia. Karena itulah setelah bebas, ia berniat memperbaiki citra dirinya. Ia tak ingin lagi melayani lelaki manapun. Ia ingin menjadi wanita somahan. Dan ketika Bajus muncul dalam hidupnya sepercik harapan muncul, harapan yang semakin lama semakin besar.",406,30,438 follower,"['Fiction', 'Indonesian Literature', 'Historical Fiction', 'Novels', 'Classics', 'Romance', 'Literature']",789 review,"2,889 (45%)","2,451 (38%)",839 (13%),170 (2%),69 (1%)
The Dream of Heroes,Adolfo Bioy Casares,3.89,"1,992 rating","January 1, 1954","At the end of carnival 1927, Emilio Gauna had an experience that he knew was the culmination of his life. The problem is that Gauna can only dimly remember what happened: he was out on the town with his raucous, reckless friends when a masked woman appeared. Several hours later, gasping and horrified, Gauna awoke at the edge of a lake. Three years later, he tries to solve the mystery the only way he knows: by re-creating the same situation and reliving it- despite the warnings of his secret protector, the Sorcerer.In The Dreams of Heroes, Adolfo Bioy Casares assembles magicians, prophetic and brave women, shamefully self-conscious men and Buenos Aires under the rubric of a sinister and mocking fate, and thrusts them forward into the dizzying realm of memory, doom and cyclical time. Written in 1954 and never before published in America, The Dream of Heroes stands as a predecessor of and model for a whole school of European and American novels that followed but never quite matched it.",212,220,743 follower,"['Fiction', 'Latin American', 'Fantasy', 'Magical Realism', 'Spanish Literature', 'Novels', 'Latin American Literature', 'Fiction', 'Latin American', 'Fantasy', 'Magical Realism', 'Spanish Literature', 'Novels', 'Latin American Literature', 'Fiction', 'Latin American', 'Fantasy', 'Magical Realism', 'Spanish Literature', 'Novels', 'Latin American Literature']",163 review,612 (30%),771 (38%),436 (21%),129 (6%),44 (2%)
The Walking Drum,Louis L'Amour,4.24,"9,250 rating","May 1, 1984","Louis L’Amour has been best known for his ability to capture the spirit and drama of the authentic American West. Now he guides his readers to an even more distant frontier—the enthralling lands of the twelfth century. Warrior, lover, and scholar, Kerbouchard is a daring seeker of knowledge and fortune bound on a journey of enormous challenge, danger, and revenge. Across Europe, over the Russian steppes, and through the Byzantine wonders of Constantinople, Kerbouchard is thrust into the treacheries, passions, violence, and dazzling wonders of a magnificent time. From castle to slave galley, from sword-racked battlefields to a princess’s secret chamber, and ultimately, to the impregnable fortress of the Valley of Assassins, The Walking Drum is a powerful adventure in an ancient world that you will find every bit as riveting as Louis L’Amour’s stories of the American West.",496,946,"2,914 follower","['Historical Fiction', 'Fiction', 'Westerns', 'Adventure', 'Historical', 'Classics', 'Fantasy']",841 review,"4,666 (50%)","2,739 (29%)","1,384 (14%)",345 (3%),116 (1%)
Et stort øde landskap,Kjell Askildsen,3.93,313 rating,"January 1, 1991","Disse sju novellene, som fungerer som løsrevne avsnitt av menneskeskjebner, handler om menneskenes ensomhet. Askildsen beskriver hverdagssituasjoner. Typisk for flere av hovedpersonene er at de reagerer kraftig, dels irrasjonelt på det trivielle livet, på språklige klisjeer, som om talemåter, med alt hva de innebærer av løgn og kamuflasje, vekker ubehagelige minner. Men det eneste alternativet de har til trivialitetene er desperasjon. Boka er innstilt til Nordisk Råds litteraturpris.",88,48,91 follower,"['Short Stories', 'Fiction']",39 review,80 (25%),149 (47%),68 (21%),14 (4%),2 (<1%)
"The Laws of Spirit: Simple, Powerful Truths for Making Life Work",Dan Millman,4.26,"1,531 rating","September 20, 1995","Explains twelve of the spiritual laws upon which all religions and moral systems are founded, laws that point the way to a life of harmony and insight",120,154,"1,102 follower","['Spirituality', 'Self Help', 'Philosophy', 'Personal Development', 'Nonfiction', 'Audiobook', 'Psychology']",108 review,760 (49%),492 (32%),217 (14%),43 (2%),19 (1%)
My Ishmael,Daniel Quinn,4.10,"10,082 rating","November 3, 1997","An extraordinary and startlingly original sequel to  Ishmael   “Enthralling, shocking, hope-filled, and utterly fearless, Daniel Quinn leads us deeper and deeper into the human heart, history, and spirit. In  My Ishmael , Quinn strikes out into entirely new territory, posing questions that will rock you on your heels, and providing tantalizing possibilities for a truly new world vision.”—Susan Chernak McElroy, author of  Animals as Teachers & HealersWhen Ishmael places an advertisement for pupils with “an earnest desire to save the world,” he does not expect a child to answer him.  But twelve-year-old Julie Gerchak is undaunted by Ishmael’s reluctance to teach someone so young, and convinces him to take her on as his next student.  Ishmael knows he can't apply the same strategies with Julie that he used with his first pupil, Alan Lomax—nor can he hope for the same outcome. But young Julie proves that she is ready to forge her own spiritual path and arrive at her own destination.  And when the time comes to choose a pupil to carry out his greatest mission yet, Ishmael makes a daring decision—a choice that just might change the world. Explore Daniel Quinn’s spiritual  Ishmael  trilogy: ISHMAEL • MY ISHMAEL • THE STORY OF B",293,46,"1,564 follower","['Fiction', 'Philosophy', 'Spirituality', 'Environment', 'Novels', 'Animals', 'Literature']",503 review,"4,189 (41%)","3,479 (34%)","1,791 (17%)",481 (4%),142 (1%)
Noddy Gets Into Trouble,Enid Blyton,3.96,228 rating,"December 1, 1954","Poor Noddy has landed himself in serious trouble. A mysterious bell wearer has been breaking into Miss Fluffy Cat's house and stealing her tarts and pies. Now all of Toyland think Noddy, the most famous bell jangler in town, is the culprit! With the help of his friend Tessie Bear, join Noddy as he sets out to uncover the real Toy Town burglar.",62,"5,916","5,786 follower","['Childrens', 'Picture Books', 'Fiction', 'Adventure', 'Childrens', 'Picture Books', 'Fiction', 'Adventure', 'Childrens', 'Picture Books', 'Fiction', 'Adventure']",17 review,85 (37%),70 (30%),56 (24%),13 (5%),4 (1%)
La vera storia dell'ultimo re socialista,Roy  Lewis,3.48,80 rating,"January 1, 1990","«E se le cose fossero andate in un altro modo? Se in un momento cruciale avessero preso un corso diverso?». Domande che qualsiasi persona ragionevole si pone ogni volta che tocca quella strana, impalpabile materia che si chiama Storia. Roy Lewis l’ha affrontata in questo romanzo con la stessa sottile verve, con la stessa illuminante disinvoltura con cui aveva trattato la preistoria in Il più grande uomo scimmia del Pleistocene, anche qui usando il gioco per dare evidenza e plasticità a pensieri che vanno lontano. Così ha voluto seguire una vena del possibile, immettendo, per così dire, in un supercomputer «la vittoria del socialismo, anziché quella del capitalismo, nella rivoluzione che travolse l’Europa del 1848». Dopo lunga elaborazione, il computer ha prodotto questo teorema in forma di romanzo. Osserviamo i fatti: anzitutto la regina Vittoria non regna per più di mezzo secolo, bensì deve abdicare nel 1849 davanti alla rivolta dei cartisti (i socialisti inglesi). Ma che avviene dopo? Si stabilisce un regime socialista (ma senza abolire la monarchia, perché siamo pur sempre in Inghilterra). Di un socialismo relativamente mite e bucolico, preoccupato soprattutto di garantire il lavoro a tutti e di mantenere l’uguaglianza. Il risultato è un lento disastro. Soprattutto perché socialismo e tecnologia non vanno insieme. La tecnologia, che è la vera rivoluzione, scompagina continuamente i rapporti sociali – e questo i bravi e un po’ tonti socialisti non riescono a sopportarlo. Si preparano così le basi per una rivoluzione che abbatta il sistema. Ma che accadrà se complice di questa rivoluzione diventa «l’ultimo re socialista»? Ce lo racconterà lui stesso, e non sarà facile dimenticare il personaggio di questo gentile, amabile sovrano, che avrebbe senz’altro preferito insegnare matematica in qualche oscura università, e si ritrova invece, spinto dalla forza delle cose, a guidare una controrivoluzione per rovesciare il proprio regime – quindi per esautorare se stesso. La vera storia dell’ultimo re socialista è apparso in Inghilterra nel 1990.",248,23,29 follower,"['Fiction', 'Historical Fiction', 'Fiction', 'Historical Fiction', 'Fiction', 'Historical Fiction']",8 review,12 (15%),28 (35%),27 (33%),12 (15%),1 (1%)
Recapitulation,Wallace Stegner,3.86,"1,451 rating","January 1, 1979","The moving sequel to the bestselling Big Rock Candy Mountain.Bruce Mason returns to Salt Lake City not for his aunt's funeral, but to encounter after forty-five years the place he fled in bitterness. A successful statesman and diplomat, Mason had buried his awkward and lonely childhood, sealed himself off from the thrills and torments of adolescence to become a figure who commanded international respect.But the realities of the present recede in the face of the ghosts of his past. As he makes the perfunctory arrangements for the funeral, we enter with him on an intensely personal and painful inner pilgrimage: we meet the father who darkened his childhood, the mother whose support was both redeeming and embarrassing, the friend who drew him into the respectable world of which he so craved to be a part, and the woman he nearly married. In this profoundly moving book Stegner has drawn an intimate portrait of a man understanding how his life has been shaped by experiences seemingly remote and inconsequential.",288,204,"1,717 follower","['Fiction', 'Literary Fiction', 'Historical Fiction', 'Westerns', 'Classics', 'Relationships', 'American Fiction']",166 review,355 (24%),647 (44%),355 (24%),77 (5%),17 (1%)
Before you're a stranger: New & selected poems,Raymond Fraser,5.00,2 rating,"January 1, 2000","Poems.About Raymond Fraser's ""Unfailingly interesting and impossible to put down once I started. The poems have wit and a perfectly authentic consistency — a subtle play against a constant background bass of despair or cosmic absurdity. Wonderful stuff!"" — LOUIS DUDEK (Poet & Critic)""I read the book from cover to cover; I found the verses so delightful I couldn’t put it down until I finished. The everyday subjects and events the poems deal with ring so true."" — T.C. TOMMY DOUGLAS (voted 'The Greatest Canadian')""Fraser notices so much, he responds with feeling and humor, and it's all so accessible to the reader. There isn't a poem in the book that isn't worth reading."" — ALAN PEARSON (Poet, 'Exploring Amazement')""Raymond Fraser happens to be one of the liveliest and most entertaining writers in the country.” — ALDEN NOWLAN (poet)",103,25,13 follower,[],0 review,2 (100%),0 (0%),0 (0%),0 (0%),0 (0%)
Elianto,Stefano Benni,4.05,"1,869 rating","January 1, 1996","Riusciranno i nostri intrepidi eroi a superare tutte le prove e trovare l'elisir che guarisca il giovane Elianto e gli faccia salvare la contea? Se si fugge di notte da Villa Bacilla sulle ali di una diavolessa sexy, sorvolando Tristalia, assieme a tre equipaggi che si spostano contemporaneamente, può accadere di visitare gli otto mondi alterei della mappa nootica. Capita così di conoscere la terra primordiale di Ermete Trismegisto, Protoplas; i mari incantati di Capitan Guepière a Posidon; i cinquanta casinò e i locali notturni di Bludus; Mnemonia con i suoi fuochi fatui e l'insidia dell'embambolia; Medium con le sue giornate di Beneficenza Ben-evidente. E poi è possibile incontrare Siperquater e Triperott a Neikos, o gli angeli cannibali nel deserto freddo di Yamserius. L'importante è fare in tempo a guarire il giovane Elianto, affetto dal Morbo Dolce, perché possa liberare le contee dal dominio del Grande Chiodo. C'è speranza di riuscire, assieme ai protagonisti (oltre a Elianto, Fido PassPass, Fuku Occhio di Tigre, Tigre Triste), a districarsi tra le mille prove e di attraversare gli infiniti mondi creati dalla fantasia di Stefano Benni?",313,100,695 follower,"['Fantasy', 'Fiction', 'Italian Literature', 'Humor', 'Italy', 'Novels', 'Contemporary']",75 review,719 (38%),660 (35%),372 (19%),100 (5%),18 (<1%)
Strength to Love,Martin Luther King Jr.,4.62,"3,816 rating","January 1, 1963",A collection of sermons by this martyred Black American leader which explains his convictions in terms of the conditions and problems of contemporary society.,160,355,"3,124 follower","['Nonfiction', 'Theology', 'Religion', 'History', 'Christianity', 'Philosophy', 'Christian']",456 review,"2,703 (70%)",848 (22%),207 (5%),40 (1%),18 (<1%)
The Solution,K.A. Applegate,4.07,"3,808 rating","January 1, 1998","David, the newest Animorph, is not what he appears. His need to control the other Animorphs and Ax is all he thinks about. And the things he does are starting to break up the group.Rachel and the others know that time is running out. The newest battle against the Yeerks is the most important one yet. And it's not one that will wait. Winning this fight could mean slowing down the invasion. But no one knows what to do with David. Because the newest Animorph is more than just a little problem. He's deadly. . . .",152,254,361 follower,"['Science Fiction', 'Young Adult', 'Fiction', 'Childrens', 'Fantasy', 'Middle Grade', 'Aliens', 'Science Fiction', 'Young Adult', 'Fiction', 'Childrens', 'Fantasy', 'Middle Grade', 'Aliens', 'Science Fiction', 'Young Adult', 'Fiction', 'Childrens', 'Fantasy', 'Middle Grade', 'Aliens']",207 review,"1,573 (41%)","1,161 (30%)",857 (22%),186 (4%),31 (<1%)
