title,authors,average_rating,rating,date_of_publication,descriptions,total_pages,no_of_books_by_author,author_followers,genres,no_of_reviews,five_star_ratings,four_star_ratings,three_star_ratings,two_star_ratings,one_star_ratings
"Vampire Chronicles: Interview with the Vampire, The Vampire Lestat, The Queen of the Damned (Anne Rice)",Anne Rice,4.30,"13,932 rating","January 1, 1989","The ornate, casket-like packaging and neogothic graphic design of this immortal trilogy is eerily enticing on its own. But just lift the lid, slide the first tape from its ghostly sleeve, and you'll soon embrace the hypnotic realm of the undead.Book 1, Interview with the Vampire, opens with the seductive purr of F. Murray Abraham (Amadeus) stating, ""I was a 25-year-old man when I became a vampire, and the year was 1791."" And so our ultimate antihero, Louis, begins the elaborate retelling of his long, tortured life as a vampire. Winding through the ages, from New Orleans to Paris, we follow Louis and his undying mentor, Lestat, as they feed on humans, whet their carnal appetites, and uncover an underworld of vampire brethren.Interview with the Vampire, read by F.Murray AbrahamRunning time: 3 hours on 2 Audio Cassettes-----------------------------------------------Book 2, The Vampire Lestat, brings us up to date, with Lestat waking from his earthen slumber to join the ranks of rock superstardom before sitting down to share the tale of his own haunting initiation into the vampire world. Michael York (Cabaret) puts his wonderfully fluid, cosmopolitan voice to good use, adding a dash of sly humor to this fast-paced, satisfying blend of sex and blood and rock and roll.The Vampire Lestat, read by Michael York Running time: 3 hours on 2 Audio Cassettes-----------------------------------------------Book 3, The Queen of the Damned, takes us back, all the way back to ancient Egypt, exposing the origins of the vampire way. Narrating in eerily serene and gracious tones, Kate Nelligan (The Prince of Tides) leads us gently down this bloody path of immortal desires. David Purdham gives the voice of Lestat a wistful quality, tinged with an evil relish that exposes the master vampire's sanguine tastes.Queen of the Damned, read by Kate Nelligan and David PurdhamRunning time: 3 hours on 2 Audio Cassettes-----------------------------------------------Anne Rice has continued her Vampire Chronicles beyond these three novels, but that shouldn't make this collection any less tempting to either the undead initiate or certified vampire junkie. --George LaneyTotal: 6 Audio Cassettes / 9 hours~",9,434,25.3k follower,"['Horror', 'Fiction', 'Fantasy', 'Vampires', 'Classics', 'Paranormal', 'Urban Fantasy', 'Horror', 'Fiction', 'Fantasy', 'Vampires', 'Classics', 'Paranormal', 'Urban Fantasy', 'Horror', 'Fiction', 'Fantasy', 'Vampires', 'Classics', 'Paranormal', 'Urban Fantasy', 'Horror', 'Fiction', 'Fantasy', 'Vampires', 'Classics', 'Paranormal', 'Urban Fantasy', 'Horror', 'Fiction', 'Fantasy', 'Vampires', 'Classics', 'Paranormal', 'Urban Fantasy']",251 review,"7,454 (53%)","4,065 (29%)","1,782 (12%)",414 (2%),217 (1%)
Conversation in the Cathedral,Mario Vargas Llosa,4.36,"9,399 rating","January 1, 1969","A haunting tale of power, corruption, and the complex search for identity, Conversation in The Cathedral takes place in 1950s Peru during the dictatorship of Manuel Apolinario Odría Amoretti. Over beers and a sea of freely spoken words, the conversation flows between two individuals, Santiago and Ambrosia, who talk of their tormented lives and of the overall degradation and frustration that has slowly taken over their town. Through a complicated web of secrets and historical references, Mario Vargas Llosa analyzes the mental and moral mechanisms that govern power and the people behind it. More than a historic analysis, Conversation in The Cathedral is a groundbreaking novel that tackles identity as well as the role of a citizen and how a lack of personal freedom can forever scar a people and a nation.",608,474,"8,163 follower","['Fiction', 'Literature', 'Classics', 'Latin American', 'Novels', 'Latin American Literature', 'Nobel Prize', 'Fiction', 'Literature', 'Classics', 'Latin American', 'Novels', 'Latin American Literature', 'Nobel Prize', 'Fiction', 'Literature', 'Classics', 'Latin American', 'Novels', 'Latin American Literature', 'Nobel Prize']",802 review,"5,240 (55%)","2,755 (29%)","1,053 (11%)",250 (2%),101 (1%)
Emily Climbs,L.M. Montgomery,4.17,"23,878 rating","July 1, 1925","Emily Starr was born with the desire to write. As an orphan living on New Moon Farm, writing helped her face the difficult, lonely times. But now all her friends are going away to high school in nearby Shrewsbury, and her old-fashioned, tyrannical aunt Elizabeth will only let her go if she promises to stop writing! All the same, this is the first step in Emily's climb to success. Once in town, Emily's activities set the Shrewsbury gossips buzzing. But Emily and her friends are confident—Ilse's a born actress, Teddy's set to be a great artist, and roguish Perry has the makings of a brilliant lawyer. When Emily has her poems published and writes for the town newspaper, success seems to be on its way—and with it the first whispers of romance. Then Emily is offered a fabulous opportunity, and she must decide if she wants to change her life forever.",325,"2,111",11.5k follower,"['Classics', 'Fiction', 'Young Adult', 'Historical Fiction', 'Childrens', 'Canada', 'Romance']",962 review,"10,135 (42%)","8,686 (36%)","4,190 (17%)",676 (2%),191 (<1%)
Deadeye Dick,Kurt Vonnegut Jr.,3.83,"28,809 rating","January 1, 1982","Deadeye Dick is Kurt Vonnegut’s funny, chillingly satirical look at the death of innocence. Amid a true Vonnegutian host of horrors—a double murder, a fatal dose of radioactivity, a decapitation, an annihilation of a city by a neutron bomb—Rudy Waltz, aka Deadeye Dick, takes us along on a zany search for absolution and happiness. Here is a tale of crime and punishment that makes us rethink what we believe . . . and who we say we are.",271,530,33.4k follower,"['Fiction', 'Classics', 'Humor', 'Literature', 'Science Fiction', 'Novels', 'American']","1,181 review","6,542 (22%)","12,456 (43%)","8,349 (28%)","1,300 (4%)",162 (<1%)
City,Clifford D. Simak,4.08,"17,349 rating","May 1, 1944","Simak's ""City"" is a series of connected stories, a series of legends, myths, and campfire stories told by Dogs about the end of human civilization, centering on the Webster family, who, among their other accomplishments, designed the ships that took Men to the stars and gave Dogs the gift of speech and robots to be their hands.Contents:· City · May 1944 · Huddling Place · Jul 1944 · Census · Sep 1944 · Desertion · Nov 1944 · Paradise · Jun 1946 · Hobbies · Nov 1946 · Aesop · Dec 1947 · The Simple Way [The Trouble with Ants] · Jan 1951.",251,913,955 follower,"['Science Fiction', 'Fiction', 'Short Stories', 'Fantasy', 'Classics', 'Science Fiction Fantasy', 'Speculative Fiction']","1,188 review","6,993 (40%)","6,100 (35%)","3,191 (18%)",776 (4%),289 (1%)
The Varieties of Religious Experience,William  James,4.01,"12,094 rating","January 1, 1902","""I am neither a theologian, nor a scholar learned in the history of religions, nor an anthropologist. Psychology is the only branch of learning in which I am particularly versed. To the psychologist the religious propensities of man must be at least as interesting as any other of the facts pertaining to his mental constitution. It would seem, therefore, as a psychologist, the natural thing for me would be to invite you to a descriptive survey of those religious propensities."" When William James went to the University of Edinburgh in 1901 to deliver a series of lectures on ""natural religion,"" he defined religion as ""the feelings, acts, and experiences of individual men in their solitude, so far as they apprehend themselves to stand in relation to whatever they may consider the divine."" Considering religion, then, not as it is defined by--or takes place in--the churches, but as it is felt in everyday life, he undertook a project that, upon completion, stands not only as one of the most important texts on psychology ever written, not only as a vitally serious contemplation of spirituality, but for many critics one of the best works of nonfiction written in the 20th century. Reading The Varieties of Religious Experience, it is easy to see why. Applying his analytic clarity to religious accounts from a variety of sources, James elaborates a pluralistic framework in which ""the divine can mean no single quality, it must mean a group of qualities, by being champions of which in alternation, different men may all find worthy missions."" It's an intellectual call for serious religious tolerance — indeed, respect — the vitality of which has not diminished through the subsequent decades.",519,410,"1,207 follower","['Philosophy', 'Religion', 'Psychology', 'Nonfiction', 'Spirituality', 'Classics', 'Theology']",595 review,"4,776 (39%)","4,071 (33%)","2,197 (18%)",644 (5%),406 (3%)
A Darkness At Sethanon,Raymond E. Feist,4.19,"66,969 rating","February 7, 1986","A Darkness at Sethanon is the stunning climax to Raymond E. Feist's brilliant epic fantasy trilogy, the Riftwar Saga. Here be dragons and sorcery, swordplay, quests, pursuits, intrigues, stratagems, journeys to the darkest realms of the dead and titanic battles between the forces of good and darkest evil. Here is the final dramatic confrontation between Arutha and Murmandamus - and the perilous quest of Pug the magician and Tomas the warrior for Macros the Black. A Darkness at Sethanon is heroic fantasy of the highest excitement and on the grandest scale, a magnificent conclusion to one of the great fantasy sagas of our time.",527,330,"8,427 follower","['Fantasy', 'Fiction', 'Epic Fantasy', 'High Fantasy', 'Science Fiction Fantasy', 'Magic', 'Adventure']",983 review,"28,489 (42%)","25,596 (38%)","10,767 (16%)","1,597 (2%)",520 (<1%)
Stellaluna,Janell Cannon,4.27,"117,695 rating","April 30, 1993","Stellaluna is the tender story of a lost young bat who finally finds her way safely home to her mother and friends. This award-winning book by Janell Cannon has sold over 500,000 copies and was on the bestseller list for more than two years.",46,14,153 follower,"['Picture Books', 'Childrens', 'Animals', 'Fiction', 'Family', 'Fantasy', 'Classics']","1,836 review","63,098 (53%)","30,920 (26%)","17,523 (14%)","4,262 (3%)","1,892 (1%)"
Dragonquest,Anne McCaffrey,4.09,"49,732 rating","May 1, 1971","Another Turn, and the deadly silver Threads began falling again. So the bold dragonriders took to the air once more and their magnificent flying dragons swirled and swooped, belching flames that destroyed the shimmering strands before they reach the ground.But F'lar knew he had to find a better way to protect his beloved Pern, and he had to find it before the rebellious Oldtimers could breed anymore dissent... before his brother F'nor would be foolhardy enough to launch another suicide mission... and before those dratted fire-lizards could stir up any more trouble!",350,568,"7,225 follower","['Fantasy', 'Science Fiction', 'Dragons', 'Fiction', 'Science Fiction Fantasy', 'Young Adult', 'Adventure']","1,076 review","19,186 (38%)","18,711 (37%)","9,694 (19%)","1,638 (3%)",503 (1%)
The Demolished Man,Alfred Bester,3.97,"31,798 rating","March 1, 1953","In a world in which the police have telepathic powers, how do you get away with murder?Ben Reichs heads a huge 24th century business empire, spanning the solar system. He is also an obsessed, driven man determined to murder a rival. To avoid capture, in a society where murderers can be detected even before they commit their crime, is the greatest challenge of his life.",250,362,858 follower,"['Science Fiction', 'Fiction', 'Classics', 'Mystery', 'Hugo Awards', 'Science Fiction Fantasy', 'Crime']","1,629 review","10,701 (33%)","12,201 (38%)","6,702 (21%)","1,694 (5%)",500 (1%)
Sparkling Cyanide,Agatha Christie,3.92,"33,964 rating","February 1, 1945","Six people sit down to a sumptuous meal at a table laid for seven. In front of the empty place is a sprig of rosemary- ""rosemary for remembrance."" A strange sentiment considering no one is likely to forget the night, exactly a year ago, that Rosemary Barton died at exactly the same table, her beautiful face unrecognizable, convulsed with pain and horror.But then Rosemary had always been memorable—she had the ability to arouse strong passions in most people she met. In one case, strong enough to kill...Titled in America Remembered Death.",336,"4,158",64.5k follower,"['Mystery', 'Crime', 'Fiction', 'Classics', 'Mystery Thriller', 'Detective', 'Audiobook']","2,558 review","9,150 (26%)","14,568 (42%)","8,835 (26%)","1,204 (3%)",207 (<1%)
Exit Unicorns,Cindy Brandner,3.98,"1,382 rating","December 1, 2000","In this sweeping and powerful epic the journey begins in the 'terrible beauty' of Northern Ireland during a time when conflict reigns and no one is spared from tragedy and sorrow, the time known as The Troubles. It is the spring of 1968 in Belfast and James Kirkpatrick has just lost his father under suspicious circumstances, Casey Riordan is released from prison after five years and Pamela O'Flaherty has crossed an ocean and a lifetime of memories to find the man she fell in love with as a little girl. All three lives are on a collision course with each other against the backdrop of the burgeoning civil rights movement and a nation on the brink of revolution. They come from disparate backgrounds-Jamie a wealthy aristocrat whose life is like an imperfect but multi-faceted jewel-brilliant, flawed and with a glitter that is designed to distract the observer. Casey, a card-carrying member of the Irish Republican Army, who must face the fact that five years away has left him a stranger, a misfit in his own neighborhood where not everyone is sympathetic to a convicted rebel. Pamela, who has come to Ireland in search of a memory and a man who may not have existed in the first place. Through it all runs the ribbon of a love story: love of country, the beginning love of two people unable to resist the pull of each other regardless of the cost to themselves and those around them, and the selfless love of one man who no longer believes himself capable of such emotion. It is an electrifying tale of a people divided by religion and politics, a tale of love and danger, of triumph and tragedy. Ultimately it is the story of that 'terrible beauty' herself-Ireland-and how nation is bound to one's identity, woven into the weft of all we become.",500,7,170 follower,"['Historical Fiction', 'Ireland', 'Fiction', 'Romance', 'Historical', 'Irish Literature', 'Historical Romance']",173 review,591 (42%),395 (28%),244 (17%),85 (6%),67 (4%)
First Blood,David Morrell,4.04,"9,655 rating","January 1, 1972","First came the man: a young wanderer in a fatigue coat and long hair. Then came the legend, as John Rambo sprang from the pages of First Blood to take his place in the American cultural landscape. This remarkable novel pits a young Vietnam veteran against a small-town cop who doesn't know whom he's dealing with—or how far Rambo will take him into a life-and-death struggle through the woods, hills, and caves of rural Kentucky. Millions saw the Rambo movies, but those who haven't read the book that started it all are in for a surprise—a critically acclaimed story of character, action, and compassion.",320,270,"1,511 follower","['Fiction', 'Thriller', 'Action', 'War', 'Adventure', 'Military Fiction', 'Classics']",878 review,"3,247 (33%)","4,008 (41%)","1,992 (20%)",338 (3%),70 (<1%)
Captain Blood,Rafael Sabatini,4.18,"16,512 rating","January 1, 1922","Short Description: Peter Blood, an Irish physician and soldier in England in the 1680's, is wrongly convicted of treason and sentenced to indentured slavery in the Caribbean. He escapes and becomes the most feared pirate captain on the Spanish Main, but all the glory of his adventures cannot help him, for the woman he loves cannot love a thief and pirate. Even when he destroys England's enemies, even at his most triumphant...but wait! What's that... Long Description: Peter Blood, an Irish physician and former soldier is happily settled, in the 1680's, as the doctor in an English town, when the rebellion of the Duke of Monmouth catches him by accident. He saves a man's life, as a doctor must try to do, but the man is a rebel and the hanging Judge Jeffreys sentences him to ten years as an indentured slave in the Caribbean colonies. Once there, his knowledge as a physician is recognized, and thus he meets and falls in love with the daughter of the man who own his servitude; not likely to be a successful love story! A Spanish ship attacks the town, and while the Spaniards celebrate their victory he boldly steals their ship, and he and his fellow convicts sail off to become the boldest and most fearless of pirates among the islands and on the Spanish Main. But all the glory of his adventures cannot help him, for the woman he loves cannot love a thief and pirate. Even when he destroys England's enemies, even at his most triumphant...but wait! Is that... The classic novel of adventure and romance, and one of Sabatini's best.",236,810,494 follower,"['Classics', 'Historical Fiction', 'Adventure', 'Fiction', 'Pirates', 'Historical', 'Romance']","1,120 review","7,286 (44%)","5,766 (34%)","2,791 (16%)",495 (2%),174 (1%)
The Edible Woman,Margaret Atwood,3.69,"36,553 rating","December 31, 1969","Marian is determined to be ordinary. She lays her head gently on the shoulder of her serious fiancé and quietly awaits marriage. But she didn't count on an inner rebellion that would rock her stable routine, and her digestion. Marriage à la mode, Marian discovers, is something she literally can't stomach... The Edible Woman is a funny, engaging novel about emotional cannibalism, men and women, and the desire to be consumed.",310,591,81.2k follower,"['Fiction', 'Feminism', 'Canada', 'Classics', 'Literary Fiction', 'Contemporary', 'Novels']","2,342 review","8,019 (21%)","13,602 (37%)","11,194 (30%)","3,041 (8%)",697 (1%)
Of Love and Shadows,Isabel Allende,3.99,"32,927 rating","January 1, 1984","Beautiful and headstrong, Irene Beltrán works as a magazine journalist—a profession that belies her privileged upbringing and her engagement to an army captain. Her investigative partner is photographer Francisco Leal, the son of impoverished Spanish Marxist émigrés. Together, they form an unlikely but inseparable team—and Francisco quickly falls in love with the fierce and loyal Irene. When an assignment leads them to a young girl whom locals believe to possess miraculous powers, they uncover an unspeakable crime perpetrated by an oppressive regime. Determined to reveal the truth in a nation overrun by terror and violence, each will risk everything to find justice—and, ultimately, to embrace the passion and fervor that binds them.Profoundly moving and ultimately uplifting, Of Love and Shadows is a tale of romance, bravery, and tragedy, set against the indelible backdrop of a country ruled with an iron fist—and peopled with those who dare to challenge it.",304,192,38.4k follower,"['Historical Fiction', 'Romance', 'Magical Realism', 'Spanish Literature', 'Latin American', 'Novels', 'Literature']","1,560 review","10,643 (32%)","13,331 (40%)","7,258 (22%)","1,377 (4%)",318 (<1%)
The Dice Man,Luke Rhinehart,3.55,"20,334 rating","January 1, 1971","The cult classic that can still change your life...Let the dice decide! This is the philosophy that changes the life of bored psychiatrist Luke Rhinehart - and in some ways changes the world as well. Because once you hand over your life to the dice, anything can happen. Entertaining, humorous, scary, shocking, subversive, The Dice Man is one of the cult bestsellers of our time.",541,31,433 follower,"['Fiction', 'Psychology', 'Thriller', 'Novels', 'Classics', 'Contemporary', 'Philosophy']","1,292 review","4,861 (23%)","6,554 (32%)","5,252 (25%)","2,298 (11%)","1,369 (6%)"
Moon Palace,Paul Auster,3.98,"25,071 rating","February 1, 1989","Marco Stanley Fogg is an orphan, a child of the sixties, a quester tirelessly seeking the key to his past, the answers to the ultimate riddle of his fate. As Marco sets out on a journey from the canyons of Manhattan to the deserts of Utah, he encounters a gallery of characters and a series of events as rich and surprising as any in modern fiction.Beginning during the summer that men first walked on the moon, and moving backward and forward in time to span three generations, Moon Palace is propelled by coincidence and memory, and illuminated by marvelous flights of lyricism and wit. Here is the most entertaining and moving novel yet from an author well known for his breathtaking imagination.",320,249,10.9k follower,"['Fiction', 'American', 'Contemporary', 'Novels', 'The United States Of America', 'Literature', 'Classics']","1,372 review","8,064 (32%)","10,365 (41%)","5,101 (20%)","1,215 (4%)",326 (1%)
Cloudstreet,Tim Winton,4.01,"25,176 rating","January 1, 1991","Hailed as a classic, Tim Winton's masterful family saga is both a paean to working-class Australians and an unflinching examination of the human heart's capacity for sorrow, joy, and endless gradations in between. An award-winning work, Cloudstreet exemplifies the brilliant ability of fiction to captivate and inspire.  Struggling to rebuild their lives after being touched by disaster, the Pickle family, who've inherited a big house called Cloudstreet in a suburb of Perth, take in the God-fearing Lambs as tenants. The Lambs have suffered their own catastrophes, and determined to survive, they open up a grocery on the ground floor. From 1944 to 1964, the shared experiences of the two overpopulated clans -- running the gamut from drunkenness, adultery, and death to resurrection, marriage, and birth -- bond them to each other and to the bustling, haunted house in ways no one could have anticipated.",426,83,"1,964 follower","['Fiction', 'Australia', 'Historical Fiction', 'Classics', 'Literature', 'Literary Fiction', 'Historical']","1,869 review","9,456 (37%)","9,101 (36%)","4,564 (18%)","1,455 (5%)",600 (2%)
Frog and Toad Are Friends,Arnold Lobel,4.24,"92,871 rating","August 26, 1970","Celebrate the power of friendship in these five adventurous stories starring Frog and Toad—a Caldecott Honor Book!From writing letters to going swimming, telling stories to finding lost buttons, Frog and Toad are always there for each other—just as best friends should be. Frog and Toad Are Friends is a Level Two I Can Read book, geared for kids who read on their own but still need a little help.The classic Frog and Toad stories by Arnold Lobel have won numerous awards and honors, including a Newbery Honor (Frog and Toad Together), a Caldecott Honor (Frog and Toad are Friends), ALA Notable Children’s Book, Fanfare Honor List (The Horn Book), School Library Journal Best Children’s Book, and Library of Congress Children’s Book.",64,275,493 follower,"['Childrens', 'Picture Books', 'Fiction', 'Classics', 'Animals', 'Fantasy', 'Chapter Books']","2,072 review","48,520 (52%)","24,235 (26%)","15,295 (16%)","3,489 (3%)","1,332 (1%)"
All the Names,José Saramago,3.91,"21,594 rating","January 1, 1997","Senhor José is a low-grade clerk in the city's Central Registry, where the living and the dead share the same shelf space. A middle-aged bachelor, he has no interest in anything beyond the certificates of birth, marriage, divorce, and death, that are his daily routine. But one day, when he comes across the records of an anonymous young woman, something happens to him. Obsessed, Senhor José sets off to follow the thread that may lead him to the woman-but as he gets closer, he discovers more about her, and about himself, than he would ever have wished.The loneliness of people's lives, the effects of chance, the discovery of love-all coalesce in this extraordinary novel that displays the power and art of José Saramago in brilliant form.",245,278,14.8k follower,"['Fiction', 'Portugal', 'Literature', 'Portuguese Literature', 'Novels', 'Nobel Prize', 'Magical Realism']","1,720 review","6,375 (29%)","8,669 (40%)","5,025 (23%)","1,217 (5%)",308 (1%)
Inherit the Wind: The Powerful Courtroom Drama in which Two Men Wage the Legal War of the Century,Jerome Lawrence,3.93,"23,306 rating","January 1, 1955","A meaningful play based on the Scopes Monkey Trial of 1925, in which a Tennessee teacher was tried for teaching evolution. The accused was a slight, frightened man who'd deliberately broken the law. His trial was a Roman circus, the chief gladiators being the two great legal giants of the century. Locked in mortal combat, they bellowed & roared imprecations & abuse. The spectators sat uneasily in the sweltering heat with murder in their hearts, barely restraining themselves. America's freedom was at stake.",129,45,26 follower,"['Plays', 'Classics', 'Fiction', 'Drama', 'Historical Fiction', 'School', 'Theatre', 'Plays', 'Classics', 'Fiction', 'Drama', 'Historical Fiction', 'School', 'Theatre', 'Plays', 'Classics', 'Fiction', 'Drama', 'Historical Fiction', 'School', 'Theatre']",977 review,"7,965 (34%)","8,323 (35%)","5,092 (21%)","1,368 (5%)",558 (2%)
