title,authors,average_rating,rating,date_of_publication,descriptions,total_pages,genres,author_followers,no_of_reviews,no_of_books_by_author,one_star_ratings,two_star_ratings,three_star_ratings,four_star_ratings,five_star_ratings
Wounded Prophet: A Portrait of Henri J.M. Nouwen,Michael    Ford,4.20,252 rating,"January 1, 1999","Henri Nouwen, a Dutch Roman Catholic priest, was one of the most beloved and important spiritual writers of the twentieth century. Since his death in 1996, his stature has only increased; and his books, including The Inner Voice of Love , The Wounded Healer , and The Return of the Prodigal Son , have become cherished classics. For thousands of readers around the world, Nouwen’s influence as a teacher and author is considered equal to, or greater than, that of the century’s great spiritual writers, C. S. Lewis and Thomas Merton.Although Nouwen could be radically revealing about his personal thoughts and struggles, there are nonetheless gaps in our understanding of who he was.With Wounded Prophet , readers are given the first extensive look into this man who touched so many, not only through his own words but, most powerfully, through the eyes of those around the world who knew Nouwen best. While researching this compelling biography, BBC producer Michael Ford conducted wide-ranging interviews with Nouwen’s friends, colleagues, and family members. What he discovered was far more compelling than what he had Though Nouwen was indeed the generous and loving man many thought he was, he was also never able to find consistent peace in his own life. Tormenting him were profound feelings of anxiety, insecurity, and loneliness. This portrait gives an honest and well-balanced account of Nouwen’s life that leaves no stone unturned, investigating his childhood, his family, his sexuality, and his life as a priest and member of the L’Arche Daybreak community in Toronto.",264,"['Biography', 'Spirituality', 'Religion', 'Christianity', 'Faith', 'Theology', 'Christian']",6 follower,21 review,9,3 (1%),6 (2%),38 (15%),95 (37%),110 (43%)
The Boardman Tasker Omnibus,Joe Tasker,4.47,197 rating,"February 16, 1995",Boardman and Tasker were British mountaineers who died on Everest in 1982. Their legacy includes four classic books that have now been gathered together in this book. Well worth the read!,890,"['Mountaineering', 'Climbing', 'Nonfiction', 'Adventure', 'Outdoors', 'Biography', 'Nature', 'Mountaineering', 'Climbing', 'Nonfiction', 'Adventure', 'Outdoors', 'Biography', 'Nature', 'Mountaineering', 'Climbing', 'Nonfiction', 'Adventure', 'Outdoors', 'Biography', 'Nature', 'Mountaineering', 'Climbing', 'Nonfiction', 'Adventure', 'Outdoors', 'Biography', 'Nature', 'Mountaineering', 'Climbing', 'Nonfiction', 'Adventure', 'Outdoors', 'Biography', 'Nature']",7 book,11 review,7,0 (0%),5 (2%),8 (4%),74 (37%),110 (55%)
"Walt Disney - Eeyore, Be Happy",Don Ferguson,4.35,603 rating,"January 1, 1991","Eeyore's gloominess gets to Tigger, so Pooh and Piglet set out to make Eeyore happy, an effort that turns into a very tiring day for poor Eeyore.",24,"['Childrens', 'Picture Books', 'Fiction', 'Childrens', 'Picture Books', 'Fiction', 'Childrens', 'Picture Books', 'Fiction']",14 follower,26 review,46,4 (<1%),27 (4%),90 (14%),114 (18%),368 (61%)
The Justification of God: An Exegetical and Theological Study of Romans 9:1-23,John      Piper,4.31,631 rating,"February 1, 1993","John Piper presents a careful, reasoned study of the doctrine of election. He dissects Paul's argument to highlight the picture of God and his righteousness painted in Romans 9. Undergirded by his belief that the sovereignty of God is too precious a part of our faith to dismiss or approach weak-kneed, Piper explores the Greek text and Paul's argument with singular deftness.",245,"['Theology', 'Christian', 'Christianity', 'Nonfiction', 'New Testament', 'Faith', 'Christian Living']","4,113 follower",39 review,446,10 (1%),16 (2%),88 (13%),171 (27%),346 (54%)
"The Prophet Armed: Trotsky, 1879-1921",Isaac Deutscher,4.33,"1,021 rating","January 1, 1954","Few political figures of the twentieth century have aroused as much controversy as the Russian revolutionary Leon Trotsky. Trotsky’s extraordinary life and extensive writings have left an indelible mark on revolutionary conscience; and yet there was at one time a danger that his name would disappear altogether from history. Isaac Deutscher’s magisterial three-volume biography was the first major publication to counter the powerful Stalinist propaganda machine, and in this definitive work Trotsky emerges in his real stature, as the most heroic, and ultimately tragic, character of the Russian revolution.This first volume of the trilogy, originally published in 1954, traces Trotsky’s political development: his early activities, the formation and crystallization of his distinctive and motivating idea—the permanent revolution— his long feud and final reconciliation with Lenin and Bolshevism, and his role in the October insurrection of 1917. The volume ends in the year 1921, when Trotsky, then at the climax of his power, unwittingly sowed the seeds of his own defeat.",497,"['History', 'Biography', 'Politics', 'Russia', 'Nonfiction', 'Russian History', 'Russian Revolution']",124 follower,74 review,83,14 (1%),25 (2%),121 (11%),311 (30%),550 (53%)
David Boring,Daniel Clowes,3.82,"8,740 rating","September 12, 2002","Meet David Boring: a nineteen-year-old security guard with a tortured innner life and an obsessive nature. When he meets the girl of his dreams, things begin to go awry: what seems too good to be true apparently is. And what seems truest in Boring's life is that, given the right set of circumstances (in this case, an orgiastic cascade of vengeance, humiliation and murder) the primal nature of humandkind will come inexorably to the fore.",136,"['Graphic Novels', 'Comics', 'Fiction', 'Graphic Novels Comics', 'Comix', 'Comic Book', 'Bande Dessinée']","1,769 follower",357 review,104,145 (1%),614 (7%),"2,299 (26%)","3,304 (37%)","2,378 (27%)"
L'esclusa,Luigi Pirandello,3.71,"1,896 rating","January 1, 1901","A questo romanzo di impianto naturalistico, Pirandello lavorò in tempi diversi e ne trasse anche una commedia: L'uomo, la bestia e la virtù. Si narra la storia di Marta, che viene cacciata di casa dal marito dietro il sospetto di un tradimento che si riduce invece a qualche lettera appassionata e filosoficheggiante che le indirizza un intellettuale del luogo, Gregorio Alvignani, deputato al Parlamento. Creduta colpevole da tutti e persino dal padre, Marta,dopo aver cercato di guadagnarsi la vita in paese, accetta un posto di maestra a Palermo. Sarà qui che tornerà ad affacciarsi l'ombra del marito e che lei, giovane e bella, diventerà facilmente vittima dell'Alvignani. Ma la sua scelta la porterà al distacco da tutti coloro che l'avevano esclusa.",236,"['Classics', 'Italian Literature', 'Fiction', 'Italy', 'Nobel Prize', 'Literature', 'Read For School']","1,256 follower",87 review,"1,229",24 (1%),148 (7%),557 (29%),789 (41%),378 (19%)
When Hope Springs New,Janette Oke,4.18,"6,952 rating","January 1, 1986","Leaving behind their dear friends in Beaver Creek, Elizabeth and Wynn take over an even more primitive outpost in the Canadian Northwest. Elizabeth finds herself totally isolated because of the Indian women's fear to even communicate with her. They thought they had already faced the most crushing disappointment of their lives when they saw little Sammy disappear from view in the arms of his father. Would they be able to survive the challenges ahead? The best in prairie love stories from bestselling author Janette Oke!",222,"['Christian Fiction', 'Historical Fiction', 'Fiction', 'Romance', 'Christian', 'Historical', 'Christian Romance']","3,023 follower",232 review,296,41 (<1%),210 (3%),"1,237 (17%)","2,412 (34%)","3,052 (43%)"
The Hammer of Eden,Ken Follett,3.59,"15,754 rating","January 1, 1993","The Hammer of Eden is a pulsating, state-of-the-art suspense thriller from master storyteller Ken Follett, author of Never and The Pillars of the Earth .A Deadly ThreatThe FBI receive an anonymous threat from a terrorist group that claims it can trigger earthquakes.A Lone AgentJudy Maddox, an FBI agent with a point to prove, is tasked with investigating the threat by her obstructive superiors. She must discover if it is credible and, if so, where it comes from.A State on the Verge of DestructionWhen a suspected, machine-generated tremor is detected her investigation reaches a critical point – can she find those responsible, and their next target, before they trigger a catastrophe that will devastate the entire West Coast of America and the millions of people who live there . . .",448,"['Fiction', 'Thriller', 'Mystery', 'Suspense', 'Mystery Thriller', 'Crime', 'Adventure']",53.7k follower,698 review,390,358 (2%),"1,557 (9%)","5,326 (33%)","5,481 (34%)","3,032 (19%)"
Zazie in the Metro,Raymond Queneau,3.66,"8,470 rating","January 23, 1959","Impish, foul-mouthed Zazie arrives in Paris from the country to stay with her uncle Gabriel. All she really wants to do is ride the metro, but finding it shut because of a strike, Zazie looks for other means of amusement and is soon caught up in a comic adventure that becomes wilder and more manic by the minute. In 1960 Queneau's cult classic was made into a hugely successful film by Louis Malle. Packed full of word play and phonetic games, 'Zazie in the Metro' remains as stylish and witty today as it did back then.",157,"['Fiction', 'France', 'Classics', 'French Literature', 'Novels', 'Humor', '20th Century', 'Fiction', 'France', 'Classics', 'French Literature', 'Novels', 'Humor', '20th Century', 'Fiction', 'France', 'Classics', 'French Literature', 'Novels', 'Humor', '20th Century', 'Fiction', 'France', 'Classics', 'French Literature', 'Novels', 'Humor', '20th Century', 'Fiction', 'France', 'Classics', 'French Literature', 'Novels', 'Humor', '20th Century']",517 follower,627 review,192,280 (3%),833 (9%),"2,372 (28%)","2,949 (34%)","2,036 (24%)"
Mhudi,Sol T. Plaatje,3.53,351 rating,"January 1, 1970","Mhudi, the first full-length novel in English by a black South African, was written in the late 1910s. A romantic epic set in the first half of the nineteenth century, the main action is unleashed by King Mzilikazi's extermination campaign against the Barolong in 1832 at Kunana (nowadays Setlagole), and covers the resultant alliance of defeated peoples with Boer frontiersmen in a resistance movement leading to Battlehill (Vegkop, 1836) and the showdown at the Battle of Mosega (17 January 1839). Plaatje's eponymous heroine is an enduring symbol of the belief in a new day.",200,"['South Africa', 'Africa', 'African Literature', 'Historical Fiction', 'Classics', 'Fiction', 'Historical']",17 follower,41 review,13,7 (1%),39 (11%),130 (37%),110 (31%),65 (18%)
The Sickness,K.A. Applegate,3.99,"3,192 rating","May 1, 1999","Something is very wrong with Ax. He's sick. And the Animorphs don't know what to do about it. They can't take him to a hospital. They don't know how to contact the Andalite home world. And Ax is dying.Cassie and the other Animorphs come up with a plan. But it involves finding a new way into the Yeerk pool. There's just one problem: Jake, Rachel, Tobias, and Marco come down with Ax's sickness. And now, for the first time, Cassie is on her own. . . .",152,"['Science Fiction', 'Young Adult', 'Fiction', 'Childrens', 'Fantasy', 'Middle Grade', 'Aliens', 'Science Fiction', 'Young Adult', 'Fiction', 'Childrens', 'Fantasy', 'Middle Grade', 'Aliens', 'Science Fiction', 'Young Adult', 'Fiction', 'Childrens', 'Fantasy', 'Middle Grade', 'Aliens']",361 follower,172 review,254,23 (<1%),165 (5%),785 (24%),"1,064 (33%)","1,155 (36%)"
The Machiavellians: Defenders of Freedom,James Burnham,4.31,"1,459 rating","January 1, 1943","This classic work of political theory and practice offers an account of the modern Machiavellians, a remarkable group who have been influential in Europe and practically unknown in the United States. The book devotes a long section to Machiavelli himself as well as to such modern Machiavellians as Gaetano Mosca, Georges Sorel, Robert Michels and Vilfredo Pareto. Burnham contends that the writings of these men hold the key both to the truth about politics and to the preservation of political liberty.",305,"['Politics', 'Philosophy', 'History', 'Nonfiction', 'Political Science', 'Economics', 'Sociology']",140 follower,157 review,60,13 (<1%),42 (2%),187 (12%),462 (31%),755 (51%)
Permanent Midnight,Jerry Stahl,3.96,"2,081 rating","October 20, 2015","His byline appeared everywhere, from L.A. Style to the Village Voice, from Esquire to Hustler. He penned scripts for twisted cult classics like Cafe Flesh and Dr. Caligari. He banged out shows for TV mega-hits like Moonlighting, Twin Peaks, and thirtysomething. But even when Jerry Stahl was making five grand a week, he was shooting six. Careening from his luxury home to L.A.'s more hellacious neighborhoods, he financed a heroin habit that brought on the soothing hiss of oblivion, while it stole his health and smashed his career. Until in a private apocalypse straight out of Day of the Locust, Jerry Stahl kicked smack and emerged clean.A searing, strung-out confessional in the lineage of Lenny Bruce, William S. Burroughs, and Hubert Selby Jr., PERMANENT MIDNIGHT chronicles one man's slide into the opiated abyss and his claw-marked ascent back into the light--heralding the return of the Urban Hipster to contemporary literature, infused with savage humor and relentless intensity.",371,"['Memoir', 'Nonfiction', 'Biography', 'Biography Memoir', 'Humor', 'Contemporary', 'Mental Health']",203 follower,156 review,40,46 (2%),116 (5%),424 (20%),791 (38%),704 (33%)
Only Mine,Elizabeth Lowell,3.90,"3,041 rating","February 1, 1992","The bastard son of a viscount and a Cheyenne shaman′s daughter, Wolfe Lonetree agrees to rescue the pampered Lady Jessica from an unwanted impending wedding -- but only if she will be his wife.Naive and shockingly innocent, Lady Jessica Charteris tricked a rugged, handsome stranger into a marriage in name only in order to escape a union with a vile British lord. Totally unprepared for the hardships awaiting her in America, she is terrified by the prospect of life in the harsh and magnificent land at the edge of the Rockies. But even more frightening is Wolfe himself -- a man whose raw sensuality leaves her breathless. Her proud, virile new ""husband"" is not one to be trifled with, nor will he be denied what his heart fervently desires -- for only in Wolfe Lonetree′s arms can Jessica truly learn the unparalleled joy of becoming the right man′s woman.",400,"['Romance', 'Historical Romance', 'Westerns', 'Historical', 'Western Romance', 'Fiction', 'Historical Fiction']","1,823 follower",175 review,203,61 (2%),183 (6%),741 (24%),"1,074 (35%)",982 (32%)
The Shores of Space,Richard Matheson,3.88,209 rating,"January 1, 1957",Contents:· Being · nv If Aug ’54 · Pattern for Survival · vi F&SF May ’55 · Steel · nv F&SF May ’56 · The Test · ss F&SF Nov ’54 · Clothes Make the Man · ss Worlds Beyond Feb ’51 · Blood Son [“Drink My Red Blood”] · ss Imagination Apr ’51 · Trespass [“Mother by Protest”] · nv Fantastic Sep/Oct ’53 · When Day Is Dun · ss Fantastic Universe May ’54 · The Curious Child · ss Fantastic Jun ’54 · The Funeral · ss F&SF Apr ’55 · The Last Day · ss Amazing Apr/May ’53 · Little Girl Lost · ss Amazing Oct/Nov ’53 · The Doll That Does Everything · ss Fantastic Universe Dec ’54,214,"['Science Fiction', 'Short Stories', 'Fiction', 'Horror', 'Fantasy', 'Collections', 'Short Story Collection']","4,183 follower",25 review,721,3 (1%),5 (2%),55 (26%),97 (46%),49 (23%)
With the Indians in the Rockies,James Willard Schultz,4.23,432 rating,"January 1, 1913","Thomas Fox, a young white trapper, and his Blackfoot friend, Pitamakan, cross the Rockies searching for better trapping and are captured and robbed by enemy Indians",144,"['History', 'Westerns']",26 follower,33 review,137,8 (1%),18 (4%),62 (14%),121 (28%),223 (51%)
Word of Honor,Nelson DeMille,4.22,"11,790 rating","November 1, 1985","Read the gripping story of a Vietnam vet whose secret past threatens his family, career, and honor, from the #1 New York Times bestselling author whose books have sold over 50 million copies worldwide, and is ""a true master"" (Dan Brown).He is a good man, a brilliant corporate executive, an honest, handsome family man admired by men and desired by women. But sixteen years ago Ben Tyson was a lieutenant in Vietnam.There, in 1968, the men under his command committed a murderous atrocity-and together swore never to tell the world what they had done. Not the press, army justice, and the events he tried to forget have caught up with Ben Tyson. His family, his career, and his personal sense of honor hang in the balance. And only one woman can reveal the truth of his past--and set him free.",526,"['Fiction', 'Thriller', 'Mystery', 'Suspense', 'Historical Fiction', 'Military Fiction', 'Mystery Thriller']","6,789 follower",458 review,175,86 (<1%),245 (2%),"1,875 (15%)","4,366 (37%)","5,218 (44%)"
Silent Partner,Jonathan Kellerman,3.90,"15,759 rating","January 1, 1989","At a party for a controversial Los Angeles sex therapist, Alex Delaware encounters a face from his own past - Sharon Ransom, an exquisite, alluring lover who left him abruptly more than a decade earlier. Sharon now hints that she desperately needs help, but Alex evades her. The next day she is dead, an apparent suicide.Driven by guilt and sadness, Delaware plunges into the maze of Sharon's life - a journey that will take him through the pleasure palaces of California's ultra-rich, into the dark closets of a family's disturbing past, and finally into the alleyways of the mind, where childhood terrors still hold sway.",484,"['Mystery', 'Fiction', 'Crime', 'Thriller', 'Mystery Thriller', 'Suspense', 'Detective']","5,226 follower",444 review,253,212 (1%),706 (4%),"4,085 (25%)","6,136 (38%)","4,620 (29%)"
The Power That Preserves,Stephen R. Donaldson,4.03,"24,776 rating","October 1, 1978","Used, book, fiction",489,"['Fantasy', 'Fiction', 'Science Fiction Fantasy', 'Science Fiction', 'Epic Fantasy', 'High Fantasy', 'Epic']","2,553 follower",429 review,164,548 (2%),"1,191 (4%)","4,560 (18%)","9,088 (36%)","9,389 (37%)"
Lukewarmness: The Devil in Disguise,Francis Fernandez-Carvajal,4.34,56 rating,"January 1, 1992","Here is a practical and complete remedy for a spiritual malady that afflicts many Christians, often without their even being aware of lukewarmness. Francis Carvajal explains how lukewarmness can creep into your soul through small infidelities, and can result in spiritual death. In this book, he offers a radical cure to this little-known spiritual sickness. He gives you realistic steps you can take now (including frequent Confession and renewed devotion to Mary) to root lukewarmness out of your soul.",142,"['Catholic', 'Spirituality', 'Religion', 'Catholic', 'Spirituality', 'Religion', 'Catholic', 'Spirituality', 'Religion']",6 book,7 review,6,1 (1%),1 (1%),9 (16%),12 (21%),33 (58%)
Lucky Starr and the Oceans of Venus,Paul  French,3.66,"1,894 rating","January 1, 1954","From the distance it seemed an emerald green, fairyland bubble! Aphrodite, the largest city of Venus, deep under the planet's sea. There Earthmen had established an incredible civilization, but now it was threatened by some awesome force which preyed on men's minds.",176,"['Science Fiction', 'Fiction', 'Young Adult', 'Science Fiction Fantasy', 'Adventure', 'Space Opera', 'Collections', 'Science Fiction', 'Fiction', 'Young Adult', 'Science Fiction Fantasy', 'Adventure', 'Space Opera', 'Collections', 'Science Fiction', 'Fiction', 'Young Adult', 'Science Fiction Fantasy', 'Adventure', 'Space Opera', 'Collections']",11 follower,79 review,13,19 (1%),157 (8%),685 (36%),613 (32%),420 (22%)
There's Always a Price Tag,James Hadley Chase,3.88,251 rating,"January 1, 1956","Small time freelance worker Glyn Nash rescues a drunken billionaire film director Dester from being run over, and soon gets appointed by the latter at his Hollywood residence, much against the wishes of Dester's glamorous and shady wife, Helen Dester. Glyn sees the employment as an opportunity to become rich and famous, not knowing what is in store for him.(wikipedia.org)","PaperbackFirst published January 1, 1956","['British Literature', 'Novels', 'Crime']",879 follower,23 review,491,3 (1%),14 (5%),64 (25%),98 (39%),72 (28%)
The Season of Passage,Christopher Pike,4.15,"3,459 rating","January 1, 1992","Dr. Lauren Wagner was a celebrity. She was involved with the most exciting adventure mankind had ever undertaken. The whole world admired and respected her.But Lauren knew fear.Inside voices entreating her to love them.Outside — the mystery of the missing group that had gone before her. The dead group.But were they simply dead?Or something else?A terrifying novel of horror — and, surprisingly, of salvation — from one of America's bestselling writers.A novel you won't forget.",438,"['Horror', 'Fiction', 'Science Fiction', 'Young Adult', 'Vampires', 'Fantasy', 'Paranormal']","5,179 follower",274 review,240,50 (1%),163 (4%),597 (17%),"1,061 (30%)","1,588 (45%)"
The Best of Robert Service,Robert W. Service,4.29,470 rating,"January 1, 1907","This new and revised edition of poems about the men and women of the North features the most loved ballads by Robert Service, and is illustrated with lively art by Marilen Van Nimwegen. While living in Whitehorse, Robert Service wrote The Cremation of Sam McGee, and other well-known poems. He wrote and published into his mid-eighties. He was quoted as saying, I just go for a walk and come back with a poem in my pocket.",128,"['Poetry', 'Canada', 'Fiction', 'Reference', 'Classics', 'Travel', 'Nature', 'Poetry', 'Canada', 'Fiction', 'Reference', 'Classics', 'Travel', 'Nature', 'Poetry', 'Canada', 'Fiction', 'Reference', 'Classics', 'Travel', 'Nature']",97 follower,69 review,140,1 (<1%),9 (1%),68 (14%),167 (35%),225 (47%)
Who's on First,William F. Buckley Jr.,3.75,460 rating,"January 1, 1980","The celebrated author of Tucker's Last Stand and Stained Glass offers a chilling story set against the backdrop of the cold war space race. Blackford Oakes heads a mission to kidnap a pair of extraordinary Russian scientists who can put the U.S. ahead in the race for space, unaware that KGB spymaster Bolgin is hot on his trail.",259,"['Fiction', 'Mystery', 'Espionage', 'Thriller', 'Historical Fiction', 'Novels', 'Spy Thriller']",303 follower,24 review,204,4 (<1%),20 (4%),161 (35%),175 (38%),100 (21%)
Strait is the Gate,André Gide,3.59,"5,027 rating","January 1, 1909","A landmark in world literature, Strait is the Gate describes a love affair between an acutely sensitive boy growing up in Paris and his cousin from the Normandy countryside that erupts into a soul-endangering passion. A devastating exploration of aestheticism taken to extremes, Strait is the Gate is a novel of haunting beauty that stimulates the mind and the emotions.A serious purpose underlies the work of Gide, and it is from such purposes that great novelists arise. - The New York TimesA little masterpiece.... as fine as a spire on Notre Dame. - James Joyce",104,"['Fiction', 'France', 'Classics', 'French Literature', 'Literature', 'Novels', '20th Century', 'Fiction', 'France', 'Classics', 'French Literature', 'Literature', 'Novels', '20th Century', 'Fiction', 'France', 'Classics', 'French Literature', 'Literature', 'Novels', '20th Century', 'Fiction', 'France', 'Classics', 'French Literature', 'Literature', 'Novels', '20th Century', 'Fiction', 'France', 'Classics', 'French Literature', 'Literature', 'Novels', '20th Century']","1,575 follower",500 review,554,151 (3%),541 (10%),"1,629 (32%)","1,626 (32%)","1,080 (21%)"
The Book of Jhereg,Steven Brust,4.19,"5,032 rating","July 1, 1983","A welcome addition to any fantasy fan's library, The Book of Jhereg follows the antics of the wise-cracking assassin Vlad Taltos and his dragon-like companion through their first three adventures: Jhereg, Yendi, and Teckla. From his rookie assassin days to his selfless feats of heroism, the dauntless Vlad will hold readers spellbound and The Book of Jhereg will take its place among the classic compilations in fantasy.",471,"['Fantasy', 'Fiction', 'Dragons', 'Science Fiction Fantasy', 'High Fantasy', 'Magic', 'Epic Fantasy']","2,193 follower",274 review,114,49 (<1%),168 (3%),763 (15%),"1,863 (37%)","2,189 (43%)"
Whoreson: The Story of a Ghetto Pimp,Donald Goines,4.29,"2,198 rating","January 1, 1972","Born and bred to the violent life of ghetto prostitution, the son of a beautiful Black prostitute and an unknown john, Whoreson Jones thinks he has it all figured out--until his self assurance is shaken by betrayal",320,"['Fiction', 'African American', 'Crime', 'Urban', 'Classics', 'African American Literature', 'Mystery']",681 follower,184 review,37,34 (1%),70 (3%),325 (14%),573 (26%),"1,196 (54%)"
