title,authors,average_rating,rating,date_of_publication,descriptions,total_pages,no_of_books_by_author,author_followers,genres,no_of_reviews,five_star_ratings,four_star_ratings,three_star_ratings,two_star_ratings,one_star_ratings
Violence and the Sacred,René Girard,4.15,"1,165 rating","January 1, 1972","Violence and the Sacred is Rene Girard's landmark study of human evil. Here Girard explores violence as it is represented and occurs throughout history, literature and myth. Girard's forceful and thought-provoking analyses of Biblical narrative, Greek tragedy and the lynchings and pogroms propagated by contemporary states illustrate his central argument that violence belongs to everyone and is at the heart of the sacred.",352,120,636 follower,"['Philosophy', 'Nonfiction', 'Anthropology', 'Religion', 'Psychology', 'History', 'Theology']",112 review,471 (40%),451 (38%),196 (16%),39 (3%),8 (<1%)
Mariel of Redwall,Brian Jacques,4.00,"28,399 rating","January 1, 1992","In the fourth volume of the epic Redwall saga, a mouse-ship is attacked by the pirate rat Gabool and his heinous band of cut-throats. Hapless voyagers Mariel and her father Joseph the Bellmaker are mercilessly thrown into the sea by the pirates. Mariel washes ashore, starved and near death, and is taken in by the hospitable inhabitants of Redwall Abbey. Sure that her poor father is dead, Mariel swears an oath of vengeance against the filthy pirates who killed her father. With he help of a motley band of animals, Mariel leads the charge to recover a bell and avenge her father.  About the Author:Brian Jacques was born in Liverpool, England, in 1939. Growing up on the docks of Liverpool, he attended St. John's School. He went on to work as a radio show host, playwright, longshoreman, lorry driver, folk singer and comedian prior to his career as a writer. The father of two sons, Jacques enjoys walking his West Highland Terrier, Teddy and spends most of his time writing. A new Redwall book is introduced once every year.",400,251,"4,028 follower","['Fantasy', 'Fiction', 'Young Adult', 'Childrens', 'Animals', 'Adventure', 'Middle Grade', 'Fantasy', 'Fiction', 'Young Adult', 'Childrens', 'Animals', 'Adventure', 'Middle Grade', 'Fantasy', 'Fiction', 'Young Adult', 'Childrens', 'Animals', 'Adventure', 'Middle Grade']",489 review,"9,408 (33%)","10,725 (37%)","7,158 (25%)",983 (3%),125 (<1%)
Butterfly Burning,Yvonne Vera,3.62,553 rating,"January 1, 1998","Butterfly Burning brings the brilliantly poetic voice of Zimbabwean writer Yvonne Vera to American readers for the first time. Set in Makokoba, a black township, in the late 1940s, the novel is an intensely bittersweet love story. When Fumbatha, a construction worker, meets the much younger Phephelaphi, he""wants her like the land beneath his feet from which birth had severed him."" He in turn fills her ""with hope larger than memory."" But Phephelaphi is not satisfied with their ""one-room"" love alone. The qualities that drew Fumbatha to her, her sense of independence and freedom, end up separating them. And the closely woven fabric of township life, where everyone knows everyone else, has a mesh too tight and too intricate to allow her to escape her circumstances on her own.Vera exploits language to peel away the skin of public and private lives. In Butterfly Burning she captures the ebullience and the bitterness of township life, as well as the strength and courage of her unforgettable heroine.",151,23,57 follower,"['Zimbabwe', 'Africa', 'Fiction', 'African Literature', 'Historical Fiction', 'Feminism', 'Womens']",65 review,145 (26%),165 (29%),155 (28%),65 (11%),23 (4%)
Farvernes uge,Elena Garro,4.27,688 rating,"January 1, 1964","Runde, orangefarvede torsdage. Den fattige skomager fra Guanajuato, der kan gå på en måde, så ingen ser ham. Tavse, lilla fredage. Kong Filip II, der kigger strengt fra sit portræt på væggen. Myrerne med deres grønne parasoller. Tiden, der har vendt sig om, som når man ser på et postkort og vender det for at se, hvad der står bagpå. Honningfarvede tæpper og hjorte, der spiser cigaretter. Nachita, der tørrer blodet af vinduet og verfer coyoterne tilbage til deres århundrede. Og hele natten, der bevæger sig fremad i en flod fuld af stjerner, munde, grene, vinde og dræbte mexicanske generaler ...Novellesamlingen Farvernes uge udkom for første gang i 1964, blot tre år før Gabriel García Márquez´ Hundred års ensomhed, og Elena Garro er ikke uberettiget blevet kaldt en forløber for genren magisk realisme. Disse tretten noveller er sprudlende og svimlende samling af fortættede universer, hvor tid og rum er flydende størrelser, som glider ind og ud af hinanden og antager nye overraskende dimensioner.",260,56,350 follower,"['Short Stories', 'Fiction', 'Womens', 'Magical Realism', 'Spanish Literature', 'Novels', 'Short Stories', 'Fiction', 'Womens', 'Magical Realism', 'Spanish Literature', 'Novels', 'Short Stories', 'Fiction', 'Womens', 'Magical Realism', 'Spanish Literature', 'Novels']",113 review,327 (47%),250 (36%),87 (12%),18 (2%),6 (<1%)
Collection of Sand,Italo Calvino,3.85,677 rating,"January 1, 1984","The last of Italo Calvino's works to appear during the author's lifetime, Collection of Sand is a group of essays never before published in English, discussing subjects ranging from cuneiform and antique maps to Mexican temples and Japanese gardens.",240,479,"7,826 follower","['Essays', 'Nonfiction', 'Italian Literature', 'Italy', 'Travel', 'Literature', 'Classics']",71 review,157 (23%),306 (45%),174 (25%),37 (5%),3 (<1%)
Darkwater: Voices from Within the Veil,W.E.B. Du Bois,4.30,850 rating,"February 1, 1920","The distinguished American civil rights leader, W. E. B. Du Bois first published these fiery essays, sketches, and poems individually nearly 80 years ago in the Atlantic, the Journal of Race Development, and other periodicals. Reflecting the author's ideas as a politician, historian, and artist, this volume has long moved and inspired readers with its militant cry for social, political, and economic reforms for black Americans. Essential reading for students of African-American history",176,388,"1,275 follower","['Nonfiction', 'History', 'Essays', 'Race', 'Philosophy', 'Poetry', 'Sociology']",91 review,416 (48%),306 (36%),103 (12%),15 (1%),10 (1%)
"...καλά, εσύ σκοτώθηκες νωρίς",Χρόνης Μίσσιος,4.50,"1,571 rating","January 1, 1985",,330,8,96 follower,"['Politics', 'Literature', 'Nonfiction', 'Biography', 'History', 'Greece', 'Philosophy', 'Politics', 'Literature', 'Nonfiction', 'Biography', 'History', 'Greece', 'Philosophy', 'Politics', 'Literature', 'Nonfiction', 'Biography', 'History', 'Greece', 'Philosophy']",63 review,942 (59%),490 (31%),119 (7%),15 (<1%),5 (<1%)
The Condition of Postmodernity: An Enquiry into the Origins of Cultural Change,David Harvey,4.16,"2,241 rating","January 1, 1989","Son yillarda gunumuz dunyasini betimlemede kullanilan ""postmodern durum"" uzerine, postmodern kultur, mimari, sanat ve toplum uzerine pek cok sey yazildi. David Harvey, Postmodernligin Durumu´nda baslangic olarak terimin farkli anlamlarini inceliyor ve modernizm sonrasi toplumsal yasantiyi anlamakta bu kavramlastirmayi kullanmanin ne olcude uygun ve yararli oldugunu tartisiyor. Ancak Postmodernligin Durumu, bir kitap olarak bundan cok daha fazlasini vaat ediyor. Yazar, Aydinlanma´dan gunumuze uzanan donem boyunca modernizmin toplumsal bir tarihini kuruyor ve modernizmin politik ve toplumsal dusunce ve hareketler icindeki, sanat, edebiyat ve mimarideki ifadelerini inceliyor. En dikkat cekici ve Harvey´e ozgu vurgulama ise, zaman ve mekin algilamalarimizin yine zaman ve mekin boyunca nasil bir degisim gosterdigi ve bu degisimin bireylerin degerleri ve toplumsal surecleri uzerinde nasil etkili oldugudur. Bu kitap sadece dogrudan sosyal bilimlerle ilgili olanlar icin degil, g",378,166,"1,429 follower","['Philosophy', 'Nonfiction', 'Theory', 'Sociology', 'History', 'Politics', 'Economics']",99 review,961 (42%),811 (36%),369 (16%),71 (3%),29 (1%)
I Was So Mad,Mercer Mayer,4.23,"18,287 rating","January 1, 1983","Mercer Mayer’s Little Critter is having quite the grumpy day in this classic, funny, and heartwarming book.Here, the Critter family says 'No' to just about everything Little Critter wants to do. He can't keep frogs in the tub, or help paint the house. Finally, mad at the world, Little Critter announces he won't put up with it anymore! Thankfully, he latter reconsiders. Whether he’s cranky on the slide or stubborn in the sandbox, everyone will relate to this beloved story. A perfect way to teach children about their emotions and how to deal with them!
Mercer Mayer's
 
Little Critter
 stories, which address all the major issues of growing up, are perennial favorites of parents and children alike.",24,693,739 follower,"['Picture Books', 'Childrens', 'Fiction', 'Emotion', 'Animals', 'Kids', 'Fantasy']",265 review,"9,543 (52%)","4,569 (24%)","3,238 (17%)",667 (3%),270 (1%)
Cape Fear,John D. MacDonald,4.06,"13,997 rating","January 1, 1957","An insane criminal threatens to destroy a family, and the police are powerless to protect them.For fourteen years convicted rapist Max Cady nursed his hatred for Sam Bowden into an insane passion for revenge. He lived only for the day he would be free—free to track down and destroy the man who had put him behind bars.Murder was merciful compared to what Cady had in mind—and what Cady had in mind was Bowden's innocent and lovely teenaged daughter....""A powerful and frightening story."" —The New York Times",224,473,"1,218 follower","['Fiction', 'Thriller', 'Mystery', 'Horror', 'Crime', 'Classics', 'Suspense']",410 review,"5,276 (37%)","5,129 (36%)","2,870 (20%)",566 (4%),156 (1%)
The House Gun,Nadine Gordimer,3.55,"1,445 rating","January 1, 1997","How else can you defend yourself against losing your hi-fi equipment, your tv set and computer, your watch and rings a house gun, like a house cat; that is a fact of ordinary life in many cities of the world as we come to the end of the twentieth century, especially in south africa at this time the successful, respected executive director of an insurance company, harold, and his doctor wife, claudia, for whom violence could never be a means of solving personal conflict, are faced with something that could never happen to their son has committed murder what kind of loyalty do a mother and a father owe a son who has committed this unimaginable horror what have they done, in influencing his character; more ominously, where is it they have failed him the house gun is a passionate narrative of love being particularly complex between parents and their children it moves with the restless pace of living itself, from the intimate to the general condition; if it is a parable of present violence, it is also an affirmation of the will to human reconciliation that starts where it must, between individuals",294,302,854 follower,"['Fiction', 'South Africa', 'Africa', 'Literary Fiction', 'Literature', 'Nobel Prize', 'African Literature']",130 review,239 (16%),564 (39%),450 (31%),133 (9%),59 (4%)
Reindeer Moon,Elizabeth Marshall Thomas,3.96,"1,757 rating","January 1, 1987","A fictional account of the life of a Siberian tribe 20,000 years ago, from the author of ""Harmless People"" and ""Warrior Herdsmen"". It is both the story of a daily struggle for survival against starvation, cold and violence, and an evocation of spiritual journeys and primitive magic.",393,55,233 follower,"['Historical Fiction', 'Fiction', 'Fantasy', 'Prehistoric', 'Historical', 'Prehistory', 'Anthropology']",104 review,628 (35%),579 (32%),433 (24%),85 (4%),32 (1%)
Tennis Shoes Among the Nephites,Chris Heimerdinger,4.00,"16,834 rating","June 1, 1989","Jim Hawkins has a bad attitude. What's more, he enjoys having a bad attitude about everything--especially about church. Garth Plimpton is a fanatic. He's spent so much time studying the scriptures and thick books on archaeology that that he can't carry on a normal conversation with other kids. That's why they consider him a nerd. Through an unusual chain of events, these two opposites become fast friends. It all began when Garth told Jim a simple ""They really existed once, you know."" ""Who?"" Jim asked. ""Nephites,"" Garth replied. ""Every character in the Book of Mormon ate, slept, died, was buried . . ."" That statement, taken for granted before, would soon echo deeply in the two boys' minds--because they were on the trail of a chilling secret.",268,37,440 follower,"['Lds Fiction', 'Lds', 'Fantasy', 'Young Adult', 'Fiction', 'Religion', 'Historical Fiction']",841 review,"6,682 (39%)","5,479 (32%)","3,258 (19%)",780 (4%),635 (3%)
The Fox in the Attic,Richard Hughes,3.51,450 rating,"January 1, 1961","A tale of enormous suspense and growing horror, The Fox in the Attic is the widely acclaimed first part of Richard Hughes's monumental historical fiction, ""The Human Predicament."" Set in the early 1920s, the book centers on Augustine, a young man from an aristocratic Welsh family who has come of age in the aftermath of World War I. Unjustly suspected of having had a hand in the murder of a young girl, Augustine takes refuge in the remote castle of Bavarian relatives. There his hopeless love for his devout cousin Mitzi blinds him to the hate that will lead to the rise of German fascism. The book reaches a climax with a brilliant description of the Munich putsch and a disturbingly intimate portrait of Adolph Hitler.The Fox in the Attic , like its no less remarkable sequel The Wooden Shepherdess , offers a richly detailed, Tolstoyan overview of the modern world in upheaval. At once a novel of ideas and an exploration of the dark spaces of the heart, it is a book in which the past returns in all its original uncertainty and strangeness.",326,237,74 follower,"['Fiction', 'Historical Fiction', 'Germany', 'War', 'Classics', 'British Literature', 'Literary Fiction']",65 review,78 (17%),163 (36%),138 (30%),51 (11%),20 (4%)
Magic for Marigold,L.M. Montgomery,3.77,"4,150 rating","January 1, 1925","The eccentric Lesley family could not agree on what to name Lorraine's new baby girl even after four months. Lorraine secretly liked the name Marigold, but who would ever agree to such a fanciful name as that? When the baby falls ill and gentle Dr. M. Woodruff Richards saves her life, the family decides to name the child after the good doctor. But a girl named Woodruff? How fortunate that Dr. Richards's seldom-used first name turns out to be . . . Marigold! A child with such an unusual name is destined for adventure. It all begins the day Marigold meets a girl in a beautiful green dress who claims to be a real-life princess. . . .",274,"2,107",11.5k follower,"['Classics', 'Fiction', 'Young Adult', 'Historical Fiction', 'Childrens', 'Historical', 'Canada']",229 review,"1,053 (25%)","1,421 (34%)","1,381 (33%)",265 (6%),30 (<1%)
XPD,Len Deighton,3.76,"2,145 rating","March 9, 1981","June 11, 1940 – where is Winston Churchill?A private aircraft takes off from a small town in central France, while Adolf Hitler, the would-be conqueror of Europe, prepares for a clandestine meeting near the Belgian border.For more than forty years the events of this day have been Britain’s most closely guarded secret. Anyone who learns of them must die - with their file stamped:XPD - expedient demise",464,186,775 follower,"['Fiction', 'Thriller', 'Espionage', 'Historical Fiction', 'Spy Thriller', 'Mystery Thriller', 'Mystery']",70 review,497 (23%),819 (38%),667 (31%),134 (6%),28 (1%)
The Weaker Vessel,Antonia Fraser,3.92,"1,393 rating","January 1, 1984","Just how weak were the women of the Civil War era? What could they expect beyond marriage and childbirth in an age where infant and maternal mortality was frequent and contraception unknown? Did anyone marry for love? Could a woman divorce? What rights had the unmarried? What expectations the widows? An expert on the period, Antonia Fraser brings to life the many and various women she has encountered in her considerable research: governesses, milkmaids, fishwives, nuns, defenders of castles, courtesans, countesses, witches and widows. ",738,168,"1,371 follower","['History', 'Nonfiction', 'Feminism', 'Womens', '17th Century', 'Historical', 'British Literature']",95 review,393 (28%),593 (42%),325 (23%),60 (4%),22 (1%)
The Virtue of Selfishness: A New Concept of Egoism,Ayn Rand,3.55,"14,239 rating","January 1, 1961","Ayn Rand here sets forth the moral principles of Objectivism, the philosophy that holds human life--the life proper to a rational being--as the standard of moral values and regards altruism as incompatible with man's nature, with the creative requirements of his survival, and with a free society.",173,406,"9,366 follower","['Philosophy', 'Nonfiction', 'Politics', 'Psychology', 'Classics', 'Essays', 'Economics', 'Philosophy', 'Nonfiction', 'Politics', 'Psychology', 'Classics', 'Essays', 'Economics', 'Philosophy', 'Nonfiction', 'Politics', 'Psychology', 'Classics', 'Essays', 'Economics']",758 review,"4,255 (29%)","3,837 (26%)","3,184 (22%)","1,355 (9%)","1,608 (11%)"
The Twelve Kingdoms: Skies of Dawn,Fuyumi Ono,4.48,973 rating,"August 5, 1994","After a year of depending on her ministers to govern the kingdom of Kei, Yoko follows Keiki's advice and descends the mountain to live among her people, eager to learn how to be a better leader from the village's wise-man, Enho. However, when Enho is kidnapped, Yoko finds herself thrust into an all-out war between the kingdoms. Friendships and alliances are put to the test during the Battle of Wa Province. Can Yoko summon the strength to take up her responsibilities as Queen?",656,137,293 follower,"['Fantasy', 'Young Adult', 'Light Novel', 'Japanese Literature', 'Fiction', 'High Fantasy', 'Japan']",47 review,582 (59%),287 (29%),98 (10%),5 (<1%),1 (<1%)
Novel Without a Name,Dương Thu Hương,3.79,"1,309 rating","January 31, 1991","“Reminiscent of All Quiet on Western Front and The Red Badge of Courage . . . .  A breathtakingly original work.""— San Francisco ChronicleTwenty-eight-year-old Quan has been fighting for the Communist cause in North Vietnam for a decade. Filled with idealism and hope when he first left his village, he now spends his days and nights dodging stray bullets and bombs, foraging scraps of food to feed himself and his men. Quan seeks comfort in childhood memories as he tries to sort out his conflicting feelings of patriotism and disillusionment. Then, given the chance to return to his home, Quan undertakes a physical and mental journey that brings him face to face with figures from his past—his angry father, his childhood sweetheart, his boyhood friends now maimed or dead—and ultimately to the shattering reality that his innocence has been irretrievably lost in the wake of the war. In a voice both lyrical and stark, Duong Thu Huong, one of Vietnam’s most beloved writers, powerfully conveys the conflict that spiritually destroyed her generation.“If it is a crime to take an unflinching look at the reality of war and life under a totalitarian regime, and to do it with great art and mastery, then Duong Thu Huong, is gloriously guilty.”— The New York Times Book Review",289,26,163 follower,"['Fiction', 'War', 'Asia', 'Historical Fiction', 'Asian Literature', 'Literature', 'Novels', 'Fiction', 'War', 'Asia', 'Historical Fiction', 'Asian Literature', 'Literature', 'Novels', 'Fiction', 'War', 'Asia', 'Historical Fiction', 'Asian Literature', 'Literature', 'Novels', 'Fiction', 'War', 'Asia', 'Historical Fiction', 'Asian Literature', 'Literature', 'Novels', 'Fiction', 'War', 'Asia', 'Historical Fiction', 'Asian Literature', 'Literature', 'Novels']",142 review,308 (23%),542 (41%),354 (27%),90 (6%),15 (1%)
The Pirate Lord,Sabrina Jeffries,3.87,"4,240 rating","April 1, 1998","

A Splendid Opportunity

A shipload of women - theirs for the taking! Pirate captain Gideon Horn couldn't be more delighted. His men are tired of wandering the high seas and want to settle down with wives on the uncharted island paradise they've discovered. And the women are bound to be grateful to be rescued from the life of drudgery awaiting them in New South Wales . . . Lord, he's so clever!

A Splendid Passion

Married? To pirates? Sara Willis couldn't be more appalled. First she demands proper courting—at least a month. The darkly handsome pirate lord gives them two weeks. Then Sara insists the men vacate their huts for the women—Gideon demands her kisses in return. As the demands heat up, so do their passions—and soon Sara can't remember just why she's fighting the devilishly seductive captain so hard. . .",372,89,"4,601 follower","['Historical Romance', 'Romance', 'Historical', 'Pirates', 'Regency', 'Historical Fiction', 'Fiction']",311 review,"1,307 (30%)","1,504 (35%)","1,085 (25%)",261 (6%),83 (1%)
Trailerpark,Russell Banks,3.84,"1,078 rating","January 1, 1981","Dans ce roman en douze caravanes et treize épisodes, le grand rêve américain semble en avoir pris un coup dans l'aile. Russel Banks porte ici sur une Amérique populaire le regard à la fois tendre et caustique d'un amateur consommé de la tragi-comédie humaine : la dame du n°11 élève des cochons d'Inde en cachette tandis que la jeune fille du 7 téléphone à Dieu. L'occupant du 3 est un prosélyte de la contraception "" tantrique "", quant au vieux pêcheur, il se fait amicalement dépouiller par ses voisins du magot qu'il a enfin décroché à la loterie... C'est dans ce fourmillement de la vie immédiate et dans la chaleureuse relation romanesque qu'entretient Russell Banks avec ses "" voisins "" du New Hampshire que ce magnifique écrivain est sans doute le plus proche de lui-même.",401,103,911 follower,"['Fiction', 'Short Stories', 'Literary Fiction', 'Novels', 'American', 'School', 'Literature']",80 review,248 (23%),478 (44%),294 (27%),43 (3%),15 (1%)
Flykten,David Baldacci,3.94,"26,936 rating","January 1, 1997","Ett oansenligt hus vid slutet av en grusväg i ett skogsområde nära Washington har en hemlig funktion. Det rymmer avancerade säkerhetssystem och dolda miniatyrkameror och skall användas av FBI för samtal med ett av de mest betydelsefulla vittnen man haft, en ung kvinna som har en otrolig historia att berätta. Några få personer känner till mötet, för dem är ett våldsamt drama på väg att inledas. Till huset har kommit en privatdetektiv och en annan man, en lejd mördare, bevakar platsen. Kvinnan, Faith Lockhart, är där för att berätta allt hon vet om den framstående lobbyist hon arbetat åt och som försökt påverka amerikanska statens politik och samtidigt skaffat sig några ytterst blodtörstiga fiender. Men innan Faith hinner berätta sin historia avfyrar lönnmördaren sitt vapen och träffar fel offer. Nu måste Faith ge sig på flykt undan de farligaste personerna i Förenta Staterna, tillsammans med en man hon inte känner men måste lita på, Lee Adams. En skoningslös jakt utspelar sig när både FBI och en mördare letar efter Faith och Lee.",377,339,118k follower,"['Fiction', 'Thriller', 'Mystery', 'Suspense', 'Mystery Thriller', 'Crime', 'Action']","1,071 review","8,258 (30%)","10,746 (39%)","6,436 (23%)","1,176 (4%)",320 (1%)
Call of Cthulhu: Horror Roleplaying,Sandy Petersen,4.46,"8,463 rating","May 15, 1981","CALL OF CTHULHU is Chaosium's classic roleplaying game of Lovecraftian horror in which ordinary people are confronted by the terrifying and alien forces of the Cthulhu Mythos. CALL OF CTHULHU uses Chaosium's Basic Roleplaying System, easy to learn and quick to play. This bestseller has won dozens of game-industry awards and is a member of the Academy of Adventure Game Design Hall of Fame. In 2001 CALL OF CTHULHU celebrated its 20th anniversary. In 2003 CALL OF CTHULHU was voted the #1 Gothic/Horror RPG of all time by the Gaming Report.com community. CALL OF CTHULHU is well-supported by an ever-growing line of high quality game supplements. This is the softcover 6th edition of this classic horror game, completely compatible with all of previous editions and supplements for CALL OF CTHULHU. This is a complete roleplaying game in one volume. All you need to play is this book, some dice, imagination, and your friends.",320,112,60 follower,"['Role Playing Games', 'Gaming', 'Horror', 'Games', 'Fantasy', 'Reference', 'Fiction', 'Role Playing Games', 'Gaming', 'Horror', 'Games', 'Fantasy', 'Reference', 'Fiction', 'Role Playing Games', 'Gaming', 'Horror', 'Games', 'Fantasy', 'Reference', 'Fiction', 'Role Playing Games', 'Gaming', 'Horror', 'Games', 'Fantasy', 'Reference', 'Fiction', 'Role Playing Games', 'Gaming', 'Horror', 'Games', 'Fantasy', 'Reference', 'Fiction']",98 review,"5,107 (60%)","2,358 (27%)",845 (9%),101 (1%),52 (<1%)
