title,authors,average_rating,rating,date_of_publication,descriptions,total_pages,no_of_books_by_author,author_followers,genres,no_of_reviews,five_star_ratings,four_star_ratings,three_star_ratings,two_star_ratings,one_star_ratings
"The Sandman, Vol. 2: The Doll's House",Neil Gaiman,4.43,"105,266 rating","January 1, 1990","A being who has existed since the beginning of the universe, Dream of the Endless rules over the realm of dreams. In The Doll's House, after a decades-long imprisonment, the Sandman has returned to find that a few dreams and nightmares have escaped to reality. Looking to recapture his lost possessions, Morpheus ventures to the human plane only to learn that a woman named Rose Walker has inadvertently become a dream vortex and threatens to rip apart his world. Now as Morpheus takes on the last escaped nightmare at a serial killers convention, the Lord of Dreams must mercilessly murder Rose or risk the destruction of his entire kingdom.Collecting issues #9-16, this new edition of The Doll's House features the improved production values and coloring from the Absolute Edition.",232,"2,138",313k follower,"['Graphic Novels', 'Comics', 'Fantasy', 'Fiction', 'Horror', 'Graphic Novels Comics', 'Comic Book', 'Graphic Novels', 'Comics', 'Fantasy', 'Fiction', 'Horror', 'Graphic Novels Comics', 'Comic Book', 'Graphic Novels', 'Comics', 'Fantasy', 'Fiction', 'Horror', 'Graphic Novels Comics', 'Comic Book', 'Graphic Novels', 'Comics', 'Fantasy', 'Fiction', 'Horror', 'Graphic Novels Comics', 'Comic Book', 'Graphic Novels', 'Comics', 'Fantasy', 'Fiction', 'Horror', 'Graphic Novels Comics', 'Comic Book']","4,042 review","59,104 (56%)","34,832 (33%)","9,674 (9%)","1,278 (1%)",378 (<1%)
The Nine Tailors,Dorothy L. Sayers,4.03,"19,748 rating","January 1, 1934","When a disfigured corpse is discovered in a country parish, the local rector pleads with Lord Peter to take on what will become one of his most brilliant and complicated cases.",397,729,"2,629 follower","['Mystery', 'Fiction', 'Crime', 'Classics', 'Mystery Thriller', 'British Literature', 'Detective']","1,596 review","7,206 (36%)","7,457 (37%)","3,853 (19%)",887 (4%),345 (1%)
Anne of Ingleside,L.M. Montgomery,4.03,"64,280 rating","January 1, 1939","This is an alternate cover edition for ISBN 9780553213157Anne is the mother of five, with never a dull moment in her lively home. And now, with a new baby on the way and insufferable Aunt Mary Maria visiting—and wearing out her welcome—Anne's life is full to bursting.Still, Mrs. Doctor can't think of any place she'd rather be than her own beloved Ingleside. Until the day she begins to worry that her adored Gilbert doesn't love her anymore. How could that be? She may be a little older, but she's still the same irrepressible, irreplaceable redhead—the wonderful Anne of Green Gables, all grown up. She's ready to make her cherished husband fall in love with her all over again!",274,"2,111",11.5k follower,"['Classics', 'Fiction', 'Young Adult', 'Historical Fiction', 'Childrens', 'Romance', 'Canada']","2,672 review","23,898 (37%)","22,622 (35%)","14,300 (22%)","2,911 (4%)",549 (<1%)
The Apprenticeship of Duddy Kravitz,Mordecai Richler,3.73,"8,883 rating","January 1, 1959","From Mordecai Richler, one of our greatest satirists, comes one of literature's most delightful characters, Duddy Kravitz -- in a novel that belongs in the pantheon of seminal twentieth century books.  Duddy -- the third generation of a Jewish immigrant family in Montreal -- is combative, amoral, scheming, a liar, and totally hilarious. From his street days tormenting teachers at the Jewish academy to his time hustling four jobs at once in a grand plan to ""be somebody,"" Duddy learns about living -- and the lesson is an outrageous roller-coaster ride through the human comedy. As Richler turns his blistering commentary on love, money, and politics, The Apprenticeship Of Duddy Kravitz becomes a lesson for us all...in laughter and in life.",384,84,332 follower,"['Fiction', 'Canada', 'Classics', 'Canadian Literature', 'Literature', 'Jewish', 'School']",347 review,"1,926 (21%)","3,682 (41%)","2,413 (27%)",634 (7%),228 (2%)
The Feynman Lectures on Physics,Richard P. Feynman,4.61,"7,738 rating","January 1, 1964","The revised edition of Feynman's legendary lectures includes extensive corrections and updates collated by Feynman and his colleagues. A new foreword by Kip Thorne, the current Richard Feynman Professor of Theoretical Physics at Caltech, discusses the relevance of the new edition to today's readers. This boxed set also includes Feynman's new Tips on Physics—the four previously unpublished lectures that Feynman gave to students preparing for exams at the end of his course. Thus, this 4-volume set is the complete and definitive edition of The Feynman Lectures on Physics. Packaged in a specially designed slipcase, this 4-volume set provides the ultimate legacy of Feynman's extraordinary contribution to students, teachers, researches, and lay readers around the world.",1552,275,"5,898 follower","['Science', 'Physics', 'Nonfiction', 'Textbooks', 'Reference', 'Mathematics', 'Technical', 'Science', 'Physics', 'Nonfiction', 'Textbooks', 'Reference', 'Mathematics', 'Technical', 'Science', 'Physics', 'Nonfiction', 'Textbooks', 'Reference', 'Mathematics', 'Technical', 'Science', 'Physics', 'Nonfiction', 'Textbooks', 'Reference', 'Mathematics', 'Technical', 'Science', 'Physics', 'Nonfiction', 'Textbooks', 'Reference', 'Mathematics', 'Technical']",167 review,"5,532 (71%)","1,581 (20%)",489 (6%),87 (1%),49 (<1%)
The Complete Poems,Anne Sexton,4.28,"16,036 rating","September 30, 1981","From the joy and anguish of her own experience, Sexton fashioned poems that told truths about the inner lives of men and women. This book comprises Sexton's ten volumes of verse, including the Pulitzer Prize-winner Live or Die, as well as seven poems from her last years.",622,149,"2,236 follower","['Poetry', 'Classics', 'Fiction', 'Feminism', '20th Century', 'American', 'Womens']",455 review,"8,118 (50%)","5,171 (32%)","2,129 (13%)",435 (2%),183 (1%)
The Cat in the Hat Comes Back,Dr. Seuss,3.90,"31,024 rating","September 12, 1958","The Cat in the Hat returns for more out-of-control fun in this wintry Beginner Book by Dr. Seuss. It’s a snowy day and Dick and Sally are stuck shovelling . . . until the Cat in the Hat arrives to liven things up (to say the least!). Featuring the Cat’s helpers Little Cat A, Little Cat B, and so on through the alphabet, and ending with a gigantic Voom, 'The Cat in the Hat Comes Back' is a riotous, fun-filled follow-up to Dr. Seuss’s classic 'The Cat in the Hat.'.",63,848,17.6k follower,"['Childrens', 'Picture Books', 'Fiction', 'Classics', 'Poetry', 'Fantasy', 'Humor']",761 review,"11,611 (37%)","8,529 (27%)","7,875 (25%)","2,276 (7%)",733 (2%)
The Longest Day,Cornelius Ryan,4.33,"24,267 rating","January 1, 1959","The unparalleled work of history that recreates the battle that changed World War II -- now in a new edition for the 50th anniversary of D-Day.Newly in print for the first time in years, this is the classic story of the invasion of Normandy, and a book that endures as a masterpiece of living history. A compelling tale of courage and heroism, glow and tragedy, The Longest Day painstakingly recreates the fateful hours that preceded and followed the massive invasion of Normandy to retell the story of an epic battle that would turn the tide against world fascism and free Europe from the grip of Nazi Germany.For this new edition of The Longest Day, the original photographs used in the first 1959 edition have been reassembled and painstakingly reproduced, and the text has been freshly reset. Here is a book that is a must for any follower of history, as well as for anyone who wants to better understand how free nations prevailed at a time when darkness enshrouded the earth.",350,34,254 follower,"['History', 'Nonfiction', 'World War II', 'War', 'Military Fiction', 'Military History', 'Historical', 'History', 'Nonfiction', 'World War II', 'War', 'Military Fiction', 'Military History', 'Historical', 'History', 'Nonfiction', 'World War II', 'War', 'Military Fiction', 'Military History', 'Historical']",781 review,"12,281 (50%)","8,565 (35%)","2,728 (11%)",450 (1%),243 (1%)
"The Sandman, Vol. 1: Preludes & Nocturnes",Neil Gaiman,4.25,"263,227 rating","January 1, 1988","New York Times best-selling author Neil Gaiman's transcendent series SANDMAN is often hailed as the definitive Vertigo title and one of the finest achievements in graphic storytelling. Gaiman created an unforgettable tale of the forces that exist beyond life and death by weaving ancient mythology, folklore and fairy tales with his own distinct narrative vision.In PRELUDES & NOCTURNES, an occultist attempting to capture Death to bargain for eternal life traps her younger brother Dream instead. After his 70 year imprisonment and eventual escape, Dream, also known as Morpheus, goes on a quest for his lost objects of power. On his arduous journey, Morpheus encounters Lucifer, John Constantine, and an all-powerful madman.This book also includes the story ""The Sound of Her Wings,"" which introduces us to the pragmatic and perky goth girl Death.Includes issues 1-8 of the original series.",240,"2,138",313k follower,"['Graphic Novels', 'Comics', 'Fantasy', 'Fiction', 'Horror', 'Graphic Novels Comics', 'Comic Book', 'Graphic Novels', 'Comics', 'Fantasy', 'Fiction', 'Horror', 'Graphic Novels Comics', 'Comic Book', 'Graphic Novels', 'Comics', 'Fantasy', 'Fiction', 'Horror', 'Graphic Novels Comics', 'Comic Book', 'Graphic Novels', 'Comics', 'Fantasy', 'Fiction', 'Horror', 'Graphic Novels Comics', 'Comic Book', 'Graphic Novels', 'Comics', 'Fantasy', 'Fiction', 'Horror', 'Graphic Novels Comics', 'Comic Book']","9,417 review","139,793 (53%)","75,165 (28%)","31,019 (11%)","9,028 (3%)","8,222 (3%)"
Gathering Blue,Lois Lowry,3.82,"190,599 rating","September 1, 2000","In her strongest work to date, Lois Lowry once again creates a mysterious but plausible future world. It is a society ruled by savagery and deceit that shuns and discards the weak. Left orphaned and physically flawed, young Kira faces a frightening, uncertain future. Blessed with an almost magical talent that keeps her alive, she struggles with ever broadening responsibilities in her quest for truth, discovering things that will change her life forever.As she did in The Giver, Lowry challenges readers to imagine what our world could become, and what will be considered valuable. Every reader will be taken by Kira's plight and will long ponder her haunting world and the hope for the future.",240,168,21.1k follower,"['Young Adult', 'Dystopia', 'Fiction', 'Fantasy', 'Science Fiction', 'Middle Grade', 'Classics']","13,135 review","50,087 (26%)","73,626 (38%)","52,614 (27%)","11,696 (6%)","2,576 (1%)"
It Had to Be You,Susan Elizabeth Phillips,4.01,"66,741 rating","January 1, 1994","What if a woman who knows nothing about sports inherits a professional football team? The Windy City definitely isn't ready for Phoebe Somerville, the outrageous York knockout who’s taking over their home town team. And Phoebe is definitely not prepared for the Stars' head coach Dan Calebow, a sexist jock taskmaster with a one-track mind. This is the book that began it all. The Chicago Stars are about to take the field... and they’re not the only ones playing for keeps.",376,52,15k follower,"['Romance', 'Contemporary Romance', 'Contemporary', 'Sports', 'Sports Romance', 'Chick Lit', 'Fiction']","2,887 review","25,901 (38%)","22,838 (34%)","12,723 (19%)","3,279 (4%)","2,000 (2%)"
Voss,Patrick White,3.78,"3,231 rating","August 10, 1957","WITH AN INTRODUCTION BY ROBERT MACFARLANESet in nineteenth-century Australia, Voss is the story of the secret passion between an explorer and a naïve young woman. Although they have met only on a few occasions, Voss and Laura are joined by overwhelming, obsessive feelings for each other. Voss sets out to cross the continent, and as hardships, mutiny and betrayal whittle away his power to endure and to lead, his attachment to Laura gradually increases. Laura, waiting in Sydney, moves through the months of separation as if they were a dream and Voss the only reality.",448,58,320 follower,"['Fiction', 'Australia', 'Classics', 'Historical Fiction', 'Nobel Prize', 'Novels', 'Literature']",328 review,964 (29%),"1,138 (35%)",709 (21%),280 (8%),140 (4%)
Orlando,Virginia Woolf,3.87,"91,633 rating","January 1, 1928","Virginia Woolf's Orlando 'The longest and most charming love letter in literature', playfully constructs the figure of Orlando as the fictional embodiment of Woolf's close friend and lover, Vita Sackville-West. Spanning three centuries, the novel opens as Orlando, a young nobleman in Elizabeth's England, awaits a visit from the Queen and traces his experience with first love as England under James I lies locked in the embrace of the Great Frost. At the midpoint of the novel, Orlando, now an ambassador in Constantinople, awakes to find that he is now a woman, and the novel indulges in farce and irony to consider the roles of women in the 18th and 19th centuries. As the novel ends in 1928, a year consonant with full suffrage for women. Orlando, now a wife and mother, stands poised at the brink of a future that holds new hope and promise for women.",336,"1,373",24.1k follower,"['Classics', 'Fiction', 'Historical Fiction', 'Queer', 'LGBT', 'Fantasy', 'Feminism', 'Classics', 'Fiction', 'Historical Fiction', 'Queer', 'LGBT', 'Fantasy', 'Feminism', 'Classics', 'Fiction', 'Historical Fiction', 'Queer', 'LGBT', 'Fantasy', 'Feminism', 'Classics', 'Fiction', 'Historical Fiction', 'Queer', 'LGBT', 'Fantasy', 'Feminism', 'Classics', 'Fiction', 'Historical Fiction', 'Queer', 'LGBT', 'Fantasy', 'Feminism']","7,755 review","29,236 (31%)","32,493 (35%)","21,064 (22%)","6,577 (7%)","2,263 (2%)"
City of Glass,Paul Auster,3.77,"19,748 rating","January 1, 1985","Nominated for an Edgar award for best mystery of the year, City of Glass inaugurates an intriguing New York Trilogy of novels that The Washington Post Book World has classified as ""post-existentialist private eye... It's as if Kafka has gotten hooked on the gumshoe game and penned his own ever-spiraling version."" As a result of a strange phone call in the middle of the night, Quinn, a writer of detective stories, becomes enmeshed in a case more puzzling than any he might have written. Written with hallucinatory clarity, City of Glass combines dark humor with Hitchcock-like suspense. Ghosts and The Locked Room are the next two brilliant installments in Paul Auster's The New York Trilogy.",203,249,10.9k follower,"['Fiction', 'Mystery', 'Literature', 'American', 'Novels', 'Contemporary', 'Classics']","1,360 review","4,950 (25%)","7,768 (39%)","5,018 (25%)","1,580 (8%)",432 (2%)
"Rich Dad, Poor Dad",Robert T. Kiyosaki,4.12,"612,304 rating","April 8, 1997","Rich Dad Poor Dad is Robert's story of growing up with two dads — his real father and the father of his best friend, his ""rich dad"" — and the ways in which both men shaped his thoughts about money and investing. The book explodes the myth that you need to earn a high income to be rich and explains the difference between working for money and having your money work for you.",195,358,"8,138 follower","['Business', 'Finance', 'Nonfiction', 'Self Help', 'Money', 'Personal Finance', 'Personal Development']","23,427 review","281,077 (45%)","186,209 (30%)","97,311 (15%)","30,819 (5%)","16,888 (2%)"
Cry to Heaven,Anne Rice,3.88,"20,895 rating","January 1, 1982","Anne Rice brings to life the exquisite and otherworldly society of the eighteenth-century castrati, the delicate and alluring male sopranos whose graceful bodies and glorious voices brought them the adulation of the royal courts and grand opera houses of Europe, men who lived as idols, concealing their pain as they were adored as angels, yet shunned as half-men.As we are drawn into their dark and luminous story, as the crowds of Venetians, Neopolitans, and Romans, noblemen and peasants, musicians, prelates, princes, saints, and intriguers swirl around them, Anne Rice brings us into the sweep of eighteenth-century Italian life, into the decadence beneath the shimmering surface of Venice, the wild frivolity of Naples, and the magnetic terror of its shadow, Vesuvius.",566,434,25.3k follower,"['Fiction', 'Historical Fiction', 'Historical', 'Horror', 'Fantasy', 'Romance', 'LGBT']",769 review,"7,156 (34%)","6,592 (31%)","5,036 (24%)","1,605 (7%)",506 (2%)
The Radetzky March,Joseph Roth,4.10,"11,796 rating","January 1, 1932","The Radetzky March charts the history of the Trotta family through three generations spanning the rise and fall of the Austro-Hungarian Empire. Through the Battle of Solferino, to the entombment of the last Hapsburg emperor, Roth's intelligent compassionate narrative illuminates the crumbling of a way of life.",363,391,662 follower,"['Fiction', 'Historical Fiction', 'Classics', 'German Literature', 'Literature', 'Novels', '20th Century', 'Fiction', 'Historical Fiction', 'Classics', 'German Literature', 'Literature', 'Novels', '20th Century', 'Fiction', 'Historical Fiction', 'Classics', 'German Literature', 'Literature', 'Novels', '20th Century']","1,212 review","4,641 (39%)","4,454 (37%)","2,074 (17%)",479 (4%),148 (1%)
The Wild Palms,William Faulkner,3.87,"4,896 rating","January 1, 1939","In this feverishly beautiful novel— subsequently titled If I Forget Thee, Jerusalem and now published in the authoritative Library of America text—William Faulkner interweaves two narratives, each wholly absorbing in its own right, each subtly illuminating the other. In New Orleans in 1937, a man and a woman embark on a headlong flight into the wilderness of illicit passion, fleeing her husband and the temptations of respectability. In Mississippi ten years earlier, a convict sets forth across a flooded river, risking his own chance at freedom to rescue a pregnant woman. From these separate stories Faulkner composes a symphony of deliverance and damnation, survival and self-sacrifice, a novel in which elemental danger is juxtaposed wiht fatal injuries of the spirit. The Wild Palms is grandly inventive, heart-stopping in its prose, and suffused on every page with the physical presence of the country that Faulkner made his own.",304,927,"9,237 follower","['Fiction', 'Classics', 'American', 'Novels', 'Literature', 'Nobel Prize', 'Southern', 'Fiction', 'Classics', 'American', 'Novels', 'Literature', 'Nobel Prize', 'Southern', 'Fiction', 'Classics', 'American', 'Novels', 'Literature', 'Nobel Prize', 'Southern']",419 review,"1,433 (29%)","1,890 (38%)","1,158 (23%)",326 (6%),89 (1%)
Space Trilogy: Out of the Silent Planet / Perelandra / That Hideous Strength,C.S. Lewis,4.17,"10,903 rating","January 1, 1938","The Cosmic Trilogy relates the interplanetary travels of Ransom, C.S. Lewis's ill-informed and terrified victim who leaves Earth much against his will and who, in the first book of the trilogy, Out of the Silent Planet, published by the Bodley Head in 1938, encounters the imaginary and delightful world of Macalandra. In the second book, Perelandra (1943), Ransom is transported to a world of sweet smells and delicious tastes, a new Garden of Eden in which is enacted, with a difference, the story of Temptation. That Hideous Strength (1945) completes the trilogy and finds Dr Ransom returned from his travels in space and living in an English university town - where the Senior Common Room is given a mysterious depth, a more than earthly dimension which such things, in the author's view, always have in life.C.S. Lewis believed that popular science was the new mythology of his age, and in The Cosmic Trilogy he ransacks the uncharted territory of space and makes that mythology the medium of his spiritual imagination.",764,"1,291",42.2k follower,"['Fiction', 'Science Fiction', 'Fantasy', 'Classics', 'Christian', 'Christian Fiction', 'Science Fiction Fantasy']",535 review,"5,043 (46%)","3,467 (31%)","1,765 (16%)",470 (4%),158 (1%)
It Can't Happen Here,Sinclair Lewis,3.78,"19,371 rating","October 1, 1935","The only one of Sinclair Lewis's later novels to match the power of Main Street, Babbitt, and Arrowsmith, It Can't Happen Here is a cautionary tale about the fragility of democracy, an alarming, eerily timeless look at how fascism could take hold in America. Written during the Great Depression when America was largely oblivious to Hitler's aggression, it juxtaposes sharp political satire with the chillingly realistic rise of a President who becomes a dictator to ""save the nation."" Now finally back in print, It Can't Happen Here remains uniquely important, a shockingly prescient novel that's as fresh and contemporary as today's news.",400,400,955 follower,"['Fiction', 'Classics', 'Politics', 'Dystopia', 'Historical Fiction', 'Literature', 'Science Fiction']","3,104 review","4,536 (23%)","8,030 (41%)","5,160 (26%)","1,276 (6%)",369 (1%)
Fever 1793,Laurie Halse Anderson,3.93,"124,515 rating","September 1, 2000","It's late summer 1793, and the streets of Philadelphia are abuzz with mosquitoes and rumors of fever. Down near the docks, many have taken ill, and the fatalities are mounting. Now they include Polly, the serving girl at the Cook Coffeehouse. But fourteen-year-old Mattie Cook doesn't get a moment to mourn the passing of her childhood playmate. New customers have overrun her family's coffee shop, located far from the mosquito-infested river, and Mattie's concerns of fever are all but overshadowed by dreams of growing her family's small business into a thriving enterprise. But when the fever begins to strike closer to home, Mattie's struggle to build a new life must give way to a new fight—the fight to stay alive.",252,84,16.9k follower,"['Historical Fiction', 'Young Adult', 'Fiction', 'Historical', 'Middle Grade', 'Childrens', 'School']","7,390 review","39,209 (31%)","47,697 (38%)","29,206 (23%)","6,425 (5%)","1,978 (1%)"
Shanna,Kathleen E. Woodiwiss,4.15,"12,267 rating","April 1, 1977","an alternate cover edition can be found hereBehind the foreboding walls of Newgate Prison, a pact is sealed in secret -- as a dashing and doomed criminal consents to wed a beautiful heiress . . . in return for one night of unparalleled pleasure.In the fading echoes of hollow wedding vows, a promise is broken -- as a sensuous free-spirit flees to a lush Caribbean paradise, abandoning the handsome stranger she married to the gallows. But Ruark Beauchamp's destiny is now eternally intertwined with his exquisite, tempestuous Shanna's. And no iron ever forged can imprison his magnificent passion . . . and no hangman's noose will deny him the ecstasy that is rightfully his.",672,51,"1,759 follower","['Romance', 'Historical Romance', 'Historical', 'Fiction', 'Historical Fiction', 'Adult', 'Pirates']",822 review,"5,920 (48%)","3,459 (28%)","1,965 (16%)",624 (5%),299 (2%)
Open Secrets: Stories,Alice Munro,4.04,"6,085 rating","January 1, 1994","In these eight tales, Munro evokes the devastating power of old love suddenly recollected. She tells of vanished schoolgirls and indentured frontier brides and an eccentric recluse who, in the course of one surpassingly odd dinner party, inadvertently lands herself a wealthy suitor from exotic Australia. And Munro shows us how one woman's romantic tale of capture and escape in the high Balkans may end up inspiring another woman who is fleeing a husband and lover in present-day Canada.Carried away --A real life --The Albanian virgin --Open secrets --The Jack Randa hotel --A wilderness station --Spaceships have landed --Vandals",294,209,"5,920 follower","['Short Stories', 'Fiction', 'Canada', 'Contemporary', 'Literary Fiction', 'Nobel Prize', 'Literature']",528 review,"2,196 (36%)","2,398 (39%)","1,116 (18%)",304 (4%),71 (1%)
The Rings of Saturn,W.G. Sebald,4.23,"14,835 rating","January 1, 1995","The Rings of Saturn — with its curious archive of photographs — records a walking tour along the east coast of England. A few of the things which cross the path and mind of its narrator (who both is and is not Sebald) are lonely eccentrics, Sir Thomas Browne's skull, a matchstick model of the Temple of Jerusalem, recession-hit seaside towns, wooded hills, Joseph Conrad, Rembrandt's ""Anatomy Lesson,"" the natural history of the herring, the massive bombings of WWII, the dowager empress Tzu Hsi, and the silk industry in Norwich.",296,52,"1,535 follower","['Fiction', 'Travel', 'German Literature', 'Literature', 'Germany', 'Novels', 'Classics', 'Fiction', 'Travel', 'German Literature', 'Literature', 'Germany', 'Novels', 'Classics', 'Fiction', 'Travel', 'German Literature', 'Literature', 'Germany', 'Novels', 'Classics']","1,661 review","7,290 (49%)","4,719 (31%)","2,038 (13%)",567 (3%),221 (1%)
Romancero gitano,Federico García Lorca,4.20,"10,803 rating","January 1, 1928","El ""Romancero gitano"" difunde el nombre de su autor por todo el ámbito de la literatura de nuestra lengua. Aclara el poeta que ""aunque se llama gitano, es el poema de Andalucía porque el gitano es lo más elevado, lo más profundo, lo más aristocrático, lo más representativo de su modo y el que guarda el ascua, la sangre y el alfabeto de la verdad andaluza y universal"".",82,"1,261","2,603 follower","['Poetry', 'Spanish Literature', 'Spain', 'Fiction', 'Classics', 'Literature', '20th Century']",643 review,"5,124 (47%)","3,432 (31%)","1,702 (15%)",412 (3%),133 (1%)
