title,authors,average_rating,rating,date_of_publication,descriptions,total_pages,genres,author_followers,no_of_reviews,no_of_books_by_author,one_star_ratings,two_star_ratings,three_star_ratings,four_star_ratings,five_star_ratings
"Thank You, Jeeves",P.G. Wodehouse,4.18,"18,101 rating","January 1, 1933","Bertram Wooster's interminable banjolele playing has driven Jeeves, his otherwise steadfast gentleman's gentleman, to give notice. The foppish aristocrat cannot survive for long without his Shakespeare-quoting and problem-solving valet, however, and after a narrowly escaped forced marriage, a cottage fire, and a great butter theft, the celebrated literary odd couple are happy to return to the way things were.",230,"['Fiction', 'Humor', 'Classics', 'Comedy', 'British Literature', 'Audiobook', '20th Century']","6,441 follower","1,408 review","1,129",193 (1%),480 (2%),"2,778 (15%)","7,054 (38%)","7,596 (41%)"
Mrs. 'Arris Goes to Paris,Paul Gallico,3.93,"4,518 rating","January 1, 1958","Mrs Harris is a salt-of-the-earth London charlady who cheerfully cleans the houses of the rich. One day, when tidying Lady Dant's wardrobe, she comes across the most beautiful thing she has ever seen in her life - a Dior dress. In all the years of her drab and humble existence, she's never seen anything as magical as the dress before her and she's never wanted anything as much before. Determined to make her dream come true, Mrs Harris scrimps, saves and slaves away until one day, after three long, uncomplaining years, she finally has enough money to go to Paris. When she arrives at the House of Dior, Mrs Harris has little idea of how her life is about to be turned upside down and how many other lives she will transform forever. Always kind, always cheery and always winsome, the indomitable Mrs Harris takes Paris by storm and learns one of life's greatest lessons along the way. This treasure from the 1950s introduces the irrepressible Mrs Harris, part charlady, part fairy-godmother, whose adventures take her from her humble London roots to the heights of glamour.",157,"['Fiction', 'Classics', 'France', 'Humor', 'Historical Fiction', 'British Literature', 'Romance', 'Fiction', 'Classics', 'France', 'Humor', 'Historical Fiction', 'British Literature', 'Romance', 'Fiction', 'Classics', 'France', 'Humor', 'Historical Fiction', 'British Literature', 'Romance']",286 follower,705 review,186,52 (1%),193 (4%),"1,050 (23%)","1,934 (42%)","1,289 (28%)"
Black Girl Lost,Donald Goines,4.32,"2,607 rating","January 1, 1973","In this shocking novel of a young girl alone on the streets, Goines delves into yet another facet of the ghetto experience-the dark, despair-ridden world of a black girl s soul! Sandra took to the streets when she was eight years old and tried to fight off the hunger pangs by shoplifting and moving into the profits of drug pushing. The she met Chink and discovered love and affection...and rape and murder!",208,"['Fiction', 'African American', 'Urban', 'Audiobook', 'Classics', 'Cultural', 'African American Literature']",681 follower,248 review,37,32 (1%),65 (2%),355 (13%),740 (28%),"1,415 (54%)"
Can I Get There by Candlelight?,Jean Slaughter Doty,4.24,500 rating,"January 1, 1980","Lonely and unhappy after her family moves to the East and with only her pony, Candlelight, for company, Gail meets Hilary who is later killed in a pony-cart accident",111,"['Time Travel', 'Horses', 'Childrens', 'Young Adult', 'Middle Grade', 'Fantasy', 'Fiction', 'Time Travel', 'Horses', 'Childrens', 'Young Adult', 'Middle Grade', 'Fantasy', 'Fiction', 'Time Travel', 'Horses', 'Childrens', 'Young Adult', 'Middle Grade', 'Fantasy', 'Fiction']",23 follower,59 review,20,4 (<1%),16 (3%),79 (15%),157 (31%),244 (48%)
Kein Keks für Kobolde,Cornelia Funke,4.12,400 rating,"January 1, 1989","Die kleinen Kobolde Neunauge, Feuerkopf und Siebenpunkt sind hungrig, denn der Winter ist früher gekommen als erwartet. Am liebsten würden sie sich ja von Ravioli, Äpfeln und Keksen ernähren, aber damit sieht es schlecht aus. An Vorräte haben sie nämlich nicht gedacht. So müssen sie sich in Abenteuer stürzen, um nicht zu verhungern. Als sie sich dann aber mit dem »weißen Kobold« anlegen, wird die Lage richtig brenzlig.",234,"['Fantasy', 'Childrens', 'German Literature', 'Middle Grade']",13k follower,23 review,360,3 (<1%),8 (2%),79 (19%),157 (39%),153 (38%)
Wanderer,Sterling Hayden,4.22,638 rating,"January 1, 1963","Since its publication in 1963, Sterling Hayden's autobiography, Wanderer, has been surrounded by controversy. The author was at the peak of his earning power as a movie star when he suddenly quit. He walked out on Hollywood, walked out of a shattered marriage, defied the courts, broke as an outlaw, set sail with his four children in the schooner Wanderer--bound for the South Seas. His attempt to escape launched his autobiography. It is the candid, sometimes painfully revealing confession of a man who scrutinized his every self-defeat and self-betrayal in the unblinking light of conscience.",452,"['Nonfiction', 'Biography', 'Memoir', 'Travel', 'Film', 'Adventure', 'Classics']",23 follower,73 review,10,9 (1%),25 (3%),81 (12%),223 (34%),300 (47%)
Lucky,Alice Sebold,3.77,"99,904 rating","August 4, 1999","In a memoir hailed for its searing candor and wit, Alice Sebold reveals how her life was utterly transformed when, as an eighteen-year-old college freshman, she was brutally raped and beaten in a park near campus. What propels this chronicle of her recovery is Sebold's indomitable spirit - as she struggles for understanding (""After telling the hard facts to anyone, from lover to friend, I have changed in their eyes""); as her dazed family and friends sometimes bungle their efforts to provide comfort and support; and as, ultimately, she triumphs, managing through grit and coincidence to help secure her attacker's arrest and conviction. In a narrative by turns disturbing, thrilling, and inspiring, Alice Sebold illuminates the experience of trauma victims even as she imparts wisdom profoundly hard-won: ""You save yourself or you remain unsaved.""",243,"['Nonfiction', 'Memoir', 'Biography', 'True Crime', 'Biography Memoir', 'Autobiography', 'Adult']","4,854 follower","4,661 review",29,"2,479 (2%)","6,751 (6%)","27,074 (27%)","38,222 (38%)","25,378 (25%)"
Μικρό βιβλίο για μεγάλα όνειρα,Tasos Leivaditis,4.54,271 rating,"January 1, 1987",,76,"['Poetry', 'Poetry', 'Poetry']",69 follower,19 review,42,2 (<1%),2 (<1%),16 (5%),80 (29%),171 (63%)
The Transitional Program for Socialist Revolution,Leon Trotsky,4.21,401 rating,"May 1, 1938","Contains discussions between leaders of the U.S Socialist Workers Party and exiled revolutionary Leon Trotsky in 1938. The product of these discussions, a program of immediate, democratic and transitional demands, was adopted by the SWP later that year. This program for socialist revolution, remains an important tool for communist workers today.",223,"['Politics', 'Nonfiction', 'Theory', 'Philosophy', 'History', 'Classics', 'Political Science']",651 follower,28 review,964,12 (2%),25 (6%),42 (10%),109 (27%),213 (53%)
Amazing ghosts & other mysteries,Peter Eldin,3.83,6 rating,"January 1, 1988","Recounts ghost stories both funny and frightening, about poltergeists, animal ghosts, and phantom skulls, and also tales of unexplained and mysterious phenomena, miracles, appearances, and disappearances.",128,"['Ghost Stories', 'Ghost Stories', 'Ghost Stories']",2 follower,2 review,148,0 (0%),1 (16%),1 (16%),2 (33%),2 (33%)
Fantastic Voyage,Isaac Asimov,3.91,"27,777 rating","October 1, 1966","Four men and a woman are reduced to a microscopic fraction of their original size, sent in a miniaturized atomic sub through a dying man's carotid artery to destroy a blood clot in his brain. If they fail, the entire world will be doomed.",186,"['Science Fiction', 'Fiction', 'Classics', 'Fantasy', 'Science Fiction Fantasy', 'Adventure', 'Speculative Fiction']",24.8k follower,586 review,"4,420",299 (1%),"1,283 (4%)","7,374 (26%)","10,589 (38%)","8,232 (29%)"
The Tryst,Grace Livingston Hill,3.93,467 rating,"January 1, 1921","When young Patricia Merrill overhears a terrible conversation, she knows she must run away. She decides to go to New York City — the perfect place to hide and forget her newly discovered sorrows. Once there, she assumes a false name and finds a job as the companion to an elderly, wealthy woman. Safe at last, Patricia settles down to her new life.",478,"['Christian Fiction', 'Romance', 'Christian', 'Fiction', 'Historical Fiction', 'Christian Romance', 'Inspirational']",473 follower,32 review,427,5 (1%),33 (7%),130 (27%),121 (25%),178 (38%)
Granny Dan,Danielle Steel,3.97,"8,946 rating","January 1, 1999","In my eyes she had always been old, always been mine, always been Granny Dan. But in another time, another place, there had been dancing, people, laughter, love. . . . She had had another life before she came to us, long before she came to me. . . .She was the cherished grandmother who sang songs in Russian, loved to roller-skate, and spoke little of her past. But when Granny Dan died, all that remained was a box wrapped in brown paper, tied with string. Inside, an old pair of satin toe shoes, a gold locket, and a stack of letters tied with ribbon. It was her legacy, her secret past, waiting to be discovered by the granddaughter who loved her but never really knew her. It was a story waiting to be told. . . .The year was 1902. A new century was dawning as a motherless young girl arrived at a ballet school in St. Petersburg, Russia, at the age of seven. By age seventeen, Danina Petroskova had become a great ballerina, a favorite of the Czar and Czarina, who welcomed her into the heart of the Imperial family. But events both near and far away shook the ground upon which she danced. A war, an extraordinary man, and a devastating illness altered the course of her life. And when revolution shattered Russia, Danina Petroskova was forced to make a heartbreaking choice--as the world around her was about to change forever.Granny Dan is about the magic of history. In it, Danielle Steel reminds us how little we know of those who came before us--and how, if we could only glimpse into their early lives, and see who they once were, there is so much we would understand and learn. For in this extraordinary novel, a simple box, filled with mementos from a grandmother, offers the greatest legacy of an unexpected gift of a life transformed, a long-forgotten history of youth and beauty, love and dreams.","Audio CassetteFirst published January 1, 1999","['Romance', 'Fiction', 'Historical Fiction', 'Historical', 'Chick Lit', 'Contemporary', 'Novels']",14.1k follower,413 review,765,171 (1%),564 (6%),"2,089 (23%)","2,697 (30%)","3,425 (38%)"
Lost in the City,Edward P. Jones,4.06,"3,277 rating","June 1, 1992","A magnificent collection of short fiction focusing on the lives of African-American men and women in Washington, D.C., Lost in the City is the book that first brought author Edward P. Jones to national attention. Winner of the Pulitzer Prize, the National Book Critics Circle Award, and numerous other honors for his novel The Known World, Jones made his literary debut with these powerful tales of ordinary people who live in the shadows in this metropolis of great monuments and rich history. Lost in the City received the Pen/Hemingway Award for Best First Fiction and was a National Book Award Finalist. This beautiful 20th Anniversary Edition features a new introduction by the author, and is a wonderful companion piece to Jones’s masterful novel and his second acclaimed collection of stories, All Aunt Hagar’s Children.",268,"['Short Stories', 'Fiction', 'African American', 'Historical Fiction', 'Literary Fiction', 'Race', 'Dc Comics']",617 follower,384 review,24,38 (1%),135 (4%),603 (18%),"1,303 (39%)","1,198 (36%)"
Scrub Dog of Alaska,Walt Morey,4.21,200 rating,"October 21, 1971","After a runt sled dog is raised by a young boy, the dog's cruel owner demands his return.",152,"['Fiction', 'Animals', 'Childrens', 'Young Adult', 'Adventure']",42 follower,22 review,58,1 (<1%),4 (2%),41 (20%),61 (30%),93 (46%)
Fear Nothing,Dean Koontz,4.00,"37,679 rating","January 1, 1997","This is a killer of a book, period. Probably the best of Koontz's career to date. Because Chris Snow has xeroderma pimentosum - a rare, and usually fatal, genetic disorder - even a brief exposure to sunlight can cause irreparable damage leading to blindness and fatal skin cancers. So Snow only comes at night. The novel opens with the death of Snow's father, a tragic, but seemingly innocent incident that tears open the fabric of Snow's life. He soon becomes embroiled in a conspiracy that seems to involve everyone in the small town of Moonlight Bay, where Snow has spent his entire life. The whole book, except for the last few pages, takes place during one night, making for a riveting, fast-paced read that still has time for thoughtful speculations and wonderful characters. If you've never tried Koontz before, this is the place to start, while for longtime readers, I need say no more than that this is Koontz writing at the peak of his form.  - Charles de Lint",391,"['Horror', 'Fiction', 'Thriller', 'Mystery', 'Suspense', 'Science Fiction', 'Fantasy']",36.2k follower,"1,228 review",922,583 (1%),"1,821 (4%)","8,292 (22%)","13,378 (35%)","13,605 (36%)"
Les Justes,Albert Camus,4.02,"8,508 rating","January 1, 1949","À Moscou, en 1905, un groupe de socialistes révolutionnaires projette d'assassiner le grand-duc Serge, qui gouverne la ville en despote, afin de lutter contre la tyrannie exercée sur eux. Kaliayev, un jeune terroriste, lancera la bombe. Dora restera en arrière, mais c'est elle qui a fabriqué les bombes servant à l'attentat. Dora et Kaliayev sont amants. Kaliayev est emprisonné, la grande-duchesse Élisabeth lui propose d'être gracié, il refuse et il est pendu. Dora, à la fin, s'apprête à faire le prochain attentat et peut ainsi rejoindre Kaliayev.",152,"['Plays', 'Classics', 'France', 'Philosophy', 'Theatre', 'French Literature', 'Fiction']",30k follower,553 review,843,83 (<1%),341 (4%),"1,749 (20%)","3,463 (40%)","2,872 (33%)"
Tempting Fortune,Jo Beverley,3.73,"1,959 rating","March 1, 1995","THE STAKESPortia St. Claire's brother has gambled and lost, throwing her into the power of ruthless men. Their price for his life is her virtue, to be auctioned off in London's most notorious brothel ...THE BIDDERTo retrieve an incriminating letter, Bryght Malloren once broke into a house where he was greeted at pistol point by a resolute woman ... a woman he could swear stands before him, masked and trembling, on a madam's auction block ...THE RISKIEST GAMEUnable to leave Portia to such a cruel fate, Bryght turns the private wager into a very public game of seduction, one that confirms his reputation as a shameless rake and keeps all of London society breathless with anticipation. But on a night shimmering with destiny, truth, and passion, those who tempt fortune risk losing everything ... including their hearts ...",444,"['Historical Romance', 'Romance', 'Historical', 'Historical Fiction', 'Regency', 'Fiction', 'Georgian']","1,101 follower",161 review,141,47 (2%),171 (8%),548 (27%),686 (35%),507 (25%)
The Ax,Donald E. Westlake,3.91,"2,189 rating","January 1, 1997","The multi-award-winning, widely-acclaimed mystery master Donald E. Westlake delivers a masterpiece with this brilliant, laser-sharp tale of the deadly consequences of corporate downsizing.Burke Devore is a middle-aged manager at a paper company when the cost-cutting ax falls, and he is laid off. Eighteen months later and still unemployed, he puts a new spin on his job search -- with agonizing care, Devore finds the seven men in the surrounding area who could take the job that rightfully should be his, and systematically kills them. Transforming himself from mild-mannered middle manager to ruthless murderer, he discovers skills ne never knew ne had -- and that come to him far too easily.",352,"['Fiction', 'Crime', 'Mystery', 'Thriller', 'Horror', 'Mystery Thriller', 'Noir']",845 follower,220 review,395,54 (2%),135 (6%),485 (22%),789 (36%),726 (33%)
Unfinished Symphony,V.C. Andrews,3.84,"6,877 rating","January 1, 1997","Melody Logan had only just found a safe harbor when a new storm set her adrift all over again.... Melody had always believed her mother, Haille, and dear stepdaddy had died in tragic accidents — that's why she'd come to stay with her secretive Logan relatives on Cape Cod. But then a friend recognized Haille's picture in a catalog and kindled Melody's hopes. Maybe her mother hadn't perished in a fire in California after all, but was in some desperate trouble that kept her out of reach.... Melody's dream of finding her mother seemed as flimsy as the scrap of paper that was her only clue. And despite the pampered life Melody was offered as a guest in a Beverly Hills mansion, nothing could soften the blow of the moment she stood face-to-face with her mother and saw her eyes turn dark and cold as stones. Melody knew there must be a reason why her mother pretended at first not to recognize her — and why she'd even faked her own death. Though Melody's beloved Cary beckoned from Cape Cod, she felt in her heart that her mother needed her now more than ever. And beneath her mother's unkept promises and tattered fantasies, Melody hoped to unearth the truth about her own past, and find her way to a safer, better place...where she could embrace a bright new future of her own.",344,"['Fiction', 'Young Adult', 'Horror', 'Romance', 'Mystery', 'Chick Lit', 'Gothic']","8,072 follower",91 review,325,103 (1%),542 (7%),"1,944 (28%)","2,065 (30%)","2,223 (32%)"
The Vanishing Tower,Michael Moorcock,3.97,"9,294 rating","January 1, 1970","The swashbuckling and fantastic adventures of the moody albino prince -- Elric -- and his soul-drinking runesword, called Storm-bringer. The two are on a quest for The Vanishing Tower, which stands at the nexus of space and time and is a gateway into other dimensions. Elric must conquer the demon that inhabits the tower and tame the soul of his black runesword.This tale and its heroes weave in and out of events throughout Moorcock's Eternal Champion series.",175,"['Fantasy', 'Fiction', 'Sword and Sorcery', 'Science Fiction Fantasy', 'Dark Fantasy', 'Epic Fantasy', 'High Fantasy']","3,332 follower",176 review,"1,020",59 (<1%),354 (3%),"2,269 (24%)","3,727 (40%)","2,885 (31%)"
Cała jaskrawość,Edward Stachura,4.15,224 rating,"January 1, 2000",Cala jaskrawosc,180,"['Polish Literature', 'Fiction', 'Audiobook', 'Poland']",39 follower,15 review,44,3 (1%),8 (3%),34 (15%),86 (38%),93 (41%)
A Cavern of Black Ice,J.V. Jones,3.88,"9,119 rating","March 1, 1999","HIGH ADVENTURE ON THE SWORD EDGE OF DESTINYA Cavern of Black Ice is the first book in J.V. Jones's Sword of Shadow seriesAs a newborn Ash March was abandoned--left for dead at the foot of a frozen mountain. Found and raised by the Penthero Iss, the mighty Surlord of Spire Vanis, she has always known she is different. Terrible dreams plague her and sometimes in the darkness she hears dread voices from another world. Iss watches her as she grows to womanhood, eager to discover what powers his ward might possess. As his interest quickens, he sends his living blade, Marafice Eye, to guard her night and day.Raif Sevrance, a young man of Clan Blackhail, also knows he is different, with uncanny abilities that distance him from the clan. But when he and his brother survive an ambush that plunges the entire Northern Territories into war, he yet seeks justice for his own . . . even if means he must forsake clan and kin.Ash and Raif must learn to master their powers and accept their joint fate if they are to defeat an ancient prophecy and prevent the release of the pure evil known as the End Lords.",769,"['Fantasy', 'Epic Fantasy', 'Fiction', 'High Fantasy', 'Science Fiction Fantasy', 'Magic', 'Dark Fantasy']",815 follower,263 review,20,198 (2%),569 (6%),"2,144 (23%)","3,453 (37%)","2,755 (30%)"
Don't Bump the Glump! and Other Fantasies,Shel Silverstein,3.88,"1,459 rating","January 1, 1964","It's a zoo in here!
Have you ever...Seen a Gritchen in your kitchen?Dared to dance with the One-Legged Zantz?Declined to dine with the Glub-Toothed Sline?
You haven't? Well then, step inside - but only if you are ready to be amazed, tickled, astonished and entertained by this most unusual bestiary of silly and scary creatures.Shel Silverstein combined his unique imagination and bold brand of humor for his first poetry collection - the only one he illustrated in full color. Now available again after three decades, DON'T BUMP THE GLUMP! and Other Fantasies was originally published in 1964, the same year as his most famous picture book, THE GIVING TREE.",64,"['Poetry', 'Childrens', 'Picture Books', 'Fiction', 'Humor', 'Classics', 'Fantasy']","9,771 follower",207 review,145,20 (1%),114 (7%),372 (25%),468 (32%),485 (33%)
Rum Punch,Elmore Leonard,3.93,"11,260 rating","January 1, 1992","Rum Punch is classic Elmore Leonard—the electrifying thriller that served as the basis for the acclaimed film Jackie Brown by director Quentin Tarantino, starring Pam Grier, Robert DeNiro, and Samuel L. Jackson. Leonard’s story of a not-altogether-blameless flight attendant on the run from her vicious gun-running sometime employer who sees her as a troublesome loose end, Rum Punch is Elmore Leonard at his sharpest and most ingeniously entertaining.",368,"['Fiction', 'Crime', 'Mystery', 'Thriller', 'Novels', 'Noir', 'American']","3,265 follower",645 review,239,54 (<1%),353 (3%),"2,699 (23%)","5,380 (47%)","2,774 (24%)"
The Business of Fancydancing,Sherman Alexie,4.17,"2,013 rating","January 1, 1991","Poetry. Fiction. Published in 1992, well before Sherman Alexie became well-known as the screenwriter for the film SMOKE SIGNALS, THE BUSINESS OF FANCYDANCING has now been turned into a film with none other than Alexie himself in his directorial debut. The screenplay for the movie, which recently won the Audience Award at the San Francisco Film Festival, is loosly adapted from this book. Many film-goers will want to visit or revisit the elegaic poems and stories that set the tone for the film itself. ""In an age when many 'Native American' writers publish books that prove their ignorance of the real Indian world, Sherman Alexie paints painfully honest visions of our beautiful and brutal lives""—Adrian C. Louis.",84,"['Poetry', 'Fiction', 'Short Stories', 'Literature', 'Adult', 'Native Americans', 'Contemporary']","6,274 follower",120 review,130,11 (<1%),44 (2%),351 (17%),792 (39%),815 (40%)
The Mark: The Beast Rules the World,Tim LaHaye,4.04,"29,422 rating","November 14, 2000","2001 Christy Award finalist!The international fiction series phenomenon continues. Jerry B. Jenkins and Tim LaHaye pick up the exciting end-times saga where The Indwelling left off. The evil world leader Nicolae Carpathia officially takes his place as the Antichrist and begins his three-and-a-half year reign of terror over the earth. Technology provides the means to place the mark of the beast on every human, and the Trib Force scrambles to survive.","Audio CassetteFirst published November 14, 2000","['Christian Fiction', 'Fiction', 'Christian', 'Religion', 'Fantasy', 'Thriller', 'Christianity', 'Christian Fiction', 'Fiction', 'Christian', 'Religion', 'Fantasy', 'Thriller', 'Christianity', 'Christian Fiction', 'Fiction', 'Christian', 'Religion', 'Fantasy', 'Thriller', 'Christianity', 'Christian Fiction', 'Fiction', 'Christian', 'Religion', 'Fantasy', 'Thriller', 'Christianity', 'Christian Fiction', 'Fiction', 'Christian', 'Religion', 'Fantasy', 'Thriller', 'Christianity']","1,926 follower",481 review,746,775 (2%),"1,519 (5%)","5,603 (19%)","9,406 (31%)","12,119 (41%)"
"The Doors of His Face, the Lamps of His Mouth",Roger Zelazny,4.07,"3,859 rating","January 1, 1964","Here are strange, beautiful stories covering the full spectrum of the late Roger Zelazny's remarkable talents. In Doors of His Face, The Lamps of His Mouth, Zelazny's rare ability to mix the dream-like, disturbing imagery of fantasy with the real-life hardware of science fiction is on full display. His vivid imagination and fine prose made him one of the most highly acclaimed writers in his field.Contents:· The Doors of His Face, the Lamps of His Mouth · nv F&SF Mar ’65 · The Keys to December · nv New Worlds Aug ’66 · Devil Car [Sam Nurdock] · ss Galaxy Jun ’65 · A Rose for Ecclesiastes · nv F&SF Nov ’63 · The Monster and the Maiden · vi Galaxy Dec ’64 · Collector’s Fever · vi Galaxy Jun ’64 · This Mortal Mountain · nv If Mar ’67 · This Moment of the Storm · nv F&SF Jun ’66 · The Great Slow Kings · ss Worlds of Tomorrow Dec ’63 · A Museum Piece · ss Fantastic Jun ’63 · Divine Madness · ss Magazine of Horror Sum ’66 · Corrida · ss Anubis v1 #3 ’68 · Love Is an Imaginary Number · ss New Worlds Jan ’66 · The Man Who Loved the Faioli · ss Galaxy Jun ’67 · Lucifer · ss Worlds of Tomorrow Jun ’64",512,"['Science Fiction', 'Fantasy', 'Short Stories', 'Fiction', 'Science Fiction Fantasy', 'Anthologies', 'Collections']","3,582 follower",149 review,758,21 (<1%),129 (3%),791 (20%),"1,531 (39%)","1,387 (35%)"
