title,authors,average_rating,rating,date_of_publication,descriptions,total_pages,genres,author_followers,no_of_reviews,no_of_books_by_author,one_star_ratings,two_star_ratings,three_star_ratings,four_star_ratings,five_star_ratings
Jim Knopf und Lukas der Lokomotivführer. Jim Knopf und die Wilde 13. Sammelband,Michael Ende,4.59,85 rating,"January 1, 1960","""En Jim Botó i en Lluc el maquinista"" i ""En Jim Botó i els 13 Salvatges"" reunits en un pack commemoratiu. Aquest any 2009 se celebraria el 80è aniversari del naixement de Michael Ende, el prolífic autor alemany de literatura infantil i juvenil. A la petita illa de Lummerland arriba el petit Jim, enviat per paquet postal. Quan és més gran, marxa amb el Lluc i l'Emma, la locomotora, per viure grans aventures i per mirar de desentrallar el misteri que envolta els seus orígens.",540,"['Fantasy', 'Childrens']","2,998 follower",4 review,267,0 (0%),0 (0%),6 (7%),23 (27%),56 (65%)
"John Quincy Adams: A Public Life, a Private Life",Paul C. Nagel,3.94,"7,727 rating","September 30, 1997","February 21, 1848, the House of Representatives, Washington,   Congressman John Quincy Adams, rising to speak, suddenly collapses at his desk; two days later, he dies in the Speaker's chamber. The public mourning that followed, writes Paul C. Nagel, ""exceeded anything previously seen in America."" Forgotten was his failed presidency and his often cold demeanor. It was the memory of an extraordinary human being--one who in his last years had fought heroically for the right of petition and against a war to expand slavery--that drew a grateful people to salute his coffin in the Capitol and to stand by the railroad tracks as his bier was transported from Washington to Boston. Nagel probes deeply into the psyche of this cantankerous, misanthropic, erudite, hardworking son of a former president whose remarkable career spanned many minister to Holland, Russia, and England, U.S. senator, secretary of state, president of the United States (1825-1829), and, finally, U.S. representative (the only ex-president to serve in the House). On the basis of a thorough study of Adams' seventy-year diary, among a host of other documents, the author gives us a richer account than we have yet had of JQA's life--his passionate marriage to Louisa Johnson, his personal tragedies (two sons lost to alcoholism), his brilliant diplomacy, his recurring depression, his exasperating behavior--and shows us why, in the end, only Abraham Lincoln's death evoked a greater outpouring of national sorrow in nineteenth-century America. We come to see how much Adams disliked politics and hoped for more from life than high office; how he sought distinction in literary and scientific endeavors, and drew his greatest pleasure from being a poet, critic, translator, essayist, botanist, and professor of oratory at Harvard; how tension between the public and private Adams vexed his life; and how his frustrations kept him masked and aloof (and unpopular). Nagel's great achievement, in this first biography of America's sixth president in a quarter century, is finally to portray Adams in all his talent and complexity.",432,"['Biography', 'History', 'Presidents', 'Nonfiction', 'American History', 'Us Presidents', 'Politics']",22 follower,187 review,13,287 (3%),489 (6%),"1,641 (21%)","2,325 (30%)","2,985 (38%)"
Absolute Power,David Baldacci,4.19,"105,617 rating","January 1, 1996","A grizzled professional cat burglar gets trapped inside the bedroom closet of one of the world's richest men, only to witness, through a one-way mirror, two Secret Service agents kill the billionaire's trampy young wife as she tries to fight off the drunken sexual advances of the nation's chief executive. Running for his life, but not before he picks up a bloodstained letter opener that puts the president at the scene of the crime, the burglar becomes the target of a clandestine manhunt orchestrated by leading members of the executive branch.Meanwhile, Jack Graham, once a public defender and now a high-powered corporate attorney, gets drawn into the case because the on-the-lam burglar just happens to be the father of his former financee, a crusading Virginia prosecutor. Embroidering the narrative through assorted plot whorls are the hero's broken romance; his conflict over selling out for financial success; the prosecutor's confused love-hate for her burglar father; the relentless investigation by a northern Virginia career cop; the dilemma of government agents trapped in a moral catch-22; the amoral ambitions of a sexy White House Chief of Staff; and the old burglar's determination to bring down the ruthless president. Meanwhile, lurking at the novel's center like a venomous spider is the sociopathic president.",550,"['Fiction', 'Thriller', 'Mystery', 'Suspense', 'Crime', 'Mystery Thriller', 'Audiobook']",118k follower,"2,363 review",339,872 (<1%),"2,409 (2%)","16,476 (15%)","41,413 (39%)","44,447 (42%)"
The Great Illusion,Norman Angell,3.59,124 rating,"January 1, 1909","First published in 1909, The Great Illusion sets out to answer one of the greatest questions in human Why is there war? Specifically, Angell wishes to discuss why there is war between the countries of Europe, which seem to always be at one another's throats. Angell refutes the belief that military power results in greater wealth and instead proposes that advanced economies based on trade and contract law can only generate value in the absence of military upset. War destroys any wealth that conquerors may have wanted to obtain, making the whole enterprise pointless. A deep understanding of this would, then, end the need for war. Students of history, political science, and peace studies will find much to ponder and much to argue with in this classic text.",396,"['History', 'Politics', 'Nonfiction', 'Economics', 'International Relations', 'Philosophy', 'War']",16 follower,13 review,202,3 (2%),14 (11%),35 (28%),51 (41%),21 (16%)
Sharpe's Enemy,Bernard Cornwell,4.28,"9,540 rating","January 1, 1984","A band of deserters led by a cook and Sharpe's vicious longtime enemy, Obadiah Hakeswill, holds a group of highborn British and French women on a strategic mountain pass. Outnumbered and attacked from two sides, newly promoted Major Sharpe leads his small force into the biting cold of the winter mountains to rescue the hostages.",350,"['Historical Fiction', 'Fiction', 'Historical', 'War', 'Adventure', 'Military Fiction', 'Action']",17.2k follower,249 review,433,14 (<1%),83 (<1%),"1,305 (13%)","3,947 (41%)","4,191 (43%)"
Ελεγεία και σάτιρες,Kostas Karyotakis,4.58,108 rating,"December 1, 1927",""" Όμως κάθε φορά πού ή ελληνική ποίηση απελπίζεται, δηλαδή κάθε φορά πού γίνεται ποίηση, ό Καρυωτάκης είναι εξακολουθητικά παρών."" Μετράει σχεδόν εν τέταρτον του αιώνος ή διαβεβαίωση ετούτη του ποιητή και κριτικού Βύρωνα Λεοντάρη, πού με την επιλογή του σημαδιακού επιρρήματος ""εξακολουθητικά"" θέλει να παραπέμψει ευθέως στη γνωστή, γενναία διαπίστωση του Τέλλου Άγρα: ""Κι έξαφνα, στα 1927, με την τρίτη και τελευταία του συλλογή, Ελεγεία και Σάτιρες, μας εξεπέρασεν όλους, αμέσως κι εξακολουθητικά. Έγινεν αμέσως maitre."" Στό σύστημα της διαβεβαίωσης αυτής ή ποίηση ταυτίζεται με την απελπισία της, τη ριζική εννοείται απελπισία της, εκείνη πού δεν τελείται σε κοινωνικό κενό, δεν ακκίζεται ούτε εξαντλείται στον υδάτινο καθρέφτη των φιλολογημάτων της, εκείνη πού συγκλονίζει την ουσία και τη μορφή, είτε για να τα ξανααρμόσει είτε για να αποδείξει ανέφικτη τη συναρμογή τους και ήδη σωπασμένη την ποίηση. Μια απελπισία, λοιπόν, σαν κι εκείνη του Κώστα Καρυωτάκη, οριακά δαπανηρή μα και τόσο οξυδερκής, σχεδόν εξωανθρώπινα οξυδερκής, ώστε αφενός να μπορεί να τρέψει σε πανίσχυρη ειρωνεία τη χολή, σε λόγο το ουρλιαχτό, αφετέρου να φτάσει να μη χρειάζεται πάντοτε το βίωμα, να μη χρειάζεται καν το βίωμα: δεν αρκούσε ή πνιγηρή υπαλληλία, ή ωχρά σπειροχαίτη και ή Πρέβεζα για να αναδυθεί τόσο αδιάλλακτη ή τέχνη του Καρυωτάκη, τέχνη πού υπερβαίνει τόσο τη βιογραφία του ποιητή όσο και τη μυθολόγησή της. (Από τον πρόλογο της έκδοσης)",125,"['Poetry', 'Poetry', 'Poetry']",39 follower,6 review,20,0 (0%),1 (<1%),3 (2%),36 (33%),68 (62%)
Sternstunden der Menschheit: Vierzehn historische Miniaturen,Stefan Zweig,4.24,"12,098 rating","January 1, 1927","Mit einem Nachwort von Knut Beck.Mit dem Autorenporträt aus dem Metzler Lexikon Weltliteratur.Mit Daten zu Leben und Werk, exklusiv verfasst von der Redaktion der Zeitschrift für Literatur TEXT + KRITIK.Manchmal ist die Geschichte selbst spannender als jedes Drama und lebendiger als jeder Roman. Stefan Zweig versammelt in diesen historischen Miniaturen vierzehn große, schicksalhafte Augenblicke in der Geschichte der Menschheit: von der Schlacht bei Waterloo über die Entstehung von Goethes berühmter Marienbader Elegie bis hin zur tragischen Südpolexpedition von Sir Robert Falcon Scott. Dabei zeigt sich: Es sind oft gerade die kurzen, vom Zufall bestimmten Augenblicke, die prägend für die Zukunft sind.",304,"['History', 'Nonfiction', 'Classics', 'Short Stories', 'German Literature', 'Biography', 'Literature']","8,704 follower","1,030 review","2,034",63 (<1%),311 (2%),"1,738 (14%)","4,587 (37%)","5,399 (44%)"
Divine Foreknowledge and Human Freedom: The Coherence of Theism: Omniscience,William Lane Craig,3.89,19 rating,"December 1, 1990","The ancient problem of fatalism, more particularly theological fatalism, has resurfaced with surprising vigour in the second half of the twentieth century. Two questions predominate in the debate: (1) Is divine foreknowledge compatible with human freedom and (2) How can God foreknow future free acts? Having surveyed the historical background of this debate in ""The Problem of Divine Foreknowledge"" and ""Future Contingents from Aristotle to Suarez"" (Brill: 1988), William Lane Craig now attempts to address these issues critically. His wide-ranging discussion brings together a thought- provoking array of related topics such as logical fatalism, multivalent logic, backward causation, precognition, time travel, counterfactual logic, temporal necessity, Newcomb's Problem, middle knowledge, and relativity theory. The present work serves both as a useful survey of the extensive literature on theological fatalism and related fields and as a stimulating assessment of the possibility of divine foreknowledge of future free acts.",374,"['Philosophy', 'Theology']",743 follower,3 review,119,1 (5%),2 (10%),3 (15%),5 (26%),8 (42%)
Terrorism and Communism: A Reply to Karl Kautsky,Leon Trotsky,3.76,601 rating,"June 1, 1920","Written in the white heat of revolutionary Russia’s Civil War, Trotsky’s Terrorism and Communism is one of the most potent defenses of revolutionary dictatorship. In his provocative commentary to this new edition the philosopher Slavoj Žižek argues that Trotsky’s attack on the illusions of liberal democracy has a vital relevance today.",183,"['Politics', 'Philosophy', 'History', 'Nonfiction', 'Russia', 'Theory', 'Russian Revolution', 'Politics', 'Philosophy', 'History', 'Nonfiction', 'Russia', 'Theory', 'Russian Revolution', 'Politics', 'Philosophy', 'History', 'Nonfiction', 'Russia', 'Theory', 'Russian Revolution']",651 follower,57 review,964,26 (4%),43 (7%),161 (26%),192 (31%),179 (29%)
Escape to Honor,Larry Harris,4.21,14 rating,"January 1, 1984",1st Paperjacks 1985 paperback vg+ In stock shipped from our UK warehouse,241,"['Nonfiction', 'Nonfiction', 'Nonfiction', 'Nonfiction', 'Nonfiction']",6 follower,4 review,50,0 (0%),0 (0%),2 (14%),7 (50%),5 (35%)
The Letter for the King,Tonke Dragt,4.17,"12,279 rating","January 1, 1962","A young messenger. A secret mission. A kingdom in peril.It is the dead of night.Sixteen-year-old Tiuri must spend hours locked in a chapel in silent contemplation if he is to be knighted the next day.But, as he waits by the light of a flickering candle, he hears a knock at the door and a voice desperately asking for help.A secret letter must be delivered to King Unauwen across the Great Mountains - a letter upon which the fate of the entire kingdom depends. Tiuri has a vital role to play, one that might cost him his knighthood.Tiuri's journey will take him through dark, menacing forests, across treacherous rivers, to sinister castles and strange cities. He will encounter evil enemies who would kill to get the letter, but also the best of friends in the most unexpected places.He must trust no one.He must keep his true identity secret.Above all, he must never reveal what is in the letter...The Letter for the King is the thrilling story of one boy's battle against evil, set in an enchanted world of chivalry, courage and true friendship.",513,"['Fantasy', 'Young Adult', 'Fiction', 'Childrens', 'Adventure', 'Classics', 'Middle Grade', 'Fantasy', 'Young Adult', 'Fiction', 'Childrens', 'Adventure', 'Classics', 'Middle Grade', 'Fantasy', 'Young Adult', 'Fiction', 'Childrens', 'Adventure', 'Classics', 'Middle Grade']",251 follower,"1,003 review",39,143 (1%),377 (3%),"1,937 (15%)","4,580 (37%)","5,242 (42%)"
The Life of Forms in Art,Henri Focillon,4.09,69 rating,"January 1, 1989","In this beautiful meditation on the art-historical problem of style, Henri Focillon (1881–1943) describes how art forms change over time. Although he argues that the development of art is irreducible to external political, social, or economic determinants, one of his great achievements was to lodge a concept of autonomous formal mutation within the shifting domain of materials and techniques. Focillon emphasizes the presence of nonsynchronous tendencies within styles that give artworks a manifold and stratified character.The Life of Forms in Art remains one of the most brilliant and important reflections on the morphology of art. It has been superbly translated by Yale art historian George Kubler, whose book The Shape of Time was influenced by Focillon. The book also contains a critical introduction by Jean Molino.","PaperbackFirst published January 1, 1989","['Art', 'Philosophy', 'Theory', 'Nonfiction', 'Architecture', 'France', 'College', 'Art', 'Philosophy', 'Theory', 'Nonfiction', 'Architecture', 'France', 'College', 'Art', 'Philosophy', 'Theory', 'Nonfiction', 'Architecture', 'France', 'College']",7 follower,7 review,127,0 (0%),5 (7%),8 (11%),32 (46%),24 (34%)
The Long Road Home,Danielle Steel,4.02,"10,302 rating","January 1, 1998","A novel of courage, hope and love...From her secret perch at the top of the stairs, seven-year-old Gabriella watches the guests arrive at her parents' lavish Manhattan home. The click, click click of her mother's high heels strikes terror into her heart, as she has been told that she is to blame for her mother's rage - and her father's failure to protect her. Her world is a confusing blend of terror, betrayal and pain, and Gabriella knows that there is no safe place for her to hide.When her parents' marriage collapses, her father disappears and her mother abandons her to a convent, where Gabriella's battered body and soul begin to mend amid the quiet safety and hushed rituals of the nuns. And when she grows into womanhood, young Father Joe Connors comes into her life. Like Gabriella, Joe is haunted by the pain of his childhood, and with her he takes the first steps towards healing. But their relationship leads to disaster as Joe must choose between the priesthood and Gabriella. She struggles to survive on her own in New York, where she seeks escape through her writing, until eventually she is able to find forgiveness, freedom from guilt, and healing from abuse.In this work of daring and compassion, Danielle Steel has created a vivid portrait of an abused child's broken world which will shock and move you to your very soul.",476,"['Romance', 'Fiction', 'Chick Lit', 'Drama', 'Contemporary', 'Adult', 'Adult Fiction']",14.1k follower,498 review,765,158 (1%),565 (5%),"2,212 (21%)","3,311 (32%)","4,056 (39%)"
Gloomy Gus,Walt Morey,4.16,114 rating,"January 1, 1970","Because of an agreement his alcoholic father makes with a circus, 15-year-old Eric begins a long journey south from Alaska with the huge Kodiak bear he raised from a cub.",192,"['Childrens', 'Animals', 'Adventure', 'Fiction']",42 follower,9 review,58,1 (<1%),3 (2%),23 (20%),37 (32%),50 (43%)
"Lies, Inc.",Philip K. Dick,3.20,"3,274 rating","July 1, 1983","A masterwork by Philip K. Dick, this is the final, expanded version of the novella The Unteleported Man, which Dick worked on shortly before his death. In Lies, Inc., fans of the science fiction legend will immediately recognize his hallmark themes of life in a security state, conspiracy, and the blurring of reality and illusion. This publication marks its first complete appearance in the United States.In this wry, paranoid vision of the future, overpopulation has turned cities into cramed industrial anthills. For those sick of this dystopian reality, one corporation, Trails of Hoffman, Inc., promises an alternative: Take a teleport to Whale's Mouth, a colonized planet billed as the supreme paradise. The only catch is that you can never comeback. When a neurotic man named Rachmael ben Applebaum discovers that the promotional films of happy crowds cheering their newfound existence on Whale's Mouth are faked, he decides to pilot a scapeship on the eighteen-year journey there to see if anyone wants to return.",202,"['Science Fiction', 'Fiction', 'Dystopia', 'Science Fiction Fantasy', 'Novels', 'Speculative Fiction', 'American']",20.1k follower,317 review,"1,582",215 (6%),618 (18%),"1,189 (36%)",809 (24%),443 (13%)
Hell House,Richard Matheson,3.75,"50,894 rating","January 1, 1971","Can any soul survive?Regarded as the Mount Everest of haunted houses, Belasco House has witnessed scenes of almost unimaginable horror and depravity. Two previous expeditions to investigate its secrets met with disaster, the participants destroyed by murder, suicide or insanity. Now a new investigation has been mounted - four strangers, each with his or her own reason for daring the unknown torments and temptations of the mansion...",301,"['Horror', 'Fiction', 'Paranormal', 'Classics', 'Ghosts', 'Mystery', 'Supernatural']","4,183 follower","4,081 review",721,"1,547 (3%)","4,444 (8%)","13,453 (26%)","17,405 (34%)","14,045 (27%)"
King Arthur and the Round Table,Geraldine McCaughrean,3.81,70 rating,"160 pages, PaperbackPublished March 1, 2007","A splendid retelling of the greatest legend of all time, by Geraldine McCaughrean, winner of the Carnegie Medal, the Whitbread Award, and the Guardian Prize.""Who pulls the sword from out this anvil is the true and rightful King of England."" In this skillful retelling of King Arthur and the Round Table , multi-award-winning author Geraldine McCaughrean weaves a dramatic and powerful spell of Arthur, his knights, Merlin, and the sword in the stone—Excalibur. Among Geraldine McCaughrean's retellings are The Canterbury Tales and One Thousand and One Arabian Knights ; her other books include My Grandmother's Clock .",160,"['Fiction', 'Historical Fiction', 'Mythology', 'Fantasy', 'Fiction', 'Historical Fiction', 'Mythology', 'Fantasy', 'Fiction', 'Historical Fiction', 'Mythology', 'Fantasy']",298 follower,3 review,310,0 (0%),6 (8%),21 (30%),23 (32%),20 (28%)
Tarnished Gold,V.C. Andrews,3.94,"7,833 rating","March 1, 1996","Her high school graduation just days away, Gabriel Landry is blissfully happy - until rich cannery owner Octavious Tate waylays her near a secluded pond and shatters her innocence, forever.Pregnant and desolate, Gabriel agrees to a shocking plan that will allow Octavious' frigid wife, Gladys, to claim the baby as her own. But nothing can prepare Gabriel for the terrible moment when Gladys takes her baby away.Drifting in a world of gloom, Gabriel is only comforted by chance glimpses of her son, until a hunting party brings handsome Creole millionaire Pierre Dumas to the bayou. Falling desperately in love, Gabriel will not heed the voice warning her that their joy may bring her more grief than she can bear.",352,"['Fiction', 'Horror', 'Young Adult', 'Romance', 'Gothic', 'Adult Fiction', 'Drama']","8,072 follower",130 review,325,97 (1%),499 (6%),"2,033 (25%)","2,351 (30%)","2,853 (36%)"
The Bane of the Black Sword,Michael Moorcock,4.02,"7,651 rating","August 1, 1977","Elric returns to Yishana, and finds peace at last. Meanwhile, at the world's rim, dragging red horror in its wake, a horde unimaginable moves on the fabled, gentle, impossible city Tanelorn.",157,"['Fantasy', 'Fiction', 'Sword and Sorcery', 'Science Fiction Fantasy', 'Dark Fantasy', 'Science Fiction', 'Epic Fantasy']","3,332 follower",150 review,"1,020",37 (<1%),259 (3%),"1,734 (22%)","3,084 (40%)","2,537 (33%)"
Before Night Falls,Reinaldo Arenas,4.20,"6,438 rating","January 1, 1992","Cuban writer Reinaldo Arenas describes his poverty-stricken childhood in rural, his adolescence as a rebel fighting for Fidel Castro, and his life in revolutionary Cuba as a homosexual. Very quickly the Castro government suppressed his writing and persecuted him for his homosexuality until he was finally imprisoned.",398,"['Nonfiction', 'Memoir', 'LGBT', 'Biography', 'Queer', 'History', 'Autobiography']",317 follower,670 review,64,61 (<1%),230 (3%),953 (14%),"2,311 (35%)","2,883 (44%)"
Ex-drummer,Herman Brusselmans,3.26,"1,532 rating","January 1, 1994", Dutch,176,"['Fiction', 'Dutch Literature', 'Literature', 'Humor', 'Collections', 'Novels', 'Film']",341 follower,56 review,129,73 (4%),227 (14%),611 (39%),471 (30%),150 (9%)
Beyond This Horizon,Robert A. Heinlein,3.70,"4,992 rating","January 1, 1948","Hamilton Felix, the result of generations of genetic selection, finds his life as the ultimate man boring, until a gang of revolutionaries tries to enlist him in their cause.",248,"['Science Fiction', 'Fiction', 'Hugo Awards', 'Science Fiction Fantasy', 'Speculative Fiction', 'Adventure', 'Classics']","9,547 follower",241 review,819,80 (1%),451 (9%),"1,572 (31%)","1,671 (33%)","1,218 (24%)"
Escape to Witch Mountain,Alexander Key,3.90,"3,555 rating","January 1, 1968","Some terrifying experience has blocked Tony and Tia's memory of the past. But because they have supernatural powers, they are sure that they come from another world--and that their people still exist somewhere.Then Tony and Tia find that they must escape from men who want to use their special powers for evil. They begin a desperate search to find their true home--which leads them to the strange and mysterious Witch Mountain.",180,"['Science Fiction', 'Fiction', 'Fantasy', 'Childrens', 'Young Adult', 'Adventure', 'Middle Grade', 'Science Fiction', 'Fiction', 'Fantasy', 'Childrens', 'Young Adult', 'Adventure', 'Middle Grade', 'Science Fiction', 'Fiction', 'Fantasy', 'Childrens', 'Young Adult', 'Adventure', 'Middle Grade']",95 follower,217 review,63,53 (1%),208 (5%),995 (27%),"1,082 (30%)","1,217 (34%)"
First Indian on the Moon,Sherman Alexie,4.08,697 rating,"January 1, 1993","Poetry. Native American Studies. FIRST INDIAN ON THE MOON opens with the section ""Influences"": ""where I have been/ most of my lives/ is where I'm going/--Lucille Clifton."" The stories and poems of Sherman Alexie, an enrolled Spokane/Coeur d'Alene Indian from Wellpint, Washington, have appeared widely, in such publications as Caliban, Esquire, The World, Beloit Poetry Journal, Red Dirt, Zyzzyva and Story. Alexie has won a National Endowment for the Arts Writing Fellowship, and lives in Spokane. ""These elegiac poems and stories will break your heart. Watch this guy. He's making myth""--Joy Harjo.",116,"['Poetry', 'Fiction', 'Short Stories', 'Adult', 'Native Americans', 'Literature', 'Cultural']","6,274 follower",50 review,130,5 (<1%),25 (3%),126 (18%),291 (41%),250 (35%)
"Bird of Life, Bird of Death: A Political Ornithology of Guatemala",Jonathan Evan Maslow,4.11,93 rating,"January 1, 1986","Maslow does a fine job of presenting his quest for the the magnificent quetzal, legendary bird of the Mayans. The book chronicles not only his search for the bird & aspects of its natural history, but presents encounters with many other birds of Central America as well. Home to some wondrous birds in the almost magical rain forests, Maslow shows tho that the avifauna & the land they inhabit are threatened by unstable politics, unchecked population growth & deforestation. A must read for any interested in birds south of the border.--Tim F. Martin (edited)","First published January 1, 1986","['Nonfiction', 'Travel', 'Politics', 'History', 'Birds', 'Animals', 'Nature']",8 book,20 review,8,2 (2%),1 (1%),16 (17%),40 (43%),34 (36%)
