title,authors,average_rating,rating,date_of_publication,descriptions,total_pages,genres,author_followers,no_of_reviews,no_of_books_by_author,one_star_ratings,two_star_ratings,three_star_ratings,four_star_ratings,five_star_ratings
Memoirs and Selected Letters,Ulysses S. Grant,4.08,"3,245 rating","January 1, 1972","Twenty years after Appomattox, the Civil War’s greatest general fought his last campaign against death and time. Stricken by cancer as his family faced financial ruin, Ulysses S. Grant wrote his Personal Memoirs to secure their future, and in doing so won for himself a unique place in American letters. Acclaimed by readers as diverse as Mark Twain, Matthew Arnold, Gertrude Stein, and Edmund Wilson, the Personal Memoirs demonstrates the intelligence, intense determination, and laconic modesty that made Grant the Union’s foremost commander. This Library of America volume also includes 174 letters written by Grant from 1839 to 1865. Many of them are to his wife, Julia, and offer an intimate view of their affectionate and enduring marriage; others, addressed to fellow generals, government officials, and his congressional patron Elihu B. Washburne, provide a fascinating contemporary perspective on the events that would later figure in the Memoirs.Grant’s autobiography is devoted almost entirely to his life as a soldier: his years at West Point, his service in the peacetime army, and his education in war during conflicts foreign and domestic. Grant considered the Mexican War “one of the most unjust ever waged by a stronger against a weaker nation” and thought that the Civil War was our punishment for it; but his retrospective disapproval did not prevent him from becoming enchanted by Mexico or from learning about his own capacity for leadership amid the confusion and carnage of battle.His account of the Civil War combines a lucid treatment of its political causes and its military actions, along with the story of his own growing strength as a commander. At the end of an inconsequential advance in Missouri in 1861 he realized that his opponent “had been as much afraid of me as I had been of him.” Fort Donelson and Shiloh taught him to seize the initiative, while his success in living off the land during the Vicksburg campaign inspired William T. Sherman to undertake his marches through the interior of the South.By 1864 Grant knew that the rebellion could be suppressed only by maintaining relentless pressure against its armies and methodically destroying its resources. As the Union’s final general-in-chief, he acted with the resolve that had eluded his predecessors, directing battles whose drawn-out ferocity had no precedent in Western warfare. His narrative of the war’s final year culminates in his meeting with Lee at Appomattox, a scene of quiet pride, sadness, and humanity.Grant’s writing is spare, telling, and quick, superbly evocative of the imperatives of decision, motion, and action that govern those who try to shape the course of war. Grant wrote about the most destructive war in American history with a clarity and directness unequaled in our literature.",1199,"['History', 'Biography', 'Civil War', 'Memoir', 'Nonfiction', 'American History', 'War', 'History', 'Biography', 'Civil War', 'Memoir', 'Nonfiction', 'American History', 'War', 'History', 'Biography', 'Civil War', 'Memoir', 'Nonfiction', 'American History', 'War', 'History', 'Biography', 'Civil War', 'Memoir', 'Nonfiction', 'American History', 'War', 'History', 'Biography', 'Civil War', 'Memoir', 'Nonfiction', 'American History', 'War']",111 follower,113 review,285,139 (4%),161 (4%),458 (14%),"1,029 (31%)","1,458 (44%)"
الحرام,Yusuf Idris,3.96,"4,319 rating","January 1, 1959",تصور الرواية جوانب الظلم الاجتماعي الذي تعيشه طبقة مهمشة من طبقات المجتمع، وذلك من خلال بيان أن الحرام الذي وقعت فيه بطلة القصة يندرج في دائرة حرام أكبر يقوم به أهل البلد الفقراء مع عمال التراحيل الذين هم أفقر منهم، فهو الحرام الحقيقي، وقد قدمت الرواية من خلال إطار فني محكم ولغة شديدة العذوبة,144,"['Novels', 'Fiction', 'Classics', 'Literature', 'Egypt', 'Media Tie In', '20th Century', 'Novels', 'Fiction', 'Classics', 'Literature', 'Egypt', 'Media Tie In', '20th Century', 'Novels', 'Fiction', 'Classics', 'Literature', 'Egypt', 'Media Tie In', '20th Century']","1,063 follower",400 review,119,82 (1%),204 (4%),948 (21%),"1,640 (37%)","1,445 (33%)"
Midnight Falcon,David Gemmell,4.29,"8,161 rating","January 1, 1999","Bane the Bastard is the illegitimate son of the Rigante king who men called Demonblade. Born of treachery, Bane grew up an outcast in his own land, feared by his fellow highlanders, and denied by the father whose unmistakable mark he bore–the eyes of Connavar, one tawny brown, the other emerald green.Hounded from the country of his birth, Bane found acceptance across the seas–only to have it stripped away in an instant by a cruel and deadly swordsman. Now fighting as a gladiator in the blood-soaked arenas of the Empire, Bane lives for one revenge. And he pursues his goal with the same single-minded determination that won his father a crown.But more is at stake than a young warrior’s quest for vengeance. The armies of the Stone are preparing to march on the lands of the Rigante. The fate of human and Seidh alike will be decided by the clash of swords–and by the bonds of twisted love and bitterness between a father and a son . . .",430,"['Fantasy', 'Fiction', 'Epic Fantasy', 'Heroic Fantasy', 'Science Fiction Fantasy', 'Adventure', 'High Fantasy']","3,233 follower",195 review,156,29 (<1%),134 (1%),"1,142 (13%)","2,972 (36%)","3,884 (47%)"
The Pendragon Legend,Antal Szerb,3.97,"2,746 rating","January 1, 1934","At an end-of-London-season soiree, the young Hungarian scholar-dilettante Janos Batky is introduced to the Earl of Gwynedd, a reclusive eccentric who is the subject of strange rumors. Invited to the family seat--Pendragon Castle in North Wales--Batky receives a mysterious phone call warning him not to go; but he does and finds himself in a bizarre world of mysticism, romance, animal experimentation, and planned murder. His quest to solve the central mystery takes him down strange byways--old libraries and warehouse cellars, Welsh mountains, and underground tombs.",330,"['Fiction', 'Hungarian Literature', 'Hungary', 'Mystery', 'Classics', 'Fantasy', 'Gothic', 'Fiction', 'Hungarian Literature', 'Hungary', 'Mystery', 'Classics', 'Fantasy', 'Gothic', 'Fiction', 'Hungarian Literature', 'Hungary', 'Mystery', 'Classics', 'Fantasy', 'Gothic']",205 follower,183 review,36,40 (1%),149 (5%),569 (20%),"1,071 (39%)",917 (33%)
The Broken Body: Journey to Wholeness,Jean Vanier,4.25,72 rating,"January 1, 1988",minor shelf wear only,"PaperbackFirst published January 1, 1988","['Spirituality', 'Nonfiction', 'Christian', 'Theology']",162 follower,6 review,202,1 (1%),1 (1%),10 (13%),27 (37%),33 (45%)
Feast of the King's Shadow,Chaz Brenchley,3.51,101 rating,"January 1, 1999","The Kingdom of Outremer was raised on sands steeped in the blood of war, and to war it is returning. The Sharai tribes, bitter and divided in defeat, have regrouped in their stronghold at Rhabat. Observing an uneasy truce under the banner of the charismatic Hasan, they await the coming of the Ghost Walker, long-promised deliverer of their people.The Ghost Walker has indeed returned, but not to the Sharai. Marron is a former Ransomer from Outremer who does not yet fully understand what he has become. His companions know more about the power he now wields, and insist that his destiny lies with theirs in Rhabat. But their motives are far from united.One thing is certain: whoever controls the Ghost Walker controls the future of Outremer. But Marron has a will of his own...",648,"['Fantasy', 'M M Romance', 'High Fantasy', 'Science Fiction Fantasy', 'Fiction', 'Gay', 'Historical Fiction']",72 follower,2 review,118,3 (2%),11 (10%),36 (35%),33 (32%),18 (17%)
The Land Remembers: The Story of a Farm and Its People,Ben Logan,4.47,563 rating,"February 10, 1975","This classic American memoir is about a farm and its people, of a boyhood on a southwestern Wisconsin hilltop world in the 1930s. Ben Logan grew up on Seldom Seen Farm with his three brothers, father, mother, and hired hand Lyle—“the fifth Logan boy.” The boys discussed and argued and joked over the events around their farm, marked the seasons by the demands of the land, tested each other and themselves, and grew up learning timeless lessons. This paperback edition features Logan's never-before-published afterword that traces the Logan land to an earlier time, bringing the story full circle to the farm and its people.",286,"['Memoir', 'Nonfiction', 'Biography', 'History', 'Agriculture', 'Biography Memoir', 'Classics']",9 follower,105 review,15,3 (<1%),10 (1%),51 (9%),155 (27%),344 (61%)
"Living My Life, Vol. 1",Emma Goldman,4.35,800 rating,"January 1, 1931","“You damn bitch of an anarchist, I wish I could get at you. I would tear your heart out and feed it to my dog.” This was one of the less obscene messages received by Emma Goldman (1869-1940), while in jail on suspicion of complicity in the assassination of McKinley. The most notorious woman of her day, she was bitterly hated by millions and equally revered by millions.The strong feelings she aroused are understandable. She was an alien, a practicing anarchist, a labor agitator, a pacifist in World War 1, an advocate of political violence, a feminist, a proponent of free love and birth control, a communist, a street-fighter for justice — all of which she did with strong intellect and boundless passion. Today, of course, many of the issues that she fought over are just as vital as they were then.Emma Goldman came from Russia at the age of 17. After an encounter with the sweatshop and an unfortunate marriage, she plunged into the bewildering intellectual and activist chaos that attended American social evolution around the turn of the twentieth century. She knew practically everyone of importance in radical circles. She dominated many areas of the radical movement, lecturing, writing, haranguing, and publishing to awaken the world to her ideas. After World War I she was deported to Russia, where she soon discovered that anarchists were no better liked than in America, despite Lenin’s first gesture of welcome. She escaped with her life but never was allowed to return to the United States.Emma Goldman was a devastatingly honest woman, who spared herself as little as she spared anyone else. From her account the reader can gain insight into a curious personality type of recurrent interest: a woman who devoted her life to eliminating suffering, yet could make a bomb or assist in staging an assassination. Equally interesting are her comments on other radicals of the period, such as Kropotkin, Berkman, Mooney, Lenin, Trotsky, Haywood, Most, the Haymarket martyrs, and many others. Her autobiography, written with vigor, ranks among the finest in the English language.",503,"['Nonfiction', 'Politics', 'Feminism', 'Biography', 'Memoir', 'History', 'Autobiography']",867 follower,54 review,276,6 (<1%),22 (2%),82 (10%),265 (33%),425 (53%)
Almost Starring Skinnybones,Barbara Park,3.74,344 rating,"March 12, 1988","If you thought Junie B. Jones was funny—catch more laughs from New York Time s bestselling author Barbara Park with the hilarious sequel to Skinnybones —just right for fans of Diary of a Wimpy Kid and I Funny! And the award goes to…Alex Frankovitch! Roll out the red carpet! Alex “Skinnybones” Frankovitch is about to become a HUGE star—in his very own TV commercial! But Alex’s plans for stardom go HORRIBLY wrong. Forget fame and fortune—his friends think he’s a FLOP! And his fan club only has two members—a cat and a drooling toddler. Can Alex figure out another way to get his name in lights? Or is this star going to crash and burn? “ Skinnybones equals tickled funny bones.” — Booklist “Young Alex ‘Skinnybones’ Frankovitch finally gets his chance to become a Big Celebrity…in this amusing follow-up to Skinnybones. ” — Publishers Weekly “Once again demonstrating her remarkable ear for dialogue, [Barbara Park] also shows a good sense of timing in this fast-paced outing.” — School Library Journal",108,"['Humor', 'Childrens', 'Fiction', 'Realistic Fiction', 'Middle Grade', 'Young Adult', 'Novels']",992 follower,34 review,317,4 (1%),35 (10%),96 (27%),119 (34%),90 (26%)
Battleaxe,Sara Douglass,3.96,"16,873 rating","July 5, 1995","A thousand years ago the Acharites drove the Forbidden from their land. Now, strange sightings along Achar's northern border foreshadow their return. The barbaric tribes of the Ravensbund are pouring south with the tales of fearsome beings who feed on the terror of their prey. Winter has come early, and with it the promise of war. Axis, bastard son of the dead Princess Rivkah, is sent to the battlefront at Gorkenfort with his elite Axe-Wielders. Once there, he must hand over command to his hated half-brother, Borneheld. But travelling north, Axis falls in love with Faraday - Borneheld's betrothed, and meets two priests who challenge the very essence of his beliefs.The Sentinels walk the land, the TreeFriend has been found, and the people of the Plough, the Wing and the Horn must set aside their differences and unite under one leader against the evil rising in the north . .",674,"['Fantasy', 'Fiction', 'Epic Fantasy', 'High Fantasy', 'Science Fiction Fantasy', 'Romance', 'Adult']",975 follower,495 review,73,409 (2%),985 (5%),"3,583 (21%)","5,821 (34%)","6,075 (36%)"
Unapologetic Theology: A Christian Voice in a Pluralistic Conversation,William C. Placher,3.75,56 rating,"January 1, 1989","In Unapologetic Theology, William Placher examines religion and the search for truth in a pluralistic society. Among the issues he considers are science and its relation to belief, dialogue among various religions, and the theological method.",184,"['Theology', 'Philosophy', 'Religion']",11 follower,3 review,20,2 (3%),2 (3%),16 (28%),24 (42%),12 (21%)
Walt Disney's The Sorcerer's Apprentice,Don Ferguson,4.39,"1,307 rating","August 1, 1994","Apprenticed to a sorcerer, Mickey Mouse tries to use magic to save himself some work.",24,"['Childrens', 'Picture Books', 'Fiction', 'Media Tie In', 'Fantasy', 'Childrens', 'Picture Books', 'Fiction', 'Media Tie In', 'Fantasy', 'Childrens', 'Picture Books', 'Fiction', 'Media Tie In', 'Fantasy', 'Childrens', 'Picture Books', 'Fiction', 'Media Tie In', 'Fantasy', 'Childrens', 'Picture Books', 'Fiction', 'Media Tie In', 'Fantasy']",14 follower,18 review,46,9 (<1%),41 (3%),194 (14%),250 (19%),813 (62%)
The King's Fifth,Scott O'Dell,3.66,"1,994 rating","January 1, 1966","A 1967 Newbery Honor Book While awaiting trial for murder and withholding from the king the obligatory fifth of the gold found in Cibola, Esteban, a seventeen-year-old cartographer, recalls his adventures with a band of conquistadors.",272,"['Historical Fiction', 'Fiction', 'Young Adult', 'Adventure', 'Middle Grade', 'Classics', 'Childrens']",741 follower,176 review,86,71 (3%),174 (8%),599 (30%),666 (33%),484 (24%)
Future Grace,John      Piper,4.19,"5,945 rating","September 1, 1995","In Future Grace, author John Piper helps readers discover the key to overcoming sin and living a life that honors God. Many men and women attempt to walk upright out of gratitude for what Christ did in the past, but Piper encourages believers to look ahead to the grace God provides for us on a day-by-day, moment-by-moment basis—putting faith into action by laying hold of God’s promises for the challenges we face.Sever the Root of SinNo one sins out of duty. We sin because we want to. Sin promises happiness, and we buy the lie. So how can the root of sin be severed in our lives? The penalty of sin must be paid by the righteous blood of Christ. And the power of sin must be broken by banking on the promises of Christ.John Piper’s meditations are rooted in rock-solid biblical reflection. Chapter by chapter—one for each day of the month—he reveals how, by cherishing the promises of God, you can break the power of anxiety, despondency, covetousness, lust, bitterness, impatience, pride, misplaced shame, and more.From the Trade Paperback edition.",448,"['Theology', 'Christian', 'Christian Living', 'Christianity', 'Nonfiction', 'Faith', 'Religion']","4,113 follower",236 review,446,159 (2%),259 (4%),868 (14%),"1,689 (28%)","2,970 (49%)"
Las batallas en el desierto,José Emilio Pacheco,4.13,"25,092 rating","July 12, 1981",A novella depicts the harsh reality of life in urban Mexico and the tragedy of childhood innocence betrayed.,72,"['Fiction', 'Spanish Literature', 'Short Stories', 'Classics', 'Latin American', 'Novels', 'Historical Fiction']",472 follower,"2,081 review",144,255 (1%),915 (3%),"4,244 (16%)","9,617 (38%)","10,061 (40%)"
The Book of Night with Moon,Diane Duane,4.07,"2,190 rating","January 1, 1997","Rhiow seems a perfectly ordinary New York City cat. Or so her humans think -- but she is much more than she appears. With her partners Saash and Urruah, she collaborates with human wizards to protect the earth from dark forces and maintain the network of magical gateways that connect to different realities. But amid this amazing secret animal world lies a danger that threatens not only the cats of the world, but humans as well.",464,"['Fantasy', 'Fiction', 'Young Adult', 'Cats', 'Urban Fantasy', 'Animals', 'Magic', 'Fantasy', 'Fiction', 'Young Adult', 'Cats', 'Urban Fantasy', 'Animals', 'Magic', 'Fantasy', 'Fiction', 'Young Adult', 'Cats', 'Urban Fantasy', 'Animals', 'Magic']","2,337 follower",158 review,196,21 (<1%),109 (4%),431 (19%),772 (35%),857 (39%)
"My Son, My Son",Spring Howard,4.28,354 rating,"January 1, 1938","The story of William Essex, who rose from humble beginnings to become a successful dramatist and novelist, and his friend Dermot O'Riordon, a fervent Irish patriot and founder of a great London furnishing house; and their sons, Oliver Essex and Rory O'Riordon. Plus some other assorted characters, from old Mr Moscrop and his daughter Nellie, and Maeve O'Riordon. Those boys grow up in friendship, but the passing years create circumstances that divide them as their fathers learn the hard way that sons do not always develop the way a parent might wish.",448,"['Fiction', 'Historical Fiction', 'British Literature', 'Classics']",11 book,34 review,11,2 (<1%),12 (3%),46 (12%),120 (33%),174 (49%)
The Great Heresies,Hilaire Belloc,4.22,988 rating,"January 1, 1938","Here the great Catholic historian Hilaire Belloc analyzes five of the greatest heresies of all time: Arianism, Mohammedanism (Islam), Albigensianism, Protestantism, and the Modern Attack, showing that the world would be vastly different today if Arianism or Albigensianism had survived--and how it is different because Protestantism survived. He predicts the re-emergence of Islam and explains how the Modern Attack is the worst threat to the Catholic Church ever. different cover forISBN-10: 0895554755ISBN-13: 978-0895554758","First published January 1, 1938","['History', 'Religion', 'Catholic', 'Theology', 'Christianity', 'Nonfiction', 'Philosophy']",327 follower,95 review,704,11 (1%),36 (3%),149 (15%),319 (32%),473 (47%)
Ragazzi di vita,Pier Paolo Pasolini,3.61,"4,758 rating","January 1, 1955","«Era una caldissima giornata di luglio. Il Riccetto che doveva farsi la prima comunione e la cresima, s'era alzato già alle cinque; ma mentre scendeva giù per via Donna Olimpia coi calzoni lunghi grigi e la camicetta bianca, piuttosto che un comunicando o un soldato di Gesù pareva un pischello quando se ne va acchittato pei lungoteveri a rimorchiare.»Il Riccetto, il Caciotta, il Lenzetta, il Begalone, Alduccio e altri sono giovanissimi sottoproletari romani. Sciamano dalle borgate della Roma anni Cinquanta verso il centro, in un itinerario picaresco fatto di eventi comici, tragici, grotteschi. Alternano una violenza gratuita a una generosità patetica: Riccetto salva una rondine che stava per annegare ma non potrà far nulla dinanzi al piccolo Genesio trascinato via dalla corrente dell'Aniene; Agnolo e Oberdan assistono Marcello agonizzante, rimasto travolto dal crollo della sua scuola. La Roma monumentale e quella della speculazione edilizia è lo spazio contraddittorio in cui avviene questa sorta di rito iniziatico di una giornata dei «ragazzi di vita».",256,"['Fiction', 'Italian Literature', 'Italy', 'Classics', 'Novels', '20th Century', 'Literature', 'Fiction', 'Italian Literature', 'Italy', 'Classics', 'Novels', '20th Century', 'Literature', 'Fiction', 'Italian Literature', 'Italy', 'Classics', 'Novels', '20th Century', 'Literature']",689 follower,296 review,345,161 (3%),455 (9%),"1,428 (30%)","1,725 (36%)",989 (20%)
Naked Pictures of Famous People,Jon Stewart,3.57,"9,933 rating","January 1, 1998","In these nineteen whip-smart essays, Jon Stewart takes on politics, religion, and celebrity with seething irreverent wit, a brilliant sense of timing, and a palate for the absurd -- and these one-of-a-kind forays into his hilarious world will expose you to all it's wickedly naked truths.",164,"['Humor', 'Nonfiction', 'Comedy', 'Essays', 'Short Stories', 'Politics', 'History']",6 follower,499 review,94,390 (3%),"1,094 (11%)","3,061 (30%)","3,196 (32%)","2,192 (22%)"
حديث عيسى بن هشام,محمد المويلحي,3.89,279 rating,"January 1, 1907","With What ʿĪsā ibn Hishām Told Us , the Library of Arabic Literature brings readers an acknowledged masterpiece of early twentieth-century Arabic prose. Penned by the Egyptian journalist Muḥammad al-Muwayliḥī, this exceptional title was first introduced in serialized form in his family’s pioneering newspaper Miṣbāḥ al-Sharq ( Light of the East ), on which this edition is based, and later published in book form in 1907. Widely hailed for its erudition and its mordant wit, What ʿĪsā ibn Hishām Told Us was embraced by Egypt’s burgeoning reading public and soon became required reading for generations of Egyptian school students.Bridging classical genres and the emerging tradition of modern Arabic fiction, What ʿĪsā ibn Hishām Told Us is divided into two parts, the second of which was only added to the text with the fourth edition of 1927. Sarcastic in tone and critical in outlook, the book relates the excursions of its narrator ʿĪsā ibn Hishāmand his companion, the Pasha, through a rapidly Westernized Cairo at the height of British occupation, providing vivid commentary of a society negotiating―however imperfectly―the clash of imported cultural values and traditional norms of conduct, law, and education. The “Second Journey” takes the narrator to Paris to visit the Exposition Universelle of 1900, where al-Muwayliḥī casts the same relentlessly critical eye on European society, modernity, and the role of Western imperialism as it ripples across the globe.Paving the way for the modern Arabic novel, What ʿĪsā ibn Hishām Told Us is invaluable both for its sociological insight into colonial Egypt and its pioneering role in Arabic literary history.A bilingual Arabic-English edition.",456,"['Novels', 'Classics', 'Egypt']",20 follower,46 review,4,4 (1%),17 (6%),64 (22%),114 (40%),80 (28%)
The Mystery of Tally-Ho Cottage,Enid Blyton,4.09,"2,675 rating","January 1, 1954","A missing picture, a locked-up house, and a white poodle all come togther to make up the mystery of Tally-Ho cottage. It seems insoluble until Fatty has a brainwave- to Mr Goon's disgust.",192,"['Mystery', 'Childrens', 'Fiction', 'Adventure', 'Middle Grade', 'Classics', 'Crime']","5,786 follower",60 review,"5,916",12 (<1%),90 (3%),601 (22%),913 (34%),"1,059 (39%)"
The Grass Arena,John Healy,4.17,969 rating,"January 1, 1988","John Healy's The Grass Arena describes with unflinching honesty his experiences of addiction, his escape through learning to play chess in prison, and his ongoing search for peace of mind. This Penguin Classics edition includes an afterword by Colin MacCabe. In his searing autobiography Healy describes his fifteen years living rough in London without state aid, when begging carried an automatic three-year prison sentence and vagrant alcoholics prowled the parks and streets in search of drink or prey. When not united in their common aim of acquiring alcohol, winos sometimes murdered one another over prostitutes or a bottle, or the begging of money. Few modern writers have managed to match Healy's power to refine from the brutal destructive condition of the chronic alcoholic a story so compelling it is beyond comparison. John Healy (b. 1943) was born into an impoverished, Irish immigrant family, in the slums of Kentish Town, North London. Out of school by 14, pressed into the army and intermittently in prison, Healy became an alcoholic early on in life. Despite these obstacles Healy achieved remarkable, indeed phenomenal expertise in both writing and chess, as outlined in the autobiographical The Grass Arena. If you enjoyed The Grass Arena, you might like Last Exit to Brooklyn, also available in Penguin Modern Classics. 'Sober and precise, grotesque, violent, sad, charming and hilarious all at once' Literary Review 'Beside it, a book like Orwell's Down and Out in Paris and London seems a rather inaccurate tourist guide' Colin MacCabe",272,"['Nonfiction', 'Biography', 'Autobiography', 'Memoir', 'Irish Literature', 'Chess', 'Literature']",18 follower,124 review,68,10 (1%),37 (3%),140 (14%),376 (38%),406 (41%)
