title,authors,average_rating,rating,date_of_publication,descriptions,total_pages,no_of_books_by_author,author_followers,genres,no_of_reviews,five_star_ratings,four_star_ratings,three_star_ratings,two_star_ratings,one_star_ratings
Sugar Rain,Paul Park,4.13,96 rating,"January 1, 1989","The second book in the Starbridge Chronicles, SUGAR RAIN relates the stories of Thanakar and Charity Starbridge during the revolution that ended the first book in the series, SOLDIERS OF PARADISE. The generations-long winter has drawn to a close, and with it the power of the tyrannical Starbridge theocracy that maintained order during the years of hunger. But a cruelly pragmatic priest has set the stage for a new faith, and even those who defy him seem fated to play out roles that will inevitably bring it to pass. As Thanakar struggles in exile to find safe harbor for his adopted family, Charity Starbridge undertakes a mythic journey to join him, passing through various underworlds to defy a tragic destiny.",384,57,39 follower,"['Science Fiction', 'Fiction', 'Fantasy', 'Science Fiction Fantasy']",3 review,42 (43%),31 (32%),17 (17%),5 (5%),1 (1%)
Anglo-Saxon Attitudes,Angus Wilson,3.66,613 rating,"January 1, 1956","Gerald Middleton is a sixty-year-old self-proclaimed failure. Worse than that, he’s ""a failure with a conscience."" As a young man, he was involved in an archaeological dig that turned up an obscene idol in the coffin of a seventh-century bishop and scandalized a generation. The discovery was in fact the most outrageous archaeological hoax of the century, and Gerald has long known who was responsible and why. But to reveal the truth is to risk destroying the world of cozy compromises that, personally as well as professionally, he has long made his own.One of England's first openly gay novelists, Angus Wilson was a dirty realist who relished the sleaze and scuffle of daily life. Slashingly satirical, virtuosically plotted, and displaying Dickensian humor and nerve, Anglo-Saxon Attitudes features a vivid cast of characters that includes scheming academics and fading actresses, big businessmen toggling between mistresses and wives, media celebrities, hustlers, transvestites, blackmailers, toadies, and even one holy fool. Everyone, it seems, is either in cahoots or in the dark, even as comically intrepid Gerald Middleton struggles to maintain some dignity while digging up a history of lies.",352,86,34 follower,"['Fiction', 'Classics', 'Humor', '20th Century', 'British Literature', 'Novels', 'Literature']",71 review,137 (22%),229 (37%),174 (28%),49 (7%),24 (3%)
Pat of Silver Bush,L.M. Montgomery,3.91,"7,305 rating","January 1, 1933","Patricia Gardiner loved Silver Bush more than anything else in the world. She was born and raised in the beautiful old-fashioned house on Prince Edward Island, ""where things always seemed the same"" and good things never changed. But things do change at Silver Bush—from her first day at school to the arrival of her new baby sister, from her aunt's joyous wedding to her own first romance. Through it all, Pat shares her experiences with her beloved friends and discovers the one thing that truly never changes: the beauty and peace she will always find at Silver Bush—the house that remembers her whole life.",278,"2,107",11.5k follower,"['Classics', 'Fiction', 'Young Adult', 'Historical Fiction', 'Childrens', 'Historical', 'Canada']",357 review,"2,356 (32%)","2,484 (34%)","2,002 (27%)",391 (5%),72 (<1%)
Mistress Pat,L.M. Montgomery,3.87,"4,430 rating","January 1, 1935","When she was twenty, nearly everyone thought Patricia Gardiner ought to be having beaus--except of course, Pat herself. For Pat, Silver Bush was both home and heaven. All she could ever ask of life was bound in the magic of the lovely old house on Prince Edward Island, ""where good things never change."" And now there was more than ever to do, what with planning for the Christmas family reunion, entertaining a countess, playing matchmaker, and preparing for the arrival of the new hired man. Yet as those she loved so dearly started to move away, Pat began to question the wisdom of her choice of Silver Bush over romance. Was it possible to be lonely at Silver Bush?",288,"2,107",11.5k follower,"['Classics', 'Fiction', 'Young Adult', 'Historical Fiction', 'Romance', 'Historical', 'Childrens']",240 review,"1,345 (30%)","1,567 (35%)","1,174 (26%)",306 (6%),38 (<1%)
I Am Not Esther,Fleur Beale,3.93,"3,555 rating","January 1, 1998","After her mother unexpectedly leaves her with her uncle's family, members of a fanatical Christian cult, Kirby tries to learn what has become of her mother and struggles to cope with the repressiveness of her new surroundings and to maintain her own identity.After her mother leaves her with her uncle's family, members of a Christian cult, Kirby tries to learn what has become of her mother and struggles to cope with the repressiveness of her surroundings and to maintain her own identity.",256,51,138 follower,"['Young Adult', 'Fiction', 'Religion', 'Contemporary', 'Realistic Fiction', 'Cults', 'Teen']",353 review,"1,124 (31%)","1,369 (38%)",803 (22%),198 (5%),61 (1%)
The Madness of the Day,Maurice Blanchot,4.06,590 rating,"March 17, 1973","Jacques Derrida writes (in Deconstruction and Criticism) of The Madness of the Day that it is ""a story whose title runs wild and drives the reader mad.la folie du jour, the madness of today, of the day today, which leads to the madness that comes from the day, is born of it, as well as the madness of the day itself, itself mad..La folie du jour is a story of madness, of that madness that consists in seeing the light, vision or visibility, to see beyond what is visible, is not merely 'to have a vision' in the usual sense of the word, but to see-beyond-sight, to see-sight-beyond-sight..The story obscures the sun.with a blinding light.""",32,135,506 follower,"['Fiction', 'France', 'Short Stories', 'Philosophy', 'Literature', 'French Literature', 'Novels', 'Fiction', 'France', 'Short Stories', 'Philosophy', 'Literature', 'French Literature', 'Novels', 'Fiction', 'France', 'Short Stories', 'Philosophy', 'Literature', 'French Literature', 'Novels']",64 review,232 (39%),212 (35%),104 (17%),32 (5%),10 (1%)
The Tale of Mr. Jeremy Fisher,Beatrix Potter,4.15,"12,036 rating","January 1, 1906","
""Once upon a time, there was a frog called Mr. Jeremy Fisher; he lived in a little damp house amongst the buttercups at the edge of a pond...""
'The Tale of Mr. Jeremy Fisher', like Peter Rabbit, began life as an illustrated letter to a young child. It was written when Beatrix Potter was on holiday in Scotland where her father and his friends enjoyed fishing expeditions. Mr. Jeremy has a day full of the worst fisherman's mishaps when he sets out to catch minnows for his dinner.The landscape that Peter Rabbit first introduced to us in 1902 is still today one of Beatrix Potter's most popular and well-loved worlds. What started as an endearing story about a bunny rabbit would soon become the first ember for the illustrious series that is 
'The World of Beatrix Potter'
 and a story which has endured retelling after retelling at bedtimes all over the world. 
Beatrix Potter
 (1866–1943) loved the countryside and spent much of her childhood drawing and studying animals. 'The Tale of Peter Rabbit', first published in 1902, was her first book. She later went on to publish more than twenty tales and collections of rhymes.Age Rating: 3–12+ / Preschool - 2+ / Lexile Measure 840L",57,"2,830","1,972 follower","['Childrens', 'Picture Books', 'Classics', 'Fiction', 'Animals', 'Fantasy', 'Short Stories']",294 review,"5,503 (45%)","3,504 (29%)","2,478 (20%)",456 (3%),95 (<1%)
One of Ours,Willa Cather,3.94,"8,931 rating","January 1, 1922","One of Ours is Willa Cather's 1923 Pulitzer Prize-winning novel about the making of an American soldier. Claude Wheeler, the sensitive but aspiring protagonist, has ready access to his family's fortune but refuses to settle for it. Alienated from his uncaring father and pious mother, and rejected by a wife whose only love is missionary work, Claude is an idealist without ideals to cling to. Only when his country enters the Great War does he find the meaning of his life.",343,707,"2,287 follower","['Fiction', 'Classics', 'Historical Fiction', 'War', 'World War I', 'Literature', 'Novels']",913 review,"2,957 (33%)","3,319 (37%)","1,987 (22%)",488 (5%),180 (2%)
الفكر المصري في العصر المسيحي,رأفت عبد الحميد,4.05,73 rating,"January 1, 2000",,359,12,27 follower,"['History', 'Religion']",14 review,29 (39%),26 (35%),14 (19%),1 (1%),3 (4%)
Και με το φως του λύκου επανέρχονται,Zyranna Zateli,4.25,"1,228 rating","January 1, 1993","""Αν πάρεις δέκα σκυλιά και πας και τ' αφήσεις σ' έναν αγριότοπο, σε μια ερημιά απ' όπου δεν περνάει ψυχή ζώσα, τα σκυλιά αυτά μέσα σε λίγες εβδομάδες θα ξαναγίνουν λύκοι...""Με την ανεξιχνίαστη περιστροφή που θα ακολουθούσε ένα ηλιοτρόπιο της νύχτας, η τέχνη της Ζ.Ζ. -επαληθευμένη χαρμόσυνα σε αυτό το τρίτο της βιβλίο, που είναι και το πρώτο της μυθιστόρημα- αποδεικνύει ότι μπορεί κανείς να γράφει σαν να προσπαθεί να λύσει τα μάγια του κόσμου ή σαν να ξορκίζει τη λύση τους.Το διάχυτο θέμα αυτών των ιστοριών: πώς γεύεται κανείς το μέλι πάνω στο τσεκούρι, είναι και η απάντηση στη συναρπαστική αδυναμία της αφηγήτριας: ανίκανη να αντέξει το μαράζι της σιωπής, γιατρεύει τη σιωπή της με τη λογοτεχνία.Ο αναγνώστης έχει τη σπάνια τύχη να μπει σε έναν εραλδικό κόσμο, όπου οι άνθρωποι υπάρχουν σαν διαλυμένα είδωλα, τα οποία εμπλέκονται στο αφηγηματικό υφάδι με τον αινιγματικό τρόπο που μια μουσική φράση παρεισφρέει αναπάντεχα σε ένα ζωγραφικό πίνακα.",667,16,179 follower,"['Fiction', 'Greece', 'Magical Realism', 'Fantasy', 'Literature', 'Classics', 'Adult', 'Fiction', 'Greece', 'Magical Realism', 'Fantasy', 'Literature', 'Classics', 'Adult', 'Fiction', 'Greece', 'Magical Realism', 'Fantasy', 'Literature', 'Classics', 'Adult']",88 review,608 (49%),401 (32%),151 (12%),49 (3%),19 (1%)
American Sphinx: The Character of Thomas Jefferson,Joseph J. Ellis,3.93,"28,250 rating","January 31, 1997","Following his subject from the drafting of the Declaration of Independence to his retirement in Monticello, Joseph Ellis unravels the contradictions of the Jeffersonian character. A marvel of scholarship, a delight to read, and an essential gloss on the Jeffersonian legacy.",440,38,"1,166 follower","['History', 'Biography', 'Nonfiction', 'American History', 'Presidents', 'Politics', 'American Revolution']",770 review,"9,957 (35%)","10,089 (35%)","5,603 (19%)","1,602 (5%)",999 (3%)
Obasan,Joy Kogawa,3.69,"7,763 rating","January 1, 1981","Winner of the American Book AwardBased on the author's own experiences, this award-winning novel was the first to tell the story of the evacuation, relocation, and dispersal of Canadian citizens of Japanese ancestry during the Second World War.",300,22,89 follower,"['Fiction', 'Historical Fiction', 'Canada', 'Japan', 'Historical', 'School', 'Classics']",665 review,"1,815 (23%)","2,895 (37%)","2,143 (27%)",672 (8%),238 (3%)
Fata Morgana,William Kotzwinkle,3.77,410 rating,"January 1, 1977","Mystery is taken to the level of enchantment in this lyrical thriller set in the glitter of nineteenth century Paris.  At the fashionable salon of Ric Lazare you can have your fortune told by an amazing machine of unerring accuracy. But the police think Lazare is a con man and send Inspector Picard to investigate. Picard prefers lemon tarts and prostitutes to high society, and is unprepared for the string of murders that pulls him across the continent until he is tangled in the killer's last seductive knot.A landmark in the history of detective fiction.",209,93,237 follower,"['Fantasy', 'Fiction', 'Mystery', 'Historical Fiction', 'Historical', 'Science Fiction Fantasy', 'Speculative Fiction']",37 review,83 (20%),191 (46%),102 (24%),26 (6%),8 (1%)
Time and Again,Clifford D. Simak,3.89,"3,471 rating","December 1, 1950","'One of those complex and enormously inventive stories... based on some real, honest, practical ethical thinking. It is an idea book.' - Groff Conklin in Galaxy Science FictionAsher Sutton has been lost in deepest space for twenty years. Suddenly arrives a warning from the future, that he will return- and that he must be killed. He is destined to write a book whose message may lead to the death of millions in centuries to come. For this reason Sutton is hounded by the sinister warring factions of the future who wish to influence or prevent the writing of this book he has not yet begun to write.Yet already a copy has been found in the burnt-out wreckage of a space-craft on Aldebaran XII.",303,913,955 follower,"['Science Fiction', 'Time Travel', 'Fiction', 'Fantasy', 'Science Fiction Fantasy', 'Classics', 'Novels']",190 review,990 (28%),"1,366 (39%)",896 (25%),171 (4%),48 (1%)
The Forbidden Lord,Sabrina Jeffries,3.97,"3,247 rating","February 1, 1999","Devastating PassionJordan Willis, the Earl of Blackmore, has played with the hearts of many a society belle- yet one stolen kiss impulsively planted on the soft, irresistible lips of the preacher's daughter, prim and proper Emily Fairchild, proves to be his undoing. Unable to forget her, he is more shaken than ever when he meets Lady Emma Campbell, an outrageously flirtatious debutante who is an uncanny double of the sweet Emily!Dangerous CharadeEmily cannot reveal the reason for her scandalous masquerade- not even to the earl whose heated embrace awkwakens a sizzling passion. Her very life depends on convincing society that she is Lady Campbell, yet no disguise can hide her dangerous attraction to the earl. But does ""Cinderella"" care risk losing her handsome ""prince"" by revealing that she is just a country girl?",384,89,"4,601 follower","['Historical Romance', 'Romance', 'Historical', 'Regency', 'Historical Fiction', 'Fiction', 'Regency Romance']",183 review,"1,030 (31%)","1,273 (39%)",799 (24%),111 (3%),34 (1%)
Deep Six,Clive Cussler,3.91,"17,556 rating","January 1, 1984","A deadly tide of poison flows into ocean waters. A ghost ship drifts across the empty northern Pacific. A luxury Soviet liner blazes into a funeral pyre. The Presidential yacht cruises the Potomac night -- and the President disappears without a trace.Dirk Pitt, the swashbuckling hero of Clive Cussler's smash bestsellers Sahara and Inca Gold, takes on a sinister Asian shipping empire in an intercontinental duel of nerves. In his most dangerous, fast-paced adventure, he fights to save the U.S. government -- and to seize one desperate moment of revenge!",470,492,"7,903 follower","['Fiction', 'Adventure', 'Thriller', 'Action', 'Mystery', 'Suspense', 'Mystery Thriller']",393 review,"4,753 (27%)","7,206 (41%)","4,897 (27%)",618 (3%),82 (<1%)
The Poetry of Pablo Neruda,Pablo Neruda,4.44,"19,452 rating","December 1, 1951","The most comprehensive English-language collection of work ever by ""the greatest poet of the twentieth century - in any language"" - Gabriel García Márquez""In his work a continent awakens to consciousness."" So wrote the Swedish Academy in awarding the Nobel Prize to Pablo Neruda, the author of more than thirty-five books of poetry and one of Latin America's most revered writers, lionized during his lifetime as ""the people's poet."" This selection of Neruda's poetry, the most comprehensive single volume available in English, presents nearly six hundred poems. Scores of them are in new and sometimes multiple translations, and many accompanied by the Spanish original. In his introduction, Ilan Stavans situates Neruda in his native milieu as well as in a contemporary English-language one, and a group of new translations by leading poets testifies to Neruda's enduring, vibrant legacy among English-speaking writers and readers today.",1040,862,"8,950 follower","['Poetry', 'Classics', 'Fiction', 'Romance', 'Literature', 'Spanish Literature', 'Nobel Prize', 'Poetry', 'Classics', 'Fiction', 'Romance', 'Literature', 'Spanish Literature', 'Nobel Prize', 'Poetry', 'Classics', 'Fiction', 'Romance', 'Literature', 'Spanish Literature', 'Nobel Prize']",361 review,"11,530 (59%)","5,596 (28%)","1,835 (9%)",327 (1%),164 (<1%)
The End of Education: Redefining the Value of School,Neil Postman,3.96,"1,799 rating","September 26, 1995","Postman suggests that the current crisis in our educational system derives from its failure to supply students with a translucent, unifying ""narrative"" like those that inspired earlier generations. Instead, today's schools promote the false ""gods"" of economic utility, consumerism, or ethnic separatism and resentment. What alternative strategies can we use to instill our children with a sense of global citizenship, healthy intellectual skepticism, respect of America's traditions, and appreciation of its diversity? In answering this question, The End of Education restores meaning and common sense to the arena in which they are most urgently needed.""Informal and clear...Postman's ideas about education are appealingly fresh.""--New York Times Book Review",209,58,843 follower,"['Education', 'Nonfiction', 'Philosophy', 'Teaching', 'Sociology', 'Parenting', 'History']",168 review,559 (31%),745 (41%),383 (21%),85 (4%),27 (1%)
The Complete Masks of Nyarlathotep,Larry DiTillio,4.46,196 rating,"January 1, 1984","At last the stars are almost right. Soon Nyarlathotep's plans will come to fruition. Then the world will be changed irrevocably - but not quite yet. Pesky human investigators have learned much. Now they must survive long enough to make sense of what they know, and take resolute action. This roleplaying classic is a series of linked adventures forming one long and unforgettable campaign. Horrifying deeds and dangerous sorcery dog those who dare attempt to unravel the fate of the Carlyle Expedition. The non-linear narrative keeps players baffled and on their toes. Action is the byword as the player-characters evade or combat cultists, magic, mad men, and the dread powers of the Outer Gods.",228,25,3 follower,"['Role Playing Games', 'Horror', 'Gaming', 'Cthulhu Mythos', 'Games', 'Role Playing Games', 'Horror', 'Gaming', 'Cthulhu Mythos', 'Games', 'Role Playing Games', 'Horror', 'Gaming', 'Cthulhu Mythos', 'Games']",17 review,113 (57%),60 (30%),23 (11%),0 (0%),0 (0%)
The Curse of Chalion,Lois McMaster Bujold,4.17,"38,923 rating","August 14, 2001","A man broken in body and spirit, Cazaril, has returned to the noble household he once served as page, and is named, to his great surprise, as the secretary-tutor to the beautiful, strong-willed sister of the impetuous boy who is next in line to rule. It is an assignment Cazaril dreads, for it will ultimately lead him to the place he fears most, the royal court of Cardegoss, where the powerful enemies, who once placed him in chains, now occupy lofty positions. In addition to the traitorous intrigues of villains, Cazaril and the Royesse Iselle, are faced with a sinister curse that hangs like a sword over the entire blighted House of Chalion and all who stand in their circle. Only by employing the darkest, most forbidden of magics, can Cazaril hope to protect his royal charge—an act that will mark the loyal, damaged servant as a tool of the miraculous, and trap him, flesh and soul, in a maze of demonic paradox, damnation, and death.",490,176,38.1k follower,"['Fantasy', 'Fiction', 'High Fantasy', 'Epic Fantasy', 'Science Fiction Fantasy', 'Romance', 'Audiobook']","2,965 review","17,120 (43%)","14,010 (35%)","5,740 (14%)","1,411 (3%)",642 (1%)
The Death of Achilles,Boris Akunin,4.14,"5,901 rating","January 1, 1998","In 1882, after six years of foreign travel and adventure, renowned diplomat and detective Erast Fandorin returns to Moscow in the heart of Mother Russia. His Moscow homecoming is anything but peaceful. In the hotel where he and his loyal if impertinent manservant Masa are staying, Fandorin’s old war-hero friend General Michel Sobolev (“Achilles” to the crowd) has been found dead, felled in his armchair by an apparent heart attack. But Fandorin suspects an unnatural cause. His suspicions lead him to the boudoir of the beautiful singer–“not exactly a courtesan”–known as Wanda. Apparently, in Wanda’s bed, the general secretly breathed his last. . . .",320,414,"1,520 follower","['Mystery', 'Fiction', 'Russia', 'Historical Fiction', 'Crime', 'Detective', 'Historical', 'Mystery', 'Fiction', 'Russia', 'Historical Fiction', 'Crime', 'Detective', 'Historical', 'Mystery', 'Fiction', 'Russia', 'Historical Fiction', 'Crime', 'Detective', 'Historical', 'Mystery', 'Fiction', 'Russia', 'Historical Fiction', 'Crime', 'Detective', 'Historical', 'Mystery', 'Fiction', 'Russia', 'Historical Fiction', 'Crime', 'Detective', 'Historical']",234 review,"2,251 (38%)","2,434 (41%)","1,039 (17%)",151 (2%),26 (<1%)
"Stars in Their Courses: The Gettysburg Campaign, June-July 1863",Shelby Foote,4.45,"1,669 rating","June 28, 1994",Historian/novelist Foote's masterly work has been culled from his critically acclaimed three-volume narrative of the Civil War.,290,129,602 follower,"['History', 'Civil War', 'Nonfiction', 'American History', 'American Civil War', 'War', 'Military Fiction']",112 review,989 (59%),496 (29%),145 (8%),27 (1%),12 (<1%)
Why Read the Classics?,Italo Calvino,3.84,"2,928 rating","June 1, 1991","From the internationally acclaimed author of some of this century's most breathtakingly original novels comes this posthumous collection of thirty-six literary essays that will make any fortunate reader view the old classics in a dazzling new light.Learn why Lara, not Zhivago, is the center of Pasternak's masterpiece, Dr. Zhivago, and why Cyrano de Bergerac is the forerunner of modern-day science-fiction writers. Learn how many odysseys The Odyssey contains, and why Hemingway's Nick Adams stories are a pinnacle of twentieth-century literature. From Ovid to Pavese, Xenophon to Dickens, Galileo to Gadda, Calvino covers the classics he has loved most with essays that are fresh, accessible and wise. Why Read the Classics? firmly establishes Calvino among the rare likes of Nabokov, Borges, and Lawrence--writers whose criticism is as vibrant and unique as their groundbreaking fiction.  ",288,479,"7,826 follower","['Nonfiction', 'Essays', 'Classics', 'Books About Books', 'Literary Criticism', 'Literature', 'Italy']",292 review,764 (26%),"1,163 (39%)",799 (27%),164 (5%),38 (1%)
Sexual Personae: Art and Decadence from Nefertiti to Emily Dickinson,Camille Paglia,3.98,"3,222 rating","January 1, 1990","Is Emily Dickinson ""the female Sade""? Is Donatello's David a bit of paedophile pornography? What is the secret kinship between Byron and Elvis Presley, between the Medusa and Madonna? How do liberals and feminists - as well as conservatives - fatally misread human nature? This audacious and omnivorously learned work of guerilla scholarship offers nothing less than a unified-field theory of Western culture, high and low, since the Egyptians invented beauty - making a persuasive case for all art as a pagan battleground between male and female, form and chaos, civilisation and demonic nature.",736,30,"1,063 follower","['Nonfiction', 'Art', 'Philosophy', 'History', 'Feminism', 'Psychology', 'Literary Criticism']",326 review,"1,262 (39%)","1,061 (32%)",587 (18%),186 (5%),126 (3%)
Breach of Faith: The Fall of Richard Nixon,Theodore H. White,3.97,307 rating,"January 1, 1975","The Nixon crisis of 1973-74 threatened the state in ways not immediately understood. Stripped of drama & confusion, however, the problem was that the President had placed himself above the law. The nation had to decide whether that could be allowed. Theodore H. White starts this story with the last days of Richard Nixon in the White House--as those closest recognized he'd deceived them & that they must force him out. He follows the thread of manipulation back to its origin 20 years earlier & shows how the Nixon team came to see politics as war without quarter, in which the White House was a command post where ordinary rules didn't apply, where power could be used without restraint.Let justice be doneThe politics of manipulationPoor Richard: how things workThe team: from politics to powerThe White House of Richard Nixon: from style to heresyThe underground: from crime to conspiracyVictory 1972: design for controlThe tapes: a tour inside the mind of Richard NixonThe systems respond: Spring 1973Firestorm: Fall 1973The question period: Winter-Spring 1974Judgment: Summer 1974Breach of faithAppendix A: The articles of impeachmentAppendix B: Richard Nixon's farewell statement, 8/8/74",476,58,57 follower,"['History', 'Politics', 'Nonfiction', 'Presidents', 'American History', 'Biography']",29 review,78 (25%),151 (49%),69 (22%),9 (2%),0 (0%)
