title,authors,average_rating,rating,date_of_publication,descriptions,total_pages,no_of_books_by_author,author_followers,genres,no_of_reviews,five_star_ratings,four_star_ratings,three_star_ratings,two_star_ratings,one_star_ratings
The Winners,Julio Cortázar,3.87,"2,181 rating","January 1, 1960","The Argentine writer Julio Cortázar, called by Carlos Fuentes the Simon Bolivar of the Latin American novel, was one of the scintillating geniuses of twentieth-century literature—a writer of sly wit and immense sophistication with a keen eye for character and the workings of social life.The Winners is the story of a luxury cruise, bound for an unknown destination, which runs terribly amok. Funny, frightening, lyrical, and humane, it is a deeply satisfying philosophical novel about crossed lives and wayward love, as well as a brilliant meditation on the myth of the New World.",456,668,"6,287 follower","['Fiction', 'Latin American', 'Literature', 'Novels', 'Magical Realism', 'Classics', 'Literary Fiction', 'Fiction', 'Latin American', 'Literature', 'Novels', 'Magical Realism', 'Classics', 'Literary Fiction', 'Fiction', 'Latin American', 'Literature', 'Novels', 'Magical Realism', 'Classics', 'Literary Fiction', 'Fiction', 'Latin American', 'Literature', 'Novels', 'Magical Realism', 'Classics', 'Literary Fiction', 'Fiction', 'Latin American', 'Literature', 'Novels', 'Magical Realism', 'Classics', 'Literary Fiction']",144 review,588 (26%),901 (41%),534 (24%),126 (5%),32 (1%)
Above Suspicion,Helen MacInnes,3.89,"2,098 rating","January 1, 1941",Suspicion,333,71,220 follower,"['Fiction', 'Mystery', 'Thriller', 'Espionage', 'Suspense', 'Historical Fiction', 'World War II']",226 review,590 (28%),843 (40%),524 (24%),117 (5%),24 (1%)
The Bug Wars,Robert Lynn Asprin,3.65,592 rating,"January 1, 1979","In a galaxy-spanning struggle of epic proportion, the L'vrai, a race of highly evolved lizards, clash with a formidable coalition of brutal insect tribes in a battle to the death",217,195,"1,030 follower","['Science Fiction', 'Fiction', 'Fantasy', 'War', 'Science Fiction Fantasy', 'Military Science Fiction', 'Space Opera']",39 review,131 (22%),196 (33%),198 (33%),60 (10%),7 (1%)
Sister Pelagia and the White Bulldog,Boris Akunin,3.75,"3,780 rating","January 1, 2000","In a remote Russian province in the late nineteenth century, Bishop Mitrofanii must deal with a family crisis. After learning that one of his great aunt’s beloved and rare white bulldogs has been poisoned, the Orthodox bishop knows there is only one detective clever enough to investigate the murder: Sister Pelagia.The bespectacled, freckled Pelagia is lively, curious, extraordinarily clumsy, and persistent. At the estate in question, she finds a whole host of suspects, any one of whom might have benefited if the old lady (who changes her will at whim) had expired of grief at the pooch’s demise. There’s Pyotr, the matron’s grandson, a nihilist with a grudge who has fallen for the maid; Stepan, the penniless caretaker, who has sacrificed his youth to the care of the estate; Miss Wrigley, a mysterious Englishwoman who has recently been named sole heiress to the fortune; Poggio, an opportunistic and freeloading “artistic” photographer; and, most intriguingly, Naina, the old lady’s granddaughter, a girl so beautiful she could drive any man to do almost anything.As Pelagia bumbles and intuits her way to the heart of a mystery among people with faith only in greed and desire, she must bear in mind the words of Saint Paul: “Beware of dogs–and beware of evil-doers.”",273,414,"1,520 follower","['Mystery', 'Historical Fiction', 'Russia', 'Fiction', 'Crime', 'Historical Mystery', 'Detective', 'Mystery', 'Historical Fiction', 'Russia', 'Fiction', 'Crime', 'Historical Mystery', 'Detective', 'Mystery', 'Historical Fiction', 'Russia', 'Fiction', 'Crime', 'Historical Mystery', 'Detective']",209 review,"1,066 (28%)","1,348 (35%)",883 (23%),326 (8%),157 (4%)
Youth / Heart of Darkness / The End of the Tether,Joseph Conrad,3.93,413 rating,"January 1, 1924","Conrad's aim was by ""the power of the written word, to make you hear, to make you feel . . . before all, to make you see""Heart of Darkness, his exploration of European colonialism in Africa and of elusive human values, embodies more profoundly than almost any other modern fiction the difficulty of 'seeing,' its relativity and shifting compromise. Portraying a young man's first sea-voyage to the East in Youth, an unenlightened maturity in Heart of Darkness, and the blind old age of Captain Whalley in The End of the Tether, the stories in this volume are united in their theme - the 'Ages of Man' - and in their scepticism. Conrad's vision has influenced twentieth-century writers and artists from T. S. Eliot to Jorge Luis Borges and Werner Herzog, and continues to draw critical fire. In his stimulating introduction John Lyon discusses the links between these three stories, the critiques of Chinua Achebe and Edward Said, and the ebb and flow of Conrad's magnificent narrative art.For more than seventy years, Penguin has been the leading publisher of classic literature in the English-speaking world. With more than 1,700 titles, Penguin Classics represents a global bookshelf of the best works throughout history and across genres and disciplines. Readers trust the series to provide authoritative texts enhanced by introductions and notes by distinguished scholars and contemporary authors, as well as up-to-date translations by award-winning translators.",384,"3,101","4,179 follower","['Classics', 'Fiction', 'Adventure', 'Short Stories', 'Novels', 'Literature', 'British Literature', 'Classics', 'Fiction', 'Adventure', 'Short Stories', 'Novels', 'Literature', 'British Literature', 'Classics', 'Fiction', 'Adventure', 'Short Stories', 'Novels', 'Literature', 'British Literature']",41 review,140 (33%),154 (37%),81 (19%),27 (6%),11 (2%)
Berlin Noir: March Violets / The Pale Criminal / A German Requiem,Philip Kerr,4.21,"10,752 rating","January 1, 1993","Now published in one paperback volume, these three mysteries are exciting and insightful looks at life inside Nazi Germany -- richer and more readable than most histories of the period. We first meet ex-policeman Bernie Gunther in 1936, in March Violets (a term of derision which original Nazis used to describe late converts.) The Olympic Games are about to start; some of Bernie's Jewish friends are beginning to realize that they should have left while they could; and Gunther himself has been hired to look into two murders that reach high into the Nazi Party. In The Pale Criminal, it's 1938, and Gunther has been blackmailed into rejoining the police by Heydrich himself. And in A German Requiem, the saddest and most disturbing of the three books, it's 1947 as Gunther stumbles across a nightmare landscape that conceals even more death than he imagines. (For a review of Kerr's latest novel, The Grid, see our Thrillers section.)",834,116,"1,869 follower","['Fiction', 'Mystery', 'Historical Fiction', 'Crime', 'Noir', 'Thriller', 'Germany']",727 review,"4,619 (42%)","4,297 (39%)","1,443 (13%)",296 (2%),97 (<1%)
Lord Brocktree,Brian Jacques,3.99,"50,827 rating","September 26, 2000","The young haremaid Dotti and the badger-warrior Lord Brocktree—unlikely comrades—set out for Salamandastron together, only to discover the legendary mountain has been captured by the wildcat Ungatt Trunn and his Blue Hordes. To face them, the two must rally an army—hares and otters, shrews and moles, mice and squirrels—and execute a plan that makes up in cleverness what it lacks in force.",370,251,"4,028 follower","['Fantasy', 'Fiction', 'Young Adult', 'Childrens', 'Animals', 'Adventure', 'Middle Grade']",389 review,"18,648 (36%)","17,532 (34%)","11,180 (21%)","2,331 (4%)","1,136 (2%)"
Verrà la morte e avrà i tuoi occhi,Cesare Pavese,4.38,"2,018 rating","January 1, 1951","Le poesie di Verrà la morte non attingono alla vena epica di Lavorare stanca. Dall'oggettivazione narrativa fanno ritorno al soggettivismo lirico, ma trascendono l'antico limite della confessione e dello sfogo, nella sottile sapienza d'un linguaggio poetico che si fa numero, immagine, valore musicale.",41,300,"1,055 follower","['Poetry', 'Italian Literature', 'Classics', 'Italy', '20th Century', 'European Literature']",133 review,"1,064 (52%)",703 (34%),209 (10%),37 (1%),5 (<1%)
Absinthe: History in a Bottle,Barnaby Conrad III,4.05,331 rating,"December 1, 1988","One hundred forty-four proof, notoriously addictive, and the drug of choice for nineteenth-century poets, absinthe is gaining bootleg popularity after almost a century of being banned. Due to popular demand, Absinthe: History in a Bottle is back in paperback with a handsome new cover. Like the author's bestselling The Martini and The Cigar, it is a potent brew of wild nights and social history, fact and trivia, gorgeous art and beautiful artifacts. As intoxicating as its subject, Absinthe makes a memorable gift for anyone who knows how to celebrate vice.",172,17,5 follower,"['History', 'Nonfiction', 'Food and Drink', 'Food', 'Microhistory', 'Booze', 'Alcohol']",20 review,104 (31%),148 (44%),73 (22%),5 (1%),1 (<1%)
The Origins of Totalitarianism,Hannah Arendt,4.29,"12,047 rating","January 1, 1951","Hannah Arendt's definitive work on totalitarianism and an essential component of any study of twentieth-century political historyThe Origins of Totalitarianism begins with the rise of anti-Semitism in central and western Europe in the 1800s and continues with an examination of European colonial imperialism from 1884 to the outbreak of World War I. Arendt explores the institutions and operations of totalitarian movements, focusing on the two genuine forms of totalitarian government in our time—Nazi Germany and Stalinist Russia—which she adroitly recognizes were two sides of the same coin, rather than opposing philosophies of Right and Left. From this vantage point, she discusses the evolution of classes into masses, the role of propaganda in dealing with the nontotalitarian world, the use of terror, and the nature of isolation and loneliness as preconditions for total domination.",527,377,"3,819 follower","['History', 'Philosophy', 'Politics', 'Nonfiction', 'Sociology', 'Political Science', 'Classics']","1,008 review","6,087 (50%)","4,024 (33%)","1,468 (12%)",338 (2%),130 (1%)
Darconville's Cat,Alexander Theroux,4.27,545 rating,"April 1, 1981","Alaric Darconville is a young professor at a southern women’s college. He falls in love with one of his students, is deserted, and the consequences are almost beyond the telling. But not quite. This novel is an astonishing wire-walking exhibition of wit, knowledge, and linguistic mastery. Darconville’s Cat is a novel about love and hate. Among other matters, it deals with delicate tensions between Life and Art, the Ideal and the Real, God and Satan, and, above all, with the crises and conflicts between Man and Woman, the tragic implications of which reach all the way back to the Primal Fall. Its chapters embody a multiplicity of narrative forms, including a diary, a formal oration, an abecedarium, a sermon, a litany, a blank-verse play, poems, essays, parodies, and fables. It is an explosion of vocabulary, rich with comic invention and dark with infernal imagination. Alexander Theroux restores words to life, invents others, liberates a language too long polluted by mutters and mumbles, anti-logic, and the inexact lunacies of the modern world where the possibility of communication itself is in question. An elegantly executed jailbreak from the ordinary, Darconville’s Cat is excessive; funny; uncompromising; a powerful epic, coming out of a tradition, yet contempo- rary, of both the sacred and the profane.",704,43,171 follower,"['Fiction', 'Novels', 'Literature', 'American', 'Literary Fiction', 'Contemporary', '20th Century']",97 review,293 (53%),162 (29%),51 (9%),22 (4%),17 (3%)
The World's Wife,Carol Ann Duffy,4.13,"9,302 rating","September 1, 1999","Be terrified.  It's you I love, perfect man, Greek God, my own; but I know you'll go, betray me, strayfrom home.So better by far for me if you were stone.—from ""Medusa""Stunningly original and haunting, the voices of Mrs. Midas, Queen Kong, and Frau Freud, to say nothing of the Devil's Wife herself, startle us with their wit, imagination, and incisiveness in this collection of poems written from the perspectives of the wives, sisters, or girlfriends of famous—and infamous—male personages. Carol Ann Duffy is a master at drawing on myth and history, then subverting them in a vivid and surprising way to create poems that have the pull of the past and the crack of the contemporary.",76,163,657 follower,"['Poetry', 'Feminism', 'School', 'Fiction', 'Mythology', 'Retellings', 'Classics']",925 review,"3,832 (41%)","3,483 (37%)","1,494 (16%)",365 (3%),128 (1%)
The Dog Who Rescues Cats: True Story of Ginny,Philip González,4.12,"1,285 rating","January 1, 1995","Philip Gonzalez had lost all interest in living after an industrial accident left him disabled. A friend suggested he adopt a dog.Reluctantly he went to the shelter, where Ginny, a badly abused one-year-old pup,quickly won him over. Philip realized immediately that Ginny was no ordinary dog--she had an amazing sixth sense that enabled her to find and rescue stray and ailing cats.There's Madame,who is completely deaf; Revlon, who has only one eye;Betty Boop,who has no hind feet;and Topsy, a paralyzed kitten whom Ginny found abandoned in an empty building. Ginny and Philip have now rescued and found homes for over 200 cats, and they have over 60 ""outdoor cats"" whom they visit and feed twice daily. Even more than extraordinary, Ginny's angelic mission has given Philip a sense of purpose and a new lease on life. You will never forget the true adventures of Ginny, the dog who rescues cats.",176,5,9 follower,"['Animals', 'Nonfiction', 'Dogs', 'Cats', 'Biography', 'Memoir', 'New York']",117 review,581 (45%),372 (28%),259 (20%),51 (3%),22 (1%)
The Organization Man,William H. Whyte,3.79,328 rating,"January 1, 1956","Who's the organization man? In America he's the prosperous, white-collar worker who lives under the protection of a big organization such as the civil service or a business corporation, & who has a kind of job in which more & more Americans are finding a promise of security & high standards of living. This book is a study of him-how he's trained in college & at work, how he's selected & tested for employment & advancement, how he lives in the family, how he worships, what he thinks, & what he hopes to get out of life. All this is of direct interest to us, for what is happening in America is happening here. We are most of us, to some degree, organization men, & specialization is already ousting the liberal arts from pride of place in our educational system. Is ours to be a society governed by the mediocrity of business method? We will do well to take warning from The Organization Man.Part I The Ideology of Organization Man1 Introduction 2 The Decline of the Protestant Ethic3 Scientism 4 Belongingness5 Togetherness Part II The Training of Organization Man6 A Generation of Bureaucrats7 The Practical Curriculum8 Business Influence on Education9 The Pipe Line10 The ""Well-Rounded"" ManPart III The Neuroses of Organization Man11 The Executive: Non-Well-Rounded Man12 The Executive Ego 13 Checkers Part IV The Testing of Organization Man14 How Good an Organization Man are You?15 The Tests of Conformity Part V The Organization Scientist16 The Fight against Genius 17 The Bureaucratization of the Scientist18 The Foundations and Projectism Part VI The Organization Man in Fiction19 Love That System20 Society as Hero Part VII The New Suburbia: Organization Man at Home21 The Transients22 The New Roots 23 Classlessness in Suburbia24 Inconspicuous Consumption25 The Web of Friendship 26 The Outgoing Life 27 The Church of Suburbia28 The Organization ChildrenConclusion Appendix: How to Cheat on Personality TestsAcknowledgmentsIndex",471,22,48 follower,"['Nonfiction', 'Sociology', 'Business', 'Psychology', 'History', 'Politics', 'Economics']",45 review,87 (26%),118 (35%),93 (28%),26 (7%),4 (1%)
Angústia,Graciliano Ramos,4.01,"2,580 rating","January 1, 1936","Romance de Graciliano Ramos inicialmente publicado no ano em que ficou preso em Maceió.Marco do romance moderno brasileiro, ""Angústia"" é a expressão máxima do embate, entre a subjetividade do escritor e a realidade objetiva é sempre opressora, que se revela na figura de um pequeno funcionário e sua consciência de condenado à mediocridade.",336,75,341 follower,"['Fiction', 'Classics', 'Brazil', 'Romance', 'Portuguese Literature', 'Novels', 'Literature']",217 review,956 (37%),947 (36%),474 (18%),154 (5%),49 (1%)
Class: A Guide Through the American Status System,Paul Fussell,3.91,"3,001 rating","January 1, 1983","The bestselling, comprehensive, and carefully researched guide to the ins-and-outs of the American class system with a detailed look at the defining factors of each group, from customs to fashion to housing.Based on careful research and told with grace and wit, Paul Fessell shows how everything people within American society do, say, and own reflects their social status. Detailing the lifestyles of each class, from the way they dress and where they live to their education and hobbies, Class is sure to entertain, enlighten, and occasionally enrage readers as they identify their own place in society and see how the other half lives.",208,57,116 follower,"['Nonfiction', 'Sociology', 'Politics', 'Economics', 'History', 'Humor', 'Class']",426 review,968 (32%),"1,115 (37%)",660 (21%),188 (6%),70 (2%)
Farewell to the Sea: A Novel of Cuba,Reinaldo Arenas,4.07,323 rating,"November 29, 1985","""...a passionate indictment of tyranny."" --  The New YorkerTwice confiscated by Cuban authorities and rewritten from memory, this is Arenas' most celebrated novel In this brilliant, apocalyptic vision of Castro's Cuba, we meet a young couple who leave the dreariness of Havana and spend six days at a small seaside retreat, where they hope to recapture the desire and carefree spirit that once united them. In a stunning juxtaposition of narrative voices, the wife recounts the grim reality of her marriage, the demands of motherhood, and her loss of freedom, innocence, and hope; while her husband, a disillusioned poet and disenchanted revolutionary, recalls his political struggles and laments the artistic and homosexual freedom that has been denied him. Rich in hallucination, myth and fantasy, Farewell to the Sea is a fierce and unforgettable work that speaks for the entire human condition.",448,64,317 follower,"['Fiction', 'Latin American', 'Literature', 'Literary Fiction', 'LGBT', 'Poetry', 'Contemporary', 'Fiction', 'Latin American', 'Literature', 'Literary Fiction', 'LGBT', 'Poetry', 'Contemporary', 'Fiction', 'Latin American', 'Literature', 'Literary Fiction', 'LGBT', 'Poetry', 'Contemporary', 'Fiction', 'Latin American', 'Literature', 'Literary Fiction', 'LGBT', 'Poetry', 'Contemporary', 'Fiction', 'Latin American', 'Literature', 'Literary Fiction', 'LGBT', 'Poetry', 'Contemporary']",31 review,135 (41%),106 (32%),58 (17%),18 (5%),6 (1%)
Autumn in Peking,Boris Vian,3.92,"2,845 rating","January 1, 1947","Boris Vian was a jack of all trades - although unfortunately his name was Boris and ""Boris of all trades"" never took off as a turn of phrase. But nevertheless Vian was a great songwriter, playwright, singer, jazz critic and, of course novelist so it should have been Boris instead of Jack. Vian's 1947 novel Autumn in Peking (L'Automne a Pekin) is perhaps Vian's most slapstick work, with an added amount of despair in its exotic recipe for a violent cocktail drink. The story takes place in the imaginary desert called Exopotamie where all the leading characters take part in the building of a train station with tracks that go nowhere. Houses and buildings are destroyed to build this unnecessary structure - and in Vian's world waste not, make not. In Alistair Rolls' pioneering study of Vian's novels, ""The Flight of the Angels,"" he expresses that Exopotamie is a thinly disguised version of Paris, where after the war the city started changing its previous centuries of architecture to something more modern. Yes, something dull to take the place of what was exciting and mysterious. Vian, in a mixture of great humor and unequal amount of disgust, introduces various 'eccentric' characters in this 'desert' adventure, such as Anne and Angel who are best friends; and Rochelle who is in love and sleeps with Anne, while Angel is madly in love with her. Besides the trio there is also Doctor Mangemanche; the archeologist Athanagore Porphyroginite, his aide, Cuivre; and Pipo - all of them in a locality similar to Lewis Carroll's Alice in Wonderland, where there is a tinge of darkness and anything is possible, except for happiness.",284,327,"1,634 follower","['Fiction', 'France', 'Classics', 'Novels', 'French Literature', '20th Century', 'Literature', 'Fiction', 'France', 'Classics', 'Novels', 'French Literature', '20th Century', 'Literature', 'Fiction', 'France', 'Classics', 'Novels', 'French Literature', '20th Century', 'Literature', 'Fiction', 'France', 'Classics', 'Novels', 'French Literature', '20th Century', 'Literature', 'Fiction', 'France', 'Classics', 'Novels', 'French Literature', '20th Century', 'Literature']",140 review,944 (33%),"1,018 (35%)",648 (22%),188 (6%),47 (1%)
Gadiantons and the Silver Sword,Chris Heimerdinger,4.12,"6,412 rating","March 28, 2000","They came from the past to retrieve something stolen. Something evil...and only Jim Hawkins stands in their way. Chris Heimerdinger, LDS master of high adventure, reunites the compelling characters from his best-selling novel, Tennis Shoes Among the Nephites, in an explosive saga that transports you from the familiar settings of Utah and the American West to the deep and shadowy jungles of southern Mexico. Jim Hawkins, still unable to remember his former adventures among the Nephites, in nevertheless haunted by fleeting images he can't seem to connect with any particular source. Vivid memories are returned to him bit by bit when strange and ancient visitors suddenly interrupt his lifeone desperate for his help, others desperate for revenge. Be a part of the excitement as Jim Hawkins, Jennifer Hawkins, and Garth Plimpton embark upon the most thrilling and hazardous quest of their lives: one that teaches them the true meaning of valiance in these latter days and where every step of the way they are pursued by darkest of villains.",314,37,440 follower,"['Lds Fiction', 'Lds', 'Young Adult', 'Fantasy', 'Religion', 'Fiction', 'Historical Fiction']",222 review,"2,567 (40%)","2,329 (36%)","1,258 (19%)",209 (3%),49 (<1%)
Trade Wind,M.M. Kaye,3.98,"3,053 rating","January 1, 1963","In the mid-nineteenth century, beautiful Hero Athena Hollis comes to Zanzibar as a missionary, but she is changed by her encounters with disease, revolution, intrigue, and the renegade slave trader Rory Frost",553,36,540 follower,"['Historical Fiction', 'Romance', 'Fiction', 'Historical', 'Historical Romance', 'Africa', 'Adventure']",182 review,"1,084 (35%)","1,094 (35%)",673 (22%),139 (4%),63 (2%)
Pedigree,Georges Simenon,3.88,222 rating,"January 1, 1948","Pedigree is Georges Simenon’s longest, most unlikely, and most adventurous novel, the book that is increasingly seen to lie at the heart of his outsize achievement as a chronicler of modern self and society. In the early 1940s, Simenon began work on a memoir of his Belgian childhood. He showed the initial pages to André Gide, who urged him to turn them into a novel. The result was, Simenon later quipped, a book in which everything is true but nothing is accurate. Spanning the years from the beginning of the century, with its political instability and terrorist threats, to the end of the First World War in 1918, Pedigree is an epic of everyday existence in all its messy unfinished intensity and density, a story about the coming-of-age of a precocious and curiousboy and the coming to be of the modern world.",560,"2,368","1,870 follower","['Fiction', 'Belgium', 'France', 'Mystery', '20th Century', 'Noir', 'War', 'Fiction', 'Belgium', 'France', 'Mystery', '20th Century', 'Noir', 'War', 'Fiction', 'Belgium', 'France', 'Mystery', '20th Century', 'Noir', 'War', 'Fiction', 'Belgium', 'France', 'Mystery', '20th Century', 'Noir', 'War', 'Fiction', 'Belgium', 'France', 'Mystery', '20th Century', 'Noir', 'War']",34 review,62 (27%),90 (40%),55 (24%),12 (5%),3 (1%)
Sagarana,João Guimarães Rosa,4.27,"2,873 rating","January 1, 1946","Considerado el mayor escritor brasileño del siglo XX y uno de los grandes renovadores de la literatura moderna universal, João Guimarães Rosa (1908-1967) es comparado con Proust, Joyce y Borges. Este es su primer libro, que se compone de nueve extensos relatos. ""Sagarana"" lleva alrededor de sesenta ediciones en portugués: la presente es la primera en lengua castellana. Con este libro, Adriana Hidalgo editora comienza el proceso de rescate de un autor clave de la literatura internacional, que continuará en 2008 con la reedición de la novela ""El gran sertón: veredas"", obra fundamental en la producción de Guimaraes.",447,88,564 follower,"['Short Stories', 'Fiction', 'Classics', 'Brazil', 'Literature', 'Portuguese Literature', 'Romance', 'Short Stories', 'Fiction', 'Classics', 'Brazil', 'Literature', 'Portuguese Literature', 'Romance', 'Short Stories', 'Fiction', 'Classics', 'Brazil', 'Literature', 'Portuguese Literature', 'Romance']",96 review,"1,485 (51%)",870 (30%),357 (12%),119 (4%),42 (1%)
