title,authors,average_rating,rating,date_of_publication,descriptions,total_pages,genres,author_followers,no_of_reviews,no_of_books_by_author,one_star_ratings,two_star_ratings,three_star_ratings,four_star_ratings,five_star_ratings
Live From Death Row,Mumia Abu-Jamal,4.23,"2,464 rating","May 1, 1995","Here for the first time are the prison writings of Abu-Jamal--including the censored commentaries from NPR--an unflinching account of the brutalities, humiliations and actrocities of prison life. Articulate and compelling, the work is certain to fuel the controversy surrounding capital punishment and freedom of speech.",215,"['Nonfiction', 'Politics', 'Memoir', 'Race', 'Biography', 'History', 'Social Justice']",230 follower,118 review,53,34 (1%),75 (3%),368 (14%),790 (32%),"1,197 (48%)"
Poems,Emily Dickinson,4.23,"2,400 rating","160 pages, PaperbackPublished October 10, 1995","The more than one hundred poems presented here are some of Emily Dickinson's finest works. These unique and gemlike lyrics are pure distillations of profound feeling and great intellect. They contain a world of imagination, observation, and precisely articulated spiritual and emotional experience. Unlike other editions of Dickinson's work, which contain the public-domain versions of poems published shortly after her death, the ones reprinted here are reconstructions based on Dickinson's original manuscripts.",160,"['Poetry', 'Classics', 'Fiction', '19th Century', 'Womens', 'American', 'Literature', 'Poetry', 'Classics', 'Fiction', '19th Century', 'Womens', 'American', 'Literature', 'Poetry', 'Classics', 'Fiction', '19th Century', 'Womens', 'American', 'Literature']","5,861 follower",47 review,"1,352",32 (1%),77 (3%),358 (14%),782 (32%),"1,151 (47%)"
Batman: Gotham by Gaslight,Brian Augustyn,3.87,"13,011 rating","November 28, 1989",Presenting for the first time the adventures of the Victorian Era Batman in one 112-page edition! This volume includes the breakthrough Elseworlds specials Gotham by Gaslight and Master of the Future that pit the Dark Knight against Jack the Ripper and a death-dealer from the skies over Gotham!This edition collects the two one-shots: Gotham by Gaslight and Master of the Future.,112,"['Comics', 'Graphic Novels', 'Batman', 'Dc Comics', 'Superheroes', 'Fiction', 'Comic Book', 'Comics', 'Graphic Novels', 'Batman', 'Dc Comics', 'Superheroes', 'Fiction', 'Comic Book', 'Comics', 'Graphic Novels', 'Batman', 'Dc Comics', 'Superheroes', 'Fiction', 'Comic Book', 'Comics', 'Graphic Novels', 'Batman', 'Dc Comics', 'Superheroes', 'Fiction', 'Comic Book', 'Comics', 'Graphic Novels', 'Batman', 'Dc Comics', 'Superheroes', 'Fiction', 'Comic Book']",34 follower,550 review,356,156 (1%),794 (6%),"3,632 (27%)","4,408 (33%)","4,021 (30%)"
The Pure and the Impure,Colette,3.63,"2,013 rating","January 1, 1932","Colette herself considered The Pure and the Impure her best book, ""the nearest I shall ever come to writing an autobiography."" This guided tour of the erotic netherworld with which Colette was so intimately acquainted begins in the darkness and languor of a fashionable opium den. It continues as a series of unforgettable encounters with men and, especially, women whose lives have been improbably and yet permanently transfigured by the strange power of desire. Lucid and lyrical, The Pure and the Impure stands out as one of modern literature's subtlest reckonings, not only with the varieties of sexual experience, but with the always unlikely nature of love.",208,"['Fiction', 'France', 'Classics', 'French Literature', 'LGBT', 'Queer', 'Literature', 'Fiction', 'France', 'Classics', 'French Literature', 'LGBT', 'Queer', 'Literature', 'Fiction', 'France', 'Classics', 'French Literature', 'LGBT', 'Queer', 'Literature', 'Fiction', 'France', 'Classics', 'French Literature', 'LGBT', 'Queer', 'Literature', 'Fiction', 'France', 'Classics', 'French Literature', 'LGBT', 'Queer', 'Literature']","1,498 follower",194 review,555,45 (2%),207 (10%),635 (31%),682 (33%),444 (22%)
Weird & Wonderful Wildlife,Michael Marten,4.71,7 rating,"December 31, 1982","Book by Marten, May, Taylor",224,"['Animals', 'Animals', 'Animals', 'Animals', 'Animals']",26 book,0 review,26,0 (0%),0 (0%),0 (0%),2 (28%),5 (71%)
დავით აღმაშენებელი. წიგნი III - IV,Konstantine Gamsakhurdia,4.53,133 rating,"January 1, 1975","ეს რომანი მიძღვნილია ქართველ მეფეზე და მის პირად ცხოვრებაზე. დავითი თავის უახლოეს მეგობრებთან ერთად იღწვის ქვეყნის გაძლიერებისთვის, მაგრამ ეს ყოველივე დიდ ხარკს მოითხოვს რადგან უნდა შესწირონ მამულს ყველაფერი,თავიანთი პირადი ცხოვრება და სიცოცხლე.",720,"['Georgian', 'Historical Fiction']",152 follower,8 review,31,1 (<1%),5 (3%),8 (6%),27 (20%),92 (69%)
Endymion,Dan Simmons,4.19,"60,669 rating","January 1, 1996","The multiple-award-winning SF master returns to the universe that is his greatest success--the world of Hyperion and The Fall of Hyperion--to tell a story of love and memory, triumph and terror in a novel even more magnificent than its predecessors.",468,"['Science Fiction', 'Fiction', 'Fantasy', 'Space Opera', 'Science Fiction Fantasy', 'Audiobook', 'Time Travel']",11.9k follower,"2,034 review",314,511 (<1%),"1,949 (3%)","9,183 (15%)","23,082 (38%)","25,944 (42%)"
"The Inklings: C.S. Lewis, J.R.R. Tolkien, Charles Williams, and Their Friends",Humphrey Carpenter,3.95,"3,485 rating","January 1, 1978","Drawing on unpublished letters and diaries, the author examines the friendship between and the social and literary gatherings of Lewis, Tolkien, and Williams who laughingly called themselves the Inklings",287,"['Biography', 'Nonfiction', 'History', 'Biography Memoir', 'Christian', 'Audiobook', 'Christianity']",73 follower,253 review,85,111 (3%),166 (4%),731 (20%),"1,268 (36%)","1,209 (34%)"
Rubicon Beach,Steve Erickson,4.01,671 rating,"January 1, 1986","A prisoner with a haunted past is released into ravaged Los Angeles, where he pursues an elusive girl to the shores or Rubicon Beach and faces his lost destiny. In his second novel, Steve Erickson creates a decaying world filled with leftover passions and poetic vision that established him as one of the most original and evocative American writers of his generation.",304,"['Fiction', 'Science Fiction', 'Dystopia', 'Fantasy', 'Literature', 'Science Fiction Fantasy', 'American']",426 follower,51 review,60,6 (<1%),33 (4%),135 (20%),274 (40%),223 (33%)
The Sniper,Liam O'Flaherty,3.73,"1,211 rating","January 1, 1923","A trained sniper doing his job during the Irish Civil War faces a shocking turn of events, after killing an enemy.","First published January 1, 1923","['Short Stories', 'Classics', 'School', 'Historical Fiction', 'Fiction', 'War', 'Irish Literature']",59 follower,127 review,134,39 (3%),104 (8%),315 (26%),437 (36%),316 (26%)
Among the Hidden,Margaret Peterson Haddix,3.99,"124,580 rating","September 1, 1998","SHADOW CHILDRENLuke has never been to school. He's never had a birthday party, or gone to a friend's house for an overnight. In fact, Luke has never had a friend.Luke is one of the shadow children, a third child forbidden by the Population Police. He's lived his entire life in hiding, and now, with a new housing development replacing the woods next to his family's farm, he is no longer even allowed to go outside.Then, one day Luke sees a girl's face in the window of a house where he knows two other children already live. Finally, he's met a shadow child like himself. Jen is willing to risk everything to come out of the shadows - does Luke dare to become involved in her dangerous plan? Can he afford not to?",153,"['Young Adult', 'Dystopia', 'Science Fiction', 'Fiction', 'Middle Grade', 'Childrens', 'Fantasy']","6,027 follower","6,984 review",103,"2,067 (1%)","6,431 (5%)","27,205 (21%)","43,746 (35%)","45,131 (36%)"
Patrimony,Philip Roth,4.21,"5,372 rating","January 1, 1991","Patrimony, a true story, touches the emotions as strongly as anything Philip Roth has ever written. Roth watches as his eighty-six-year-old father—famous for his vigor, charm, and his repertoire of Newark recollections—battles with the brain tumor that will kill him. The son, full of love, anxiety, and dread, accompanies his father through each fearful stage of his final ordeal, and, as he does so, discloses the survivalist tenacity that has distinguished his father's long, stubborn engagement with life.",240,"['Memoir', 'Nonfiction', 'Biography', 'American', 'Biography Memoir', 'The United States Of America', 'Literature']","6,690 follower",509 review,260,22 (<1%),117 (2%),802 (14%),"2,226 (41%)","2,205 (41%)"
Put Out the Fires,Maureen Lee,4.36,661 rating,"December 28, 1996","The second novel in bestseller Maureen Lee's outstanding Liverpool sequence about family life during the Second World War September 1940 - the cruellest year of war for Britain's civilians as the Luftwaffe mercilessly blitz their cities. In Pearl Street, near Liverpool's docks, families struggle to cope the best they can. A nasty surprise for ever-cheerful dressmaker Brenda Mahon, and flighty Sean's love for little Alice, show how life goes on even when it appears to be falling apart. Yet while Eileen Costello tries to hide her ruined hopes of happiness with Nick, and do her best by the husband she hoped had gone for ever, Ruth Singerman returns, having escaped from Austria. Even the joy of seeing her father again cannot make up for the bitter loss of her children.",496,"['Historical Fiction', 'Fiction', 'Historical', 'War', 'British Literature', 'World War II']",261 follower,34 review,60,9 (1%),13 (1%),75 (11%),197 (29%),367 (55%)
"Nausicaä of the Valley of the Wind, Vol. 6",Hayao Miyazaki,4.60,"2,550 rating","January 1, 1993","In a long-ago war, humankind set off a devastating ecological disaster. Now the Earth is slowly submerging beneath the expanding Sea of Corruption, an enormous toxic forest filled with mutant fungi that release a miasma of poisonous spores into the air. Nausicaa, a compassionate young princess, and her allies fight to create peace between kingdoms fighting over the world's remaining precious natural resources. Nausicaa embarks on an inner, spiritual journey to the heart of the Sea of Corruption, where she discovers its surprising secret. She returns to the land of the living, compelled to share her discovery, but Nausicaa accidentally awakens a God Warrior - a biotechnological abomination of the war known as the Seven Days of Fire - from its stasis. And now the monstrous yet childlike God Warrior thinks Nausicaa is its mother!",159,"['Manga', 'Comics', 'Graphic Novels', 'Fantasy', 'Science Fiction', 'Fiction', 'Graphic Novels Comics']","2,925 follower",71 review,359,2 (<1%),19 (<1%),145 (5%),659 (25%),"1,725 (67%)"
"His Toy, His Dream, His Rest",John Berryman,4.38,69 rating,"January 1, 1968",Continues and concludes the long poem begun in 77 Dream Songs. Winner of the National Book Award.,317,['Poetry'],221 follower,3 review,121,0 (0%),2 (2%),9 (13%),19 (27%),39 (56%)
The Gods of Mars,Edgar Rice Burroughs,3.88,"19,219 rating","January 1, 1913","After the long exile on Earth, John Carter finally returned to his beloved Mars. But beautiful Dejah Thoris, the woman he loved, had vanished. Now he was trapped in the legendary Eden of Mars -- an Eden from which none ever escaped alive.The Gods of Mars is a science fantasy novel by American writer Edgar Rice Burroughs, the second of his Barsoom series. It was first published in The All-Story as a five-part serial in the issues for January-May 1913.[1] It was later published as a complete novel by A. C. McClurg in September, 1918.Excerpt:For moments after that awful laugh had ceased reverberating through the rocky room, Tars Tarkas and I stood in tense and expectant silence. But no further sound broke the stillness, nor within the range of our vision did aught move.At length Tars Tarkas laughed softly, after the manner of his strange kind when in the presence of the horrible or terrifying. It is not an hysterical laugh, but rather the genuine expression of the pleasure they derive from the things that move Earth men to loathing or to tears.Often and again have I seen them roll upon the ground in mad fits of uncontrollable mirth when witnessing the death agonies of women and little children beneath the torture of that hellish green Martian fete-the Great Games.I looked up at the Thark, a smile upon my own lips, for here in truth was greater need for a smiling face than a trembling chin.",190,"['Science Fiction', 'Fantasy', 'Fiction', 'Classics', 'Adventure', 'Pulp', 'Science Fiction Fantasy', 'Science Fiction', 'Fantasy', 'Fiction', 'Classics', 'Adventure', 'Pulp', 'Science Fiction Fantasy', 'Science Fiction', 'Fantasy', 'Fiction', 'Classics', 'Adventure', 'Pulp', 'Science Fiction Fantasy']","2,586 follower","1,050 review","3,035",197 (1%),913 (4%),"5,215 (27%)","7,522 (39%)","5,372 (27%)"
Call for the Dead,John le Carré,3.85,"38,397 rating","January 1, 1961","John le Carré classic novels deftly navigate readers through the intricate shadow worlds of international espionage with unsurpassed skill and knowledge, and have earned him -- and his hero, British Secret Service Agent George Smiley, who is introduced in this, his first novel -- unprecedented worldwide acclaim. George smiley had liked Samuel Fennan, and now Fennan was dead from an apparent suicide. But why? Fennan, a Foreign Office man, had been under investigation for alleged Communist Party activities, but Smiley had made it clear that the investigation -- little more than a routine security check -- was over and that the file on Fennan could be closed. The very next day, Fennan was found dead with a note by his body saying his career was finished and he couldn't go on. Smiley was puzzled...",144,"['Fiction', 'Mystery', 'Thriller', 'Espionage', 'Crime', 'Mystery Thriller', 'Audiobook']","8,512 follower","2,609 review",174,351 (<1%),"1,446 (3%)","10,569 (27%)","17,278 (44%)","8,753 (22%)"
A Rose for Emily,William Faulkner,3.83,"10,768 rating","April 30, 1930","Emily is a member of a family in the antebellum Southern aristocracy; after the Civil War, the family has fallen on hard times.",36,"['Short Stories', 'Classics', 'Fiction', 'Horror', 'Gothic', 'School', 'Read For School']","9,238 follower",887 review,928,190 (1%),717 (6%),"2,813 (26%)","4,045 (37%)","3,003 (27%)"
Moonraker,Ian Fleming,3.79,"27,211 rating","January 1, 1955","‘Benzedrine,’ said James Bond. ‘It’s what I shall need If I’m going to keep my wits about me tonight. It’s apt to make one a bit overconfident, but that’ll help too.’ He stirred the champagne so that the white powder whirled among the bubbles. Then he drank the mixture down with one long swallow. ‘It doesn’t taste,’ said Bond, ‘And the champagne is quite excellent’At M’s request, Bond has gone up against Sir Hugo Drax at the card table, on a mission to teach the millionaire and head of the Moonraker project a lesson he won’t forget, and prevent a scandal engulfing Britain’s latest defence system. But there is more to the mysterious Drax than simply cheating at cards. And once Bond delves deeper into goings-on at the Moonraker base he discovers that both the project and its leader are something other than they pretend to be …",310,"['Fiction', 'Thriller', 'Espionage', 'Mystery', 'Adventure', 'Classics', 'Audiobook', 'Fiction', 'Thriller', 'Espionage', 'Mystery', 'Adventure', 'Classics', 'Audiobook', 'Fiction', 'Thriller', 'Espionage', 'Mystery', 'Adventure', 'Classics', 'Audiobook']","3,013 follower","1,764 review",667,218 (<1%),"1,457 (5%)","8,242 (30%)","11,089 (40%)","6,205 (22%)"
Flying Fury: Five Years in the Royal Flying Corps,James McCudden,4.34,680 rating,"January 1, 1918","The day-to-day insights of a brilliantly daring World War I ace that only ends with his death at the age of 23 . . .James McCudden was an outstanding British fighter ace of World War I, whose daring exploits earned him a tremendous reputation and, ultimately, an untimely end. Here, in this unique and gripping firsthand account, he brings to life some of aviation history's most dramatic episodes in a memoir completed at the age of twenty-three, just days before his tragic death. During his time in France with the Royal Flying Corps from 1914 to 1918, McCudden rose from mechanic to pilot and flight commander. Following his first kill in September 1916, McCudden shot down a total of fifty-seven enemy planes, including a remarkable three in a single minute in January 1918. A dashing patrol leader, he combined courage, loyalty, and judgment, studying the habits and psychology of enemy pilots and stalking them with patience and tenacity.Written with modesty and frankness, yet acutely perceptive, Flying Fury is both a valuable insight into the world of early aviation and a powerful account of courage and survival above the mud and trenches of Flanders. Fighter ace James McCudden died in July 1918, after engine failure caused his plane to crash just four months before the end of World War I. His success as one of Britain's deadliest pilots earned him the Victoria Cross.",288,"['Aviation', 'World War I', 'Biography', 'Nonfiction', 'History', 'Military History']",2 follower,35 review,3,6 (<1%),16 (2%),82 (12%),215 (31%),361 (53%)
The Children's Hour,Lillian Hellman,3.96,"14,405 rating","January 1, 1934","Cast 2 men, 12 women. One of the great successes of this distinguished writer. A serious and adult play about two women who run a school for girls. After a malicious youngster starts a rumor about the two women, the rumor soon turns to scandal. As the young girl comes to understand the power she wields, she sticks by her story, which precipitates tragedy for the women. It is later discovered that the gossip was pure invention, but it is too late. Irreparable damage has been done.",75,"['Plays', 'Classics', 'Drama', 'Theatre', 'Fiction', 'LGBT', 'Queer']",187 follower,330 review,73,431 (2%),749 (5%),"2,923 (20%)","5,111 (35%)","5,191 (36%)"
The Bicentennial Man and Other Stories,Isaac Asimov,4.13,"14,579 rating","February 1, 1976","Andrew was one of Earth's first house robot domestic servants—smoothly designed and functional. But when Andrew started to develop special talents which exceeded the confines of his allotted positronic pathways, he abandoned his domestic duties in favour of more intellectual pursuits. As time passed, Andrew acquired knowledge, feelings and ambitions way beyond anything ever experienced by any other mechanical men. And he found himself launched on to a career which would bring him fame fortune — and danger. For a robot who wants to be human must also be prepared to die...In the Bicentennial Man, Isaac Asimov returns to his first and most enduring love — robotics. The result is a brilliant book of first-class entertainment and mind-spinning ideas which confirm Asimov's supreme status as Grand Master of science fiction.Content""Feminine Intuition"" (1969)""Waterclap"" (1970) ""That Thou Art Mindful of Him"" (1974)""Stranger in Paradise"" (1974)""The Life and Times of Multivac"" (1975)""The Winnowing"" (1976)""The Bicentennial Man"" (1976)""Marching In"" (1976) ""Old-Fashioned"" (1976)""The Tercentenary Incident"" (1976)""Birth of a Notion"" (1976)Cover Illustration: Don Dixon",211,"['Science Fiction', 'Fiction', 'Short Stories', 'Classics', 'Robots', 'Science Fiction Fantasy', 'Collections']",24.8k follower,561 review,"4,420",62 (<1%),384 (2%),"2,696 (18%)","5,909 (40%)","5,528 (37%)"
A Hunger Artist,Franz Kafka,4.11,"18,103 rating","January 1, 1924","The last book published during Kafka's lifetime, A Hunger Artist (1924) explores many of the themes that were close to him: spiritual poverty, asceticism, futility, and the alienation of the modern artist. He edited the manuscript just before his death, and these four stories are some of his best known and most powerful work, marking his maturity as a writer. In addition to ""First Sorrow,"" ""A Little Woman,"" and ""Josephine the Singer, or the Mouse People"" is the title story, ""A Hunger Artist,"" which has been called by the critic Heinz Politzer ""a perfection, a fatal fulfillment that expresses Kafka's desire for permanence."" The three volumes Twisted Spoon Press has published: Contemplation, A Country Doctor, and A Hunger Artist are the collections of stories that Kafka had published during his lifetime. Though each volume has its own distinctive character, they have most often appeared in English in collected editions. They are presented here as separate editions, in new translations by Kevin Blahut, each with its own illustrator from the Prague community.",84,"['Short Stories', 'Classics', 'Fiction', 'Literature', 'Philosophy', 'German Literature', 'Literary Fiction', 'Short Stories', 'Classics', 'Fiction', 'Literature', 'Philosophy', 'German Literature', 'Literary Fiction', 'Short Stories', 'Classics', 'Fiction', 'Literature', 'Philosophy', 'German Literature', 'Literary Fiction', 'Short Stories', 'Classics', 'Fiction', 'Literature', 'Philosophy', 'German Literature', 'Literary Fiction', 'Short Stories', 'Classics', 'Fiction', 'Literature', 'Philosophy', 'German Literature', 'Literary Fiction']",29.1k follower,"1,039 review","2,758",166 (<1%),652 (3%),"3,314 (18%)","6,931 (38%)","7,040 (38%)"
The Coherence of Theism,Richard Swinburne,3.99,88 rating,"December 29, 1977","This book investigates what it means, and whether it is coherent, to say that there is a God. The author concludes that, despite philosophical objections, the claims which religious believers make about God are generally coherent; and that although some important claims are coherent only ifthe words by which they are expressed are being used in stretched or analogical senses, this is in fact the way in which theologians have usually claimed they are being used. This revised edition includes various minor corrections and clarifications.",328,"['Philosophy', 'Religion', 'Theology', 'Nonfiction', 'Atheism', 'Christian']",127 follower,10 review,43,2 (2%),3 (3%),19 (21%),34 (38%),30 (34%)
Light a Penny Candle,Maeve Binchy,3.96,"21,018 rating","January 1, 1982","Evacuated from Blitz-battered London, shy and genteel Elizabeth White is sent to stay with the boisterous O’Connors in Kilgarret, Ireland. It is the beginning of an unshakeable bond between Elizabeth and Aisling O’Connor, a friendship that will endure through twenty turbulent years of change and chaos, joy and sorrow, soaring dreams and searing betrayals.Writing with warmth, wit and great compassion, Maeve Binchy tells a magnificent story of the lives and loves of two women, bound together in a friendship that nothing could tear asunder -- not even the man who threatened to come between them forever.",832,"['Fiction', 'Ireland', 'Chick Lit', 'Historical Fiction', 'Romance', 'Irish Literature', 'Adult Fiction']","4,496 follower",966 review,248,210 (<1%),888 (4%),"5,204 (24%)","7,988 (38%)","6,728 (32%)"
Harlequin Valentine,Neil Gaiman,3.74,"3,332 rating","March 1, 1999","In this modern hardcover retelling of a classic commedia dell'arte legend of tomfoolery and hopeless, fawning love, creators Neil Gaiman (The Sandman, the Newbery Medal-winning The Graveyard Book) and John Bolton (Evil Dead) update the relationship of Harlequin and Columbine. A buffoon burdened with a brimming heart, Harlequin chases his sensible, oblivious Columbine around the city streets, having given his heart freely. Consumed with love, the impulsive clown sees his heart dragged about town, with a charming surprise to bend the tale in a modern direction. Gaiman's writing is poetic and as heartfelt as the subject matter. Bolton's art, a combination of digitally enhanced photorealism and dynamic painting, provides sensational depth with bright characters over fittingly muted backgrounds. Those who have spent Valentine's Day alone are aware that the cold February holiday can be hard to swallow. Gaiman and Bolton want you to know that all it takes is a steak knife, a fork, and a bottle of quality ketchup!",40,"['Graphic Novels', 'Comics', 'Fantasy', 'Fiction', 'Graphic Novels Comics', 'Short Stories', 'Horror', 'Graphic Novels', 'Comics', 'Fantasy', 'Fiction', 'Graphic Novels Comics', 'Short Stories', 'Horror', 'Graphic Novels', 'Comics', 'Fantasy', 'Fiction', 'Graphic Novels Comics', 'Short Stories', 'Horror']",314k follower,159 review,"2,138",52 (1%),254 (7%),"1,043 (31%)","1,130 (33%)",853 (25%)
