title,authors,average_rating,rating,date_of_publication,descriptions,total_pages,genres,author_followers,no_of_reviews,no_of_books_by_author,one_star_ratings,two_star_ratings,three_star_ratings,four_star_ratings,five_star_ratings
The ABC of Communism,Nikolai Bukharin,3.63,309 rating,"January 1, 1919","A duo of classic Russian Communist texts are presented together in this single volume. First published in 1919 and 1920 respectively, Programme of the Russian Communist Party and ABC of Communism were created as popular introductions, explanations, and commentary for the masses on the new party. Today they serve as historical documents and offer a non-Stalinist view of early Russian Communism. A new introduction and a glossary are included.Author Biography: Nicholas I. Bukharin was a member of the Russian Communist Party. He was the editor of Pravda and the author of Economics of the Transition Period, Historical Materialism, and Imperialism and World Economy. Evgenii A. Preobrazhensky was a member of the Russian Communist Party and was elected to the secretariat of the party central committee. He was the author of The Crisis of Soviet Industrialization, From NEP to Socialism, and The New Economics.",479,"['Politics', 'Nonfiction', 'Philosophy', 'Economics', 'History', 'Russia', 'Theory', 'Politics', 'Nonfiction', 'Philosophy', 'Economics', 'History', 'Russia', 'Theory', 'Politics', 'Nonfiction', 'Philosophy', 'Economics', 'History', 'Russia', 'Theory', 'Politics', 'Nonfiction', 'Philosophy', 'Economics', 'History', 'Russia', 'Theory', 'Politics', 'Nonfiction', 'Philosophy', 'Economics', 'History', 'Russia', 'Theory']",50 follower,42 review,67,12 (3%),27 (8%),90 (29%),114 (36%),66 (21%)
Doom Patrol: Book One,Grant Morrison,4.32,"1,188 rating","July 1, 1990","The groundbreaking series from Grant Morrison that led American comics in a wholly unexpected direction. Originally conceived in the 1960s by the visionary team of writer Arnold Drake and artist Bruno Premiani, the Doom Patrol was reborn a generation later through Grant Morrison’s singular imagination. Though they are super-powered beings, and though their foes are bent on world domination, convention ends there. Shunned as freaks and outcasts, and tempered by loss and insanity, this band of misfits faces threats so mystifying in nature and so corrupted in motive that reality itself threatens to fall apart around them—but it’s still all in a day’s work for the Doom Patrol. Written by Grant Morrison and featuring art by Richard Case, John Nyberg, Doug Braithwaite, Scott Hanna and Carlos Garzón, Doom Patrol: Book One collects issues #19-34 and includes introductions by Morrison and editor Tom Peyer.",424,"['Comics', 'Graphic Novels', 'Dc Comics', 'Fiction', 'Superheroes', 'Horror', 'Science Fiction']","4,225 follower",147 review,"2,001",8 (<1%),25 (2%),133 (11%),434 (36%),588 (49%)
Cinco horas con Mario,Miguel Delibes,3.90,"5,799 rating","January 1, 1966",Librarian note: An alternative cover for this ISBN can be found here.,296,"['Spanish Literature', 'Classics', 'Fiction', 'Spain', 'Drama', '20th Century', 'Novels']",484 follower,395 review,156,131 (2%),413 (7%),"1,240 (21%)","2,133 (36%)","1,882 (32%)"
The Occult Reich,J.H. Brennan,3.13,47 rating,"May 1, 1974",British account of occultism during the Third Reich.It is one of the most prominent books on the subject matter. It was first published in the UK in 1974 by Futura Publications,192,"['Nonfiction', 'Occult', 'World War II', 'History', 'Mythology', 'Magic']",44 follower,6 review,103,4 (8%),7 (14%),18 (38%),15 (31%),3 (6%)
Comics and Sequential Art,Will Eisner,4.11,"6,150 rating","November 1, 1985","Eisner presents the principles of graphic storytelling in this guide, which is based on his popular sequential art course at New York's School of Visual Art. Readers will learn the basic anatomy, fundamentals of storycraft and how the medium works as a means of expression.",163,"['Comics', 'Art', 'Nonfiction', 'Graphic Novels', 'Writing', 'Reference', 'Drawing']",506 follower,146 review,670,179 (2%),258 (4%),"1,079 (17%)","1,805 (29%)","2,829 (46%)"
Dino: Living High in the Dirty Business of Dreams,Nick Tosches,4.04,995 rating,"January 1, 1992","From dealing blackjack in the small-time gangster  town of Steubenville, Ohio, to carousing with the  famous ""Rat Pack"" in a Hollywood he  called home, Dean Martin lived in a grandstand,  guttering life of booze, broads, and big money. He  rubbed shoulders with the mob, the Kennedys, and  Hollywood's biggest stars. He was one of America's  favorite entertainers. But no one really knew him.  Now Nick Tosches reveals the man behind the  image--the dark side of the American dream. It's a  wild, illuminating, sometimes shocking tale of sex,  ambition, heartaches--and a life lived hard, fast,  and without  apologies.",620,"['Biography', 'Music', 'Nonfiction', 'Film', 'Biography Memoir', 'History', 'Media Tie In']",218 follower,122 review,66,16 (1%),48 (4%),186 (18%),376 (37%),369 (37%)
Cotton Comes to Harlem,Chester Himes,3.81,"2,168 rating","January 1, 1964","Black flim-flam man Deke O'Hara is no sooner out of Atlanta's state penitentiary than he's back on the streets working the scam of a lifetime. As sponsor of the Back-to-Africa movement he's counting on the big Harlem rally to produce a big collection-for his own private charity. But the take-$87,000-is hijacked by white gunmen and hidden in a bale of cotton that suddenly everybody wants to get his hands on. With Coffin Ed Johnson and Grave Digger Jones on everyone's trail and piecing together the complexity of the scheme, Cotton Comes to Harlem is one of Himes's hardest-hitting and most entertaining thrillers.",160,"['Mystery', 'Fiction', 'Crime', 'Noir', 'African American', 'Classics', 'Mystery Thriller']",419 follower,218 review,147,29 (1%),140 (6%),565 (26%),916 (42%),518 (23%)
Mangeclous,Albert Cohen,4.10,331 rating,"January 1, 1938","Mangeclous, un des sommets de la littérature contemporaine. Mangeclous, livre plein d'une verve triomphale, livre d'une liberté extraordinaire (nous sommes à l'époque des livres contraints), livre riche (nous sommes à l'époque des livres pauvres), livre gras (nous sommes à l'époque des livres maigres), grand livre enfin. Mangeclous est pour moi l'exemple à peu près unique, dans la littérature contemporaine, d'une épopée comique, c'est-à-dire d'un comique grand. Une épopée, et pourtant on ne cesse pas de hurler de rire.Félicien Marceau, de l'Académie française.Un héros comme Mangeclous atteint à l'épique. Il y a là, à mon sens, quelque chose sans aucune espèce de comparaison. Il y a du souffle de Rabelais. C'est comme dans Rabelais: on accepte tout. On accepte tout parce qu'il y a encore un amour du personnage, parce qu'il y a une manière démesurée de le traiter qui fait que simplement on est ébloui.Joseph Kessel, de l'Académie française.L'admirable Mangeclous, un grand héros comique d'une drôlerie extraordinaire. Le comique de Mangeclous est juif par sa subtilité, par les récifs de mélancolie qui affleurent soudain, par l'observation féroce et tendre qui le nourrit. Mais ce roman acquiert une portée générale par son humanité, son grand rire salubre, sa verve populaire. Sa fraîcheur, sa fruste saveur, sa robuste simplicité le font accéder à la majesté des légendes populaires et des grandes épopées.Marcel Pagnol, de l'Académie française.",496,"['France', 'Fiction', 'Roman', 'Novels', 'Literature', 'French Literature', '20th Century']",163 follower,22 review,138,5 (1%),17 (5%),56 (16%),116 (35%),137 (41%)
Les Mandarins: Tome 1,Simone de Beauvoir,4.13,613 rating,"January 1, 1954","«– Qu'est-ce qui ne va pas ?– Rien, tout va très bien, dis-je d'un ton dégagé.– Allons ! Allons ! je sais ce que ça veut dire quand tu prends ta voix de dame du monde, dit Robert. Je suis sûr qu'en ce moment ça tourne dur dans cette tête. Combien de verres de punch as-tu bus ?– Sûrement moins que vous, et le punch n'y est pour rien.– Ah ! tu avoues ! dit Robert d'un ton triomphant ; il y a quelque chose et le punch n'y est pour rien ; quoi donc ?– C'est Scriassine, dis-je en riant ; il m'a expliqué que les intellectuels français étaient foutus.»",512,"['Fiction', 'Novels', 'France', 'Classics', 'Feminism', 'Roman', 'French Literature']","9,113 follower",71 review,307,4 (<1%),19 (3%),107 (17%),248 (40%),235 (38%)
Across the Wire: Life and Hard Times on the Mexican Border,Luis Alberto Urrea,4.21,885 rating,"January 2, 1993","            Luis Alberto Urrea's Across the Wire offers a compelling and unprecedented look at what life is like for those refugees living on the Mexican side of the border—a world that is only some twenty miles from San Diego, but that few have seen.  Urrea gives us a compassionate and candid account of his work as a member and ""official translator"" of a crew of relief workers that provided aid to the many refugees hidden just behind the flashy tourist spots of Tijuana.  His account of the struggle of these people to survive amid abject poverty, unsanitary living conditions, and the legal and political chaos that reign in the Mexican borderlands explains without a doubt the reason so many are forced to make the dangerous and illegal journey ""across the wire"" into the United States.            More than just an expose, Across the Wire is a tribute to the tenacity of a people who have learned to survive against the most impossible odds, and returns to these forgotten people their pride and their identity.  ",208,"['Nonfiction', 'Politics', 'Memoir', 'Sociology', 'Social Justice', 'History', 'Short Stories']","2,553 follower",107 review,57,6 (<1%),18 (2%),139 (15%),344 (38%),378 (42%)
Heir of Sea and Fire,Patricia A. McKillip,4.15,"8,033 rating","July 1, 1977","By the vow of her father and her own desire, Raederle was pledged to Morgon, Riddle-Master of Hed. But a year had passed since Morgon disappeared on his search for the High One at Erlenstar Mountain, and rumors claimed he was dead.Raederle set out to learn the truth for herself, though her small gift of magic seemed too slight for the perils she must face. The quest led through strange lands and dangerous adventures. Only her growing powers enabled her at last to reach Erlenstar Mountain. And there she discovered what she could not bear to accept.Accompanied by Deth, the High One's Harper, she fled. And behind them came a pursuer whose name was Morgon, bent on executing a grim destiny upon Raederle and Deth.Her only hope lay in summoning the Hosts of the Dead, led by the King whose skull she bore . . .",213,"['Fantasy', 'Fiction', 'Science Fiction Fantasy', 'High Fantasy', 'Young Adult', 'Magic', 'Epic Fantasy']","2,633 follower",276 review,112,59 (<1%),252 (3%),"1,534 (19%)","2,736 (34%)","3,452 (42%)"
The Princess Test,Gail Carson Levine,3.79,"11,048 rating","March 21, 1999","King Humphrey has decided it's time for his son, Prince Nicholas, to marry. But he must make sure the bride is a real princess. So he devises a series of princess tests, designed to weed out the phonies and the fakes. Meanwhile, Nicholas has fallen in love with Lorelei, a mere blacksmith's daughter. She's no princess, but he wants to marry her all the same--but how will she ever pass the terrible tests?",91,"['Fantasy', 'Fairy Tales', 'Childrens', 'Middle Grade', 'Young Adult', 'Fiction', 'Retellings', 'Fantasy', 'Fairy Tales', 'Childrens', 'Middle Grade', 'Young Adult', 'Fiction', 'Retellings', 'Fantasy', 'Fairy Tales', 'Childrens', 'Middle Grade', 'Young Adult', 'Fiction', 'Retellings']","9,047 follower",349 review,56,64 (<1%),683 (6%),"3,632 (32%)","3,814 (34%)","2,855 (25%)"
"East, West",Salman Rushdie,3.56,"7,499 rating","January 1, 1994","In these nine stories, Salman Rushdie looks at what happens when East meets West, at the forces that pull his characters first in one direction, then the other. Fantasy and realism collide as a rickshaw driver writes letters describing his film star career in Bombay; a mispronunciation leads to romance and an unusual courtship in sixties London; two childhood friends turned diplomats live out in a violent world fantasies hatched by ""Star Trek""; and Christopher Columbus dreams of consummating his relationship with Queen Isabella. The stories in ""East, West"" show the extraordinary range and power of Salman Rushdie's writing.",224,"['Fiction', 'Short Stories', 'India', 'Magical Realism', 'Literary Fiction', 'Literature', 'Indian Literature']",11.4k follower,559 review,140,105 (1%),693 (9%),"2,742 (36%)","2,820 (37%)","1,139 (15%)"
Staying On,Paul Scott,3.89,"3,907 rating","January 1, 1977","In this sequel to The Raj Quartet, Colonel Tusker and Lucy Smalley stay on in the hills of Pankot after Indian independence deprives them of their colonial status. Finally fed up with accommodating her husband, Lucy claims a degree of independence herself. Eloquent and hilarious, she and Tusker act out class tensions among the British of the Raj and give voice to the loneliness, rage, and stubborn affection in their marriage. Staying On won the Booker Prize in 1977 and was made into a motion picture starring Trevor Howard and Celia Johnson in 1979.",224,"['Fiction', 'India', 'Historical Fiction', 'Classics', 'Literary Fiction', 'Literature', 'Asia']",140 follower,239 review,184,77 (1%),228 (5%),916 (23%),"1,518 (38%)","1,168 (29%)"
Charms for the Easy Life,Kaye Gibbons,4.02,"12,667 rating","January 1, 1993","A family without men, the Birches live gloriously offbeat lives in the lush, green backwoods of North Carolina. Radiant, headstrong Sophia and her shy, brilliant daughter, Margaret, possess powerful charms to ward off loneliness, despair, and the human misery that often beats a path to their door. And they are protected by the eccentric wisdom and muscular love of the remarkable matriarch Charlie Kate, a solid, uncompromising, self-taught healer who treats everything from boils to broken bones to broken hearts.Sophia, Margaret, and Charlie Kate find strength in a time when women almost always depended on men, and their bond deepens as each one experiences love and loss during World War II. Charms for the Easy Life is a passionate, luminous, and exhilarating story about embracing what life has to offer, even if it means finding it in unconventional ways.",272,"['Fiction', 'Historical Fiction', 'Southern', 'Adult Fiction', 'Book Club', 'Novels', 'Literature']",529 follower,920 review,33,105 (<1%),470 (3%),"2,719 (21%)","5,115 (40%)","4,258 (33%)"
"Bloomsbury Birthday Quid: ""She Wasn't Soft""",T. Coraghessan Boyle,3.49,68 rating,"PaperbackPublished September 19, 1996",,"PaperbackPublished September 19, 1996","['Short Stories', 'Fiction']","2,772 follower",16 review,153,5 (7%),8 (11%),17 (25%),25 (36%),13 (19%)
Boyhood,J.M. Coetzee,3.77,"5,427 rating","September 1, 1997","Coetzee grew up in a new development north of Cape Town, tormented by guilt and fear. With a father he despised, and a mother he both adored and resented, he led a double life—the brilliant and well-behaved student at school, the princely despot at home, always terrified of losing his mother's love. His first encounters with literature, the awakenings of sexual desire, and a growing awareness of apartheid left him with baffling questions; and only in his love of the high veld (""farms are places of freedom, of life"") could he find a sense of belonging. Bold and telling, this masterly evocation of a young boy's life is the book Coetzee's many admirers have been waiting for, but never could have expected.",166,"['Fiction', 'Africa', 'South Africa', 'Nobel Prize', 'Literature', 'Novels', 'Literary Fiction']","4,739 follower",417 review,147,81 (1%),338 (6%),"1,520 (28%)","2,282 (42%)","1,206 (22%)"
A Treatise on Cosmic Fire,Alice A. Bailey,4.34,125 rating,"January 1, 1925","Although this book was one of the first to be written by Alice Bailey in collaboration with the Tibetan, it is probably the most timeless, profound and least understood. A Treatise on Cosmic Fire deals with the underlying structure of occult teaching for the present era, with vast cosmic processes reproduced through all areas of life from universe to atom. It is, therefore, no book for the proof-demanding concrete mind, or for those who dabble in the spectacular and the phenomenal. The true student, however, the seriously applied aspirant, will find his mind stimulated and his consciousness expanded.The book is dedicated to Helena Petrovna Blavatsky, and is said to be ""the psychological key to the Cosmic Creation."" Certainly in its revelation of relationship and correspondences throughout the Cosmos, all aspects of life unfolding through consciousness are included, based on the aphorism—""Having pervaded the entire universe with one fragment of Myself, I remain.""The One Life manifests through all form within the universe as fiery energy; and the three main streams of cosmic energy, differentiated into seven systemic rays, are shown in relation to the three aspects of fire controlling all manifested life: Electric Fire, the Fire of Spirit; Solar Fire, the Fire of Mind; Fire by Friction, the Internal Fires.A large section of the book is directed to a detailed exposition of Solar Fire, the Fire of Mind, since this is the dominant energy to be understood and controlled during this second solar system. The cosmic Laws operating through the system are shown in relation to the lesser laws of planetary origin and the laws of nature, operating through substance, as distinct from the life and the consciousness of the planet.In her foreword to the book, the author mentions a five-fold purpose within its teaching; briefly: (a) To provide a compact and skeleton outline of a scheme of cosmology, philosophy and psychology which may serve as a reference and textbook; (b) As an elucidation of the relation between Spirit and Matter, demonstrating as consciousness; (c) To show the coherent development of all that is found within a solar system and to demonstrate that everything evolves; (d) To give practical information about focal points of energy found in the etheric bodies of the Solar Logos, the macrocosm, and of man, the microcosm; (e) To give some information of the place and work of those sentient lives who form the essence of objectivity, and to indicate the nature of the Hierarchies of Existences who form out of their own substance all that is seen and known.These five objectives, and more, the book encompasses; for the effect in the individual consciousness is such that theories become transcended and the mind begins to experience through contemplative thought what the words on paper reveal to the intelligence. The finite human mind can touch its cosmic origins and its fiery essence when it opens to the three cosmic Laws of Synthesis, of Attraction and of Economy.The fire of love, the flame of life within the heart, is the touchstone for all intuitive thought, and the alchemist to the dense materiality of gross substance.",1342,"['Spirituality', 'Philosophy', 'Alchemy', 'Occult', 'Theosophy']",183 follower,12 review,261,4 (3%),8 (6%),9 (7%),24 (19%),80 (64%)
A Tangled Web,L.M. Montgomery,3.86,"5,298 rating","January 1, 1931","Over the years sixty members of the Dark family and sixty Penhallows have married one another—but not without their share of fighting and feuding. Now Aunt Becky, the eccentric old matriarch of the clan, has bequeathed her prized possession: a legendary heirloom jug. But the name of the jug's new owner will not be revealed for one year. In the next twelve months beautiful Gay Penhallow's handsome fiancé Noel Gibson leaves her for sly and seductive Nan Penhallow; reckless Peter Penhallow and lovely Donna Dark, who have hated each other since childhood, are inexplicably brought together by the jug; Hugh and Joscelyn Dark, separated on their wedding night ten years ago for reasons never revealed, find a second chance—all watched over by the mysterious Moon Man, who has the gift of second sight. Then comes the night when Aunt Becky's wishes will be revealed...and the family is in for the biggest surprise of all.",257,"['Classics', 'Fiction', 'Young Adult', 'Historical Fiction', 'Romance', 'Historical', 'Canada']",11.5k follower,489 review,"2,108",81 (1%),285 (5%),"1,453 (27%)","1,948 (36%)","1,531 (28%)"
Wyrms,Orson Scott Card,3.40,"5,946 rating","July 1, 1987","The sphere is alien in origin, but has been controlled by man for millennia. A legend as old as the stars rules this constructed world; When the seventh seventh seventh human Heptarch is crowned, he will be the Kristos and will bring eternal salvation . . . or the destruction of the cosmos.Patience is the only daughter of the rightful Heptarch, but she, like her father before her, serves the usurper who has destroyed her family. For she has learned the true ruler's honor.Duty to one's race is more important than duty to one's self. But the time for prudence has passed, and that which has slept for ages has awakened. And Patience must journey to the heartsoul of this planet to confront her destiny . . . and her world's.",336,"['Science Fiction', 'Fantasy', 'Fiction', 'Science Fiction Fantasy', 'Speculative Fiction', 'Aliens', 'Young Adult']",19.5k follower,306 review,859,242 (4%),813 (13%),"2,148 (36%)","1,809 (30%)",934 (15%)
A Minor Apocalypse,Tadeusz Konwicki,3.66,"2,682 rating","January 1, 1979","As in his novel The Polish Complex, Konwicki's A Minor Apocalypse stars a narrator and character named Konwicki, who has been asked to set himself on fire that evening in front of the Communist Party headquarters in Warsaw in an act of protest. He accepts the commission, but without any clear idea of whether he will actually go through with the self-immolation. He spends the rest of the day wandering the streets of Warsaw, being tortured by the secret police and falling in love. Both himself and Everyman, the character-author experiences the effects of ideologies and bureaucracies gone insane with, as always in history, the individual struggling for survival rather than offering himself up on the pyre of the greater good. Brilliantly translated by Richard Lourie, A Minor Apocalypse is one of the most important novels to emerge from Poland in the last twenty five years.",238,"['Polish Literature', 'Fiction', 'Poland', 'Classics', 'School', 'Literature', 'Novels', 'Polish Literature', 'Fiction', 'Poland', 'Classics', 'School', 'Literature', 'Novels', 'Polish Literature', 'Fiction', 'Poland', 'Classics', 'School', 'Literature', 'Novels']",91 follower,313 review,37,110 (4%),266 (9%),707 (26%),948 (35%),651 (24%)
The Celery Stalks at Midnight,James Howe,3.93,"12,769 rating","January 1, 1983","HARE TODAY, GONE TOMORROWBunnicula is missing! Chester is convinced all the world's vegetables are in danger of being drained of their life juices and turned into zombies. Soon he has Harold and Howie running around sticking toothpicks through hearts of lettuce and any other veggie in sight. Of course, Chester has been known to be wrong before...but you can never be too careful when there's a vampire bunny at large!",144,"['Childrens', 'Fiction', 'Fantasy', 'Humor', 'Mystery', 'Animals', 'Middle Grade', 'Childrens', 'Fiction', 'Fantasy', 'Humor', 'Mystery', 'Animals', 'Middle Grade', 'Childrens', 'Fiction', 'Fantasy', 'Humor', 'Mystery', 'Animals', 'Middle Grade']",443 follower,363 review,201,244 (1%),571 (4%),"3,342 (26%)","4,252 (33%)","4,360 (34%)"
Downbelow Station,C.J. Cherryh,3.90,"15,457 rating","January 1, 1981","A legend among sci-fi readers, C. J. Cherryh's Union-Alliance novels, while separate and complete in themselves, are part of a much larger tapestry—a future history spanning 5,000 years of human civilization. A blockbuster space opera of the rebellion between Earth and its far-flung colonies, it is a classic science fiction masterwork.",526,"['Science Fiction', 'Fiction', 'Space Opera', 'Hugo Awards', 'Science Fiction Fantasy', 'Space', 'Speculative Fiction']","3,290 follower",796 review,309,368 (2%),998 (6%),"3,462 (22%)","5,598 (36%)","5,031 (32%)"
