title,authors,average_rating,rating,date_of_publication,descriptions,total_pages,no_of_books_by_author,author_followers,genres,no_of_reviews,five_star_ratings,four_star_ratings,three_star_ratings,two_star_ratings,one_star_ratings
Assassin's Quest,Robin Hobb,4.20,"156,243 rating","March 1, 1997","King Shrewd is dead at the hands of his son Regal. As is Fitz--or so his enemies and friends believe. But with the help of his allies and his beast magic, he emerges from the grave, deeply scarred in body and soul. The kingdom also teeters toward ruin: Regal has plundered and abandoned the capital, while the rightful heir, Prince Verity, is lost to his mad quest--perhaps to death. Only Verity's return--or the heir his princess carries--can save the Six Duchies.But Fitz will not wait. Driven by loss and bitter memories, he undertakes a quest: to kill Regal. The journey casts him into deep waters, as he discovers wild currents of magic within him--currents that will either drown him or make him something more than he was.",757,291,102k follower,"['Fantasy', 'Fiction', 'Epic Fantasy', 'High Fantasy', 'Dragons', 'Adventure', 'Magic']","8,120 review","70,620 (45%)","55,327 (35%)","23,021 (14%)","5,574 (3%)","1,701 (1%)"
Johnny Tremain,Esther Forbes,3.69,"48,167 rating","January 1, 1943","Johnny Tremain, a young apprentice silversmith, is caught up in the danger and excitement of 1775 Boston, just before the Revolutionary War. But even more gripping than living through the drama of Revolutionary Boston is the important discovery Johnny makes in his own life.",322,38,335 follower,"['Historical Fiction', 'Fiction', 'Classics', 'Young Adult', 'Childrens', 'Historical', 'Middle Grade', 'Historical Fiction', 'Fiction', 'Classics', 'Young Adult', 'Childrens', 'Historical', 'Middle Grade', 'Historical Fiction', 'Fiction', 'Classics', 'Young Adult', 'Childrens', 'Historical', 'Middle Grade']","2,814 review","12,898 (26%)","16,082 (33%)","12,683 (26%)","4,151 (8%)","2,353 (4%)"
Four Arguments for the Elimination of Television,Jerry Mander,4.13,"1,433 rating","January 1, 1977","A total departure from previous writing about television, this book is the first ever to advocate that the medium is not reformable. Its problems are inherent in the technology itself and are so dangerous -- to personal health and sanity, to the environment, and to democratic processes -- that TV ought to be eliminated forever. Weaving personal experiences through meticulous research, the author ranges widely over aspects of television that have rarely been examined and never before joined together, allowing an entirely new, frightening image to emerge. The idea that all technologies are ""neutral,"" benign instruments that can be used well or badly, is thrown open to profound doubt. Speaking of TV reform is, in the words of the author, ""as absurd as speaking of the reform of a technology such as guns.""",384,27,69 follower,"['Nonfiction', 'Philosophy', 'Sociology', 'Technology', 'Cultural', 'Politics', 'Psychology']",165 review,615 (42%),513 (35%),211 (14%),64 (4%),30 (2%)
Death: The High Cost of Living,Neil Gaiman,4.20,"41,648 rating","May 1, 1993","From the pages of Neil Gaiman's SANDMAN comes the young, pale, perky, and genuinely likable Death. One day in every century, Death walks the Earth to better understand those to whom she will be the final visitor. Today is that day. As a young mortal girl named Didi, Death befriends a teenager and helps a 250-year old homeless woman find her missing heart. What follows is a sincere musing on love, life and (of course) death.",104,"2,138",313k follower,"['Graphic Novels', 'Comics', 'Fantasy', 'Fiction', 'Graphic Novels Comics', 'Comic Book', 'Urban Fantasy', 'Graphic Novels', 'Comics', 'Fantasy', 'Fiction', 'Graphic Novels Comics', 'Comic Book', 'Urban Fantasy', 'Graphic Novels', 'Comics', 'Fantasy', 'Fiction', 'Graphic Novels Comics', 'Comic Book', 'Urban Fantasy', 'Graphic Novels', 'Comics', 'Fantasy', 'Fiction', 'Graphic Novels Comics', 'Comic Book', 'Urban Fantasy', 'Graphic Novels', 'Comics', 'Fantasy', 'Fiction', 'Graphic Novels Comics', 'Comic Book', 'Urban Fantasy']",628 review,"20,205 (48%)","12,865 (30%)","6,248 (15%)","1,367 (3%)",963 (2%)
A Knight in Shining Armor,Jude Deveraux,4.20,"36,489 rating","July 1, 1989","Once upon a time... ...as a fair maiden lay weeping upon a cold tombstone, her heartfelt desire was suddenly made real before her: tall, broad of shoulder, attired in gleaming silver and gold, her knight in shining armor had come to rescue his damsel in distress....  A Knight in Shining Armor  Jude Deveraux's beloved bestseller has captivated readers the world over; now in a special edition featuring new material, this timeless love story greets a new generation. Abandoned by her lover, thoroughly modern Dougless Montgomery finds herself alone and brokenhearted in an old English church. She never dreamed that a love more powerful than time awaited her there...until Nicholas Stafford, Earl of Thornwyck, a sixteenth-century knight, appeared. Drawn to him by a bond so sudden and compelling that it defied reason, Dougless knew that Nicholas was nothing less than a miracle: a man who would not seek to change her, who found her perfect just as she was. But she could not know how strong were the chains that tied them to the past -- or the grand adventure that lay before them.",464,207,"6,559 follower","['Romance', 'Time Travel', 'Historical Romance', 'Historical', 'Historical Fiction', 'Fantasy', 'Fiction']","2,669 review","18,282 (50%)","10,419 (28%)","5,472 (14%)","1,536 (4%)",780 (2%)
Life & Times of Michael K,J.M. Coetzee,3.86,"19,116 rating","January 1, 1983","In a South Africa torn by civil war, Michael K sets out to take his mother back to her rural home. On the way there she dies, leaving him alone in an anarchic world of brutal roving armies. Imprisoned, Michael is unable to bear confinement and escapes, determined to live with dignity. Life and Times of Michael K goes to the centre of human experience—the need for an interior, spiritual life, for some connections to the world in which we live, and for purity of vision.",192,147,"4,738 follower","['Fiction', 'South Africa', 'Literature', 'Novels', 'Nobel Prize', 'Literary Fiction', 'African Literature']","1,284 review","5,352 (27%)","7,628 (39%)","4,606 (24%)","1,168 (6%)",362 (1%)
A Rose in Winter,Kathleen E. Woodiwiss,4.18,"12,047 rating","December 1, 1982","A HEART TORMENTED Erienne's father had given her hand to the richest suitor. She was now Lady Saxton, mistress of a great manor all but ruined by fire, wife to a man whose mysteriously shrouded form aroused fear and pity. Yet even as she fell in love with her adoring husband, Erienne despaired of freeing her heart from the dashingly handsome Yankee who couldn't forget her. The beautiful Erienne, once filled with young dreams of romance, was now a wife and woman ... torn between the two men she loved.",567,51,"1,759 follower","['Romance', 'Historical Romance', 'Historical', 'Historical Fiction', 'Fiction', 'Beauty and The Beast', 'Regency']",692 review,"5,661 (46%)","3,737 (31%)","2,016 (16%)",469 (3%),164 (1%)
The Labyrinth of Solitude and Other Writings,Octavio Paz,4.12,"11,788 rating","January 1, 1950","Octavio Paz has long been acknowledged as Mexico's foremost writer and critic. In this international classic, Paz has written one of the most enduring and powerful works ever created on Mexico and its people, character, and culture. Compared to Ortega y Gasset's The Revolt of the Masses for its trenchant analysis, this collection contains his most famous work, ""The Labyrinth of Solitude,"" a beautifully written and deeply felt discourse on Mexico's quest for identity that gives us an unequaled look at the country hidden behind ""the mask."" Also included are ""The Other Mexico,"" ""Return to the Labyrinth of Solitude,"" ""Mexico and the United States,"" and ""The Philanthropic Ogre,"" all of which develop the themes of the title essay and extend his penetrating commentary to the United States and Latin America.",398,570,"1,284 follower","['Nonfiction', 'Essays', 'History', 'Philosophy', 'Spanish Literature', 'Poetry', 'Classics', 'Nonfiction', 'Essays', 'History', 'Philosophy', 'Spanish Literature', 'Poetry', 'Classics', 'Nonfiction', 'Essays', 'History', 'Philosophy', 'Spanish Literature', 'Poetry', 'Classics', 'Nonfiction', 'Essays', 'History', 'Philosophy', 'Spanish Literature', 'Poetry', 'Classics', 'Nonfiction', 'Essays', 'History', 'Philosophy', 'Spanish Literature', 'Poetry', 'Classics']",614 review,"4,985 (42%)","4,047 (34%)","2,091 (17%)",487 (4%),178 (1%)
Let Us Now Praise Famous Men,James Agee,4.00,"4,320 rating","August 1, 1941","In the summer of 1936, Agee and Evans set out on assignment for ""Fortune"" magazine to explore the daily lives of sharecroppers in the South. Their journey would prove an extraordinary collaboration and a watershed literary event when in 1941 ""Let Us Now Praise Famous Men"" was first published to enormous critical acclaim. This unsparing record of place, of the people who shaped the land, and of the rhythm of their lives today stands as one of the most influential books of the twentieth century.",416,96,260 follower,"['Nonfiction', 'History', 'Photography', 'Classics', 'Art', 'Sociology', 'American History', 'Nonfiction', 'History', 'Photography', 'Classics', 'Art', 'Sociology', 'American History', 'Nonfiction', 'History', 'Photography', 'Classics', 'Art', 'Sociology', 'American History']",557 review,"1,784 (41%)","1,333 (30%)",758 (17%),303 (7%),142 (3%)
The Princess Diaries,Meg Cabot,3.80,"253,681 rating","May 30, 2000","Mia Thermopolis is pretty sure there's nothing worse than being a five-foot-nine, flat-chested freshman, who also happens to be flunking Algebra.Is she ever in for a surprise.First mom announces that she's dating Mia's Algebra teacher. Then Dad has to go and reveal that he is the crown prince of Genovia. And guess who still doesn't have a date for the Cultural Diversity Dance?",283,273,34.4k follower,"['Young Adult', 'Romance', 'Fiction', 'Contemporary', 'Chick Lit', 'Teen', 'Childrens']","7,218 review","78,440 (30%)","79,566 (31%)","69,788 (27%)","19,411 (7%)","6,476 (2%)"
The Wings of the Dove,Henry James,3.79,"17,019 rating","January 1, 1902","Set amid the splendor of London drawing rooms and gilded Venetian palazzos, The Wings of the Dove is the story of Milly Theale, a naïve, doomed American heiress, and a pair of lovers, Kate Croy and Merton Densher, who conspire to obtain her fortune. In this witty tragedy of treachery, self-deception, and betrayal, Henry James weaves together three ill-fated and wholly human destinies unexpectedly linked by desire, greed, and salvation. As Amy Bloom writes in her Introduction, “The Wings of the Dove is a novel of intimacy. . . . [James] gives us passion, he gives us love in its terrible and enchanting forms.”",741,"4,415","3,466 follower","['Classics', 'Fiction', 'Literature', 'American', 'Romance', 'Historical Fiction', 'Novels', 'Classics', 'Fiction', 'Literature', 'American', 'Romance', 'Historical Fiction', 'Novels', 'Classics', 'Fiction', 'Literature', 'American', 'Romance', 'Historical Fiction', 'Novels', 'Classics', 'Fiction', 'Literature', 'American', 'Romance', 'Historical Fiction', 'Novels', 'Classics', 'Fiction', 'Literature', 'American', 'Romance', 'Historical Fiction', 'Novels']",749 review,"5,167 (30%)","5,795 (34%)","4,048 (23%)","1,343 (7%)",666 (3%)
Equus,Peter Shaffer,3.91,"21,729 rating","January 1, 1973","In ""Equus,"" which took critics and public alike by storm and has gone on to become a modern classic, Peter Shaffer depicts the story of a deranged youth who blinds six horses with a spike. Through a psychiatrist's analysis of the events, Shaffer creates a chilling portrait of how materialism and convenience have killed our capacity for worship and passion and, consequently, our capacity for pain. Rarely has a playwrite created an atmosphere and situation that so harshly pinpoint the spiritual and mental decay of modern man.",112,63,168 follower,"['Plays', 'Drama', 'Fiction', 'Classics', 'Theatre', 'School', 'Psychology']",859 review,"7,616 (35%)","7,482 (34%)","4,458 (20%)","1,496 (6%)",677 (3%)
Tigana,Guy Gavriel Kay,4.09,"47,955 rating","August 1, 1990","A masterful epic of magic, politics, war, and the power of love and hate — from the renowned author of The Fionavar Tapestry and Children of Earth and Sky.Tigana is the magical story of a beleaguered land struggling to be free. It is the tale of a people so cursed by the black sorcery of a cruel despotic king that even the name of their once-beautiful homeland cannot be spoken or remembered... But years after the devastation, a handful of courageous men and women embark upon a dangerous crusade to overthrow their conquerors and bring back to the dark world the brilliance of a long-lost name...Tigana. Against the magnificently rendered background of a world both sensuous and barbaric, this sweeping epic of a passionate people pursuing their dream is breathtaking in its vision, changing forever the boundaries of fantasy fiction.",676,46,"8,117 follower","['Fantasy', 'Fiction', 'High Fantasy', 'Epic Fantasy', 'Science Fiction Fantasy', 'Historical Fiction', 'Historical Fantasy']","3,290 review","20,763 (43%)","15,701 (32%)","7,699 (16%)","2,506 (5%)","1,286 (2%)"
"The Collected Poems of William Carlos Williams, Vol. 2: 1939-1962",William Carlos Williams,4.28,"4,026 rating","June 1, 1967","So that readers could more fully understand the extent of Williams' radical simplicity, all of his published poetry, excluding Paterson, was reissued in two definite volumes, of which this is the first.",553,336,762 follower,"['Poetry', 'American', 'Classics', 'Literature', '20th Century', 'Contemporary', 'Fiction']",28 review,"2,053 (50%)","1,268 (31%)",532 (13%),124 (3%),49 (1%)
"The Sandman, Vol. 4: Season of Mists",Neil Gaiman,4.54,"77,483 rating","January 1, 1990","Ten thousand years ago, Morpheus condemned a woman who loved him to Hell. Now the other members of his immortal family, The Endless, have convinced the Dream King that this was an injustice. To make it right, Morpheus must return to Hell to rescue his banished love -- and Hell's ruler, the fallen angel Lucifer, has already sworn to destroy him.Collects THE SANDMAN #21-28.",224,"2,138",313k follower,"['Graphic Novels', 'Comics', 'Fantasy', 'Fiction', 'Horror', 'Graphic Novels Comics', 'Comic Book']","2,742 review","48,838 (63%)","22,513 (29%)","5,276 (6%)",615 (<1%),241 (<1%)
Eichmann in Jerusalem: A Report on the Banality of Evil,Hannah Arendt,4.20,"26,805 rating","January 1, 1963","Originally appearing as a series of articles in The New Yorker, Hannah Arendt’s authoritative and stunning report on the trial of Nazi leader Adolf Eichmann sparked a flurry of debate upon its publication. This revised edition includes material that came to light after the trial, as well as Arendt’s postscript directly addressing the controversy that arose over her account. A major journalistic triumph by an intellectual of singular influence, Eichmann in Jerusalem is as shocking as it is informative—an unflinching look at one of the most unsettling and unsettled issues of the twentieth century that remains hotly debated to this day.",312,377,"3,817 follower","['History', 'Nonfiction', 'Philosophy', 'Politics', 'Holocaust', 'Psychology', 'Classics']","2,257 review","11,186 (41%)","10,916 (40%)","3,813 (14%)",705 (2%),185 (<1%)
The Secret Agent,Joseph Conrad,3.59,"22,585 rating","January 1, 1907","Mr Verloc, the secret agent, keeps a shop in London's Soho where he lives with his wife Winnie, her infirm mother, and her idiot brother, Stevie. When Verloc is reluctantly involved in an anarchist plot to blow up the Greenwich Observatory things go disastrously wrong, and what appears to be ""a simple tale"" proves to involve politicians, policemen, foreign diplomats, and London's fashionable society in the darkest and most surprising interrelations.Based on the text which Conrad's first English readers enjoyed, this new edition includes a full and up-to-date bibliography, a comprehensive chronology and a critical introduction which describes Conrad's great London novel as the realization of a ""monstrous town,"" a place of idiocy, madness, criminality, and savage butchery. It also discusses contemporary anarchist activity in the UK, imperialism, and Conrad's narrative techniques.",304,"3,102","4,179 follower","['Fiction', 'Classics', 'Literature', 'Mystery', 'Espionage', 'Novels', 'Crime', 'Fiction', 'Classics', 'Literature', 'Mystery', 'Espionage', 'Novels', 'Crime', 'Fiction', 'Classics', 'Literature', 'Mystery', 'Espionage', 'Novels', 'Crime']","1,729 review","4,431 (19%)","8,050 (35%)","7,213 (31%)","2,200 (9%)",691 (3%)
The 39 Steps,John Buchan,3.61,"41,621 rating","January 1, 1915","Adventurer Richard Hannay, just returned from South Africa, is thoroughly bored with London life—until he is accosted by a mysterious American, who warns him of an assassination plot that could completely destabalise the fragile political balance of Europe. Initially sceptical, Hannay nonetheless harbours the man—but one day returns home to find him murdered... An obvious suspect, Hannay flees to his native Scotland, pursued by both the police and a cunning, ruthless enemy. His life and the security of Britain are in grave peril, and everything rests on the solution to a baffling enigma: what are the 'thirty nine steps?'",100,"1,502",411 follower,"['Fiction', 'Classics', 'Mystery', 'Thriller', 'Adventure', 'Crime', 'Espionage']","3,458 review","8,463 (20%)","14,574 (35%)","13,505 (32%)","3,989 (9%)","1,090 (2%)"
Profiles in Courage,John F. Kennedy,3.92,"13,170 rating","January 1, 1955","The Pulitzer Prize winning classic by President John F. Kennedy, with an introduction by Caroline Kennedy and a foreword by Robert F. Kennedy.Written in 1955 by the then junior senator from the state of Massachusetts, John F. Kennedy's Profiles in Courage serves as a clarion call to every American.In this book Kennedy chose eight of his historical colleagues to profile for their acts of astounding integrity in the face of overwhelming opposition. These heroes, coming from different junctures in our nation’s history, include John Quincy Adams, Daniel Webster, Thomas Hart Benton, and Robert A. Taft.Now, a half-century later, the book remains a moving, powerful, and relevant testament to the indomitable national spirit and an unparalleled celebration of that most noble of human virtues. It resounds with timeless lessons on the most cherished of virtues and is a powerful reminder of the strength of the human spirit. Profiles in Courage is as Robert Kennedy states in the foreword: “not just stories of the past but a book of hope and confidence for the future. What happens to the country, to the world, depends on what we do with what others have left us.""Along with vintage photographs and an extensive author biography, this book features Kennedy's correspondence about the writing project, contemporary reviews, a letter from Ernest Hemingway, and two rousing speeches from recipients of the Profile in Courage Award.  Introduction by John F. Kennedy’s daughter Caroline Kennedy, forward by John F. Kennedy’s brother Robert F. Kennedy.",245,253,396 follower,"['History', 'Nonfiction', 'Biography', 'Politics', 'American History', 'Classics', 'Presidents']",926 review,"3,998 (30%)","5,123 (38%)","3,236 (24%)",657 (4%),156 (1%)
A Distant Mirror: The Calamitous 14th Century,Barbara W. Tuchman,4.05,"40,930 rating","September 21, 1978","The 14th century gives us back two contradictory images: a glittering time of crusades and castles, cathedrals and chivalry, and a dark time of ferocity and spiritual agony, a world plunged into a chaos of war, fear and the Plague. Barbara Tuchman anatomizes the century, revealing both the great rhythms of history and the grain and texture of domestic life as it was lived.",714,41,"1,913 follower","['History', 'Nonfiction', 'Medieval', 'European History', 'Medieval History', 'Historical', 'France']","1,890 review","17,271 (42%)","13,591 (33%)","6,488 (15%)","1,995 (4%)","1,585 (3%)"
Residence on Earth,Pablo Neruda,4.36,"4,016 rating","January 1, 1933","These poems, written by the prolific Chilean poet between the 1920's and 1940's, illuminate his views on alienation and political oppression.",359,862,"8,950 follower","['Poetry', 'Spanish Literature', 'Latin American', 'Classics', 'Fiction', 'Latin American Literature', 'Nobel Prize', 'Poetry', 'Spanish Literature', 'Latin American', 'Classics', 'Fiction', 'Latin American Literature', 'Nobel Prize', 'Poetry', 'Spanish Literature', 'Latin American', 'Classics', 'Fiction', 'Latin American Literature', 'Nobel Prize']",171 review,"2,243 (55%)","1,134 (28%)",511 (12%),88 (2%),40 (<1%)
The Cricket in Times Square,George Selden,4.04,"65,027 rating","January 1, 1960","One night, the sounds of New York City--the rumbling of subway trains, thrumming of automobile tires, hooting of horns, howling of brakes, and the babbling of voices--is interrupted by a sound that even Tucker Mouse, a jaded inhabitant of Times Square, has never heard before. Mario, the son of Mama and Papa Bellini, proprietors of the subway-station newsstand, had only heard the sound once. What was this new, strangely musical chirping? None other than the mellifluous leg-rubbing of the somewhat disoriented Chester Cricket from Connecticut. Attracted by the irresistible smell of liverwurst, Chester had foolishly jumped into the picnic basket of some unsuspecting New Yorkers on a junket to the country. Despite the insect's wurst intentions, he ends up in a pile of dirt in Times Square. Mario is elated to find Chester. He begs his parents to let him keep the shiny insect in the newsstand, assuring his bug-fearing mother that crickets are harmless, maybe even good luck. What ensues is an altogether captivating spin on the city mouse/country mouse story, as Chester adjusts to the bustle of the big city. Despite the cricket's comfortable matchbox bed (with Kleenex sheets); the fancy, seven-tiered pagoda cricket cage from Sai Fong's novelty shop; tasty mulberry leaves; the jolly company of Tucker Mouse and Harry Cat; and even his new-found fame as ""the most famous musician in New York City,"" Chester begins to miss his peaceful life in the Connecticut countryside. The Cricket in Times Square--a Newbery Honor Book in 1961--is charmingly illustrated by the well-loved Garth Williams, and the tiniest details of this elegantly spun, vividly told, surprisingly suspenseful tale will stick with children for years and years. Make sure this classic sits on the shelf of your favorite child, right next to The Wind in the Willows. (Ages 9 to 12)",134,57,88 follower,"['Childrens', 'Fiction', 'Classics', 'Fantasy', 'Middle Grade', 'Animals', 'Young Adult', 'Childrens', 'Fiction', 'Classics', 'Fantasy', 'Middle Grade', 'Animals', 'Young Adult', 'Childrens', 'Fiction', 'Classics', 'Fantasy', 'Middle Grade', 'Animals', 'Young Adult']","2,170 review","25,009 (38%)","22,390 (34%)","13,772 (21%)","2,760 (4%)","1,096 (1%)"
The Ghost Road,Pat Barker,4.09,"17,502 rating","January 1, 1995","  The final book in the Regeneration Trilogy, and winner of the 1995 Booker Prize The Ghost Road is the culminating masterpiece of Pat Barker's towering World War I fiction trilogy. The time of the novel is the closing months of the most senselessly savage of modern conflicts. In France, millions of men engaged in brutal trench warfare are all ""ghosts in the making."" In England, psychologist William Rivers, with severe pangs of conscience, treats the mental casualties of the war to make them whole enough to fight again. One of these, Billy Prior, risen to the officer class from the working class, both courageous and sardonic, decides to return to France with his fellow officer, poet Wilfred Owen, to fight a war he no longer believes in. Meanwhile, Rivers, enfevered by influenza, returns in memory to his experience studying a South Pacific tribe whose ethos amounted to a culture of death. Across the gulf between his society and theirs, Rivers begins to form connections that cast new light on his--and our--understanding of war.Combining poetic intensity with gritty realism, blending biting humor with tragic drama, moving toward a denouement as inevitable as it is devastating, The Ghost Road both encapsulates history and transcends it. It is a modern masterpiece ",288,31,"2,189 follower","['Fiction', 'Historical Fiction', 'War', 'World War I', 'Historical', 'Literature', 'British Literature']",702 review,"6,974 (39%)","6,456 (36%)","3,020 (17%)",719 (4%),333 (1%)
